;url;price;surface;nb_pieces;nb_chambres;lieu;prix_m2;date_publication;tag_1;tag_2;tag_3;description;tags;images_url
107;https://www.superimmo.com/annonces/achat-maison-177m-le-cannet-06110-xwai9z;740000;177;6;3;Le Cannet (06110);4181;11/07/2024;Chauffage individuel électrique;;Honoraires à la charge du vendeur. Barème d’honoraires : https://fr.foncia.com/agence-immobiliere/cannes-06/agence-immobiliere/foncia-transaction-cannes-3695;"FONCIA CANNES, LAMY, VOUS PROPOSE CETTE MAISON DE VILLAGE de 177m2 AU VIEUX CANNET AU CALME SUR QUATRE NIVEAUX AVEC VUE PANORAMIQUE MER, EXPOSITION PLEIN SUD. LA MAISON EST À RAFRAÎCHIR. POSSIBILITÉ DE GARAGE À PROXIMITÉ.
Renseignements et visite au 06/ 60 /97/ 42. 15
A quelques minutes de la Gare TGV et Aéroport de Nice, Idéal pour télétravailleurs la région à la fibre : Paris-Nice :1h30 Situé dans les Alpes Maritimes et de la Provence, Cannes, Antibes, Cagnes sur mer, Grasse et ses parfums, s’étire entre ciel et mer, sur un vaste territoire réputé pour la variété de ses paysages terrestres, marins et sous-marins d’exception, et la douceur de son climat, Les communes de Cannes, Antibes, Cagnes sur Mer, propose également des excursions sur les iles toutes proches (Iles de Lérins, Port-Cros, Porquerolles, Le Levant), Les plages que vous trouverez le long de ce littoral riche en biodiversité seront également vous séduire pour des vacances inoubliables (Plage du Midi, Crique Portet, la Gravette, des ondes) Bénéficiant d'un accès rapide à l'autoroute A57 reliant Marseille ou Nice, La ville de Cannes et son célèbre palais des festivals, est également dotée d'un aéroport particulier pour les pilotes privés, desservant de nombreuses destinations en France comme à l'étranger.
Notre équipe de FONCIA TRANSACTION est constituée de seize conseillers spécialistes en mesure de vous accompagner efficacement dans votre projet d'achat ou de vente.
Spécialisée en gestion locative, syndic de copropriété et achat/vente de biens immobiliers récents et anciens, l'agence immobilière FONCIA TRANSACTION vous propose des offres d'appartements, de maisons et de garages, à vendre ou à louer, dans la région de Cannes, Mandelieu, Antibes, Cagnes sur Mer, Grasse, Mougins, Villeneuve Loubet, et de ses environs : Vallauris, la Colle sur Loup, Vence, St Paul de Vence, Mouans Sartoux.
Afficher plus";['Disponible immédiatement', '177 m² - 6 pièces - 3 chambres', 'Vue sur mer', 'Année de construction : 1835', 'Chauffage individuel électrique', '', None, None, None, None, None, None, None, None, None, None, None, None, None, None];['https://photo.superimmo.com/jfv4ny8plcucjnnsezpuxcz34b7r', 'https://photo.superimmo.com/kz725yi1vji9bax5qly2qbn36x98', 'https://photo.superimmo.com/fy13q6x8ze70mtzbjxu3p1u5tsp3', 'https://photo.superimmo.com/d1dghzhh0y9yub46ccqmi01bf5ie', 'https://photo.superimmo.com/p4zbgdxr9ar0rb23g4oh1jxf38cf', None, None, None, None, None]
108;https://www.superimmo.com/annonces/achat-appartement-30m-antibes-06600-xwai9u;212000;30;1;;Antibes (06600);7067;11/07/2024;Exclusivité;Dernier étage avec ascenseur;Honoraires à la charge du vendeur. Barème d’honoraires : https://fr.foncia.com/agence-immobiliere/grasse-06/agence-immobiliere/foncia-transaction-grasse-1104;Antibes Les Pins, agréable grand studio de 30 m2 avec chambre séparée, dans résidence sécurisée avec piscine et gardien, cinquième et dernier étage, large terrasse avec aperçu mer, résidence à pieds des plages et commodités, un parking en sous-sol et une cave accompagne ce bien;['Disponible immédiatement', '30 m² - 1 pièce', 'Piscine', 'Dernier étage (5ème) avec ascenseur', 'Vue sur mer', 'Parking couvert', 'Année de construction : 1992', 'Chauffage individuel électrique', 'Fibre optique', 'Copropriété de 80 lots', None, None, None, None, None, None, None, None, None, None];['https://photo.superimmo.com/1up40j87m7eo1nfib5pl3mt1l92i', 'https://photo.superimmo.com/bmmzea9kbvbprtfwn6cq84fx5amf', 'https://photo.superimmo.com/v75pn1y7fx3gg806nmavmcetnhs7', 'https://photo.superimmo.com/0uae5smw0mt5ibm2hazfffp6t6fy', 'https://photo.superimmo.com/36eix81c0f1epm2em3tkjfhmj0ni', None, None, None, None, None]
109;https://www.superimmo.com/annonces/achat-appartement-111m-nice-06000-xwai8l;780000;111;4;3;Nice (06000);7027;11/07/2024;Étage 2/6 avec ascenseur;Balcon;Honoraires à la charge du vendeur.;Nice au cœur de la ville- beau quartier, dans un immeuble de standing, appartement 4 pièces traversant de 112 m² environ composé d'un séjour de 30 m² avec cuisine indépendante, 3 chambres, salle de bain, wc, dressing et rangement, terrasse de 12 m² au sud et balcon. Rare !;"['111 m² - 4 pièces - 3 chambres', 'Étage 2/6 avec ascenseur', 'Orientation : Nord / Sud - Traversant', 'Balcon', 'Terrasse', 'Année de construction : 1956', ""Assainissement : tout à l'égout"", 'Chauffage collectif', 'Climatisation', 'Cuisine séparée', '1 salle de bain', '1 wc', 'Fenêtres double vitrage', 'Digicode', 'Copropriété de 116 lots', '', None, None, None, None]";['https://photo.superimmo.com/t0ii0mb8yt444365usj0rd99oih2', 'https://photo.superimmo.com/vumw7uwlojo7crty7az9m37hnyar', 'https://photo.superimmo.com/fkk26r2xt42fk7ttsz78lz0d1iab', 'https://photo.superimmo.com/6jh3sdks35fjoajo3hb412m90j9j', 'https://photo.superimmo.com/7ctyh088lr4dmn9emem8b85la4wu', None, None, None, None, None]
110;https://www.superimmo.com/annonces/achat-maison-172m-contes-06390-xwai68;650000;172;6;4;Contes (06390);3779;11/07/2024;Chauffage électrique;Piscine;Honoraires à la charge du vendeur. Barème d’honoraires : https://bareme.iadfrance.fr;"iad France - Anthony Galli (06 24 05 72 89) vous propose : Charmante maison de 172m² à Contes, entièrement rénovée il y a 3 ans. Avec 4 chambres, 3 salles de bains, un dressing, un bureau et une buanderie, cette maison offre un très bel espace de vie. Sur 2 étages, elle est idéale pour une famille grâce à ses nombreux espaces. Profitez d'une cuisine équipée, d'un salon cathédrale spacieux et d'une salle à manger lumineuse. L'ensemble de la maison a été modernisé pour offrir un confort optimal. Exposée au sud, la luminosité est au rendez-vous. Les adeptes de tranquillité seront comblés. Place de parking disponible. Ne manquez pas cette opportunité de vivre dans un cadre paisible et agréable à quelques minutes de Contes.
Honoraires d’agence à la charge du vendeur.Information d'affichage énergétique sur ce bien : classe ENERGIE A indice 83 et classe CLIMAT A indice 2. Les informations sur les risques auxquels ce bien est exposé sont disponibles sur le site Géorisques : www.georisques.gouv.fr. La présente annonce immobilière a été rédigée sous la responsabilité éditoriale de M. Anthony Galli EI (ID 32140), mandataire indépendant en immobilier (sans détention de fonds), agent commercial de la SAS I@D France immatriculé au RSAC de NICE sous le numéro 842 607 939, titulaire de la carte de démarchage immobilier pour le compte de la société I@D France SAS.
Retrouvez tous nos biens sur notre site internet.
Afficher plus";['172 m² - 6 pièces - 4 chambres - ter. 1 300 m²', 'Piscine', 'Année de construction : 1980', 'Chauffage électrique', 'Alarme', '', None, None, None, None, None, None, None, None, None, None, None, None, None, None];['https://photo.superimmo.com/jum8acx4vx159t3h5qkquxukwd76', 'https://photo.superimmo.com/05u6lfrtm5tvdvpfa6ys422cg6yu', 'https://photo.superimmo.com/n1be1sb72dwppz4urd6g5obhtmoy', 'https://photo.superimmo.com/8s68gzivtsoy9a280lg8csqwqu8c', 'https://photo.superimmo.com/fqyl11ykkoi4l6ksn2yki3w88326', None, None, None, None, None]
111;https://www.superimmo.com/annonces/achat-appartement-36m-antibes-06160-06600-xwai60;229900;36;2;1;Antibes (06);6386;11/07/2024;Étage 1/6 avec ascenseur;Chauffage collectif au gaz (radiateurs);Honoraires à la charge du vendeur. Barème d’honoraires : https://bareme.iadfrance.fr;"iad France - Marie-Line Giordana (06 67 11 13 42) vous propose : - DEUX PIECES – CENTRE VILLE - PROCHE DES PLAGES – ANTIBES JUAN LES PINS –
Appartement à deux pas des célèbres plages de la station balnéaire de JUAN LES PINS.
Immeuble des années 1930 classé remarquable - style art déco construit par l’architecte Georges DIKANSKY.
Charmant deux pièces TRAVERSANT très bien agencé SANS TRAVAUX et VENDU MEUBLÉ.
Il se compose d’une entrée avec placard de rangement, une cuisine ouverte équipée/ aménagée, un séjour exposé EST, une salle de bain avec wc, une chambre avec placard donnant sur les JARDINS de l’immeuble.
L’appartement est entièrement CLIMATISÉ.
Idéalement situé, cet appartement bénéficie d'un emplacement prisé, proche des commodités, (supermarché au pied de l’immeuble, pôle de santé en face).
SES ATOUTS :
-Hauteur plafond, moulures.
-Climatisation réversible récente.
-Porte blindée 10 cm.
- Balcon.
-Isolation phonique.
-Vendu meublé.
-A 15 min à pied du centre-ville d’Antibes, et 5 min de JUAN LES PINS.
-A 5 min de la gare SNCF.
-Arrêt de bus en bas de l’immeuble.
-COMMERCES en bas de l’immeuble.
A visiter sans tarder.
La présente annonce immobilière vise 1 lot principal situé dans une copropriété formant 145 lots au total ne faisant l'objet d'aucune procédure en cours et d'un montant de charges d’environ 172 € par mois (soit 2064 € annuel) déclaré par le vendeur.Honoraires d’agence à la charge du vendeur.Information d'affichage énergétique sur ce bien : classe ENERGIE C indice 179 et classe CLIMAT C indice 29. Les informations sur les risques auxquels ce bien est exposé sont disponibles sur le site Géorisques : www.georisques.gouv.fr. La présente annonce immobilière a été rédigée sous la responsabilité éditoriale de Mlle Marie-Line Giordana EI (ID 49385), mandataire indépendant en immobilier (sans détention de fonds), agent commercial de la SAS I@D France immatriculé au RSAC de Antibes sous le numéro 888785938, titulaire de la carte de démarchage immobilier pour le compte de la société I@D France SAS.
Retrouvez tous nos biens sur notre site internet.
Afficher plus";['36 m² - 2 pièces - 1 chambre', 'Étage 1/6 avec ascenseur', 'Année de construction : 1930', 'Chauffage collectif au gaz (radiateurs)', 'Climatisation', 'Interphone', 'Copropriété de 195 lots', '', None, None, None, None, None, None, None, None, None, None, None, None];['https://photo.superimmo.com/e0j4d7np4hlfxe3prowk13qj6uhy', 'https://photo.superimmo.com/2hfh4puyqwvql4znzv9pjdrdkvtp', 'https://photo.superimmo.com/l9685y1evtyps78b67vhdj9oizqv', 'https://photo.superimmo.com/yey7aurxvop1s85zn7apnve6a4tr', 'https://photo.superimmo.com/t15c111t3rcv1zf9tsjpodyaia10', None, None, None, None, None]
112;https://www.superimmo.com/annonces/achat-appartement-62m-menton-06500-xwai3n;398000;62;3;2;Menton (06500);6419;11/07/2024;Dernier étage avec ascenseur;Terrasse;Honoraires à la charge du vendeur. Barème d’honoraires : https://bareme.iadfrance.fr;"iad France - Guillaume Navarro (06 80 31 95 23) vous propose : BELLE OPPORTUNITE A SAISIR
Magnifique appartement de 3 pièces de 62 m² environ avec terrasse, situé au 5 ème et dernier étage d’une résidence construite très récemment et proche des écoles, d’un hypermarché et de l’accès à l’autoroute.
Ce T3, refait entièrement à neuf avec des matériaux de qualité, se compose d’une entrée, d’un salon avec cuisine américaine donnant sur la terrasse avec un aperçu mer, une buanderie, deux chambres et une salle d’eau.
Deux places de parking couvertes complète ce bien.
L’appartement est intégralement meublé dans un style contemporain et de qualité.
Le prix affiché inclut tout le mobilier présent ainsi que les deux places de parking couvertes.
À voir absolument !
La présente annonce immobilière vise 1 lot principal situé dans une copropriété formant 500 lots au total ne faisant l'objet d'aucune procédure en cours et d'un montant de charges d’environ 140 € par mois (soit 1680 € annuel) déclaré par le vendeur.Honoraires d’agence à la charge du vendeur. Bien non soumis au DPE. Les informations sur les risques auxquels ce bien est exposé sont disponibles sur le site Géorisques : www.georisques.gouv.fr. La présente annonce immobilière a été rédigée sous la responsabilité éditoriale de M. Guillaume Navarro EI (ID 75523), mandataire indépendant en immobilier (sans détention de fonds), agent commercial de la SAS I@D France immatriculé au RSAC de NICE sous le numéro 811785807, titulaire de la carte de démarchage immobilier pour le compte de la société I@D France SAS.
Retrouvez tous nos biens sur notre site internet.
Afficher plus";['62 m² - 3 pièces - 2 chambres', 'Dernier étage (5ème) avec ascenseur', '1 Parking', 'Terrasse', 'Année de construction : 2022', 'Cuisine ouverte, équipée', 'Digicode - Interphone', 'Copropriété de 800 lots', None, None, None, None, None, None, None, None, None, None, None, None];['https://photo.superimmo.com/zotcmgk4ufubga8pxldn3yzjlq5h', 'https://photo.superimmo.com/h2visqosk962ic0dk4et9bi3nbp4', 'https://photo.superimmo.com/1453cq19tju52zh7femj47mzxdpb', 'https://photo.superimmo.com/jhqchkbl647jflc1bq6linrq5yml', 'https://photo.superimmo.com/6doqy3ujr2997s3db9uu9rowi6iv', None, None, None, None, None]
113;https://www.superimmo.com/annonces/achat-appartement-57m-vallauris-06220-xwai1j;325000;57;3;2;Vallauris (06220);5702;11/07/2024;2ème étage avec ascenseur;Terrasse;Honoraires à la charge du vendeur. Barème d’honoraires : https://bareme.iadfrance.fr;"iad France - Gabin Dumont (06 31 93 29 18) vous propose : Superbe appartement 3 pièces avec vue mer, idéalement situé à quelques rues du Vieux-Port de Golf Juan. Construit dans les années 80, cet appartement offre des espaces lumineux et des vues exceptionnelles. Il est vendu avec une cave et un parking de 25,4 m² environ.
La première chambre de 10,7 m² environ, orientée à l'Est, s'ouvre sur une loggia de 8,4 m² environ, offrant une splendide vue. Attenante à cette loggia, la cuisine d'époque, fonctionnelle et bien organisée, partage la même orientation. En suivant le couloir, vous découvrirez des WC et une salle de bain séparés, chacun doté d'une fenêtre.
Au bout du couloir, la seconde chambre, orientée plein Sud, donne accès à une terrasse de belle envergure. Le séjour, également orienté plein Sud et attenant à la terrasse, est baigné de lumière naturelle. Cette grande terrasse, ainsi que la loggia, offre un panorama rare de près de 180°, allant du Golf Juan jusqu’à La Maure, avec une ravissante vue sur l’espace vert soigneusement entretenu de la résidence.
Ne laissez pas passer cette opportunité rare sur le marché.
Pour tout renseignement, appelez-moi dès maintenant.
La présente annonce immobilière vise 1 lot principal situé dans une copropriété ne faisant l'objet d'aucune procédure en cours et d'un montant de charges d’environ 187.67 € par mois (soit 2252.04 € annuel) déclaré par le vendeur.Honoraires d’agence à la charge du vendeur.Information d'affichage énergétique sur ce bien : classe ENERGIE D indice 227 et classe CLIMAT B indice 7. Les informations sur les risques auxquels ce bien est exposé sont disponibles sur le site Géorisques : www.georisques.gouv.fr. La présente annonce immobilière a été rédigée sous la responsabilité éditoriale de M. Gabin Dumont EI (ID 81259), mandataire indépendant en immobilier (sans détention de fonds), agent commercial de la SAS I@D France immatriculé au RSAC de frejus sous le numéro 983565359, titulaire de la carte de démarchage immobilier pour le compte de la société I@D France SAS.
Retrouvez tous nos biens sur notre site internet.
Afficher plus";['57 m² - 3 pièces - 2 chambres', '2ème étage avec ascenseur', '1 Garage', 'Cave', 'Terrasse', 'Chauffage collectif électrique', 'Cuisine séparée, équipée', 'Digicode - Interphone', 'Copropriété de 3 lots', '', None, None, None, None, None, None, None, None, None, None];['https://photo.superimmo.com/fpyuhuviepb19xgsbvdscdi13rtl', 'https://photo.superimmo.com/oybecjvpix4p8carkctrfp53zjcj', 'https://photo.superimmo.com/jy7p30ygekqlalfb06pt4eyr5he8', 'https://photo.superimmo.com/e4ue3ro888gpg68jwd4ujy4pmh31', 'https://photo.superimmo.com/hskmh6aztdevsp1hw3yheb0rd2iw', None, None, None, None, None]
114;https://www.superimmo.com/annonces/achat-appartement-58m-gattieres-06510-xwahy6;239000;58;3;2;Gattières (06510);4121;11/07/2024;Dernier étage;1 balcon;Honoraires à la charge du vendeur. Barème d’honoraires : https://bareme.iadfrance.fr;"iad France - James LEFEBVRE (06 18 10 51 90) vous propose : GATTIERES Village perché entre la rivière du Var et montagnes les Baous, à 5 mn de Carros et 20 Mn de Nice.
Je vous propose ce bel appartement lumineux de type F3 dans une résidence sécurisée et fermée avec piscine, à 2 pas du village historique de Gattières.
Il se compose de la façon suivante :
1 grande entrée, 1 salle d’eau, de 2 chambres, 1 wc individuel et 1 séjour cuisine donnant sur un grand balcon-terrasse sur une vue dégagée sur le village et la vallée.
Proche de tous commerces, écoles, santé et services administratifs.
Prestations :
Fenêtres (double vitrage), fibre optique, parking sous sol (boxable) et bien sur une très belle piscine résidentielle fermée et sécurisée.
N'hésitez plus appelez-moi et on visite !!!
La présente annonce immobilière vise 1 lot principal situé dans une copropriété formant 43 lots au total ne faisant l'objet d'aucune procédure en cours et d'un montant de charges d’environ 100 € par mois (soit 1200 € annuel) déclaré par le vendeur.Honoraires d’agence à la charge du vendeur.Information d'affichage énergétique sur ce bien : classe ENERGIE C indice 172 et classe CLIMAT A indice 5. Les informations sur les risques auxquels ce bien est exposé sont disponibles sur le site Géorisques : www.georisques.gouv.fr. La présente annonce immobilière a été rédigée sous la responsabilité éditoriale de M. James LEFEBVRE EI (ID 44101), mandataire indépendant en immobilier (sans détention de fonds), agent commercial de la SAS I@D France immatriculé au RSAC de GRASSE sous le numéro 881938955, titulaire de la carte de démarchage immobilier pour le compte de la société I@D France SAS.
Retrouvez tous nos biens sur notre site internet.
Afficher plus";['58 m² - 3 pièces - 2 chambres', 'Dernier étage (2ème)', '1 Parking', '1 balcon', 'Année de construction : 2002', 'Chauffage individuel électrique (radiateurs)', 'Cuisine équipée', 'Interphone', 'Télévision par cable', 'Copropriété de 143 lots', None, None, None, None, None, None, None, None, None, None];['https://photo.superimmo.com/r2oy1ev1zpjrsbv1lgdcmou9dmup', 'https://photo.superimmo.com/020y8gsurzix6tym63t4xsibkbzy', 'https://photo.superimmo.com/pyucxl2oktivbnf0pquu7idqivyy', 'https://photo.superimmo.com/ue3obrjujwboauwfbdoal9hbwvui', 'https://photo.superimmo.com/jfcyrwrtem5834ee9hg8pthrtnc4', None, None, None, None, None]
115;https://www.superimmo.com/annonces/achat-appartement-57m-valdeblore-06420-xwahxt;185000;57;4;3;Valdeblore (06420);3246;11/07/2024;1 Parking;Chauffage individuel électrique;Honoraires à la charge du vendeur. Barème d’honoraires : https://bareme.iadfrance.fr;"iad France - Laetitia Carton (06 99 03 65 61) vous propose : Appartement 4 pièces, 3 chambres Jardin et Parking - Valdeblore - Vue Magnifique
Découvrez ce charmant appartement de 56.91m²en duplex, situé à Valdeblore, offrant 3 chambres dont une en rez-de-chaussée , un séjour lumineux avec poêle à bois, une cuisine équipée et un jardin privé avec terrasse.
Profitez d'une vue imprenable sur les montagnes environnantes.
Idéalement situé à proximité de la station de ski La Colmiane (à 4km) et du Parc National du Mercantour (à 6km).
2 places de parking disponible.
À visiter sans tarder !
La présente annonce immobilière vise 3 lots principaux situés dans une copropriété formant 18 lots au total ne faisant l'objet d'aucune procédure en cours et d'un montant de charges d’environ 29.17 € par mois (soit 350 € annuel) déclaré par le vendeur.Honoraires d’agence à la charge du vendeur.Information d'affichage énergétique sur ce bien : classe ENERGIE G indice 569 et classe CLIMAT C indice 18. Les informations sur les risques auxquels ce bien est exposé sont disponibles sur le site Géorisques : www.georisques.gouv.fr. La présente annonce immobilière a été rédigée sous la responsabilité éditoriale de Mlle Laetitia Carton EI (ID 47383), mandataire indépendant en immobilier (sans détention de fonds), agent commercial de la SAS I@D France immatriculé au RSAC de Marseille sous le numéro 792619157, titulaire de la carte de démarchage immobilier pour le compte de la société I@D France SAS.
Retrouvez tous nos biens sur notre site internet.
Afficher plus";['57 m² - 4 pièces - 3 chambres - ter. 100 m²', 'Rez-de-chaussée', '1 Parking', 'Chauffage individuel électrique', 'Télévision par cable', 'Copropriété de 18 lots', None, None, None, None, None, None, None, None, None, None, None, None, None, None];['https://photo.superimmo.com/vk8syepopzqnhnx2qxt219afat1s', 'https://photo.superimmo.com/cl6f4ishu5xptjehgdalnrzey9m4', 'https://photo.superimmo.com/6kvbgp0761xm1v3my0b1dndjhklh', 'https://photo.superimmo.com/y56e5yhpqmg1qsos0dpkv9jlaa0a', 'https://photo.superimmo.com/8wpyk3go3gotlyqzc9eefznzz499', None, None, None, None, None]
