;url;price;surface;nb_pieces;nb_chambres;lieu;prix_m2;date_publication;tag_1;tag_2;tag_3;description;tags;images_url
60;https://www.superimmo.com/annonces/achat-appartement-60m-nice-06200-xwakhm;374000;60;3;1;Nice (06200);6233;11/07/2024;Exclusivité;Étage 1/2;Barème d’honoraires : https://welmo.fr/;"Welmo, l'agence immobilière en ligne, vous présente :
06200 - NICE - SECTEUR NAPOLEON III - 3 PIECES - 1 CHAMBRE - GRANDE TERRASSE - GARAGE EN SUS
Vous souhaitez visiter ce bien ? Planifiez directement une visite sur le site Welmo avec la référence : SklMJWL6DR
Welmo vous présente ce très bel appartement de 3 pièces mesurant 58,15m² (loi carrez), situé au 1er étage d'une copropriété bien entretenue.
Vous apprécierez tout particulièrement sa luminosité et sa terrasse magnifique.
L'appartement rénové est organisé comme suit :
- une entrée avec rangement
- un salon séjour lumineux avec 3 baies vitrées
- une cuisine vendue partiellement équipée et ouverte sur l'espace de vie
- une grande terrasse de plus de 80m2
- une chambre de plus 14m² donnant sur le balcon
- possibilité de rajouter une chambre supplémentaire
- une salle de bain avec baignoire, simple vasque, armoire de rangement, sèche serviette et WC
- WC séparés avec lave main
Prestations : Climatisation, fibre internet.
- parking : possibilité d'acquérir un garage fermé au sous-sol de la résidence au prix de € 20.000 en sus du prix.
Détail des surfaces :
Superficie carrez 58,15 m2
Superficie terrasse et balcon 84,00 m2
Superficie pondérée 60 m2
Toutes les commodités, commerces et transport sont à quelques minutes.
Coup de cœur assuré !
Nombre de lots : 50
Charges prévisionnelles annuelles : 2160 €
DPE réalisé après Juillet 2021
Welmo, commission de 3.95 % à la charge de l'acquéreur incluse dans le prix de vente affiché
La présente annonce immobilière a été rédigée par Georges Andriko, agent commercial de la SAS WELMO France, immatriculé au RSAC de Nice sous le numéro 890 140 676
Les informations sur les risques auxquels ce bien est exposé sont disponibles sur le site Géorisques : www.georisques.gouv.fr
Afficher plus";['60 m² - 3 pièces - 1 chambre', 'Étage 1/2', 'Orientation : Est, Sud, Sud-Est', 'Balcon', 'Terrasse', 'Chauffage individuel électrique', '1 salle de bain', 'Jardin privatif', 'Copropriété de 36 lots', '', None, None, None, None, None, None, None, None, None, None];['https://photo.superimmo.com/1jd7uwqhffpxldw0ofcocetnyuv3', 'https://photo.superimmo.com/av5a3u2wzetbmjuba7lwavysrlpf', 'https://photo.superimmo.com/yyaqbrw4wp2y7h6wsmod302xql31', 'https://photo.superimmo.com/712enpd4lt4ufwxqusdpmmvi48oi', 'https://photo.superimmo.com/bkdydld4wfzm33kekw5svymgpwyz', None, None, None, None, None]
61;https://www.superimmo.com/annonces/achat-appartement-52m-mougins-06250-xwakfk;369250;52;2;1;Mougins (06250);7101;11/07/2024;Exclusivité;Chauffage individuel électrique (clim. réversible);Honoraires à la charge du vendeur. Barème d’honoraires : http://diszln7ft1ccx.cloudfront.net/pdf/BAREME_NATIONAL.pdf;"06250 - MOUGINS - CORNICHE - QUARTIER CALME - 2 PIECES - 1 CHAMBRE - 52.41 M² - APPARTEMENT EN REZ DE JARDIN
Efficity, l’agence qui estime votre bien en ligne, vous propose cet appartement situé dans un quartier calme de Mougins.
Ce bien de 52m² dispose d'un séjour et d'une chambre, d'une salle d'eau avec WC , de nombreux rangements.
En annexe, un parking exterieur.
Récemment rénové, cet appartement offre un espace de vie agréable augmenté d'un jardin de plain pied au calme de 100m2 environ.
N'hésitez pas à venir visiter ce bien unique à Mougins, idéal pour les personnes en quête de calme et de sérénité.
Les informations sur les risques auxquels ce bien est exposé sont disponibles sur le site Georisque : georisques. gouv. fr
Max Ego - EI - est Agent Commercial mandataire en immobilier, immatriculé au Registre Spécial des Agents Commerciaux du Tribunal de Commerce de Cannes sous le n°441841848.
Siège social du mandant : effiCity, 48 avenue de Villiers - 75017 PARIS - Société par Actions Simplifiée, société au capital de 132 373,05 euros, immatriculée au RCS Paris 497 617 746 et titulaire de la Carte professionnelle CPI 7501 2015 000 002 025 délivrée par la CCI Paris IDF - Caisse de Garantie : GALIAN Assurances 89 rue de la Boétie 75008 Paris
Afficher plus";"['52 m² - 2 pièces - 1 chambre', 'Rez-de-chaussée', 'Orientation : Est / Ouest', '1 cave', 'Année de construction : 1975', 'Chauffage individuel électrique (clim. réversible)', 'Séjour de 21 m²', ""1 salle d'eau"", '1 wc', 'Jardin privatif', 'Copropriété de 6 lots', '', None, None, None, None, None, None, None, None]";['https://photo.superimmo.com/e0c1piv3ozezx17kkf3v3m8wtxah', 'https://photo.superimmo.com/mz5794yib1p49hd2r6o1um02uv0h', 'https://photo.superimmo.com/hxjr1xm4xxr0xbwjmhx7skljz7ot', 'https://photo.superimmo.com/p208wgsvh30pa01hlydy5dkhqqqe', 'https://photo.superimmo.com/6f3s3wmdix9mkfryo6xzyxicadhd', None, None, None, None, None]
62;https://www.superimmo.com/annonces/achat-appartement-37m-cannes-06400-xwakfb;850000;37;2;1;Cannes (06400);22973;11/07/2024;Exclusivité;Terrasse;Honoraires à la charge de l'acquéreur : 5,46% TTC - 44 000 € TTC inclus dans le prix de vente - Prix hors honoraires : 806 000 €. Barème d’honoraires : http://diszln7ft1ccx.cloudfront.net/pdf/BAREME_NATIONAL.pdf;"06400 - EXCLUSIVITE - CANNES CROISETTE - PLACEMENT PREMIUM - DEUX PIECES - ENTREE INDEPENDANTE - JARDIN 60 M² - PROCHE MARTINEZ - TRAVERSANT - SANS VIS A VIS - COUR INTERIEUR 10M² - CALME
La Croisette à cinq minutes du Palais des Festivals proche MARTINEZ, Efficity vous propose en EXCLUSIVITE un appartement de 37 m2 avec jardin de 55m² et cour intérieure de 10 m² .
Situé dans un immeuble style art déco, cet appartement de deux pièces offre un emplacement de choix sur la croisette.
L'appartement se compose d'un séjour lumineux d'une chambre , un WC séparé , une salle de bain et une cuisine séparée.
Entièrement à rénover.
La plage est accessible juste en face de l'appartement.
Ne manquez pas cette opportunité RARE.
Je suis ouvert à la CO - AGENCE n'hésitez pas
Renseignements et visites - RACALBUTO Jérémy – 07 69 41 67 03
Les informations sur les risques auxquels ce bien est exposé sont disponibles sur le site Georisque : georisques. gouv. fr
Corinne Vantaggi - EI - est Agent Commercial mandataire en immobilier, immatriculé au Registre Spécial des Agents Commerciaux du Tribunal de Commerce de Cannes sous le n°442879482.
Siège social du mandant : effiCity, 48 avenue de Villiers - 75017 PARIS - Société par Actions Simplifiée, société au capital de 132 373,05 euros, immatriculée au RCS Paris 497 617 746 et titulaire de la Carte professionnelle CPI 7501 2015 000 002 025 délivrée par la CCI Paris IDF - Caisse de Garantie : GALIAN Assurances 89 rue de la Boétie 75008 Paris
Afficher plus";['37 m² - 2 pièces - 1 chambre', 'Avec ascenseur', 'Orientation : Est / Ouest', 'Terrasse', 'Année de construction : 1970', 'Chauffage individuel électrique (radiateurs)', '1 salle de bain', 'Jardin privatif', 'Copropriété de 17 lots', '', None, None, None, None, None, None, None, None, None, None];['https://photo.superimmo.com/h4xz2rlarwleocaazj7tevly1ivn', 'https://photo.superimmo.com/k6oh4jjr3syf3576x1pdlr77xwl3', 'https://photo.superimmo.com/p3501phfnp1u2o7lk8dts94rgr9w', 'https://photo.superimmo.com/6y28onnm4rczrfjffhjm53xedm5e', 'https://photo.superimmo.com/1x7ht4potrd1q9k110j6luw4d0yf', None, None, None, None, None]
63;https://www.superimmo.com/annonces/achat-appartement-78m-mandelieu-la-napoule-06210-xwakf6;410000;78;3;2;Mandelieu-la-Napoule (06210);5256;11/07/2024;1er étage avec ascenseur;Balcon;Honoraires à la charge de l'acquéreur : 1,23% TTC - 5 000 € TTC inclus dans le prix de vente - Prix hors honoraires : 405 000 €. Barème d’honoraires : http://diszln7ft1ccx.cloudfront.net/pdf/BAREME_NATIONAL.pdf;"06210 - Quartier Capitou - Magnifique 3 Pièces Traversant Rénové avec Goût et Prestations Haut de Gamme dans Résidence avec Piscine - 2 Suites Parentales - Une Belle Terrasse Sans Vis-à-Vis - Une Grande Loggia - Une Cave et un Box Fermé de 14 m2 au Sous-Sol - 410 000 euros.
Bienvenue dans votre futur havre de paix !
Situé dans une résidence prisée, cet appartement de 78 m² est une véritable perle rare. Dès l'entrée, vous serez séduit par sa luminosité naturelle et ses finitions haut de gamme, ses 2 suites parentales, et ses 2 balcons dont l'un vitré. Cet appartement traversant offre une harmonie parfaite entre fonctionnalité et élégance. La cuisine équipée, les volets électriques et son exposition est-ouest s'intègrent parfaitement à cet ensemble, vous assurant un cadre de vie confortable et lumineux.
De plus, la présence d'une cave et d'un box fermé ajoute une dimension pratique à cette belle proposition, garantissant un confort absolu au quotidien. Profitez également des commodités de la résidence, avec sa piscine et ses espaces verts paisibles. Ici, pas de vis-à-vis, juste une vue dégagée et une atmosphère sereine.
Ne manquez pas cette opportunité unique d'acquérir un bien d'exception.
Contactez-nous dès maintenant pour organiser une visite !
Les informations sur les risques auxquels ce bien est exposé sont disponibles sur le site Georisque : georisques. gouv. fr
Cecile Bruneel - EI - est Agent Commercial mandataire en immobilier, immatriculé au Registre Spécial des Agents Commerciaux du Tribunal de Commerce de Cannes sous le n°979414307.
Siège social du mandant : effiCity, 48 avenue de Villiers - 75017 PARIS - Société par Actions Simplifiée, société au capital de 132 373,05 euros, immatriculée au RCS Paris 497 617 746 et titulaire de la Carte professionnelle CPI 7501 2015 000 002 025 délivrée par la CCI Paris IDF - Caisse de Garantie : GALIAN Assurances 89 rue de la Boétie 75008 Paris
Afficher plus";"['78 m² - 3 pièces - 2 chambres', 'Piscine', '1er étage avec ascenseur', 'Orientation : Est / Ouest', 'Garage', '1 cave', 'Balcon', 'Terrasse', 'Gardien', 'Chauffage collectif au gaz', 'Séjour de 22 m²', ""1 salle d'eau - 1 salle de bain"", '1 wc', 'Copropriété de 15 lots', None, None, None, None, None, None]";['https://photo.superimmo.com/eq37p75acg6948kf5hgqpqlwfmre', 'https://photo.superimmo.com/jiycfms36xb34tdhiqyso44xdhte', 'https://photo.superimmo.com/3w350utceeeb3bqjksdx6smjtasa', 'https://photo.superimmo.com/io34rg2pbv5ktm9xq3c0cimhggdb', 'https://photo.superimmo.com/q1jjjr85datawjbnlue4eagrkls8', None, None, None, None, None]
64;https://www.superimmo.com/annonces/achat-appartement-41m-la-colle-sur-loup-06480-xwaka4;128750;41;2;1;La Colle-sur-Loup (06480);3140;11/07/2024;Exclusivité;Meublé;Barème d’honoraires : https://pierre-revente.com/;"Idéal investissement locatif
Spécial Investissement locatif par bail commercial. Fiscalité LMNP.
« Aucune possibilité d’acquisition en résidence principale ou secondaire »
A La Colle sur Loup, au sein d’une résidence de tourisme, appartement - 2 pièces, meublé, d’une surface de 41.95m², bénéficiant d’un emplacement privilégié.
Gestion locative totalement gérée et sans souci par bail locatif
Percevez …. €net de charges (montant à indiquer calculer comme suit = loyer ht – charges) de loyer garanti/an soit ….% de rentabilité immédiate.
Grâce à l’avantage fiscal du Loueur Meublé Non Professionnel, bénéficiez de revenus nets d’impôts (ou partiellement).
Pour obtenir des informations complémentaires, Contactez-nous vite !! PIERRE-REVENTE : +33(0)2.40.26.33.88 ou Christophe BIZEAU : 06.34.11.23.76 ou Marjorie GARGANO : 06.66.78.81.44 ou via notre site « PIERRE-REVENTE ».
Afficher plus";['41 m² - 2 pièces - 1 chambre', 'Rez-de-chaussée', 'Piscine', 'Balcon', 'Année de construction : 1968', 'Cuisine équipée', '1 salle de bain', '1 wc', None, None, None, None, None, None, None, None, None, None, None, None];['https://photo.superimmo.com/e69exhw3wiqygi225uhksk2ovpva', 'https://photo.superimmo.com/grfhpv8lqjux6eu9180u36vommai', 'https://photo.superimmo.com/0e0katu5xa50pcbfp90xjbyyu8g5', 'https://photo.superimmo.com/75cuz12llikg37zb1lstcck2vta3', 'https://photo.superimmo.com/2ib5iborswg16lhkd7usu4lcobv2', None, None, None, None, None]
65;https://www.superimmo.com/annonces/achat-appartement-63m-le-cannet-06110-xwajrs;399000;63;3;2;Le Cannet (06110);6333;11/07/2024;Étage 2/4 avec ascenseur;Terrasse;Barème d’honoraires : https://media.immo-facile.com/segments/immo/catalog/images/manufacturers_bareme/385550.pdf;"En limite immédiate de Cannes, au sein du quartier résidentiel Europe, calme et à proximité de toutes les commodités (marché et commerces à pied), des établissements scolaires (lycée Carnot, Institut Stanislas), et de La Croisette (2,5 kms). Accès A8 à 6 minutes en voiture.
Dans un domaine privé, paysagé et sécurisé, T3 de 63m² composé d'une entrée avec placard d'accueil, d'un séjour/cuisine de 30m² donnant sur une terrasse de 25m² en orientation Sud-Ouest. Les deux chambres ont également accès à la terrasse. Une salle de bain tout confort, WC suspendu indépendant.
Cet appartement bénéficie de deux garages en sous-sol.
399 000 euros (honoraires charges vendeurs)
DPE non requis
Pour visiter et vous accompagner dans votre projet, vous pouvez me contactez, Jean-Marc NADAUD, au 06 11 77 48 99 ou par courriel à
Selon l'article L.561.5 du Code Monétaire et Financier, pour l'organisation de la visite, la présentation d'une pièce d'identité vous sera demandée.
Cette vente est garantie 12 mois.
Cette présente annonce a été rédigée sous la responsabilité éditoriale de Jean-Marc NADAUD agissant en qualité de conseiller immobilier indépendant sous portage salarial auprès de la SAS PROPRIETES PRIVEES, au capital de 40 000 euros, ZAC LE CHÊNE FERRÉ - 44 ALLÉE DES CINQ CONTINENTS 44120 VERTOU; SIRET 487 624 777 00040, RCS Nantes. Carte professionnelle Transactions sur immeubles et fonds de commerce (T) et Gestion immobilière (G) n° CPI 4401 2016 000 010 388 délivrée par la CCI Nantes - Saint Nazaire. Compte séquestre n°30932508467 BPA SAINT-SEBASTIEN-SUR-LOIRE (44230) ; Garantie GALIAN - 89 rue de la Boétie, 75008 Paris - n°28137 J pour 2 000 000 euros pour T et 120 000 euros pour G. Assurance responsabilité civile professionnelle par MMA Entreprise n° de police 120.137.405
Mandat réf : 373001 - Le professionnel garantit et sécurise votre projet immobilier.
Copropriété de 43 lots ().
Les informations sur les risques auxquels ce bien est exposé sont disponibles sur le site Géorisques : www. georisques. gouv. fr
Afficher plus";['63 m² - 3 pièces - 2 chambres', 'Étage 2/4 avec ascenseur', 'Parking couvert', 'Terrasse', 'Chauffage individuel électrique', 'Cuisine ouverte', 'Séjour de 29 m²', '1 salle de bain', '1 wc', 'Digicode', 'Copropriété de 43 lots', '', None, None, None, None, None, None, None, None];['https://photo.superimmo.com/n988tf6b5cyxxmytx4t98wd5xkf6', 'https://photo.superimmo.com/lnwndchifgiwpell0acy5nnud7t4', 'https://photo.superimmo.com/q8ayctbedr8muh9usggbpw1s4jx0', None, None, None, None, None, None, None]
66;https://www.superimmo.com/annonces/achat-appartement-51m-grasse-06130-xwajrh;162880;51;2;1;Grasse (06130);3194;11/07/2024;;;Honoraires à la charge du vendeur. Barème d’honoraires : https://media.immo-facile.com/segments/immo/catalog/images/manufacturers_bareme/290051.pdf;"Investissez en NUE-PROPRIÉTÉ au coeur de la Capitale Mondiale du Parfum : GRASSE
Optez pour un dispositif sans charges, sans impôts, sans contraintes de gestion et hors de toutes pressions fiscales pendant toute la durée de l'usufruit (16 ans).
Grasse, située au coeur de la région Provence-Alpes-Côte d'Azur, est entourée de collines verdoyantes et de champs de fleurs, offrant un cadre de vie exceptionnel toute l'année.
Découvrez cet ensemble immobilier comprenant 3 bâtiments à taille humaine, proposant 53 logements, dont 6 en Usufruit Locatif, allant du T2 au T3 et répartis sur les bâtiments A et B (R+3+combles).
Les appartements, spacieux et lumineux, orientés plein sud, offrent des vues panoramiques sur la mer Méditerranée.
La résidence est proche du centre-ville historique et des attractions mondialement connues, offrant un accès privilégié aux plaisirs de la vie provençale.
Distances :
- 20 min de Sophia Antipolis
- 15 min de Cannes
- 20 min d'Antibes
- 30 min de Nice
- 55 min de Monaco
*Stationnement(s) inclus dans les prestations
Possibilité d'achat en pleine propriété TTC : 254.500 euros Parkings TTC : 6.400 euros
Pour visiter et vous accompagner dans votre projet, contactez Marc BERIMI au 06 13 37 59 14 ou par courriel à .
Conformément à l'article L.561.5 du Code Monétaire et Financier, la présentation d'une pièce d'identité sera demandée pour l'organisation de la visite.
Cette annonce a été rédigée sous la responsabilité éditoriale de Marc BERIMI, agissant sous le statut d'agent commercial immatriculé au RSAC 513785535 CANNES auprès de la SAS PROPRIETES PRIVEES, au capital de 40 000 euros, ZAC LE CHÊNE FERRÉ - 44 ALLÉE DES CINQ CONTINENTS 44120 VERTOU; SIRET 487 624 777 00040, RCS Nantes. Carte professionnelle Transactions sur immeubles et fonds de commerce (T) et Gestion immobilière (G) n° CPI 4401 2016 000 010 388 délivrée par la CCI Nantes - Saint Nazaire. Compte séquestre n°30932508467 BPA SAINT-SEBASTIEN-SUR-LOIRE (44230); Garantie GALIAN - 89 rue de la Boétie, 75008 Paris - n°28137 J pour 2 000 000 euros pour T et 120 000 euros pour G. Assurance responsabilité civile professionnelle par MMA Entreprise n° de police 120.137.405.
Mandat réf : 373106 - Le professionnel garantit et sécurise votre projet immobilier.
Marc BERIMI (EI) Agent Commercial - Numéro RSAC : 513785535 CANNES - .
Afficher plus";['51 m² - 2 pièces - 1 chambre', 'Rez-de-chaussée', 'Orientation : Est, Ouest, Sud, Sud-Ouest', 'Vue sur mer', None, None, None, None, None, None, None, None, None, None, None, None, None, None, None, None];['https://photo.superimmo.com/hybwtkrqfy4fkc8uckqpntp7osln', 'https://photo.superimmo.com/7ypq802geemrw0rxjgd51tejpp7l', 'https://photo.superimmo.com/i0h68k9u82ej7q2znxw8z5r24nmg', 'https://photo.superimmo.com/8l2mywt5pflown2vzbdjpm9ldjee', 'https://photo.superimmo.com/fndvb1i0au4qs73sqawpotj4ax16', None, None, None, None, None]
67;https://www.superimmo.com/annonces/achat-appartement-73m-nice-06000-xwajoq;566000;73;3;2;Nice (06000);7753;11/07/2024;Étage 2/3;;Honoraires à la charge du vendeur. Barème d’honoraires : https://media.immo-facile.com/segments/immo/catalog/images/manufacturers_bareme/367723.pdf;"Je vous présente cet appartement situé au coeur d'une rue tranquille et résidentielle, à proximité immédiate du centre-ville, des commerces, du quartier du port et des transports en commun. Ce ravissant 3 pièces entièrement climatisé vous séduira par ses prestations de qualité, sa magnifique exposition sud/ouest, son agréable terrasse de 13 m² et sa PLACE DE PARKING en sous-sol. Une opportunité à ne pas manquer
Prix : 566 000 euros Honoraires à la charge du vendeur (Lot A22)
autres appartements disponibles 2 et 3 pièces
DPE A GES A - copropriété 22 lots - DISPONIBLE septembre 2025
Pour visiter et vous accompagner dans votre projet, contactez Sandrine MARSEGUERRA, au 0615457121 ou par courriel à L.561.5 du Code Monétaire et Financier, pour l'organisation de la visite, la présentation d'une pièce d'identité vous sera demandée. Cette vente est garantie 12 mois. Cette présente annonce a été rédigée sous la responsabilité éditoriale de Sandrine MARSEGUERRA agissant sous le statut d'agent commercial immatriculé au RSAC Antibes 983 292 483 auprès de la SAS PROPRIETES PRIVEES, au capital de 40 000 euros, ZAC LE CHÊNE FERRÉ - 44 ALLÉE DES CINQ CONTINENTS 44120 VERTOU; SIRET 487 624 777 00040, RCS Nantes. Carte professionnelle Transactions sur immeubles et fonds de commerce (T) et Gestion immobilière (G) n° CPI 4401 2016 000 010 388 délivrée par la CCI Nantes - Saint Nazaire. Compte séquestre n°30932508467 BPA SAINT-SEBASTIEN-SUR-LOIRE (44230) ; Garantie GALIAN - 89 rue de la Boétie, 75008 Paris - n°28137 J pour 2 000 000 euros pour T et 120 000 euros pour G. Assurance responsabilité civile professionnelle par MMA Entreprise n° de police 120.137.405 Mandat réf : 373145 - Le professionnel garantit et sécurise votre projet immobilier.
Copropriété de 22 lots ().
Sandrine MARSEGUERRA (EI) Agent Commercial - Numéro RSAC : Antibes 983 292 483 - .
Afficher plus";['73 m² - 3 pièces - 2 chambres', 'Étage 2/3', 'Orientation : Est, Ouest, Sud, Sud-Ouest', 'Année de construction : 2024', 'Copropriété de 22 lots', '', None, None, None, None, None, None, None, None, None, None, None, None, None, None];['https://photo.superimmo.com/kbkedsdgkwtthhfaomlcjdgvmq92', 'https://photo.superimmo.com/bykqhgwn2bum8doe2r73kv26zr8i', 'https://photo.superimmo.com/iuzpj8lfun49np5dpnfmitx3cdn9', 'https://photo.superimmo.com/b5ot7hm3q1co4vbpe3moag1fu4zm', 'https://photo.superimmo.com/pid4xx8w4t737neuvfng6rqcfkyu', None, None, None, None, None]
68;https://www.superimmo.com/annonces/achat-appartement-59m-nice-06300-xwajfu;344900;59;3;1;Nice (06300);5846;11/07/2024;Meublé;Avec ascenseur;Honoraires à la charge du vendeur. Barème d’honoraires : https://api.apimo.pro/uploads/agency/19258/fees_document.pdf?1716975847;"Belle opportunité, sur l'avenue des fleurs, secteur calme à forte demande, proche de toutes les commodités et du centre-ville de Nice.
Dans une résidence bien fréquentée, très entretenue et sécurisée.
Nous y retrouvons un lot de deux habitations.
Un deux pièces avec une belle cuisine lumineuse et son salon, une grande chambre de 16m2 avec rangements, une salle de douche.
Un studio entièrement équipé et refait avec gout, un séjour cuisine, salle de douche, toilette séparé.
Une belle hauteur sous plafond, un triple vitrage, un chauffage au sol, l'appartement bénéficie d'une belle exposition au soleil, il est équipé et meublé.
Idéal pour un investisseur actuellement loué 700€ et 925€, une résidence secondaire, un couple ou une famille.
Avis de l'agent immobilier : Emplacement stratégique avec un fort potentiel locatif, l'achat du bien pourrait être en partie amorti par la mise en location du studio.
Aucun travaux à prévoir, résidence saine et réactive, équipement de qualité, c'est un appartement très engageant.
Le prix reste toutefois négociable.
Les informations sur les risques auxquels ce bien est exposé sont disponibles sur le site Géorisques : georisques.gouv.fr Honoraires à la charge du vendeur - Montant moyen de la quote-part de charges courantes 2,400 €/an - Montant estimé des dépenses annuelles d'énergie pour un usage standard, établi à partir des prix de l'énergie de l'année 2021 : 830€ ~ 1150€ - Frédéric CANINO - Agent commercial - EI - RSAC NICE 513 625 319
Afficher plus";"['59 m² - 3 pièces - 1 chambre', 'Rez-de-chaussée', 'Avec ascenseur', 'Orientation : Est / Ouest', '1 cave', 'Gardien', ""Assainissement : tout à l'égout"", 'Chauffage collectif au fuel (au sol)', 'Séjour de 9 m²', ""2 salles d'eau"", '2 wc', 'Fenêtres triple vitrage', 'Digicode', '', None, None, None, None, None, None]";['https://photo.superimmo.com/1s2mutkmngwm6qj6a6bvuhwy6wbi', 'https://photo.superimmo.com/ov2hj20aabwj2a7g4nk53of2cpdw', 'https://photo.superimmo.com/sfh4f4mhd4zwnsilo8xyjtoneimk', 'https://photo.superimmo.com/ywpiplnhrnk0b6mlwbtxfvmk0edi', 'https://photo.superimmo.com/qcs0ce1mcnz0ez6yrppivihmff7f', None, None, None, None, None]
69;https://www.superimmo.com/annonces/achat-maison-50m-saint-laurent-du-var-06700-xwajfm;280000;50;3;1;Saint-Laurent-du-Var (06700);5600;11/07/2024;Exclusivité;Chauffage individuel électrique (radiateurs);Honoraires à la charge du vendeur. Barème d’honoraires : https://api.apimo.pro/uploads/agency/19258/fees_document.pdf?1716975847;"06700 SAINT LAURENT DU VAR - MAISON DE 3 PIECES AVEC JARDIN ET PARKING - LES PLATEAUX FLEURIS -
eXp, le plus grand réseau immobilier au Monde vous propose dans un quartier pavillonnaire CALME cette maison LUMINEUSE et bien agencée.
La maison d'une superficie Loi Carrez de 43.33 m2 se compose d'une entrée avec espace de rangement, d'un séjour donnant sur son JARDIN, d'une cuisine ouverte équipée et aménagée, d'une chambre et d'un espace nuit avec espaces de rangement, d'une salle d'eau avec douche à l'italienne et d'un WC séparé.
La maison dispose également d'un emplacement de PARKING.
A proximité des écoles, des commerces et des transports. Honoraires à la charge du vendeur - Montant moyen de la quote-part de charges courantes 516 €/an - Montant estimé des dépenses annuelles d'énergie pour un usage standard, établi à partir des prix de l'énergie de l'année 2021 : 490€ ~ 720€ - Mehdi IRBAD - Agent commercial - EI - RSAC Nice 823314307
Afficher plus";"['50 m² - 3 pièces - 1 chambre', '2 niveaux', 'Orientation : Sud', ""Assainissement : tout à l'égout"", 'Chauffage individuel électrique (radiateurs)', ""1 salle d'eau"", 'Fenêtres double vitrage', 'Fibre optique', None, None, None, None, None, None, None, None, None, None, None, None]";['https://photo.superimmo.com/dxfx21vd7vgd0nh41mnr3bi85swb', 'https://photo.superimmo.com/gnlscw5xr73xrzimnusa11zb9ehi', 'https://photo.superimmo.com/eswc2l55q2wv6wgcqv9yihl55814', 'https://photo.superimmo.com/0yfogz9rxxl469jon5ltmth1fxd9', 'https://photo.superimmo.com/o2m5afdvzucbg57zc63oykci0y1e', None, None, None, None, None]
