;url;price;surface;nb_pieces;nb_chambres;lieu;prix_m2;date_publication;tag_1;tag_2;tag_3;description;tags;images_url
39;https://www.superimmo.com/annonces/achat-appartement-18m-marseille-4eme-13004-xwc261;109000;18;1;;Marseille 4ème (13004);6056;17/07/2024;Exclusivité;Étage 1/4;Honoraires à la charge du vendeur. Barème d’honoraires : https://homki-immobilier.com/notre-offre;"Idéalement situé entre les Réformés et le Parc Longchamp, à proximité de toutes les commodités
Appartement de type 1 de 18m² entièrement refait.
Situé au 1er étage, il se compose d'une entrée, une pièce de vie de 16m² avec cuisine aménagée et équipée, une mezzanine de 16m² et une salle d'eau avec des WC.
Appartement vendu Loué, loyer 695CC par mois
Contactez Solenne Morel 06 48 08 74 97
Informations financières :
La taxe foncière est de 600€
Les charges sont de 33€
Qui est le Homker proche de chez vous ?
Je suis Solenne Morel, agent commercial immatriculé au RSAC de Marseille sous le numéro 901 527 960, et je serais ravie de vous le faire découvrir !
Qui est Homki ?
Homki offre aux acquéreurs et vendeurs un service complet et transparent afin que chaque projet immobilier soit une expérience innovante vécue sereinement.
Nos frais d'agence sont de 4 900 € fixes à la charge du vendeur.
Afficher plus";"['18 m² - 1 pièce', 'Étage 1/4', 'Orientation : Nord, Nord-Ouest, Est, Ouest', 'Vue sur rue', ""Assainissement : tout à l'égout"", 'Chauffage électrique', 'Séjour de 16 m²', ""1 salle d'eau"", '1 wc', 'Espace vert', None, None, None, None, None, None, None, None, None, None]";['https://photo.superimmo.com/qtabu5jwdhxikleo3eumy27yngcy', 'https://photo.superimmo.com/gf8eute8l4v33ett03ntn1a0bfnu', 'https://photo.superimmo.com/j5ng1deavg54hdge43zz4ktu30cb', None, None, None, None, None, None, None]
40;https://www.superimmo.com/annonces/achat-appartement-20m-marseille-2eme-13002-xwc25u;50000;20;1;1;Marseille 2ème (13002);2500;17/07/2024;Exclusivité;Étage 3/8 avec ascenseur;Honoraires à la charge du vendeur. Barème d’honoraires : https://fr.foncia.com/agence-immobiliere/marseille-13001/agence-immobiliere/foncia-transaction-marseille-1er-1106;"Dans une résidence récente de 2013, boulevard de Paris, quartier Joliette / Euromed, ce studio est proche de toutes les commodités.
Situé au troisième étage avec ascenseur, superficie de 18m2 loi Carrez.
Libre d'occupation, chauffage inclus dans les charges.
ATTENTION : convention PLS avec loyer plafonné à 280 € mensuels hors charges jusqu'en 01/2027
Idéal premier investissement";['Disponible immédiatement', '20 m² - 1 pièce - 1 chambre', 'Étage 3/8 avec ascenseur', 'Année de construction : 2013', 'Gardien', 'Chauffage collectif', None, None, None, None, None, None, None, None, None, None, None, None, None, None];[None, None, None, None, None, None, None, None, None, None]
41;https://www.superimmo.com/annonces/achat-appartement-51m-marseille-1er-13001-xwc25s;240000;51;3;2;Marseille 1er (13001);4706;17/07/2024;Exclusivité;;Honoraires à la charge du vendeur.;"Mon Office Immobilier Marseille 1er vous propose à la vente, en exclusivité, cet appartement de type 3 avec balcon. L'adresse du bien, la vidéo de visite virtuelle et toutes les informations financières sont disponibles en ligne sur le site de Mon Office Immobilier avec la référence -CLA.
Situé à proximité du Palais Longchamp et des Cinq-Avenues, proche des commerces et transports en commun (tram 2/metro 1).
Au 2ème étage d'une petit copropriété, vous trouverez ce charmant appartement dans lequel vous profitez d'une surface de 51m2 loi Carrez.
Cet appartement traversant et climatisé, dispose d'un séjour avec cuisine semi-ouverte et équipée, tous deux aérés sur un balcon exposé sud avec vue sur jardin.
Se trouvent également deux chambres, une salle d'eau ainsi que des wc séparés.
Cet appartement cocon met en avant tous les codes du charme de l'ancien, alliant ainsi une belle hauteur sous plafond, moulures, cheminées et tomettes !
Vous serez séduits par son emplacement, sa luminosité, son calme et son extérieur donnant sur cour !
--
--
À votre service : Chloé LAFITTE - +33627888104
Agent commercial immatriculé au RSAC de MARSEILLE - N°899 634 570
Référence annonce : 4515-CLA
Le DPE est visible dans l'onglet informations énergétiques.
Le prix indiqué comprend les honoraires à la charge du vendeur.
Les informations sur les risques auxquels ce bien est exposé sont disponibles sur le site Géorisques : www.georisques.gouv.fr
Le bien est soumis au statut de la copropriété.
Dans une copropriété de 4 lots.
Sans procédure en cours.
Environ 864 € de charges annuelles de copropriété.
Afficher plus";"['51 m² - 3 pièces - 2 chambres', ""1 salle d'eau"", 'Copropriété de 4 lots', '', None, None, None, None, None, None, None, None, None, None, None, None, None, None, None, None]";['https://photo.superimmo.com/1ourysn1szjgx6crxj276lk1bg97', 'https://photo.superimmo.com/qq78jans24ftzwdm1ggvsfpvopke', 'https://photo.superimmo.com/79pik1c3ypqaisflshtv8lwn2d9z', 'https://photo.superimmo.com/ufndl9qsn47ji21s0qkyho0yvdlm', 'https://photo.superimmo.com/mwa64p9iw2q9bpolyhf366b4d2ap', None, None, None, None, None]
42;https://www.superimmo.com/annonces/achat-appartement-72m-marseille-10eme-13010-xwc25r;187000;72;3;2;Marseille 10ème (13010);2597;17/07/2024;2ème étage avec ascenseur;Balcon;12 000 € TTC inclus dans le prix de vente - Prix hors honoraires : 175 000 €. Barème d’honoraires : https://telemaque.orpi.coop/agence/4704/bareme.pdf;"ORPI- T3 - BALCON - TRAVERSANT- CALME - LUMINEUX- BON ETAT- SAINT TRONC- MARSEILLE- 13010
Orpi vous présente ce bel appartement type 3 dans une copropriété calme et sécurisée secteur Saint-Tronc. Calme et lumineux, cette appartement vous apportera tranquillité et quiétude.
Composé d'un séjour accueillant et spacieux de 25m² s'ouvrant sur une cuisine équipée et fonctionnelle. Un bel extérieur vous permettra de profiter du soleil de Marseille. Deux deux grandes chambres , une salle de bains avec douche à italienne, un WC indépendant.
N'hésitez pas à nous contacter pour plus d'informations.
Référence agence : 2711";"['Disponible immédiatement', '72 m² - 3 pièces - 2 chambres', '2ème étage avec ascenseur', 'Parking extérieur', '1 cave', 'Balcon', 'Chauffage collectif électrique (central)', 'Climatisation', ""1 salle d'eau - 1 salle de bain"", '1 wc', 'Fenêtres double vitrage', 'Copropriété de 190 lots', None, None, None, None, None, None, None, None]";['https://photo.superimmo.com/ac5gpunlals0wgzzz4jqxddge3kj', 'https://photo.superimmo.com/qr60cxcde6frug7eany9auzpe9md', 'https://photo.superimmo.com/s2d84pr0i2nmxegb7jd7dkf4ysh5', 'https://photo.superimmo.com/i1d4zbqgl58gbrcz816cfk7yts1y', 'https://photo.superimmo.com/9d8bctmwl3ckmdvyrjhk7sjihycw', None, None, None, None, None]
43;https://www.superimmo.com/annonces/achat-maison-110m-gignac-la-nerthe-13180-xwc25q;345000;110;4;2;Gignac-la-Nerthe (13180);3136;17/07/2024;;;Honoraires à la charge du vendeur.;"M-OI Gignac la Nerthe vous présente à la vente une maison de 110 m² au calme dans le quartier prisé de Laure.
Idéalement située, cette maison vous offre un cadre de vie paisible à proximité des commodités et des points d'intérêt locaux.
La maison propose une entrée accueillante avec une belle cuisine ouverte sur la salle à manger, un espace salon, une buanderie et un WC.
À l'étage, l'espace nuit se compose de deux chambres mansardées, d'une salle d'eau et d'un WC séparé.
Deux vérandas et une belle terrasse d'environ 25 m² complètent ce bien, parfait pour profiter des journées ensoleillées.
Cette maison offre également deux places de parking privatives au sein de la copropriété sécurisée par un portail électrique.
L'adresse du bien, la vidéo de visite virtuelle et toutes les informations financières sont disponibles en ligne sur le site de Mon Office Immobilier avec la référence 4503-ABR
--
--
À votre service : Audrey BRETNACHER - +33601223122
Agent commercial immatriculé au RSAC de AIX EN PROVENCE - N°978 507 127
Référence annonce : 4503-ABR.
Le DPE est visible dans l'onglet informations énergétiques.
Le prix indiqué comprend les honoraires à la charge du vendeur.
Les informations sur les risques auxquels ce bien est exposé sont disponibles sur le site Géorisques : www.georisques.gouv.fr
Afficher plus";"['110 m² - 4 pièces - 2 chambres - ter. 25 m²', ""1 salle d'eau"", None, None, None, None, None, None, None, None, None, None, None, None, None, None, None, None, None, None]";['https://photo.superimmo.com/amppr2k1tq5pktzlhtxju2j7vnea', 'https://photo.superimmo.com/ypdzc6z0efd6dj9tcoiao57miagd', 'https://photo.superimmo.com/3c1fgaw6fh8tsccfc9sbo7m6numo', 'https://photo.superimmo.com/uq0ppefjjc6icqk3437u3w5bd5wj', 'https://photo.superimmo.com/txpo6cqfcya0ud1o117bjq6wt46i', None, None, None, None, None]
44;https://www.superimmo.com/annonces/achat-appartement-84m-marseille-7eme-13007-xwc25p;450000;84;3;2;Marseille 7ème (13007);5357;17/07/2024;Exclusivité;;Honoraires à la charge du vendeur.;"M-OI Marseille 7e Arrondissement vous propose à la vente, en exclusivité, cet appartement de type T3 avec balcon et loggia. L'adresse du bien, la vidéo de visite virtuelle et toutes les informations financières sont disponibles en ligne sur le site de Mon Office Immobilier avec la référence 4532-CLA (Lien direct sur les photos)
Situé au sien du Quartier du Roucas Blanc, proche des transports en commun (bus), dans une résidence bien entretenue.
Au 1er étage avec ascenseur, vous trouverez cet appartement traversant, dans lequel vous profitez d'une surface au sol totale de 84m4 dont 67m2 en loi Carrez.
Celui-ci propose une pièce de vie spacieuse et aérée donnant accès à un balcon fermé de 14m2 exposée Sud et pouvant s'ouvrir. Il dispose également d'une cuisine équipée donnant sur une loggia d'environ 4m2 bénéficiant d'une vue imprenable sur Notre Dame de La Garde. Se trouvent également deux chambres, une salle d'eau ainsi que des wc séparés.
Une cave vient compléter l'ensemble.
Vous serez séduits par son emplacement au calme, son extérieur, sa vue imprenable sur le Roucas et son état prêt-à-emménager.
--
--
À votre service : Chloé LAFITTE - +33627888104
Agent commercial immatriculé au RSAC de MARSEILLE - N°899 634 570
Référence annonce : 4532-CLA
Le DPE est visible dans l'onglet informations énergétiques.
Le prix indiqué comprend les honoraires à la charge du vendeur.
Les informations sur les risques auxquels ce bien est exposé sont disponibles sur le site Géorisques : www.georisques.gouv.fr
Le bien est soumis au statut de la copropriété.
Dans une copropriété de 18 lots.
Sans procédure en cours.
Environ 1 332 € de charges annuelles de copropriété.
Afficher plus";"['84 m² - 3 pièces - 2 chambres', ""1 salle d'eau"", 'Copropriété de 18 lots', '', None, None, None, None, None, None, None, None, None, None, None, None, None, None, None, None]";['https://photo.superimmo.com/d4wo7tbclvi63rdfh9h4boregy9o', 'https://photo.superimmo.com/7vjem6s7qif6it5kyg1zuch582rf', 'https://photo.superimmo.com/iha17h59kqtca0jsdkl39nfzho8x', 'https://photo.superimmo.com/nuzmo2513ehcmg347kipv7r84qqb', 'https://photo.superimmo.com/rljjp1hzvnroomwrjxpi5glwizih', None, None, None, None, None]
45;https://www.superimmo.com/annonces/achat-maison-140m-marignane-13700-xwc25o;415000;140;5;4;Marignane (13700);2964;17/07/2024;Exclusivité;;Honoraires à la charge du vendeur.;"Mon office Immobilier de Marignane vous présente à la vente en Exclusivité une maison d'environ 140 m2 sur une parcelle de 576 m2 orientée Est/Ouest.
Situation et contexte :
Située dans une copropriété sécurisée et fermée près du quartier La Signore et centre ville, cette maison est proche des commodités, des transports en commun, des écoles et des axes routiers.
Description intérieure :
Cette villa comprend une entrée, une grande pièce de vie donnant sur une cuisine ouverte équipée et aménagée, une pièce d'environ 14 m2 aménageable en chambre avec travaux, un coin salle d'eau et W.C complète le rez-de-chausée.Les climatisations réversibles et le poêle à bois assurent un confort optimal.
Coin nuit :
À l'étage, un dégagement dessert trois chambres, un bureau, une salle de bain et un WC séparé.
Avantages extérieurs :
Le terrain de 576 m² inclut une terrasse, un jardin sur l'avant et l'arrière de la maison, ainsi qu'un garage.
Prestations complémentaires :
Cette villa offre également la possibilité de garer plusieurs véhicules dans la propriété et sur des places privatives à l'extérieur.
Conclusion :
Saisissez l'opportunité d'acquérir cette villa confortable aux multiples atouts dans un cadre agréable.
M-OI Marignane vous propose à la vente une maison. L'adresse du bien, la vidéo de visite virtuelle et toutes les informations financières sont disponibles en ligne sur le site de Mon Office Immobilier avec la référence 4527-SCA (Lien direct sur les photos)
--
--
À votre service : Sandrine CAMPO - +33620540590
Agent commercial immatriculé au RSAC de Marseille - N°904541364
Référence annonce : 4527-SCA
Le DPE est visible dans l'onglet informations énergétiques.
Le prix indiqué comprend les honoraires à la charge du vendeur.
Les informations sur les risques auxquels ce bien est exposé sont disponibles sur le site Géorisques : www.georisques.gouv.fr
Le bien est soumis au statut de la copropriété.
Dans une copropriété de 16 lots.
Sans procédure en cours.
Environ 312 € de charges annuelles de copropriété.
Afficher plus";['140 m² - 5 pièces - 4 chambres - ter. 576 m²', '1 salle de bain', 'Copropriété de 16 lots', '', None, None, None, None, None, None, None, None, None, None, None, None, None, None, None, None];['https://photo.superimmo.com/c6qe9myznvt9pd668ct3yx2glyg7', 'https://photo.superimmo.com/nzh5xjvsac60yu9hz801kbhhomjz', 'https://photo.superimmo.com/eswlkd6kn379p2nd7rme87l7wvkh', 'https://photo.superimmo.com/hi103uvcolak4anbadh67bm2df0f', 'https://photo.superimmo.com/she5x272bitc9i7ncla36izf92w0', None, None, None, None, None]
46;https://www.superimmo.com/annonces/achat-appartement-58m-marseille-13eme-13013-xwc22c;190000;58;3;2;Marseille 13ème (13013);3276;17/07/2024;Étage 1/5 avec ascenseur;Terrasse;Honoraires à la charge du vendeur. Barème d’honoraires : https://bareme.iadfrance.fr;"iad France - Gianni D'esposito (07 83 51 35 51) vous propose : Situé à la limite de Saint Mitre, venez découvrir cet appartement 3 pièces situé dans une résidence récente et encore sous garantie.
Vous avez besoin d'un extérieur au calme, ce bien est donc pour vous ! Avec sa terrasse, sans vis-à-vis, vous pourrez profiter d'agréables moments en famille !
L'appartement se compose d'un séjour/cuisine, le tout donnant sur la terrasse, de 2 chambres avec placards, d'une salle d'eau et d'un wc séparé.
Vous découvrirez des prestations de qualité comme porte blindée, climatisations réversibles, cuisine aménagée…
Il y a la possibilité de rajouter un double garage fermé sécurisé avec éclairage, en sus.
Pour vous éviter des frais supplémentaires, les charges comprennent, entre autre, eau froide, eau chaude, chauffage, ascenseur, ménage des parties communes...
Le bien est au 1er étage dans un immeuble de 5 étages.
Enfin pour vous simplifier, toutes les commodités sont à proximité (métro, commerces, écoles, lycée… ).
N'hésitez à me contacter rapidement pour cette belle opportunité !
Taxe Foncière : 1351e
La présente annonce immobilière vise 1 lot principal situé dans une copropriété formant 56 lots au total ne faisant l'objet d'aucune procédure en cours et d'un montant de charges d’environ 165.66 € par mois (soit 1987.92 € annuel) déclaré par le vendeur.Honoraires d’agence à la charge du vendeur.Information d'affichage énergétique sur ce bien : classe ENERGIE C indice 117 et classe CLIMAT C indice 20. Les informations sur les risques auxquels ce bien est exposé sont disponibles sur le site Géorisques : www.georisques.gouv.fr. La présente annonce immobilière a été rédigée sous la responsabilité éditoriale de M. Gianni D'esposito EI (ID 83065), mandataire indépendant en immobilier (sans détention de fonds), agent commercial de la SAS I@D France immatriculé au RSAC de MARSEILLE sous le numéro 930559315, titulaire de la carte de démarchage immobilier pour le compte de la société I@D France SAS.
Retrouvez tous nos biens sur notre site internet.
Afficher plus";['58 m² - 3 pièces - 2 chambres', 'Étage 1/5 avec ascenseur', '1 garage - 1 parking', 'Terrasse', 'Année de construction : 2014', 'Chauffage individuel électrique', 'Digicode - Interphone', 'Télévision par cable', 'Copropriété de 119 lots', '', None, None, None, None, None, None, None, None, None, None];['https://photo.superimmo.com/ofvci2ad4652qibou96mbiiue3vg', 'https://photo.superimmo.com/opthwizqm8r0r19vy9alo7z71d8k', 'https://photo.superimmo.com/hvnfqod61kdamek948my2zgzvdrc', 'https://photo.superimmo.com/7jvimp7906yxlrjhiij1mkuqb8jg', 'https://photo.superimmo.com/23qc538fiv94q22j1z9mg4riytqb', None, None, None, None, None]
47;https://www.superimmo.com/annonces/achat-appartement-75m-marseille-8eme-13008-xwc211;549000;75;3;2;Marseille 8ème (13008);7320;17/07/2024;Dernier étage avec ascenseur;1 balcon;Honoraires à la charge du vendeur. Barème d’honoraires : https://bareme.iadfrance.fr;"iad France - Gianni D'esposito (07 83 51 35 51) vous propose : Secteur Prado, venez découvrir cet appartement Lumineux avec Balcon et Terrasse !
Superbe logement de 3/4 pièces situé au 8ème et dernier étage d'un immeuble bien entretenu à Marseille. Avec une surface de 75m², cet appartement comprend 2 chambres spacieuses, une double cuisine séparée entièrement équipée donnant accès à la grande terrasse, un double salon lumineux donnant accès à un balcon qui offre une vue dégagée, une salle d'eau avec wc et un bureau.
Les plus de l'appartement un cellier, une zone pour étendre le linge et une grande cave.
L'ensemble est en bon état général et offre un cadre de vie confortable et agréable.
Les équipements incluent la climatisation, la fibre optique, un ascenseur et un gardien dans la résidence.
Possibilité d'acquérir un garage en sus, pour un confort supplémentaire.
Proche de toutes les commodités et avec un accès facile à ces dernières.
C'est une opportunité à ne pas manquer pour les amateurs de la vie urbaine à Marseille.
Contactez-moi vite pour planifier une visite !
La présente annonce immobilière vise 1 lot principal situé dans une copropriété formant 19 lots au total ne faisant l'objet d'aucune procédure en cours et d'un montant de charges d’environ 200 € par mois (soit 2400 € annuel) déclaré par le vendeur.Honoraires d’agence à la charge du vendeur.Information d'affichage énergétique sur ce bien : classe ENERGIE C indice 154 et classe CLIMAT A indice 4. Les informations sur les risques auxquels ce bien est exposé sont disponibles sur le site Géorisques : www.georisques.gouv.fr. La présente annonce immobilière a été rédigée sous la responsabilité éditoriale de M. Gianni D'esposito EI (ID 83065), mandataire indépendant en immobilier (sans détention de fonds), agent commercial de la SAS I@D France immatriculé au RSAC de MARSEILLE sous le numéro 930559315, titulaire de la carte de démarchage immobilier pour le compte de la société I@D France SAS.
Retrouvez tous nos biens sur notre site internet.
Afficher plus";['75 m² - 3 pièces - 2 chambres', 'Dernier étage (8ème) avec ascenseur', '1 Garage', '1 balcon', 'Terrasse', 'Année de construction : 1953', 'Gardien', 'Chauffage individuel électrique', 'Climatisation', 'Cuisine séparée, équipée', 'Interphone', 'Télévision par cable', 'Copropriété de 46 lots', '', None, None, None, None, None, None];['https://photo.superimmo.com/6evaed0mc9o5h71ct7cnipjuf4h4', 'https://photo.superimmo.com/lg7pzr0cdr2zp416kafm9tat0b7d', 'https://photo.superimmo.com/7dtxzme3le62wtb4ugpnj4w1n6n6', 'https://photo.superimmo.com/byg3zwxpe27tob0mitsm6kupr73l', 'https://photo.superimmo.com/nggp4d1redzu15s8kaabi2qlwmgt', None, None, None, None, None]
48;https://www.superimmo.com/annonces/achat-maison-158m-molleges-13940-xwc1zh;680000;158;5;3;Mollégès (13940);4304;17/07/2024;Chauffage électrique;Piscine;Honoraires à la charge du vendeur. Barème d’honoraires : https://bareme.iadfrance.fr;"iad France - Camille NOUGUIER (06 05 27 09 84) vous propose : Maison Esprit Loft avec Jardin et Piscine à Mollégès
Venez découvrir cette magnifique maison de 3 chambres, idéalement située dans le charmant village de Mollégès, à proximité d'Eygalières et de St Remy de Provence. Entièrement rénovée, cette propriété vous séduira par ses volumes généreux et son design contemporain.
Points forts de la propriété :
Volumes ouverts et lumineux : La pièce à vivre de presque 70 m2 , véritable cOEur de la maison avec sa cuisine ouverte, bénéficie d’une belle hauteur sous plafond, apportant une sensation d’espace et de lumière exceptionnelle.
Grand jardin privé :
Profitez de moments de détente et de convivialité dans votre spacieux jardin, idéal pour les réceptions ou les activités en famille.
Piscine accueillante :
Rafraîchissez-vous et profitez des chaudes journées d’été dans votre piscine privée, un véritable havre de paix à quelques pas du centre du village.
Proximité des commodités :
Située à proximité immédiate du centre de Mollégès, vous avez accès facilement aux commerces, écoles et autres services locaux.
Cadre de vie privilégié : Vivez au cOEur d’un village paisible et pittoresque, tout en étant à quelques minutes des animations et attractions d’Eygalières, de St Remy ou même d'Avignon.
Laissez-vous charmer par cette maison, où le confort moderne (pompe à chaleur : plancher chauffant/rafraichissant) rencontre le charme authentique. Contactez-moi dès aujourd’hui pour organiser une visite et découvrir cette propriété d'exception !
Visite virtuelle sur demande
Chers confrères et consoeurs, je travaille en partage d'affaires.
Honoraires d’agence à la charge du vendeur.Information d'affichage énergétique sur ce bien : classe ENERGIE B indice 94 et classe CLIMAT A indice 2. Les informations sur les risques auxquels ce bien est exposé sont disponibles sur le site Géorisques : www.georisques.gouv.fr. La présente annonce immobilière a été rédigée sous la responsabilité éditoriale de Mme Camille NOUGUIER EI (ID 59911), mandataire indépendant en immobilier (sans détention de fonds), agent commercial de la SAS I@D France immatriculé au RSAC de AVIGNON sous le numéro 901817601, titulaire de la carte de démarchage immobilier pour le compte de la société I@D France SAS.
Retrouvez tous nos biens sur notre site internet.
Afficher plus";['158 m² - 5 pièces - 3 chambres - ter. 1 196 m²', 'Piscine', 'Année de construction : 1960', 'Chauffage électrique', 'Climatisation', '', None, None, None, None, None, None, None, None, None, None, None, None, None, None];['https://photo.superimmo.com/63s2p6x6hdyhc6j33suamautkzce', 'https://photo.superimmo.com/i8k1fevoeyfpcnzmkne0vstx6z3f', 'https://photo.superimmo.com/t2o7r0w71nqw19uy8paoal96alky', 'https://photo.superimmo.com/o2xnvmu7fwxobjai2wa4byx4vemj', 'https://photo.superimmo.com/hivre1im3za9k1dylh3sqddztlvm', None, None, None, None, None]
