;url;price;surface;nb_pieces;nb_chambres;lieu;prix_m2;date_publication;tag_1;tag_2;tag_3;description;tags;images_url
84;https://www.superimmo.com/annonces/achat-appartement-83m-marseille-4eme-13004-xwc01y;268000;31;4;3;Marseille 4ème (13004);3217;17/07/2024;Exclusivité;Étage 1/6 avec ascenseur;Honoraires à la charge du vendeur. Barème d’honoraires : www.siga.fr;"SIGA LONGCHAMP vous propose en EXCLUSIVITE dans le secteur des CHUTES LAVIE un T4 lumineux et traversant de 83m2 au 1er étage d un immeuble des années 80 bien entretenu avec présence d un ascenseur
Les + : 2 emplacements de parking sécurisés.La proximité des commodités: bus métro écoles commerces et à 2 pas, le magnifique PALAIS LONGCHAMP
Le bien se compose d une pièce de vie plein sud avec terrasse, d'une cuisine séparée, de 3 chambres, d une salle de bain et d'un WC séparé.
DPE B Estimation des coûts annuels d énergie : 640EUR - 910EUR
Les charges s élèvent à 145EUR/mois
La taxe foncière est de 1609EUR
Pas de procédure en cours
Le prix est de 268 000 EUR FAI Les honoraires sont à la charge du vendeur
Mandat 726 Pour toute demande n hésitez pas à contacter :
Votre conseillère Nadine CANDELLA au 07 78 95 65 45
EI Agent Commercial RSAC 83475853400012 Carte Professionnelle CPI 13102016000003340
Afficher plus";['83,31 m² - 4 pièces - 3 chambres', 'Étage 1/6 avec ascenseur', 'Orientation : Sud', '2 Parkings', '1 balcon', '1 terrasse', 'Année de construction : 1990', 'Chauffage individuel électrique (radiateurs)', 'Cuisine séparée', 'Séjour de 26 m²', '1 salle de bain', '1 wc', 'Interphone', '', None, None, None, None, None, None];['https://photo.superimmo.com/ztdotrew2p15co2mbbqw4yabmwoa', 'https://photo.superimmo.com/bydm1jw188d76jk4jw39j4yja900', 'https://photo.superimmo.com/hjzvg0w1y1dxbz73315fiy1782rl', 'https://photo.superimmo.com/i701krq6om2leuxxewrv5xird4cg', 'https://photo.superimmo.com/d2442ti03pg04s2enq9ihiqxklr7', None, None, None, None, None]
85;https://www.superimmo.com/annonces/achat-appartement-43m-gardanne-13120-xwbzvy;225000;43;2;1;Gardanne (13120);5233;17/07/2024;Exclusivité;Étage 2/5 avec ascenseur;Honoraires à la charge du vendeur. Barème d’honoraires : https://belartimmo.la-boite-immo.com/i/redac/honoraires?honofor=1;"Gardanne - 13120 - Avec un double garage, nous vous proposons cet appartement situé au sein d'une résidence de 2021 à proximité immédiate des premières commodités. A 3 minutes à pieds des arrêts de bus, à 15 mn à pieds de la gare SNCF de Gardanne .
Il s'agit d'un charmant Type 2 d'environ 43 m2 situé au deuxième étage d'un immeuble avec ascenseur et interphone.
Idéal pour une personne seule ou un couple. Vous disposez d'un séjour lumineux de 23 m2 avec cuisine ouverte. La chambre spacieuse de 13 m2 offre tout le confort nécessaire. Une salle d'eau moderne complète cet espace fonctionnel.
Avec cet appartement vous disposez d'une terrasse de 6 m2 pour vos moments de détente.
Le chauffage et l'eau chaude sont individuels, garantissant une gestion optimale de vos dépenses énergétiques.
Un double garage en sous-sol avec l'électricité et un portail électrique est également inclus.
Ne manquez pas cette opportunité unique d'acquérir un bien de qualité dans un quartier dynamique et bien desservi !
Prix : 225 000 EUR. Honoraires 'charge vendeur' . Mandat Amépi No1527. RCS 833984529.
CPI Marseille-Provence No1310 2018 000 025 466
Contactez l'agence Bel Art Immobilier au O4 42 54 5O 52 pour plus de renseignements.
Mandat délégué par une agence membre de l'AMEPI, honoraires conformes à son barème.
Les informations sur les risques auxquels ce bien est exposé sont disponibles sur le site Géorisques : georisques.gouv.fr
Afficher plus";"['Date de disponibilité : 15 août 2024', '43 m² - 2 pièces - 1 chambre', 'Étage 2/5 avec ascenseur', '1 Garage', '1 terrasse', 'Année de construction : 2021', 'Chauffage au gaz (radiateurs)', 'Cuisine ouverte, équipée', 'Séjour de 23 m²', ""1 salle d'eau"", '1 wc', 'Interphone', 'Copropriété de 170 lots', '', None, None, None, None, None, None]";['https://photo.superimmo.com/lzjdwh6vvkd0powc4x7qjr5u8v4f', 'https://photo.superimmo.com/ve8fzd2r80719f5ev2tzmxuv0lx6', 'https://photo.superimmo.com/km59wnmhlmw97u5pks2993dcbgx2', 'https://photo.superimmo.com/wa6wkx2mn1bmlztdf4ofgg9tr8xy', 'https://photo.superimmo.com/evpqisslj9eo32kwr2j9ulxzyt3t', None, None, None, None, None]
86;https://www.superimmo.com/annonces/achat-maison-76m-fuveau-13710-xwbzvn;249000;76;4;2;Fuveau (13710);3276;17/07/2024;Exclusivité;1 Garage;Honoraires à la charge du vendeur. Barème d’honoraires : https://belartimmo.la-boite-immo.com/i/redac/honoraires?honofor=1;"FUVEAU -13710 - Si vous aimez le charme des maisons de village, nous vous invitons à decouvrir cette maison traversante, située en plein coeur du village, dans une rue calme et proche de toutes les commodites (écoles, bus, commerces).
Vous trouverez au rez de chaussee une grande pièce de vie avec sa cuisine ouverte, une salle d'eau et wc.
A l'étage, 2 chambres de 12,50 m2 et 13,50 m2 avec rangement, une salle d'eau et wc.
En sous sol , accessible aussi depuis l'habitation, un grand garage de 46 m2 avec un espace buanderie. Exposition traversante, Est-Ouest.
Les informations sur les risques auxquels ce bien est exposé sont disponibles sur le site Géorisques : georisques.gouv.fr
Prix : 249 000 EUR. Honoraires 'charge vendeur' . Mandat No1253. Exclusivité Amépi Vallée de l'Arc. RCS833984529.
DPE en D et GES en A. Taxe Foncière de 456 EUR.
Contactez l'agence Bel Art Immobilier au 06 71 73 26 95 pour plus de renseignements.
Afficher plus";"['Disponible immédiatement', '76 m² - 4 pièces - 2 chambres', 'Orientation : Est / Ouest', '1 Garage', 'Année de construction : 1920', 'Chauffage individuel', 'Climatisation', 'Cuisine ouverte, équipée', 'Séjour de 32 m²', ""2 salles d'eau"", '2 wc', '', None, None, None, None, None, None, None, None]";['https://photo.superimmo.com/to2o0gil6qznhy5mp1wrr8rnd71y', 'https://photo.superimmo.com/dd9t9v5ayrg0flr3v79u85kruoz6', 'https://photo.superimmo.com/km0e2okjpx5s0vkaax8sgdmjgygr', 'https://photo.superimmo.com/tr8u0npmbn65vxfgs3212xdw82ke', 'https://photo.superimmo.com/5eq0zhg129u3lx29pfm99trc65jr', None, None, None, None, None]
87;https://www.superimmo.com/annonces/achat-appartement-55m-rousset-13790-xwbzvf;174000;55;3;2;Rousset (13790);3164;17/07/2024;Cuisine ouverte;Chauffage individuel électrique (radiateurs);Honoraires à la charge du vendeur. Barème d’honoraires : https://www.4cheminsimmobilier.com/i/redac/honoraires?honofor=1;"A vendre, dans le centre du village de Rousset, à proximité de toutes les commodités, en copropriété (6lots) sans procédure et avec de faibles charges, Appartement rénové de type 2/3 en rez de chaussée. Il se compose d'un espace séjour/cuisine équipée d environ 26 m2, une buanderie , un coin nuit avec une chambre de 10.50m2, une petite chambre et une salle d'eau avec un toilette séparé.
Pas de travaux à prévoir, ce bien est idéal pour un primo accédant ou pour un investisseur,
DPE en cours de réalisation.
Mandat no2763 , Le prix de vente est de 174 000 euros, honoraires d agence à charge vendeur inclus dans ce prix.
Renseignements C.Saffré au 0663120659, Agent commercial, EI, RSAC Aix en Provence no 443732060
Les informations sur les risques auxquels ce bien est exposé sont disponibles sur le site Géorisques : www. georisques.
Retrouvez tous nos biens sur :
Afficher plus";"['55 m² - 3 pièces - 2 chambres', 'Rez-de-chaussée', 'Orientation : Est', 'Chauffage individuel électrique (radiateurs)', 'Cuisine ouverte', 'Séjour de 19 m²', ""1 salle d'eau"", '1 wc', 'Copropriété de 6 lots', '', None, None, None, None, None, None, None, None, None, None]";['https://photo.superimmo.com/ouuzxa9jwhz610hinxeini2k4rxd', 'https://photo.superimmo.com/onrkeocdxeg44h5ea0myvkqrqsxo', 'https://photo.superimmo.com/5owf4z5fkpnjwl2gzpopt04wdbgc', 'https://photo.superimmo.com/9xi05m26w3cun8goj3hefmm9b9nn', 'https://photo.superimmo.com/07n8tylmw2h7wsbjwg7rgn62ys5h', None, None, None, None, None]
88;https://www.superimmo.com/annonces/achat-maison-112m-aureille-13930-xwbzto;398500;112;5;4;Aureille (13930);3558;17/07/2024;1 terrasse;1 Garage;Barème d’honoraires : https://www.reseau-expertimo.fr/i/redac/honoraires?honofor=2792;"Aureille, dans les Alpilles, entre Mouriès et Eyguières, villa de plain pied de 112 m2 habitables, avec 4 chambres, sur une belle parcelle de terrain de 898 m2, hors lotissement.
Cette maison de 1995 est saine et très bien entretenue.
Grande pièce de vie avec une cuisine ouverte équipée, 4 chambres avec placards, une salle d'eau, une grande buanderie.
A l'arrière de la villa, une dépendance avec la climatisation et les arrivées d'eaux déjà installées, offre la possibilité d'une cinquième chambre ou d'une future location saisonnière.
Très grand garage avec aussi la possibilité de garer trois autres véhicules sur le terrain.
La maison possède également une belle terrasse carrelée, exposée plein sud, protégé par une tonnelle et sa bache.
Nombreuses prestations :
Grand jacuzzi avec nage à contre courant, double vitrage récent, poêle à bois, climatisation, cave à vin, volets en aluminium, moutiquaires, alarme, adoucisseur d'eau...
Je reste à votre disposition pour organiser une visite.
Pascal QUEVENNE 06 80 02 23 96
Cette annonce vous est proposée par QUEVENNE Pascal - EI -NoRSAC: 511 608 960, Enregistré au Greffe du tribunal de commerce de SALON DE PROVENCE - Annonce rédigée et publiée par un Agent Mandataire -
Afficher plus";"['112 m² - 5 pièces - 4 chambres - ter. 898 m²', 'Orientation : Sud', '1 Garage', '1 terrasse', 'Année de construction : 1995', 'Chauffage individuel', 'Climatisation', ""1 salle d'eau"", '1 wc', 'Alarme', None, None, None, None, None, None, None, None, None, None]";['https://photo.superimmo.com/pmf7zdx5htd06we0raft9ta4fvp3', 'https://photo.superimmo.com/0krsxy867bhdf1h3kgl5z76uwnpx', 'https://photo.superimmo.com/96xshqd30j6twdlr79kufcebwvph', 'https://photo.superimmo.com/hoovksstliyys3lj6ftypr5iuuh1', 'https://photo.superimmo.com/gyr3jbdgxinvzptan94tippem0r6', None, None, None, None, None]
89;https://www.superimmo.com/annonces/achat-maison-80m-marseille-10eme-13010-xwbzt0;449000;80;4;3;Marseille 10ème (13010);5613;17/07/2024;2 terrasses;1 garage - 4 parkings;Honoraires à la charge du vendeur. Barème d’honoraires : https://www.reseau-expertimo.fr/i/redac/honoraires?honofor=1656;"Vous rêvez d'une maison abordable avec une vue imprenable, et les travaux ne vous effraient pas ? Les escaliers ne sont pas un obstacle pour vous ?
Alors, ne tardez pas à contacter Louis 'Le Québécois' pour discuter de ce projet unique !
Située au fond d'une impasse calme, cette maison de plain pied 80 m2, entièrement à rénover, vous attend.
En rez-de-chaussée, la propriété se compose actuellement de deux chambres, d'une cuisine d'été à aménager, et d'un ancien studio. Une grande piscine, également à rénover, avec une profondeur progressive, complète ce bien.
Vous accédez à la propriété par un escalier attenant à un grand garage de 56 m2, suivi d'un escalier et de quelques restanques menant à la maison.
La villa offre également des combles partiellement aménagés, donnant accès à une terrasse sur le toit avec une vue dégagée à couper le souffle.
La taxe foncière s'élève à 2 419 euros par an.
Cette maison est l'endroit idéal pour s'installer avec votre petite famille. Si cette villa vous intéresse, votre agence immobilière (EIRL) Louis DANSEREAU est à votre disposition pour toute information supplémentaire.
** Les informations sur les risques auxquels ce bien est exposé sont disponibles sur le site Géorisques : www.georisques.gouv.fr **
Cette annonce vous est proposée par DANSEREAU Louis (EIRL) - EIRL - NoRSAC: 807661442, Enregistré au Greffe du tribunal de commerce de MARSEILLE - Annonce rédigée et publiée par un Agent Mandataire -
Afficher plus";['Disponible immédiatement', '80 m² - 4 pièces - 3 chambres - ter. 1 200 m²', 'Piscine', 'Orientation : Est / Ouest', '1 garage - 4 parkings', '2 terrasses', 'Année de construction : 1880', 'Chauffage individuel électrique (radiateurs)', 'Cuisine séparée', 'Séjour de 25 m²', '1 salle de bain', '1 wc', None, None, None, None, None, None, None, None];['https://photo.superimmo.com/vvycjtstv9cdvi5yi9ug5ai2aruz', 'https://photo.superimmo.com/l4ut8x3fsaiv1h1zt8j8gq190qv5', 'https://photo.superimmo.com/iznjvmd19mct9l57qgoz45oxshvu', 'https://photo.superimmo.com/dxhqbh3m8fqaaj3imj3wbe6t1hiy', 'https://photo.superimmo.com/3x7rhmnul2lik1s0xummf03v65s8', None, None, None, None, None]
90;https://www.superimmo.com/annonces/achat-maison-192m-la-ciotat-13600-xwbzp0;1090000;192;7;5;La Ciotat (13600);5677;17/07/2024;Terrasse;2 garages - 2 parkings;Honoraires à la charge de l'acquéreur : 4,2% TTC - 43 934,74 € TTC inclus dans le prix de vente. Barème d’honoraires : http://www.reflet-marine-immobilier.com/i/redac/honoraires?honofor=1;"A La CIOTAT, Belle maison T7 de 192m2 avec une très belle vue sur LA MER et sur la baie de La Ciotat ( baie classée une des plus belle baie du monde).
Belle maison T7, des Années 1969, avec un beau potentiel, bien entretenu, sur 636m2 de terrain plat avec annexes GARAGES de 53m2 DEPENDANCES de plus de 90m
Elle se compose de deux appartements, le premier en rez de jardin avec véranda et terrasse, et le deuxième avec terrasse vue mer et comble aménagée et aménageable.,
Des travaux de remise au gout du jour sont à prévoir.
Possibilté de diviser en plusieurs appartements
A saisir VITE !!";"['192 m² - 7 pièces - 5 chambres', 'Orientation : Est, Sud, Sud-Est', '2 garages - 2 parkings', 'Terrasse', 'Année de construction : 1969', ""1 salle d'eau - 1 salle de bain"", '3 wc', '', None, None, None, None, None, None, None, None, None, None, None, None]";['https://photo.superimmo.com/k5s72630lxtaw3lf3ypa153w0rx8', 'https://photo.superimmo.com/cqo6xjskhp785s5eavz6k7a56o8q', 'https://photo.superimmo.com/k2vhjc9dhkt2ap3z1tepcw7sh9oj', 'https://photo.superimmo.com/nn0rwigojiuhq4zfv0rxy4m4pa13', 'https://photo.superimmo.com/usee3axs9mpiqen63swjjhe3o7p5', None, None, None, None, None]
91;https://www.superimmo.com/annonces/achat-appartement-18m-marseille-1er-13001-xwbzoo;99900;54;1;;Marseille 1er (13001);5388;17/07/2024;Étage 2/8;1 balcon (1 m²);Honoraires à la charge du vendeur. Barème d’honoraires : https://fides-transactions.la-boite-immo.com/i/redac/honoraires?honofor=1;"Nous vous proposons un studio entièrement rénové, idéalement situé à deux pas de la gare Saint-Charles, au 2ème étage d'un immeuble avec ascenseur.
Ce studio climatisé et meublé dispose d'un petit balcon, de fenêtres à double vitrage et de volets électriques, offrant ainsi tout le confort nécessaire. Les locations de courte durée sont autorisées dans l'immeuble, ce qui en fait une excellente opportunité d'investissement.
Charges : 50 EUR par mois
Taxe foncière : 600 EUR par an
Pour plus d'informations ou pour organiser une visite, veuillez contacter Sarah Furnion au 07.77.26.00.40.";"['18,54 m² - 1 pièce', 'Étage 2/8', '1 balcon (1 m²)', '1 terrasse', 'Année de construction : 1769', 'Climatisation', 'Cuisine ouverte, équipée', ""1 salle d'eau"", '1 wc', 'Interphone', 'Copropriété de 60 lots', '', None, None, None, None, None, None, None, None]";['https://photo.superimmo.com/71ycpunbmimlehroy90talq3t7c0', 'https://photo.superimmo.com/stogylrs15m5flhf3hbiilafbyv3', 'https://photo.superimmo.com/tyxeeohvlc8r5rstqz21oi99gjch', 'https://photo.superimmo.com/53kxxxrxc94bfeb9e8k30mlm2dug', 'https://photo.superimmo.com/l8jaeru6c9z1cmjlegimkh5iev17', None, None, None, None, None]
92;https://www.superimmo.com/annonces/achat-appartement-170m-marseille-8eme-13008-xwbzog;1290000;170;5;4;Marseille 8ème (13008);7588;17/07/2024;4ème étage;;Barème d’honoraires : https://dehiba-immobilier.fr/;"SUPERBE APPARTEMENT T5 DE 170M2 AVEC TERRASSE DE 50M2 EN PLEIN COEUR DU CARRÉ D'OR - RÉSIDENCE ILE DE FRANCE
En plein coeur du Carré d'Or et à deux pas de la célèbre Avenue du Prado venez découvrir sans plus attendre notre appartement coup de coeur d'une superficie de 170m2, bénéficiant d'une terrasse de 50m2...rare à la vente !
Niché au 4ème étage sur 8 au sein d'un bel immeuble de standing avec ascenseur, il vous séduira à coup sûr par sa luminosité et son côté traversant.
À la suite d'une vaste entrée, vous tomberez sous le charme de cette superbe pièce de vie agrémentée d'un beau parquet de près de 77m2, imaginée sans cloison pour une lecture simple de l'espace, qui se prolonge sur une belle et grande terrasse de 50m2 à la vue dégagée, idéalement orientée SUD et OUEST.
Vous apprécierez sans aucun doute sa cuisine moderne équipée et aménagée, ouverte sur le séjour.
Côté nuit, vous profiterez d'une agréable suite parentale de 30m2 disposant de sa salle d'eau et son wc indépendant.
Trois autres belles chambres bénéficiant chacune de leur salle d'eau, complètent l'espace nuit avec un second wc indépendant.
L'appartement est équipé d'une climatisation et dispose d'une buanderie ainsi qu'une cave au sous-sol de la résidence. De même, le chauffage est inclus dans les charges.
Pour votre confort, un gardien est présent sur place.
Sa disposition, sa luminosité et ses grands volumes en font l'appartement familial idéal, proche de la mer, du Parc Borély, à deux pas de l'École Provence et de toutes commodités, dans un quartier prisé et tellement agréable à vivre !
Amoureux des beaux volumes dans un secteur recherché, cette pépite n'attend que vous !
Afficher plus";"['170 m² - 5 pièces - 4 chambres', '4ème étage', ""3 salles d'eau"", '2 wc', None, None, None, None, None, None, None, None, None, None, None, None, None, None, None, None]";['https://photo.superimmo.com/xkd7384a0uxmieqmgdtxp40cr5hu', 'https://photo.superimmo.com/p2lt0pgotwya97z3jfv4b1wm4h95', 'https://photo.superimmo.com/hhnc53diha816aaiir5ff76dameo', 'https://photo.superimmo.com/4l5gbhgw6cx3hq9irupaqgp6ys9q', 'https://photo.superimmo.com/asdziidr73fdd0y84pjlrwvygwq3', None, None, None, None, None]
93;https://www.superimmo.com/annonces/achat-appartement-42m-marseille-7eme-13007-xwbzo2;315000;6;2;1;Marseille 7ème (13007);7394;17/07/2024;Étage 5/6 avec ascenseur;2 balcons (8 m²);Barème d’honoraires : https://jeromebaille.la-boite-immo.com/i/redac/honoraires?honofor=1;"Rarissime !! Un incroyable nid d'aigle, niché au 5ème étage avec ascenseur d'un immeuble au coeur de Malmousque. Un deux pièces traversant qui ne vous laissera pas indifférent. En passant la porte d'entrée, vous serez totalement happez par cette vue à couper le souffle sur la mer et les îles du Frioul. Sur l'arrière, une chambre au calme absolu et une cuisine séparée avec sa grande loggia et même une vue dégagée sur Notre Dame.
Contact : Pierre MORITZ - 06 65 19 46 88
Bien en copropriété . Mandat en délégation. DPE / D/B . Taxe foncières : 1027 EUR . Charges annuelles : 917 EUR . www.gé. Non détention de fonds. Honoraires inclus charge vendeur.";"['42,6 m² - 2 pièces - 1 chambre', 'Étage 5/6 avec ascenseur', 'Orientation : Est, Ouest, Sud, Sud-Ouest', '2 balcons (8 m²)', 'Année de construction : 1970', 'Chauffage individuel électrique (radiateurs)', 'Cuisine séparée, équipée', ""1 salle d'eau"", '1 wc', 'Interphone', None, None, None, None, None, None, None, None, None, None]";['https://photo.superimmo.com/fvlb8ht103b877jn0gvm9zg4ee95', 'https://photo.superimmo.com/f7oi45nff4h0lpm835zhbqjn6r6r', 'https://photo.superimmo.com/fdak4e2yx8p9kmxiz9xfg2vev7jw', 'https://photo.superimmo.com/dkklh8b3ma36bf65j5wtvhegocg8', 'https://photo.superimmo.com/iem5shzszmikijthwhjg83j9s44d', None, None, None, None, None]
94;https://www.superimmo.com/annonces/achat-appartement-78m-marseille-14eme-13014-xwbzh6;98000;78;4;2;Marseille 14ème (13014);1256;17/07/2024;Exclusivité;Étage 7/9 avec ascenseur;Honoraires à la charge du vendeur. Barème d’honoraires : https://media.immo-facile.com/segments/immo/catalog/images/manufacturers_bareme/6444.pdf;ADEO immobilier, spécialiste de votre secteur depuis plus de 25 ans, Vous propose à la vente en EXCLUSIVITÉ. Cet appartement de type 3/4 traversant de 78 m2, situé dans la résidence Lou Souleou. Situé au 7e étage sur 9 avec ascenseur, venez découvrir son très grand balcon avec une superbe vue dégagée sur la mer et Marseille, un double salon séjour de 30 m2, une cuisine indépendante, deux chambres, une salle d'eau, et un WC indépendant. Vendu avec une place parking privative rattachée a l'appartement. Des travaux de remise au goût du jour sont à prévoir. Copropriété de 148 lots (Pas de procédure en cours).;"['78 m² - 4 pièces - 2 chambres', 'Étage 7/9 avec ascenseur', '1 Parking', 'Terrasse', ""Assainissement : tout à l'égout"", 'Séjour de 30 m²', ""1 salle d'eau"", '1 wc', 'Fenêtres en bois, simple vitrage', 'Copropriété de 148 lots', None, None, None, None, None, None, None, None, None, None]";['https://photo.superimmo.com/dyoen3i4w3lrts3wrh5r2mjo25hh', 'https://photo.superimmo.com/85c5zskjxg3w7j816nqybphuwruj', 'https://photo.superimmo.com/9onzbpbaoocfnw96vfdadvx3j47q', 'https://photo.superimmo.com/xsfv5uvflu0jaz15aq7a5nt9ko3n', 'https://photo.superimmo.com/394azaunvyx0x0kqusw26nytt5ox', None, None, None, None, None]
95;https://www.superimmo.com/annonces/achat-appartement-45m-marseille-2eme-13002-xwbzcr;191000;45;2;1;Marseille 2ème (13002);4244;17/07/2024;Étage 1/7 avec ascenseur;1 Garage;Honoraires à la charge du vendeur.;"ARENC - MARSEILLE 13002 - BEL APPARTEMENT T2 A VENDRE PAR LES AGENCES PLAZA MARSEILLE CENTRE Lorenzo de L'Agence Stéphane PLAZA MARSEILLE 2- 41 RUE DE LA REPUBLIQUE- 13002 MARSEILLE ( En face de L'arrêt de Tramway Sadi Carnot) - 1ère agence 2023-2024 du réseau Stéphane Plaza Immobilier, AVEC PLUS DE 300 ANNONCES IMMOBILIÈRES, vous présente : Découvrez ce magnifique appartement T2 situé dans le quartier prisé d'Arenc, à proximité des Terrasses du Port dans une résidence récente de 2019. Parfait pour un premier achat ou un investissement locatif, cet appartement allie confort et modernité dans un cadre dynamique et en pleine transformation. Entrez et découvrez la pièce de vie lumineuse, avec sa cuisine ouverte entièrement équipée, s'ouvrant sur un spacieux balcon de 29 m². Véritable atout de ce bien, ce balcon est un espace extérieur idéal pour profiter des beaux jours et créer un coin détente. La chambre, calme et lumineuse, sera parfaite pour un moment de repos bien méritée. La salle de bain moderne est équipée d'une douche à l'italienne, allie fonctionnalité et esthétisme. Enfin, ce bien comprend également un box en sous-sol, parfait pour stationner votre véhicule en toute sécurité ou pour bénéficier d'un espace de rangement supplémentaire. N'hésitez plus, contactez nous pour plus d'informations et venir visiter ! Référence : 8513LC17 VENTES - LOCATIONS - GESTION LOCATIVE - ESTIMATIONS OFFERTES - STÉPHANE PLAZA IMMOBILIER MARSEILLE CENTRE: Marseille 1,2,3e : 41 rue de la République Marseille 5e : 76 boulevard Chave Marseille 6e : 63 cours Pierre Puget Marseille 7e : 242 rue d'Endoume Notre équipe est à votre disposition du Lundi au Samedi de 9h00 à 19h30 sans interruption - Tél : 04 91 45 65 78 E-mail :
Afficher plus";"['45 m² - 2 pièces - 1 chambre', 'Étage 1/7 avec ascenseur', 'Orientation : Nord, Nord-Ouest, Est, Ouest', '1 Garage', 'Année de construction : 2019', 'Climatisation', ""1 salle d'eau"", 'Sous-sol', 'Procédure en cours : Oui', '', None, None, None, None, None, None, None, None, None, None]";['https://photo.superimmo.com/o2vgaqqy9u5wzq4rmft9onspg5ru', 'https://photo.superimmo.com/4ec054sp2c9tqg3eeficn1zv7uxu', 'https://photo.superimmo.com/90a0ojs6uv7jako9vgvrq2185p85', 'https://photo.superimmo.com/wre0rl8yg3pw7jdmymizvu9ltjyr', 'https://photo.superimmo.com/sp01xz7qqucdnc4q9q43nekho2xj', None, None, None, None, None]
96;https://www.superimmo.com/annonces/achat-maison-152m-aix-en-provence-13090-xwbz9n;850000;152;6;5;Aix-en-Provence (13090);5592;17/07/2024;;;Honoraires à la charge du vendeur.;Le Groupe Chateauneuf Immobilier vous propose cette maison de charme de 152 m² à Aix en Provence, située à 10mn à pied du centre-ville et à proximité de toutes commodités. Sur un terrain d'environ 450 m², elle comprend : Au RDC : - 3 chambres, - 1 salle de bains - 1 wc Au 1er étage : - 1 salle à manger, - 1 salon, - 1 cuisine, - 2 chambres, - 1 salle d'eau et 1 wc. - un balcon et 90 m2 de terrasses et patio. 2 places de stationnement complète ce bien. Possibilité d'acquérir un studio en complément. Idéal pour les professions libérales. Jean Michel ELOY (EI) Agent Commercial - Numéro RSAC : - .;"['152 m² - 6 pièces - 5 chambres - ter. 450 m²', 'Orientation : Est, Sud, Sud-Est', 'Année de construction : 1949', ""Assainissement : tout à l'égout"", ""1 salle d'eau - 1 salle de bain"", '2 wc', 'Fenêtres double vitrage, en pvc', '', None, None, None, None, None, None, None, None, None, None, None, None]";['https://photo.superimmo.com/a82p2lrha4i20fwfr01pi36wkirv', 'https://photo.superimmo.com/hsi8kpd0xsr6v1e723j1ikyltnvn', 'https://photo.superimmo.com/k0c3a6kicqxf9jaenjkpmgokvqlt', 'https://photo.superimmo.com/w8pdyxncdxyu7mlemfxxfa3pgw51', 'https://photo.superimmo.com/0qgca4jxu8imfagaski5vth85uf6', None, None, None, None, None]
