;url;price;surface;nb_pieces;nb_chambres;lieu;prix_m2;date_publication;tag_1;tag_2;tag_3;description;tags;images_url
55;https://www.superimmo.com/annonces/achat-maison-146m-saint-cezaire-sur-siagne-06530-xwcvp7;599000;146;5;4;Saint-Cézaire-sur-Siagne (06530);4103;20/07/2024;Exclusivité;Cuisine de 10 m²;Honoraires à la charge du vendeur.;"Maison 5 pièces - Plain pied - Calme absolu
CO-EXCLUSIVITE : Située au cœur d'un environnement paisible, cette charmante maison de plain-pied de type 5 pièces s'étend harmonieusement sur un terrain plat de 2500 m² offrant une sensation d'espace propice à toutes sortes d'activités de plein air et de détente avec cuisine d'été et de nombreuses terrasses.
La maison, d'une surface habitable de 145 m², s'ouvre sur une belle entrée avec rangements, un spacieux salon, salle à manger orienté sud avec cuisine provençale ouverte. La partie nuit se compose de 3 chambres dont une avec salle de douche attenante, d'une salle de bains balnéo/douche/wc et un wc indépendant. Un studio à aménager de 20 m² ainsi que des combles aménagées en bureau et chambre d'amis viennent compléter le bien.
Cette maison de plain-pied, alliant confort moderne et charme de la campagne, représente une belle opportunité alliant charme de la campagne et proximité des commodités nécessaires au quotidien.
Prix : 599 000 €, honoraires à la charge du vendeur.
Les informations sur les risques auxquels ce bien est exposé, sont disponibles sur le site Géorisques http://georisques.gouv.fr
Afficher plus";['146 m² (carrez : 145) - 5 pièces - 4 chambres - ter. 2 500 m²', 'Orientation : Sud', 'Vue sur verdure', 'Année de construction : 1999', 'Assainissement : fosse septique', 'Eau chaude individuelle : chaudière', 'Climatisation', 'Cuisine de 10 m²', 'Séjour de 33 m²', 'Barbecue', 'Fenêtres double vitrage', 'Cheminée', None, None, None, None, None, None, None, None];['https://photo.superimmo.com/q2lm3h8xyf9enmhjk4j4vmbdimk4', 'https://photo.superimmo.com/ggqjsmroc9havuvb7e79npo8ouao', 'https://photo.superimmo.com/kee5a9pvs6gve2e0pit834icmdah', 'https://photo.superimmo.com/ezwbz4ceqvg6igefdhooojnkbnh8', 'https://photo.superimmo.com/yyfq5zxdpsfeotp6a2qmco88xqhe', None, None, None, None, None]
56;https://www.superimmo.com/annonces/achat-appartement-39m-cannes-06150-xwcsfu;380000;39;2;1;Cannes (06150);9744;20/07/2024;;;Honoraires à la charge du vendeur - Prix hors honoraires : 360 000 €. Barème d’honoraires : https://media.immo-facile.com/segments/immo/catalog/images/manufacturers_bareme/111059.pdf;"Votre agence immobilière de Cannes centre ERA Marclé vous propose à la vente, dans un petit immeuble bourgeois, cet appartement de 2P de 39M² LC entièrement rénové, vendu meublé et proche du Palais des Festivals et de la Croisette. Il représente un excellent investissement locatif clés en main ou résidence secondaire.
Pour plus de renseignements, contactez votre agence immobilière de Cannes centre ERA Marclé, au 04.93.39.00.64.
Les informations sur les risques auxquels ce bien est exposé sont disponibles sur le site Géorisques http://www.georisques.gouv.fr
L'Etat des Risques et Pollution peut être consulté sur https://www.georisques.gouv.fr";['39 m² - 2 pièces - 1 chambre', 'Copropriété de 7 lots', None, None, None, None, None, None, None, None, None, None, None, None, None, None, None, None, None, None];['https://photo.superimmo.com/rhwkiqdoq0pjqcv6bz2bhs5kf807', 'https://photo.superimmo.com/1af8ab6fkm6ub0vja849me5ima6v', 'https://photo.superimmo.com/2weg886buc0upq620d0y78iz6zr9', 'https://photo.superimmo.com/bl4s8k5o4ynyf6k6jab7lq4lj6di', 'https://photo.superimmo.com/lf6iyn8zqmhhd6i6oq16cjluryn8', None, None, None, None, None]
57;https://www.superimmo.com/annonces/achat-maison-116m-magagnosc-06520-xwcsfe;695000;3;5;3;;5976;20/07/2024;;;Honoraires à la charge du vendeur - Prix hors honoraires : 653 300 €. Barème d’honoraires : https://media.immo-facile.com/segments/immo/catalog/images/manufacturers_bareme/13450.pdf;"ERA GRASSE vous propose à la vente cette propriété à Magagnosc avec une magnifique vue dégagée.
Cette maison de plain pied de 116.30m2 habitables se compose d'un hall d'entrée, d'un séjour avec cheminée et donnant sur une véranda, d'un coin télévision et d'une cuisine indépendante .
L'espace nuit se compose de trois chambres dont une avec coin bureau, d'une salle d'eau, d'une salle de bains avec wc et d'un wc avec lave-mains.
Cette maison dispose d'une belle terrasse couverte, d'une piscine chauffée, d'un garage et d'un magnifique terrain en restanques avec de beaux oliviers.
Vous souhaitez plus d'informations, contactez-nous au 04 93 66 18 30.
L'Etat des Risques et Pollution peut être consulté sur https://www.georisques.gouv.fr";['116,3 m² - 5 pièces - 3 chambres - ter. 3 320 m²', None, None, None, None, None, None, None, None, None, None, None, None, None, None, None, None, None, None, None];['https://photo.superimmo.com/kshcld0d31f56ygeheurx7wgr8ev', 'https://photo.superimmo.com/fi531gf4lt94omoa1tixggmylrki', 'https://photo.superimmo.com/l370sp12z4hxzjxn6vhwxbreb8t6', 'https://photo.superimmo.com/twp51w433ac8bwnuvav80vgywv6d', 'https://photo.superimmo.com/ot0utjce7efgw1sgpgvwwsttlth5', 'https://photo.superimmo.com/lwowcwavglzvpz2ug14virkyfe51', None, None, None, None]
58;https://www.superimmo.com/annonces/achat-appartement-69m-nice-06300-xwcs66;185000;69;3;2;Nice (06300);2681;20/07/2024;Dernier étage;1 Parking;Honoraires à la charge du vendeur. Barème d’honoraires : https://www.imkiz.com/offres;"A Nice, Quartier Pont Michel, bel appartement de type 3 en duplex au dernier étage (6°) comprenant :
Au Premier Niveau :
- une entrée avec un grand placard surface Carrez 8.83m² surface au sol 9.59m²
- un séjour-cuisine (équipée) surface Carrez 19.11m² surface au sol 20.46m², ouvrant sur une terrasse d'environ 10m²
- une salle d'eau/wc surface Carrez 4.28m²
Au Deuxième Niveau :
- un palier surface Carrez 3.8m² surface au sol 5.25m²
- une chambre 1 surface Carrez 8.91m² surface au sol 15.41m²
- un bureau/chambre 2 surface Carrez 6.77m² surface au sol 10.97m²
- une salle d'eau/wc surface Carrez 3.35m²
Chauffage individuel électrique. (Bon DPE C).
Nombre de lots de copropriété : 205 dont 95 logements.
Charges de copropriété : 118€/mois.
Taxe Foncière : 1345€
Commodités (commerces, santé, éducation (écoles, collège, lycée, université)) à proximité immédiate
Bus Ancien Octroi à 134m
Tram Pont Michel à 169m
Gare Nice Pont Michel à 238m.
Présenté par imkiz, l'agence en ligne 100% proche de vous. Honoraires inclus dans le prix de vente, dès 2490 €
Afficher plus";['69 m² - 3 pièces - 2 chambres', 'Dernier étage (6ème)', '1 Parking', '2 wc', None, None, None, None, None, None, None, None, None, None, None, None, None, None, None, None];['https://photo.superimmo.com/ahm1yfambnnf418qufrccs3ayqcq', 'https://photo.superimmo.com/9f14qtz12hj3d9ke4fnyrj5x0adc', 'https://photo.superimmo.com/6v6m9sa23pv86tanqpmfdyx942ng', 'https://photo.superimmo.com/d1a2o8elnnum9x12wt2fj8y0cwf0', 'https://photo.superimmo.com/l6w3px7tp6m1p3fl6gk7op7w2zf0', None, None, None, None, None]
59;https://www.superimmo.com/annonces/achat-appartement-45m-nice-06000-xwcs60;280000;45;2;1;Nice (06000);6222;20/07/2024;Étage 3/6;;Honoraires à la charge du vendeur. Barème d’honoraires : https://www.imkiz.com/offres;"NICE-GAMBETTA, Idéalement situé à proximité des commerces et plages;
Je vous propose ce charmant appartement de 46 m² au 3ème étage avec ascenseur dans une résidence sécurisée,
Une belle entrée avec placards vous accueil, elle dessert :
- Une belle pièce de vie de 30m2 avec sa cuisine ouverte donnant sur un balcon de 4m²,
- Une chambre de 8m²,
- Une salle de bains,
- Toilette séparé.
Charges 330€ /trimestre comprenant le chauffage.
Présenté par imkiz, l'agence en ligne 100% proche de vous. Honoraires inclus dans le prix de vente, dès 2490 €";['45 m² - 2 pièces - 1 chambre', 'Étage 3/6', '1 salle de bain', '1 wc', None, None, None, None, None, None, None, None, None, None, None, None, None, None, None, None];['https://photo.superimmo.com/apohkp2ke2kokyrrg4uprieci0xz', 'https://photo.superimmo.com/wnxplwe9q6umc845ce4oz8b8jxlq', 'https://photo.superimmo.com/qd1o340g1b1jn2pgkciq5hztau7g', 'https://photo.superimmo.com/jfejmi36pgl5330v0egsg0typ1qp', 'https://photo.superimmo.com/d9vvzyr25aztnuaz10fww5jpibq9', None, None, None, None, None]
60;https://www.superimmo.com/annonces/achat-appartement-91m-cabris-06530-xwcs54;449000;91;3;2;Cabris (06530);4934;20/07/2024;2 Parkings;;Honoraires à la charge du vendeur. Barème d’honoraires : https://www.imkiz.com/offres;"Dans un secteur pavillonnaire, au sein d'une charmante maison provençale divisée en 2 logements.
Venez découvrir ce magnifique T3 de 91m2 entièrement refait à neuf donnant sur un terrain de 511m2. De Belles prestations et de beaux volumes.
Ce bas de villa dispose d'un confortable et spacieux séjour de 35 mètres carrés agrémenté d'un poêle à bois, d'une cuisine équipée et fonctionnelle de qualité semi-ouverte sur le séjour, 2 belles chambres, une salle d'eau et un wc indépendant. Le tout donnant sur une agréable terrasse de 70 m², ensoleillée composée d'un jacuzzi, d'une piscine hors sol et d'un jolie jardin.
2 places de parking privatives.
À découvrir rapidement !
Présenté par imkiz, l'agence en ligne 100% proche de vous. Honoraires inclus dans le prix de vente, dès 2490 euros";['91 m² - 3 pièces - 2 chambres', 'Rez-de-chaussée', '2 Parkings', '1 wc', None, None, None, None, None, None, None, None, None, None, None, None, None, None, None, None];['https://photo.superimmo.com/zsk226vpwuygukjt3ibui2fsqbbt', 'https://photo.superimmo.com/ukrwso4m1pl28z3tkdutq5oa6u55', 'https://photo.superimmo.com/f1tkbsjiwo8d9zqb317lqv1nfbcd', 'https://photo.superimmo.com/2tsf45zcubr9seb3a26tafofvakm', 'https://photo.superimmo.com/n331to3m6p2lmv5e88tz2w2k5lln', None, None, None, None, None]
61;https://www.superimmo.com/annonces/achat-maison-94m-antibes-06600-xwcrrj;490000;3;4;3;Antibes (06600);5211;19/07/2024;1 terrasse;1 Garage;Honoraires à la charge du vendeur. Barème d’honoraires : https://www.maurer-immo.com/i/redac/honoraires?honofor=1;"Au sein d'un lotissement sécurisé Maison de type 4 Pièces d'une superficie de 94 m2 Carrez avec un jardin arboré d'une superficie approximative de 238 m2 avec barbecue.
Particulièrement lumineuse et située au calme
Ce bien est constitué au rez-de-jardin : d'un séjour / Salle à manger d'une superficie de 40,84 m2 avec cheminée, d'une cuisine séparée, meublée et équipée, de rangements et d'un WC séparé.
Au premier étage de trois chambres, d'une salle d'eau avec WC, d'un dégagement et d'une terrasse de 11,77 m2.
Annexes et dépendances : d'un cellier de 12,32 m2, d'un abri voiture de 14,62 m2 et d'un abri bois de 3,50 m2.
Possibilité de fermer l'abri voiture afin d'en faire un garage clos
Climatisation - Chauffage : Individuel électrique - Eau chaude : Individuelle électrique
A proximité immédiate des commerces dont le centre commercial « Carrefour Antibes »
Accès très rapide à l'Autoroute A8 (La Provençale) ainsi qu'à Sophia Antipolis.
A proximité de l'école élémentaire et maternelle de Saint-Jean, de l'école élémentaire et maternelle Jean MOULIN et de l'école maternelle de Super Antibes.
Arrêts de bus lignes : 6, 7, 9 et 19
Le montant annuel de la quote-part de charges courantes est de 1517 EUR soit 126 EUR par mois
Taxes Foncières : 1239 EUR / an
Maison située dans une copropriété loi no65-557 du 10 juillet 1965 - Nombre de lots de la copropriété : 111
Aucune procédure en cours menée sur le fondement des articles 29-1 A et 29-1 de la loi no65-557 du 10 juillet 1965 et de l'article L.615-6 du CCH
Les informations sur les risques auxquels ce bien est exposé sont disponibles sur le site Géorisques :
Afficher plus";"['94,03 m² - 4 pièces - 3 chambres - ter. 238 m²', '1 Garage', '1 terrasse', 'Chauffage individuel électrique (radiateurs)', 'Climatisation', 'Cuisine séparée, équipée', 'Séjour de 40 m²', ""1 salle d'eau"", '2 wc', 'Copropriété de 111 lots', None, None, None, None, None, None, None, None, None, None]";['https://photo.superimmo.com/5p4i5wacdxkz3i2r5eodpcnein3s', 'https://photo.superimmo.com/cz1eemszv2f2zoswv7hgft1b43io', 'https://photo.superimmo.com/7eh8egtuxca258gpm41yjtnjswct', 'https://photo.superimmo.com/9tf6og1dq0nd8opajh8u5j331d5r', 'https://photo.superimmo.com/a5oyb7ibzv53pa4f8evu3jo9iwg9', None, None, None, None, None]
62;https://www.superimmo.com/annonces/achat-maison-135m-nice-06000-xwcr2f;1190000;135;7;5;Nice (06000);8815;19/07/2024;Balcon;Terrasse;Honoraires à la charge du vendeur. Barème d’honoraires : https://www.remax.fr/azur-collection;"Nice, Baumettes - Charmante maison de ville de 135m², entièrement rénovée avec de belles prestations. Répartie sur trois niveaux, elle se compose comme suit :
- Au rez-de-chaussée : entrée, vaste séjour, cuisine américaine équipée, salle de bains et toilettes séparées.
- Au premier étage : trois chambres, un balcon, une salle de bains avec WC et des placards de rangement.
- Au niveau -1 : appartement indépendant de type trois pièces avec séjour et cuisine, deux chambres, une salle de bain et toilettes, ouvrant sur une belle terrasse orientée plein sud.
Extérieur : jardin, terrasses, cabanons et deux places de stationnement devant la maison.Proche des commodités, du tramway et à deux pas de la mer.
Honoraires à la charge du vendeur 4%.
Les informations sur les risques auxquels ce bien est exposé sont disponibles sur le site Géorisques : www.georisques.gouv.fr .
Afficher plus";['135 m² - 7 pièces - 5 chambres', 'Balcon', 'Terrasse', 'Année de construction : 1940', '3 salles de bain', '3 wc', 'Jardin privatif', '', None, None, None, None, None, None, None, None, None, None, None, None];['https://photo.superimmo.com/dqhu6ariexupu997t8qmkgqywapl', 'https://photo.superimmo.com/te8ve9aya6t8vfa0voor3xmct8yi', 'https://photo.superimmo.com/eh2a3yyj91jjqvrb70tmmvmlr6se', 'https://photo.superimmo.com/zc01wilou9chj2nz9azwi31bf0g7', 'https://photo.superimmo.com/53o066i45utffu7uz65l6zil3k0z', None, None, None, None, None]
63;https://www.superimmo.com/annonces/achat-appartement-77m-antibes-06600-xwcqzz;369000;77;3;2;Antibes (06600);4792;19/07/2024;Étage 2/4 avec ascenseur;Balcon;Barème d’honoraires : https://welmo.fr/;"Welmo, l'agence immobilière en ligne, vous présente :
(06600) ANTIBES - LUMINEUX - PROCHE CENTRE VILLE - RÉSIDENCE 2015 - GRAND BALCON - 2 CHAMBRES - VUE DEGAGEE SANS VIS-A-VIS - PARKING
Vous souhaitez visiter ce bien ? Planifiez directement une visite sur le site Welmo avec la référence : H1ezfkYI-0
Welmo vous présente ce bel appartement lumineux, de 70,25 m2 (loi Carrez) au 2ème étage avec ascenseur dans une résidence récente (2015) très bien entretenue.
Vous serez à coup sûr séduit par son grand balcon de 23 m², sa luminosité et son agencement.
Il comprend : une entrée avec placard, un vaste séjour baigné de lumière avec son coin salle à manger et un accès au balcon, une cuisine séparée, aménagée et toute équipée, 2 chambres avec grands placards, une salle de bains et WC indépendant avec lave mains. Il dispose de nombreux rangements.
Une place de parking privative au sous-sol vient compléter l'ensemble.
Cet appartement est très lumineux et agréable à vivre. Aucun travaux n’est à prévoir.
Proche du centre ville d’Antibes, de toutes commodités (écoles, commerces) et idéalement situé à 8 minutes à pied de la gare.
Nombre de lots : 35
Charges prévisionnelles annuelles : 1920 €
DPE réalisé avant Juillet 2021
Welmo, commission de 10 990 € à la charge de l'acquéreur incluse dans le prix de vente affiché
La présente annonce immobilière a été rédigée par Dorothée Davis, agent commercial de la SAS WELMO France, immatriculé au RSAC de Evry sous le numéro 853 974 350
Les informations sur les risques auxquels ce bien est exposé sont disponibles sur le site Géorisques : www.georisques.gouv.fr
Afficher plus";['77 m² - 3 pièces - 2 chambres', 'Étage 2/4 avec ascenseur', 'Orientation : Est', 'Balcon', 'Terrasse', 'Chauffage individuel au gaz', '1 salle de bain', 'Copropriété de 35 lots', None, None, None, None, None, None, None, None, None, None, None, None];['https://photo.superimmo.com/q9etpy4hkpvwu68q61elb95fupoc', 'https://photo.superimmo.com/t2jap83vwxf5jx375mbn38w4g3j8', 'https://photo.superimmo.com/lvvmnrqtr3g6lfh9yjmf4iiwn1wo', 'https://photo.superimmo.com/r1ikuron07n4lq38p55zih5fdf05', 'https://photo.superimmo.com/qke6uzowajh0e5j70pbt48aohfmc', None, None, None, None, None]
64;https://www.superimmo.com/annonces/achat-appartement-108m-cannes-06400-xwcqbg;736850;108;3;2;Cannes (06400);6823;19/07/2024;Étage 5/8;;Honoraires à la charge du vendeur. Barème d’honoraires : https://media.immo-facile.com/segments/immo/catalog/images/manufacturers_bareme/309632.pdf;"Quartier Alexandre III dans un immeuble de standing , sécurisé - Vente appartement de type 3P d'environ 108m2 au sol (72m2 carrez) avec des prestations haut de gamme, une Cave et un Parking en sous-sol complètent ce bien. Triple exposition, l'appartement a ses deux chambres à l'Est, prolongées par une loggia de 17m2, elles bénéficient d'une vue sur les îles. La pièce de vie avec cuisine Américaine entièrement équipée De Dietrich offre une surface généreuse de presque 50m2 car elle est prolongée côté ouest par une loggia fermée par des baies vitrées , des stores électriques ainsi que la climatisation assurent une bonne qualité de vie. l'appartement est vendu meublé, dans le salon un ensemble home cinéma , avec écran de projection et uneTv QLED 85 pouces vous rappelle que nous sommes dans la ville du Cinéma. L'appartement baigne de lumière et est au calme absolu. Il bénéficie de tous les commerces de proximité , la plage de la Croisette est seulement à 650 mètres. à voir rapidement.
Code pour la Visite virtuelle sur demande par mail.
DPE : note ""E"" 281 kWh/m2/an et ""E"" 57 kgCO2/m2/an
( 4 972 kWh consommés sur l'année 2023 facture faisant foi, soit pour 108m2 un calcul de 46 kWh/m2/an soit une note de ""A"") .
Bien en copropriété , pas de procédure en cours.
prix de vente 736 850 euros mandat charge vendeur pour une commission de 5% soit 36 850 euros.
Pour visiter et vous accompagner dans votre projet, contactez Pascal EMMANUELLI, au 0622870080 ou par courriel à
Selon l'article L.561.5 du Code Monétaire et Financier, pour l'organisation de la visite, la présentation d'une pièce d'identité vous sera demandée.
Cette vente est garantie 12 mois.
Cette présente annonce a été rédigée sous la responsabilité éditoriale de Pascal EMMANUELLI agissant sous le statut d'agent commercial immatriculé au RSAC CANNES 789781499 auprès de la SAS PROPRIETES PRIVEES, au capital de 40 000 euros, ZAC LE CHÊNE FERRÉ - 44 ALLÉE DES CINQ CONTINENTS 44120 VERTOU; SIRET 487 624 777 00040, RCS Nantes. Carte professionnelle Transactions sur immeubles et fonds de commerce (T) et Gestion immobilière (G) n° CPI 4401 2016 000 010 388 délivrée par la CCI Nantes - Saint Nazaire. Compte séquestre n°30932508467 BPA SAINT-SEBASTIEN-SUR-LOIRE (44230) ; Garantie GALIAN - 89 rue de la Boétie, 75008 Paris - n°28137 J pour 2 000 000 euros pour T et 120 000 euros pour G. Assurance responsabilité civile professionnelle par MMA Entreprise n° de police 120.137.405
Mandat réf : 373 731 - Le professionnel garantit et sécurise votre projet immobilier.
Pascal EMMANUELLI (EI) Agent Commercial - Numéro RSAC : CANNES 789781499 - .
Les informations sur les risques auxquels ce bien est exposé sont disponibles sur le site Géorisques : www. georisques. gouv. fr
Afficher plus";['108 m² - 3 pièces - 2 chambres', 'Étage 5/8', 'Orientation : Est / Ouest', 'Vue sur mer', 'Séjour de 33 m²', '', None, None, None, None, None, None, None, None, None, None, None, None, None, None];['https://photo.superimmo.com/od77e0zggo2js049jt70o4tnntq5', 'https://photo.superimmo.com/corbydkz0r3o3ys8mspcuymh85e0', 'https://photo.superimmo.com/hewfp1zb6844zt01jsucrrvs6ks9', 'https://photo.superimmo.com/priithnirvkzgil46kccumpy86de', 'https://photo.superimmo.com/qycrvsc0yja9wofcqndx2udn1nfp', None, None, None, None, None]
65;https://www.superimmo.com/annonces/achat-appartement-110m-nice-06300-xwcq73;990000;110;5;3;Nice (06300);9000;19/07/2024;Avec ascenseur;Balcon;Honoraires à la charge du vendeur. Barème d’honoraires : https://media.immo-facile.com/segments/immo/catalog/images/manufacturers_bareme/289939.pdf;"110 m2. Nice MONT BORON .
Le quartier résidentiel de Nice!
Vue imprenable et exceptionnelle sur la baie des Anges, dans immeuble de grand standing avec piscine, parc arboré et gardien à demeure.
Appartement de 110 m2, comprenant un grand séjour donnant directement sur une grande et profonde terrasse, cuisine entièrement équipée et séparée, pouvant être ouverte sur le séjour . 2 ou 3 chambres, 2 salles de bains, toilettes invités, nombreux placards. Box fermé et cave accessible directement par l'ascenseur .
Visite possible tous les jours , n'hésitez pas à contacter !
Odile Gouvy Branche Prestige
06 08 01 81 00
Les informations sur les risques auxquels ce bien est exposé sont disponibles sur le site Géorisques : www.georisques.gouv.fr.?Pour visiter et vous accompagner dans votre projet, contactez Odile Gouvy au 06 08 01 81 00 ou par courriel à o.gouvy @?Selon l'article L.561.5 du Code Monétaire et Financier, pour l'organisation de la visite, la présentation d'une pièce d'identité vous sera demandée.?Cette présente annonce a été rédigée sous la responsabilité éditoriale de Odile Gouvy agissant sous le statut d'agent commercial immatriculé au RSAC PARIS??? auprès de la SAS PROPRIETES PRIVEES au capital de 40 000 euros, ZAC LE CHÊNE FERRÉ - 44 ALLÉE DES CINQ CONTINENTS 44120 VERTOU ; SIRET ???? RNE Nantes. Carte professionnelle Transactions sur immeubles et fonds de commerce (T) et Gestion immobilière (G) n° CPI 4401 2016 000 010 388 délivrée par la CCI Nantes - Saint Nazaire. Compte séquestre n°30932508467 BPA SAINT-SEBASTIEN-SUR-LOIRE (44230) ; Garantie GALIAN - 89 rue de la Boétie, 75008 Paris - n°28137 J pour 2 000 000euros pour T et 120 000euros pour G. Assurance responsabilité civile professionnelle par MMA Entreprise n° de police 120.137.405
Copropriété de 150 lots ().
Odile GOUVY (EI) Agent Commercial - Numéro RSAC : 31926496600023 - .
Afficher plus";['110 m² - 5 pièces - 3 chambres', 'Rez-de-chaussée', 'Piscine', 'Avec ascenseur', 'Orientation : Est, Ouest, Sud, Sud-Ouest', 'Vue sur mer', 'Garage', '1 cave', 'Balcon', 'Terrasse', 'Année de construction : 1984', 'Gardien', 'Chauffage individuel électrique', 'Cuisine aménagée', '2 salles de bain', '2 wc', 'Digicode', '', None, None];['https://photo.superimmo.com/to5nsljd859zf7ns938zxigr6kld', 'https://photo.superimmo.com/wq5zm344y9663gm5qcf4om8uc9rz', 'https://photo.superimmo.com/62np7qcl1dzg0lofxugn8b3l73b2', 'https://photo.superimmo.com/jvna1h6ya44cs7d6ly1cujaax8ex', 'https://photo.superimmo.com/0zkoecah46yaxxqyufri55f9jyho', None, None, None, None, None]
66;https://www.superimmo.com/annonces/achat-maison-320m-antibes-06160-06600-xwcpzb;15950000;320;7;;Antibes (06);49844;19/07/2024;Chauffage: central;Piscine;Honoraires à la charge de l'acquéreur : 6% TTC - 902 830 € TTC inclus dans le prix de vente - Prix hors honoraires : 15 047 170 €. Barème d’honoraires : https://api.apimo.pro/uploads/agency/19258/fees_document.pdf?1716975847;"Située au cœur du Cap d'Antibes, à deux pas d'un palace prestigieux, cette villa offre une vue époustouflante dans un endroit calme et reposant.
La propriété, dotée d'une piscine, d'un pool house et d'un immense jardin de 3788 m², s'étend sur trois étages. Au rez-de-chaussée, vous trouverez cinq chambres avec salles de bains ensuite, un bureau/salle de jeux, une buanderie et une kitchenette. Au premier étage, un très grand séjour, une grande cuisine aménagée et une salle à manger s'ouvrent sur une magnifique terrasse offrant une vue exceptionnelle. Au troisième étage, une chambre de maître offre un confort de grand standing. 15,047,170 € Honoraires d'agence non inclus - Honoraires agence: 6%TTC Honoraires à la charge de l'acquéreur - Montant estimé des dépenses annuelles d'énergie pour un usage standard, établi à partir des prix de l'énergie de l'année 2021 : 3131€ ~ 4235€ - Les informations sur les risques auxquels ce bien est exposé sont disponibles sur le site Géorisques : www.georisques.gouv.fr - Olivier MEVELLEC - Agent commercial - EI - RSAC ANTIBES 893 957 779
Afficher plus";"['320 m² - 7 pièces', '3 niveaux', 'Piscine', ""Assainissement : tout à l'égout"", 'Chauffage: central', 'Climatisation', 'Fenêtres double vitrage', 'Vidéosurveillance', None, None, None, None, None, None, None, None, None, None, None, None]";['https://photo.superimmo.com/hd2eugrmbtnfmu3mfsmnunk0xwyq', 'https://photo.superimmo.com/pr2g67k5f2f4i4dg8boscihef70c', 'https://photo.superimmo.com/o12jmukj77kaht4vn70rip0xv7ax', 'https://photo.superimmo.com/vpod7bok9a0rjy1wz79s19nvqdyr', 'https://photo.superimmo.com/zrtnuy3v29nay0eo8jwnyrj3k14b', None, None, None, None, None]
