;url;price;surface;nb_pieces;nb_chambres;lieu;prix_m2;date_publication;tag_1;tag_2;tag_3;description;tags;images_url
161;https://www.superimmo.com/annonces/achat-appartement-34m-antibes-06600-xwcmei;259000;43;2;1;Antibes (06600);7523;19/07/2024;1er étage;;Honoraires à la charge du vendeur.;"2 Pièces ANTIBES Centre Historique - Investissement Locatif Idéal
Ce charmant appartement de 34 m² entièrement rénové et climatisé se situe en plein centre d'Antibes, vieille ville, au cœur du centre historique.
Niché dans une rue piétonne animée, il offre un cadre de vie exceptionnel au sein d'un immeuble avec de superbes pierres apparentes.
Situé au premier étage (sans ascenseur), cet appartement est idéal pour les amoureux du charme et de l'authenticité.
Il se compose de :
- Un séjour lumineux avec une cuisine ouverte équipée
- Une salle d'eau moderne avec une douche et une fenêtre, assurant une bonne ventilation.
- Une chambre confortable avec rangements
Les fenêtres de l'appartement donnent sur une autre rue piétonne non passante et donc paisible, offrant un havre de tranquillité en plein cœur de la ville.
Sa situation exceptionnelle avec la mer à seulement 5 minutes à pied et le marché provençal à 3 minutes à pied vous offre ainsi une excellente opportunité d'investissement locatif.
FAIBLES CHARGES.
Afficher plus";"['34,43 m² - 2 pièces - 1 chambre', 'Année de rénovation : 2023', '1er étage', ""Assainissement : tout à l'égout"", 'Eau chaude individuelle : chaudière', 'Climatisation', 'Fenêtres double vitrage', '', None, None, None, None, None, None, None, None, None, None, None, None]";['https://photo.superimmo.com/h5fsap1jplep4acvvwgmof1g3kdd', 'https://photo.superimmo.com/d2l26vqze0d86rswh98lcu6mfoiq', 'https://photo.superimmo.com/dpegmsrcicjtd1movnd5r0q89dr5', 'https://photo.superimmo.com/a4yschcexbb0j8m6eso6prqadkwv', 'https://photo.superimmo.com/m0akuss4cpf6jt8u2784exfu7s7q', None, None, None, None, None]
162;https://www.superimmo.com/annonces/achat-maison-230m-vence-06140-xwcmea;2100000;230;6;5;Vence (06140);9130;19/07/2024;Cuisine de 23 m²;Piscine;Honoraires à la charge du vendeur.;"Vence Malbosquet . Villa Contemporaine 6 pièces 274 m2 Piscine
VENCE Malbosquet
Idéalement située, cette villa contemporaine neuve est nichée dans un cadre résidentiel, verdoyant et calme. Cette villa d'exception offre une qualité de vie exceptionnelle, elle propose des espaces de vie épurés aux volumes importants.
Elle dispose de cinq chambres au total, 4 sont en suites (avec leur propres salle de douche, WC et dressing). Concernant l'espace de vie, le séjour et la cuisine totalise plus de 80 m2 d'espace.
Le terrain paysager de 1143 m2 est aménagé de façons à profiter un maximum de l'espace autour de la piscine. Il est un véritable havre de paix ou vous pourrez également profiter d'un espace de verdure et d'un coin potager.
Vous pourrez stationner au total 8 véhicules dont deux dans un garage fermé.
Cette villa incarne l'élégance du style contemporain.
Elle dispose évidemment de l'arrosage automatique, du portail électrique, d'un système de vidéo surveillance, et de la climatisation centralisée.
Cette opportunité est rare sur le marché.
Honoraires à la charges du vendeur.
Les informations sur les risques auxquels ce bien est exposé sont disponibles sur le site Géorisques : georisques.gouv.fr
Afficher plus";"['230 m² - 6 pièces - 5 chambres', 'Année de rénovation : 2024', 'Piscine', 'Orientation : Sud', 'Vue sur mer', 'Année de construction : 2023', ""Assainissement : tout à l'égout"", 'Eau chaude individuelle : chaudière', 'Climatisation', 'Cuisine de 23 m²', 'Séjour de 56 m²', 'Fenêtres double vitrage', 'Alarme - Porte blindée - Vidéosurveillance - Visiophone', '', None, None, None, None, None, None]";['https://photo.superimmo.com/j6hewxrm1nd1nuq0z5pwenmyc62d', 'https://photo.superimmo.com/m2rt0dr6ss6woqkse0j9a8paegau', 'https://photo.superimmo.com/pwsa16cubgqpcm8imc2uod8og0gy', 'https://photo.superimmo.com/fjo5jc8xf6fjz6o51jetfhkwf9e1', 'https://photo.superimmo.com/th0nn1zeossq9a8zejocw86l2skw', None, None, None, None, None]
163;https://www.superimmo.com/annonces/achat-appartement-42m-nice-06200-xwcmdq;186000;42;2;;Nice (06200);4429;19/07/2024;Étage 5/6 avec ascenseur;;8 000 € TTC inclus dans le prix de vente.;"Appartement 2 pièces Sainte Marguerite - 42m2 - 186 000€ - 186 000€
A la vente :
Dans le quartier calme de Sainte-Marguerite
A l'avant dernier étage ( 5ème), appartement composé d'une entrée donnant sur un séjour spacieux et lumineux, vous bénéficiez d'une profonde terrasse plein sud et sans vis-a-vis, offrant une vue dégagée.
La cuisine est indépendante mais peut s'intégrer dans le séjour si vous le désirez, 1 salle de douche et WC séparés, un grand dressing mural vous offre un grand rangement. La résidence est calme et arborée,
Cet appartement possède un potentiel important a aménager selon ses aspirations
Une cave vient compléter ce bien,
Une place de Parking est vendue séparément pour un montant de 25 000€
Honoraires à charge acquéreur
DPE : N.C
Charges trimestrielles : 620€
Taxe Foncière : 871€ par an
Les visites sont simples, contactez nous pour plus d'informations !
Les informations sur les risques auxquels ce bien est exposé sont disponibles sur le site georisques.gouv
Afficher plus";['42 m² - 2 pièces', 'Étage 5/6 avec ascenseur', 'Vue dégagée', '', None, None, None, None, None, None, None, None, None, None, None, None, None, None, None, None];['https://photo.superimmo.com/vhhmyrc19719jr3vxp858a4zbzk4', 'https://photo.superimmo.com/qgmwrueuw5lqsiyk5397l2n34m3c', 'https://photo.superimmo.com/233kvo9zx0ywgeftmamiiax82ud1', 'https://photo.superimmo.com/umgz2q1xpdanc8q17ejbrf0k2wip', 'https://photo.superimmo.com/i6yrgn1dbgaa7atoth1dqk10jcar', None, None, None, None, None]
164;https://www.superimmo.com/annonces/achat-maison-643m-beausoleil-06240-xwcmdg;6500000;643;9;6;Beausoleil (06240);10109;19/07/2024;Cuisine de 14 m²;Piscine;Honoraires à la charge du vendeur.;"Villa de luxe, vue mer, piscine.
Située aux confins de Beausoleil, découvrez cette splendide villa contemporaine, un joyau architectural qui jouit d'une vue à couper le souffle sur la majestueuse Principauté de Monaco et l'horizon marin infini. Ce chef-d'œuvre architectural s'étend majestueusement sur environ 643 m² habitables, répartis harmonieusement sur trois niveaux, tous accessibles par ascenseur, et vous plonge dans un univers de luxe et de grandeur.
S'élevant majestueusement sur un terrain pittoresque de 1600 m², cette villa est dotée de vastes terrasses et d'une piscine à débordement, idéales pour profiter des panoramas à couper le souffle de la région.
Le design de cette demeure a été minutieusement pensé pour offrir un confort sans égale. Vous y trouverez une spacieuse salle de réception, un vaste espace de vie modulable pouvant accueillir une bibliothèque ou un bar, une cuisine ultramoderne et une salle à manger qui invitent à la convivialité. Les quatre suites complètes, véritables havres de paix, sont propices à la détente et à l'intimité. Un généreux rez-de-jardin s'offre à vous, prêt à accueillir une salle de cinéma, une salle de sport, une cave à vin, selon vos désirs. La propriété est également dotée d'un appartement indépendant, ajoutant une touche supplémentaire d'autonomie.
Possédant un gigantesque garage capable d'accueillir jusqu'à dix voitures, cette villa bénéficie également d'un accès aisé aux commerces et écoles avoisinantes. Vendu en l'état, ce projet vous offre la liberté de personnaliser l'aménagement intérieur à votre image, selon vos goûts et vos nécessités.
Ne laissez pas passer cette chance unique d'acquérir cette propriété d'exception à Beausoleil, un véritable écrin de luxe surplombant Monaco et la mer. N'hésitez pas à nous contacter pour organiser une visite et laissez-vous envoûter par le luxe raffiné et le charme singulier de cette résidence de prestige.
Les informations sur les risques auxquels ce bien est exposé sont disponibles sur le site Géorisques : georisques.gouv.fr
Afficher plus";"['643 m² - 9 pièces - 6 chambres', 'Année de rénovation : 2023', 'Piscine', 'Orientation : Sud', 'Vue sur mer', 'Année de construction : 2023', ""Assainissement : tout à l'égout"", 'Climatisation', 'Cuisine de 14 m²', 'Séjour de 30 m²', None, None, None, None, None, None, None, None, None, None]";['https://photo.superimmo.com/ua9r1xu56tujgtsbuadwi4gctg10', 'https://photo.superimmo.com/y9xr3pzinj2btbsa3n4gew4yhdz9', 'https://photo.superimmo.com/hx5mqurrf0o76wnvspz1cjmzrqyw', 'https://photo.superimmo.com/b1ofv528fokyc1xkoac799yogxny', 'https://photo.superimmo.com/60f45ghpi3bwmt1dfgs8vtaghlvh', None, None, None, None, None]
165;https://www.superimmo.com/annonces/achat-maison-200m-antibes-06600-xwcmdf;1508000;200;7;4;Antibes (06600);7540;19/07/2024;Piscine;;Honoraires à la charge du vendeur.;"Antibes Rastines, Domaine de standing à faibles charges, Belle villa individuelle, récente, parfait état, vue mer, Calme absolu
Située dans un quartier résidentiel recherché et prisé, proche de la mer, du centre, et des axes routiers tout en étant au calme absolu.
Cette belle néo-provençale de bonne facture, construite en 1991 et en parfaite état vous séduira par sa localité, sa vue mer et collines, et sa distribution bien pensée.
Vous retrouverez une belle entrée, un vaste salon-salle à manger d'environ 50m2 avec accès direct par de belles terrasses au jardin plat et la piscine. Sur ce même étage vous disposez également d'une cuisine individuelle équipée, avec son cellier/buanderie et de deux chambres de plein pied avec salles de bain.
A l'étage supérieur deux autres chambres et une salle d'eau, une mezzanine qui offre un agréable coin bureau et une petite pièce supplémentaire pouvant faire office de 5ieme chambre.
A l'extérieur un abris voiture double, une belle piscine 10x5, un terrain complanté de 1292m2 en majorité plat. Une cave de 40m2 complète le bien
ref : 3483YBEFEN
Honoraires agence inclus dans le prix à charge vendeurs
Les risques auxquels le bien est soumis sont disponibles sur le site de Géorisques : georisques.gouv.fr
Afficher plus";"['200 m² (carrez : 186) - 7 pièces - 4 chambres - ter. 1 292 m²', 'Piscine', 'Orientation : Sud', 'Vue dégagée, sur mer', 'Année de construction : 1991', ""Assainissement : tout à l'égout"", 'Eau chaude individuelle : chaudière', 'Fenêtres double vitrage', 'Cheminée', 'Interphone - Porte blindée - Visiophone', None, None, None, None, None, None, None, None, None, None]";['https://photo.superimmo.com/m7vdw3bhiwmxzsh158dyrilmshha', 'https://photo.superimmo.com/mgmd8m5cmyos1l2xlw4l49ziiyph', 'https://photo.superimmo.com/foeuwndw4pn6jsii4ncxpvn36x3i', 'https://photo.superimmo.com/zywqst5zgg4o6fffjdmtwy25juj4', 'https://photo.superimmo.com/bxqdooep1eov8c07w3cafsmqki9m', None, None, None, None, None]
166;https://www.superimmo.com/annonces/achat-maison-146m-biot-06410-xwcmde;1100000;1;6;4;Biot (06410);7529;19/07/2024;Exclusivité;Piscine;Honoraires à la charge du vendeur.;"A vendre villa familiale 4 chambres au calme absolu avec piscine
BIOT EXCLUSIVITE Dans un petit domaine sécurisé, à 5mn des commodités et du lycée Simone Veil, belle bastide individuelle d'environ 150 m² bien exposée et au calme absolu. Sur un terrain de 1000m² parfaitement entretenu avec piscine à débordement, la villa en excellent état et très lumineuse offre de beaux volumes harmonieusement agencés avec des jolies prestations. Sur deux niveaux elle se compose en rez de jardin d'une entrée avec toilette invité, une vaste pièce de vie de 60m² avec cuisine américaine aménagée et équipée, une buanderie ou arrière cuisine, une chambre avec sa salle d'eau privative, un bureau et un espace garage à vélos et/ou motos. A l'étage 3 chambres donnant sur la piscine et le jardin avec vue dégagée, un dressing, une salle de bain et un toilette indépendant. La villa est équipée de panneaux photovoltaïques et de nombreuses places de parking intérieures et extérieures viennent compléter le tout.
Honoraires d'agence charges vendeur inclus dans le prix.
Les informations sur les risques auxquels ce bien est exposé sont disponibles sur le site Géorisques : georisques. gouv. fr
Afficher plus";"['146,1 m² (carrez : 146,1) - 6 pièces - 4 chambres - ter. 1 000 m²', 'Piscine', 'Vue dégagée, sur jardin', 'Année de construction : 2002', ""Assainissement : tout à l'égout"", 'Eau chaude individuelle : chaudière', 'Climatisation', 'Fenêtres double vitrage', 'Cheminée', 'Interphone', None, None, None, None, None, None, None, None, None, None]";['https://photo.superimmo.com/u4hgbfjhw2p0qe09f6ox7pmxrmxd', 'https://photo.superimmo.com/r634pm9gl2x399bzpafrpdnez41y', 'https://photo.superimmo.com/5jim9i1u5025kb89erdijazmcxaz', 'https://photo.superimmo.com/9outcmu8y56tzfvr4bfsmwqtu8d4', 'https://photo.superimmo.com/h72qzrsmg2uwu9jas8eb8fg063ci', None, None, None, None, None]
167;https://www.superimmo.com/annonces/achat-maison-193m-antibes-06600-xwcmdd;1640000;193;6;4;Antibes (06600);8497;19/07/2024;Cuisine de 13 m²;Piscine;Honoraires à la charge du vendeur.;"Antibes , Villa vue mer panoramique, calme, piscine, studio, grand garage , parking
Située à Antibes, cette magnifique villa offre une vue panoramique sur la mer. Avec ses 6 pièces, elle se trouve dans un environnement d'un calme absolu, au sein d'un domaine sécurisé. La propriété s'étend sur un terrain plat de 1300 m², agrémenté d'une piscine de 10x5, et dispose d'un vaste garage de 90 m². Nichée dans un quartier résidentiel, cette villa individuelle propose un spacieux salon de 44 m² avec cheminée, une cuisine indépendante, trois chambres au rez-de-chaussée, ainsi qu'une chambre de maître à l'étage avec salle de bain et une grande terrasse offrant une vue imprenable sur la mer.
Au rez-de-jardin, on trouve également un. appartement de 2 pièces indépendant.
Le tout avec une surface totale au sol de 284m2 avec garage, cave et buanderie, soit 193m2 sans le garage et 136m2 loi Carrez.
Comission charge vendeur inclus dans le prix de vente.
Les risques auxquels le bien est soumis sont disponible sur le site de Géorisques : gé
Ref 3483YBEFEN
Afficher plus";"['193 m² (carrez : 136) - 6 pièces - 4 chambres - ter. 1 300 m²', 'Piscine', 'Vue sur mer', 'Année de construction : 1990', ""Assainissement : tout à l'égout"", 'Eau chaude individuelle : chaudière', 'Climatisation', 'Cuisine de 13 m²', 'Barbecue', 'Fenêtres double vitrage', 'Cheminée', 'Visiophone', None, None, None, None, None, None, None, None]";['https://photo.superimmo.com/0hs3e0lm89e5h48aygommpoiotk8', 'https://photo.superimmo.com/2yfiaqlbolpohyi7c7g0mgiza7xk', 'https://photo.superimmo.com/t2uoxcxr5casz9g1df2z0mup08b8', 'https://photo.superimmo.com/6sfi7i8bmyrjh1ncxkvk2u2q04mb', 'https://photo.superimmo.com/xmvrppm04rrakjvb9xtbhsqdlz1v', None, None, None, None, None]
168;https://www.superimmo.com/annonces/achat-maison-342m-chateauneuf-grasse-06740-xwcmdc;1480000;61;9;5;Châteauneuf-Grasse (06740);4320;19/07/2024;Cuisine de 21 m²;Piscine;Honoraires à la charge du vendeur.;"Magnifique propriété, Limite Valbonne, Néo-provençale chic, Calme absolu, parfait état, vue dégagée, 5/6 chambres,Terrasses, Terrain 5000m2 plat,
Située sur la commune de Chateauneuf à quelques minutes de Valbonne et à proximité immédiate du Golf d'Opio, cette magnifique propriété vous séduira par son cachet néo-provençal chic, ses volumes, son magnifique extérieur arboré (4900m2 plat )où il fait bon vivre à l'abri de tout regard.
Cette maison familiale vous offre 342m2 de surface habitable avec 5/6 chambres reparties sur deux niveaux
En rez de jardin vous retrouverez une vaste entrée, un espace de vie de 100m2 avec double salon, salle à manger, salon TV. Une cuisine équipée semi-ouverte, un bureau, une chaufferie/buanderie et deux chambres de plain pied avec salle de bain.
A l'étage, une belle mezzanine, trois autres chambres avec leur salle d'eau toutes donnant sur d'agréables terrasses avec une très belle vue montagne et village.
Son espace extérieur est parfaitement bien pensé, avec une grande piscine à débordement son pool-house et ses multiples terrasses.
Un grand garage de 60m2, un abri voiture double et la possibilité de stationner une dizaine de voitures vous permettra d'accueillir vos convives
Le terrain de 4900m2 est entièrement plat, ornée de magnifiques murs en pierre et complanté de nombreux oliviers centenaires, ainsi que diverses essences méditerranéennes.
Produit coup de coeur ! Beaucoup d'atouts ! Une visite s'impose !
Ref : 3590YBEFEN
Les honoraires agence sont inclus dans le prix à charge vendeur.
Les risques auxquels le bien est soumis sont disponibles sur le site de Géorisque.
Afficher plus";"['342,61 m² - 9 pièces - 5 chambres - ter. 4 900 m²', 'Piscine', 'Orientation : Sud', 'Vue dégagée, sur campagne, sur montagne', 'Année de construction : 1976', ""Assainissement : tout à l'égout"", 'Eau chaude individuelle : chaudière', 'Climatisation', 'Cuisine de 21 m²', 'Fenêtres double vitrage', 'Cheminée', 'Interphone', None, None, None, None, None, None, None, None]";['https://photo.superimmo.com/z2ube4o3e5huv62huyrtft7rjj7o', 'https://photo.superimmo.com/d6pqkd3l9qh7m588qgixs9wevm3p', 'https://photo.superimmo.com/tydgs7x8qx8ny2xov9820q3o4ox5', 'https://photo.superimmo.com/kjte7kk0ddh2woz4lsdes1dogl3d', 'https://photo.superimmo.com/rtux6adowmxi90vyv5z3w0wqztow', None, None, None, None, None]
169;https://www.superimmo.com/annonces/achat-maison-105m-antibes-06600-xwcmd9;570000;105;5;4;Antibes (06600);5429;19/07/2024;Cuisine de 8 m²;;Honoraires à la charge du vendeur.;"Antibes. Villa 5 pièces de 105m² avec jardin de 250m²
Antibes. Dans une résidence fermée et sécurisée, venez découvrir cette très jolie villa mitoyenne d’angle. Elle se compose au rez de chaussée d’un grand salon avec cheminée et d’une cuisine indépendante et à l’étage de 4 grandes chambres avec salle de bain et salle d'eau.
Une cuisine d'été ouvre directement sur un joli jardin de 250 m²
Un vaste garage de 30m² environ et la possibilité de garer 2 voitures devant la maison complètent ce bien. Réf : CT7712vm";"['105 m² (carrez : 105) - 5 pièces - 4 chambres', 'Orientation : Sud', 'Vue dégagée, sur jardin, sur verdure', 'Année de construction : 1972', ""Assainissement : tout à l'égout"", 'Eau chaude individuelle : chaudière', 'Climatisation', 'Cuisine de 8 m²', 'Séjour de 30 m²', 'Fenêtres double vitrage', 'Cheminée', 'Interphone', None, None, None, None, None, None, None, None]";['https://photo.superimmo.com/vkrwdygp5q1b576ing1rnefzxypf', 'https://photo.superimmo.com/n4gbxjsz3i9ubrwngf6mkb3am9c0', 'https://photo.superimmo.com/1sk65c4bcwrirsfrlrr9ozd2sfur', 'https://photo.superimmo.com/prjlvljprlwlhjin3gud6lg6xkcm', 'https://photo.superimmo.com/dkf4xa871kppvsw8javmr5tanpqc', None, None, None, None, None]
170;https://www.superimmo.com/annonces/achat-appartement-78m-cannes-06400-xwcmd5;567000;6;3;2;Cannes (06400);7214;19/07/2024;Meublé;Étage 3/4 avec ascenseur;Honoraires à la charge du vendeur. Barème d’honoraires : http://www.swixim.fr/fr/agence-annecy/honoraires;"3 pièces Basse Californie Vue mer
Réf: 68519VPE. A Cannes, ce grand appartement de 3 pièces dispose des avantages suivants:
Importante hauteur sous plafond.
Belle luminosité.
Vue mer dégagée sur le Parc de la Résidence.
Cave et en supplément, une chambre de service située sous les toits.
Un accès facile et des places de parking dans la résidence.
Ce bâtiment historique est typique du 19e avec le charme de l’ancien. Charges: 220€/mois.
A découvrir ! Agent commercial indépendant Swixim sur votre secteur : +33687499961 Honoraires à la charge du vendeur - Valérie PEREZ - Agent commercial - EI - RSAC 483 981 379 / Grasse";"['78,6 m² (carrez : 78,6) - 3 pièces - 2 chambres', 'Étage 3/4 avec ascenseur', 'Orientation : Sud', 'Vue dégagée', 'Gardien', ""Assainissement : tout à l'égout"", 'Cuisine de 6 m²', 'Séjour de 22 m²', 'Cheminée', 'Digicode', None, None, None, None, None, None, None, None, None, None]";['https://photo.superimmo.com/bkbhemkavesvnjuuir59zlwhdz6s', 'https://photo.superimmo.com/sci4p0pjcf1j545or7wxwtou40mi', 'https://photo.superimmo.com/o7g59pc07mzq24ase3zbufj4fxgo', 'https://photo.superimmo.com/ysn57g6kxisca3hle6eoz804qra1', 'https://photo.superimmo.com/z0jyeipi2w5c8mief132p81vgtjv', None, None, None, None, None]
171;https://www.superimmo.com/annonces/achat-appartement-76m-nice-06300-xwcmco;355000;76;3;2;Nice (06300);4671;19/07/2024;Exclusivité;Étage 2/8 avec ascenseur;Barème d’honoraires : http://azurmetropole.com/i/redac/honoraires?honofor=1;"EXCLUSIVITE !
Idéalement situé à Nice dans le quartier recherché de République, à deux pas de la place Garibaldi, du Port, à proximité immédiate de toutes les commodités, écoles et des lignes 1 et 2 du tramway,
Dans une résidence de standing sécurisée avec ascenseur, bel appartement de type 3 Pièces d'une superficie habitable Carrez de 76 m2, traversant Est/Ouest, calme et lumineux, trés agréable à vivre !
Le bien se compose d'une entrée avec rangements intégrés, un grand séjour de 21 m2 ensoleillé ouvrant sur un balcon; deux chambres sur cour (dont une grande chambre de 17 m2 avec placard) et une cuisine séparée, ces 3 pièces ouvertes sur un grand balcon de 10 m2 ; une salle de bains et un WC indépendant.
Divisible et aménageable en bureaux, en partie ou en totalité en redistribuant les pièces (aprés transformation, 3 espaces de 21 m2, 17 m2 et 18 m2)
Double vitrage, installation électrique récente, alarme, nombreux rangements. beaux volumes, matériaux de qualité (marbre au sol,..),
Une cave, en sous-sol de la copropriété, complète le bien, inclue dans le prix.
Bien soumis au statut de la copropriété. Nombre de lots :35. Charges courantes annuelles: 2.192 EUR (incluant charges communes, eau froide et eau chaude). Honoraires d'agence inclus, charge vendeur.
Afficher plus";['76 m² - 3 pièces - 2 chambres', 'Étage 2/8 avec ascenseur', 'Orientation : Est / Ouest', 'Cave (3 m²)', '1 balcon (3 m²)', '1 terrasse', 'Année de construction : 1979', 'Chauffage individuel électrique (radiateurs)', 'Cuisine séparée', 'Séjour de 21 m²', '1 salle de bain', '1 wc', 'Alarme - Interphone', 'Copropriété de 35 lots', None, None, None, None, None, None];['https://photo.superimmo.com/mpd4ew8f6e6jr9qxf5uz9kz2qtwy', 'https://photo.superimmo.com/0l1pejtimjtu9ojsoh881rjbpjj9', 'https://photo.superimmo.com/ygjnaskm7xuvztdls9l3da6sqlwl', 'https://photo.superimmo.com/g0qo5cnzmkgm2qv4fhc2048l08bg', 'https://photo.superimmo.com/qpmn2la17ogshazvdhan66m0vmfn', None, None, None, None, None]
172;https://www.superimmo.com/annonces/achat-maison-86m-tourrettes-sur-loup-06140-xwcmb9;649000;86;4;3;Tourrettes-sur-Loup (06140);7547;19/07/2024;1 terrasse;Cuisine ouverte, équipée;Barème d’honoraires : https://www.immobiliervence.fr/i/redac/honoraires?honofor=10;"EXCLUSIVITE : Située au calme dans une ruelle excentrée, tout en étant proche de tout, venez découvrir cette magnifique maison de village sur deux niveaux d'une superficie habitable de 85m2 . Cette maison de village fut intégralement renovée avec des materiaux de très grande qualité (carrelage provenant chez 'les terres cuites de Raujolles').
Cette maison en pierre est édifiée sur 3 niveaux : - au rez-de-chaussee : chambre double ou bureau, une salle d'eau, dressing sur mesure - au premier etage : chambre principale et salle de bains - au deuxieme etage : beaux volumes comprenant sejour, cuisine ouverte Magnifique terrasse amenagee sur le toit avec une vue à couper le souffle...
Venez la visiter et vous serez séduits !
L'avis de l'agence : 'Cette maison de village est simplement exceptionnelle. Elle vous surprendra par ses volumes, ses finitions/prestations et bien évidement sa vue exceptionnelle'
Afficher plus";"['86 m² - 4 pièces - 3 chambres', 'Orientation : Est, Sud, Sud-Est', '1 terrasse', 'Année de construction : 1949', 'Chauffage individuel électrique (radiateurs)', 'Cuisine ouverte, équipée', 'Séjour de 19 m²', ""2 salles d'eau"", '2 wc', 'Copropriété de 2 lots', None, None, None, None, None, None, None, None, None, None]";['https://photo.superimmo.com/frjimvnkzmqwd3kiszajm03bgy5n', 'https://photo.superimmo.com/1x3ea4xkp6d48qhukz0kyqamjy95', 'https://photo.superimmo.com/47d93d8lhzpnufrmc4cyhfti1k8c', 'https://photo.superimmo.com/aykiz76kj5sh0z8bex3ukzbo0svg', 'https://photo.superimmo.com/h71jgmwq38mmerhe9osz30ocqdc9', None, None, None, None, None]
