;url;price;surface;nb_pieces;nb_chambres;lieu;prix_m2;date_publication;tag_1;tag_2;tag_3;description;tags;images_url
153;https://www.superimmo.com/annonces/achat-appartement-19m-bordeaux-33000-xwc8v8;130000;19;1;;Bordeaux (33000);6842;18/07/2024;Exclusivité;Dernier étage;Honoraires à la charge du vendeur. Barème d’honoraires : https://files.netty.immo/file/mansonproperties33/189/xLg5o/bareme_d_honoraires_1_.pdf;"MANSON PROPERTIES vous propose de découvrir ce studio en exclusivité situé au troisième et dernier étage d'un petit immeuble en pierre en plein coeur des Chartrons.
Il se compose d'une pièce de vie avec un espace cuisine et d'une salle d'eau avec wc.
Emplacement idéal proche des écoles supérieures, des commerces, 4 minutes à pied de l'arrêt du tram B Chartrons ainsi que du Cours portal et de la célèbre rue Notre Dame.
Idéal pour un premier achat, un étudiant, jeune actif, location.
Petite copropriété de 7 lots, bien en bon état général.
Honoraires à la charge du vendeur. Dans une copropriété de 7 lots. Aucune procédure n'est en cours. Classe énergie D, Classe climat B Montant moyen estimé des dépenses annuelles d'énergie pour un usage standard, établi à partir des prix de l'énergie de l'année 2021 : entre 400.00 et 600.00 €. Ce bien vous est proposé par un agent commercial. Nos honoraires : Les informations sur les risques auxquels ce bien est exposé sont disponibles sur le site Géorisques : georisques.gouv.fr
Votre conseiller Manson Properties : Estelle Chapelleaubos - Tél. 0679232482
Agent commercial (Entreprise individuelle)
RSAC 877 697 730
RCP MRCSACI202104FR00000000034516A00
Agence MANSON PROPERTIES Bordeaux, Bassin d'Arcachon & Bretagne, SAS au capital de 33 467 euros, siège social : 6 quai Louis XVIII – 33000 BORDEAUX, immatriculée au RCS Bordeaux sous le n° 892 572 413, titulaire de la carte professionnelle « Transactions sur immeubles et fonds de commerce » n° CPI33012021000000005 délivrée par CCI Bordeaux Gironde.
Afficher plus";"['19 m² - 1 pièce', 'Dernier étage (3ème)', 'Chauffage individuel électrique', 'Cuisine équipée', ""1 salle d'eau"", '1 wc', 'Copropriété de 7 lots', '', None, None, None, None, None, None, None, None, None, None, None, None]";['https://photo.superimmo.com/y3zbjctb58ncs26ry1az2z7zfu1j', 'https://photo.superimmo.com/chia3fvj6ylq036wm6fkxuh7quxh', 'https://photo.superimmo.com/lckb4h7nmr4atbvpo9nqg59h2r0n', 'https://photo.superimmo.com/5bt810rd5wi4807bblx12r2xpoas', 'https://photo.superimmo.com/ou4nybtg26xxarp62cw60vdfkaon', None, None, None, None, None]
154;https://www.superimmo.com/annonces/achat-maison-95m-bordeaux-33800-xwc8jn;509000;95;4;3;Bordeaux (33800);5358;18/07/2024;Cuisine équipée;Chauffage au gaz;Honoraires à la charge de l'acquéreur : 2% TTC - 10 000 € TTC inclus dans le prix de vente. Barème d’honoraires : https://neomuros.fr/residence-principale/;"Située dans le quartier Nansouty, dans une petite rue calme, proche des commerces, transports et écoles, cette jolie maison entièrement rénovée avec beaucoup de goût, offre un cadre idéal pour une famille.
L'entrée dessert une cuisine entièrement équipée, un WC séparé, un salon traversant qui s'ouvre sur un jardin de ville de 30m² permettant de profiter des beaux jours et d'un barbecue entre amis à l'abri des regards.
A l'étage, trois chambres avec salle de bain et WC.
Les matériaux sont de qualités, parquet massif présent dans les chambres et dans le salon, salle à manger.
La chaudière date de 2018 et le chauffage est au gaz.
Coup de coeur assuré !
Honoraires inclus de 2% TTC à la charge de l'acquéreur. Prix hors honoraires 499 000 €. Classe énergie D, Classe climat D Montant moyen estimé des dépenses annuelles d'énergie pour un usage standard, établi à partir des prix de l'énergie de l'année 2021 : entre 1340.00 et 1860.00 €. Nos honoraires : Les informations sur les risques auxquels ce bien est exposé sont disponibles sur le site Géorisques : georisques.gouv.fr
Afficher plus";['95 m² - 4 pièces - 3 chambres', 'Orientation : Nord, Nord-Ouest, Est, Ouest', 'Chauffage au gaz', 'Cuisine équipée', '1 salle de bain', 'Wc séparé - 2 wc', None, None, None, None, None, None, None, None, None, None, None, None, None, None];['https://photo.superimmo.com/9rr6qiwlonx1ldp8nongnangcoo7', 'https://photo.superimmo.com/xc1eu3j4s7344negpcgb2n0z0okg', 'https://photo.superimmo.com/8qqe2ffnhdu6gh8uh3up9xwwj355', 'https://photo.superimmo.com/yuegoss2hscr74fu9p58ax6e9rl3', 'https://photo.superimmo.com/83levgec6ewxh1uynbaxmksxao0c', None, None, None, None, None]
155;https://www.superimmo.com/annonces/achat-appartement-58m-pessac-33600-xwc8dh;275000;58;3;2;Pessac (33600);4741;18/07/2024;Dernier étage;1 Garage;Honoraires à la charge du vendeur.;"A VENDRE APPARTEMENT T3 ENTIÈREMENT RÉNOVÉE D'ENVIRON 58 M2, AVEC 1 PLACES DE PARKING SÉCURISÉE, QUARTIER FRANCE-ALOUETTE, 33600 PESSAC.
Le bien s'ouvre sur un couloir, permettant l'accès à la pièce de vie accompagnée de de sa cuisine ouverte entièrement aménagée de 20 m2 !
S'en suivent 2 chambres de 14 et 11 m2 chacune, une salle d'eau avec WC et un cellier.
Côté extérieur, vous pourrez profiter d'une piscine communes aux 4 appartements ainsi que d'une place de parking.
N'hésitez plus et venez découvrir ce bien sans plus attendre !
Honoraires à la charge du vendeur. Dans une copropriété de 4 lots. Aucune procédure n'est en cours. Classe énergie D, Classe climat B Montant moyen estimé des dépenses annuelles d'énergie pour un usage standard, établi à partir des prix de l'énergie de l'année 2021 : entre 905.00 et 1245.00 €. Les informations sur les risques auxquels ce bien est exposé sont disponibles sur le site Géorisques : georisques.gouv.fr
HK HomeKare immobilier : ACHAT - VENTE - LOCATION - GESTION - SYNDIC
Afficher plus";"['58 m² - 3 pièces - 2 chambres', 'Piscine', 'Dernier étage (1er)', '1 Garage', 'Année de construction : 1970', 'Chauffage individuel électrique', 'Cuisine ouverte, équipée', 'Séjour de 20 m²', ""1 salle d'eau"", '1 wc', 'Copropriété de 4 lots', '', None, None, None, None, None, None, None, None]";['https://photo.superimmo.com/3m24xslq1sp8vdx9nfbdtyb8u8mp', 'https://photo.superimmo.com/wrxag6lzq5rmua7w5oyx1uanlxr6', 'https://photo.superimmo.com/xvj21bm29dtmy3q9er3ylkc1omkl', 'https://photo.superimmo.com/er9mj4fa3ixmpkvkenpcrbw9iu0e', 'https://photo.superimmo.com/kkqv75x51h7pc85icqo8leintue1', 'https://photo.superimmo.com/ecie362urgup60hlmqu8cz5yjeqe', None, None, None, None]
156;https://www.superimmo.com/annonces/achat-appartement-96m-pessac-33600-xwc8di;377000;96;4;3;Pessac (33600);3927;18/07/2024;Dernier étage;2 Garages;Honoraires à la charge du vendeur.;"A VENDRE APPARTEMENT RENOVÉ T4 EN DUPLEX DE 96 M2 AVEC JARDIN ET 2 PLACES DE PARKING, QUARTIER FRANCE-ALOUETTE, 33600 PESSAC.
Le bien s'ouvre sur une pièce de vie accompagnée de sa cuisine ouverte entièrement aménagée le tout faisant près de 28 m2 !
S'en suivent 2 chambres de 16 et 12 m2 chacune accompagnée de sa salle d'eau, un cellier et un WC indépendant. A l'étage, vous retrouverez une grande pièce mansardée de plus de 40 m2 !
Côté extérieur, vous pourrez profiter d'un jardin privatif ainsi que d'une piscine communes aux 4 appartements.
Deux places de parking viennent également compléter ce bien.
N'hésitez plus et venez découvrir ce bien sans plus attendre !
Honoraires à la charge du vendeur. Dans une copropriété de 4 lots. Aucune procédure n'est en cours. Classe énergie D, Classe climat B Montant moyen estimé des dépenses annuelles d'énergie pour un usage standard, établi à partir des prix de l'énergie de l'année 2021 : entre 1498.00 et 2062.00 €. Les informations sur les risques auxquels ce bien est exposé sont disponibles sur le site Géorisques : georisques.gouv.fr
HK HomeKare immobilier : ACHAT - VENTE - LOCATION - GESTION - SYNDIC
Afficher plus";"['96 m² - 4 pièces - 3 chambres', 'Dernier étage (1er)', '2 Garages', 'Année de construction : 1970', 'Chauffage individuel électrique', 'Cuisine équipée', 'Séjour de 28 m²', ""1 salle d'eau - 1 salle de bain"", 'Wc séparé - 2 wc', 'Copropriété de 4 lots', None, None, None, None, None, None, None, None, None, None]";['https://photo.superimmo.com/9bt2dveri9otplowhg6wci7nx2ia', 'https://photo.superimmo.com/4c9p4aarzd5ewpjeggcbv6umlxnv', 'https://photo.superimmo.com/8494faynqatgzxuk84fduzx7jblh', 'https://photo.superimmo.com/r2ncf9qdbn79zal69ni3qnmo36rj', 'https://photo.superimmo.com/8f6mfbfltslkqfcalh8zphi1121j', None, None, None, None, None]
157;https://www.superimmo.com/annonces/achat-appartement-119m-pessac-33600-xwc8dg;411000;119;4;3;Pessac (33600);3454;18/07/2024;2 Garages;Cuisine ouverte, équipée;Honoraires à la charge du vendeur.;"A VENDRE APPARTEMENT T4 ENTIÈREMENT RÉNOVÉE D'ENVIRON 120 M2 AVEC JARDIN PRIVATIF ET DEUX PLACES DE PARKING SÉCURISÉE, QUARTIER FRANCE-ALOUETTE, 33600 PESSAC.
Le bien s'ouvre sur un couloir, permettant l'accès à la grande pièce de vie accompagnée de de sa cuisine ouverte entièrement aménagée et équipée le tout faisant près de 50 m2 !
S'en suivent 3 chambres de 16, 13 et 12 m2 chacune dont une suite parentale avec salle d'eau, un cellier une seconde salle d'eau et un WC indépendant.
Côté extérieur, vous pourrez profiter d'un jardin privatif d'environ 210 m2 avec terrasse ainsi que d'une piscine communes aux 4 appartements.
Deux places de parking et un cave de 17 m2 viennent également compléter ce bien.
N'hésitez plus et venez découvrir ce bien sans plus attendre !
Honoraires à la charge du vendeur. Dans une copropriété de 4 lots. Aucune procédure n'est en cours. Classe énergie D, Classe climat B Montant moyen estimé des dépenses annuelles d'énergie pour un usage standard, établi à partir des prix de l'énergie de l'année 2021 : entre 1350.00 et 1880.00 €. Les informations sur les risques auxquels ce bien est exposé sont disponibles sur le site Géorisques : georisques.gouv.fr
HK HomeKare immobilier : ACHAT - VENTE - LOCATION - GESTION - SYNDIC
Afficher plus";"['119 m² - 4 pièces - 3 chambres', 'Rez-de-chaussée', 'Piscine', 'Orientation : Est / Ouest', 'Vue dégagée', '2 Garages', 'Cave', 'Année de construction : 1970', 'Chauffage individuel électrique', 'Cuisine ouverte, équipée', 'Séjour de 50 m²', ""2 salles d'eau"", 'Wc séparé - 1 wc', 'Copropriété de 4 lots', None, None, None, None, None, None]";['https://photo.superimmo.com/zb3hm67l0bh7jfbpvt1k11hb6s60', 'https://photo.superimmo.com/ffhqympl6fbwr2ijhfotrore29xo', 'https://photo.superimmo.com/xccczy04ictdbnq6uktjlml23g3v', 'https://photo.superimmo.com/fmnjwpzgzvpvxuwgmju7gmxsw4ao', 'https://photo.superimmo.com/u4ir7utsx9j6ll6nwxafi07l7evj', None, None, None, None, None]
158;https://www.superimmo.com/annonces/achat-maison-85m-le-bouscat-33110-xwc8db;514000;85;4;3;Le Bouscat (33110);6047;18/07/2024;1 Parking;Cuisine équipée;Honoraires à la charge de l'acquéreur : 3,01% TTC - 15 000 € TTC inclus dans le prix de vente.;"A VENDRE MAGNIFIQUE MAISON D'ENVIRON 85M2 AVEC JARDIN, 33110 LE BOUSCAT.
Venez rapidement découvrir cette magnifique maison entièrement rénovée en 2022 proche du centre du Bouscat sur une parcelle de 260 m2.
Nous retrouvons une entrée qui va desservir un cellier, une chambre parentale avec sa salle d'eau et son wc, deux chambres d'environ 11m2, une salle de bain et un wc indépendant.
Coté séjour, nous retrouvons une cuisine semi-équipée et ouverte sur la pièce principale d'environ 25m2.
Un jardin piscinable et une place de stationnement complètent ce bien.
Honoraires inclus de 3.01% TTC à la charge de l'acquéreur. Prix hors honoraires 499 000 €. Classe énergie D, Classe climat B Montant moyen estimé des dépenses annuelles d'énergie pour un usage standard, établi à partir des prix de l'énergie de l'année 2021 : entre 1270.00 et 1770.00 €. Les informations sur les risques auxquels ce bien est exposé sont disponibles sur le site Géorisques : georisques.gouv.fr
HK HomeKare immobilier : ACHAT - VENTE - LOCATION - GESTION - SYNDIC
Afficher plus";"['85 m² - 4 pièces - 3 chambres - ter. 260 m²', '1 Parking', 'Année de construction : 1980', 'Chauffage électrique', 'Cuisine équipée', 'Séjour de 25 m²', ""1 salle d'eau - 1 salle de bain"", 'Wc séparé - 2 wc', None, None, None, None, None, None, None, None, None, None, None, None]";['https://photo.superimmo.com/b0ps9rb9yk7e9ac9baxolo9bpck9', 'https://photo.superimmo.com/moxoq4ckim27ufvbiaawcevh9yzs', 'https://photo.superimmo.com/nu6hivldj34r1ej70hegcksoli1i', 'https://photo.superimmo.com/xuvhpg1o3pgvohev48c4te8a36gw', 'https://photo.superimmo.com/qr9pqj0gl6yiqx1dtwsuxajr985h', None, None, None, None, None]
159;https://www.superimmo.com/annonces/achat-maison-135m-le-bouscat-33110-xwc8d2;757000;135;5;4;Le Bouscat (33110);5607;18/07/2024;Cuisine équipée;;Honoraires à la charge du vendeur.;"A VENDRE - MAISON 5 PIÈCES - ENVIRON 135M2 - 33110 - BOUSCAT - BARRIERE DU MEDOC - JARDIN - STANDING - GARAGE
Au rez-de-jardin, une cuisine spacieuse et fonctionnelle s'ouvre sur le jardin par une grande baie vitrée, offrant une luminosité naturelle tout au long de la journée.
Le deuxième niveau accueille un bureau, un salon chaleureux et un coin lecture, tous bénéficiant d'une abondance de lumière grâce aux nombreuses fenêtres et à la porte-fenêtre donnant sur un balcon côté jardin.
Au troisième niveau, une somptueuse suite parentale vous attend avec son vaste dressing et sa salle de bain attenante. Deux chambres supplémentaires, dont une avec un second balcon côté rue.
Pour plus d'informations sur cette opportunité unique, contactez-nous dès maintenant.
Honoraires à la charge du vendeur. Classe énergie C, Classe climat C. Date de réalisation du DPE : 05-10-2023. Les informations sur les risques auxquels ce bien est exposé sont disponibles sur le site Géorisques : georisques.gouv.fr
HK HomeKare immobilier : ACHAT - VENTE - LOCATION - GESTION - SYNDIC
Afficher plus";['135 m² - 5 pièces - 4 chambres', 'Année de construction : 1970', 'Cuisine équipée', '', None, None, None, None, None, None, None, None, None, None, None, None, None, None, None, None];['https://photo.superimmo.com/obbgnoqw66xk0b08uq1aewl8v8h5', 'https://photo.superimmo.com/ebvo15ag130l62cgc52zqy9jpxvn', 'https://photo.superimmo.com/d8n68qi4qql94xowk5smrgs1agqx', 'https://photo.superimmo.com/f5nzjgkd1dwajjlejz7fvryp6m4k', 'https://photo.superimmo.com/0syeldcjmqtag4elc47mb6li9btd', 'https://photo.superimmo.com/4fbf0yghz2feo7avxwm4tvjol4kk', None, None, None, None]
160;https://www.superimmo.com/annonces/achat-appartement-71m-bordeaux-33300-xwc8d0;174000;71;3;2;Bordeaux (33300);2451;18/07/2024;Étage 16/18 avec ascenseur;1 Garage;Honoraires à la charge du vendeur.;"A VENDRE APPARTEMENT DE TYPE 3 D'ENVIRON 75 M2 DANS LE SECTEUR CHARTRONS-GRAND PARC, 33300 BORDEAUX
Venez découvrir rapidement cet appartement de type 3 d'environ 75 m2.
Nous retrouvons une entrée avec rangement, un cellier, un wc, un séjour avec une très grande vue dégagée ainsi qu'une cuisine séparée avec la possibilité de l'ouvrir sur le séjour.
Coté nuit, nous retrouvons deux chambres d'environ 11 m2 chacune, une salle d'eau avec wc et un dressing indépendant.
Une place de parking couverte complète ce bien.
Honoraires à la charge du vendeur. Dans une copropriété de 150 lots. Aucune procédure n'est en cours. Classe énergie D, Classe climat D Montant moyen estimé des dépenses annuelles d'énergie pour un usage standard, établi à partir des prix de l'énergie de l'année 2021 : entre 840.00 et 1170.00 €. Les informations sur les risques auxquels ce bien est exposé sont disponibles sur le site Géorisques : georisques.gouv.fr
HK HomeKare immobilier : ACHAT - VENTE - LOCATION - GESTION - SYNDIC
Afficher plus";"['71 m² - 3 pièces - 2 chambres', 'Étage 16/18 avec ascenseur', 'Orientation : Nord, Nord-Ouest, Est, Ouest', '1 Garage', 'Année de construction : 1968', 'Chauffage collectif au gaz', ""1 salle d'eau"", '1 wc', 'Copropriété de 150 lots', '', None, None, None, None, None, None, None, None, None, None]";['https://photo.superimmo.com/wxqh9u8ju5iwsy3j1dpd6ldfb1el', 'https://photo.superimmo.com/hi5bzqve2g1gwl8jhr0ni4381xwm', 'https://photo.superimmo.com/07m3v7ay2bxspjqvjr0yeczpervz', 'https://photo.superimmo.com/h0dtclz1cz1syekirc5xr4sh1mqn', 'https://photo.superimmo.com/l567zo3w9jt6sb0g3322egl1w32f', None, None, None, None, None]
161;https://www.superimmo.com/annonces/achat-appartement-49m-bordeaux-33000-xwc8cd;260000;49;2;1;Bordeaux (33000);5306;18/07/2024;Dernier étage;Cuisine équipée;Honoraires à la charge du vendeur. Barème d’honoraires : https://files.netty.immo/file/citycergy/316/5R8Tq/city_bordeaux_honoraires_agence_2024.pdf;"City Bordeaux Immobilier est ravie de vous présenter. cet appartement T2 de 49 m2 dans un immeuble en pierre, à 2 pas du Palais de Justice.
De par sa proximité aux Transports (TRAM Ligne A et B, Bus), Commerces et Ecoles, il dispose d'un emplacement privilégié.
Entièrement rénové, niché au 3ème et dernier étage d'une petite copropriété, il bénéficie d'une belle luminosité grâce à sa double exposition.
Il se compose d'une spacieuse Pièce de vie, d'une Cuisine indépendante, d'une Chambre d'un beau volume, d'une Salle d'eau, d'un WC et d'un Cellier.
A visiter sans tarder...!
Honoraires à la charge du vendeur. Dans une copropriété de 7 lots. Aucune procédure n'est en cours. Classe énergie E, Classe climat B Montant moyen estimé des dépenses annuelles d'énergie pour un usage standard, établi à partir des prix de l'énergie de l'année 2021 : entre 890.00 et 1250.00 €. Ce bien vous est proposé par un agent commercial. Nos honoraires : Les informations sur les risques auxquels ce bien est exposé sont disponibles sur le site Géorisques : georisques.gouv.fr
Afficher plus";"['49 m² - 2 pièces - 1 chambre', 'Dernier étage (3ème)', 'Cuisine équipée', ""1 salle d'eau"", 'Wc séparé - 1 wc', 'Copropriété de 7 lots', None, None, None, None, None, None, None, None, None, None, None, None, None, None]";['https://photo.superimmo.com/uauk8af3bvx9bz639swpb1o1xec3', 'https://photo.superimmo.com/w6yzjvbtw27wr5cts7x0ouctdn3f', 'https://photo.superimmo.com/40xqriy8e33ck9jwkomyyxbcpuh9', 'https://photo.superimmo.com/f99oe4hllsp6v8fca2l6v1wltlot', None, None, None, None, None, None]
162;https://www.superimmo.com/annonces/achat-appartement-49m-bordeaux-33000-xwc8cd;260000;49;2;1;Bordeaux (33000);5306;18/07/2024;Dernier étage;Cuisine équipée;Honoraires à la charge du vendeur. Barème d’honoraires : https://files.netty.immo/file/citycergy/316/5R8Tq/city_bordeaux_honoraires_agence_2024.pdf;"City Bordeaux Immobilier est ravie de vous présenter. cet appartement T2 de 49 m2 dans un immeuble en pierre, à 2 pas du Palais de Justice.
De par sa proximité aux Transports (TRAM Ligne A et B, Bus), Commerces et Ecoles, il dispose d'un emplacement privilégié.
Entièrement rénové, niché au 3ème et dernier étage d'une petite copropriété, il bénéficie d'une belle luminosité grâce à sa double exposition.
Il se compose d'une spacieuse Pièce de vie, d'une Cuisine indépendante, d'une Chambre d'un beau volume, d'une Salle d'eau, d'un WC et d'un Cellier.
A visiter sans tarder...!
Honoraires à la charge du vendeur. Dans une copropriété de 7 lots. Aucune procédure n'est en cours. Classe énergie E, Classe climat B Montant moyen estimé des dépenses annuelles d'énergie pour un usage standard, établi à partir des prix de l'énergie de l'année 2021 : entre 890.00 et 1250.00 €. Ce bien vous est proposé par un agent commercial. Nos honoraires : Les informations sur les risques auxquels ce bien est exposé sont disponibles sur le site Géorisques : georisques.gouv.fr
Afficher plus";"['49 m² - 2 pièces - 1 chambre', 'Dernier étage (3ème)', 'Cuisine équipée', ""1 salle d'eau"", 'Wc séparé - 1 wc', 'Copropriété de 7 lots', None, None, None, None, None, None, None, None, None, None, None, None, None, None]";['https://photo.superimmo.com/uauk8af3bvx9bz639swpb1o1xec3', 'https://photo.superimmo.com/w6yzjvbtw27wr5cts7x0ouctdn3f', 'https://photo.superimmo.com/40xqriy8e33ck9jwkomyyxbcpuh9', 'https://photo.superimmo.com/f99oe4hllsp6v8fca2l6v1wltlot', None, None, None, None, None, None]
163;https://www.superimmo.com/annonces/achat-appartement-49m-bordeaux-33000-xwc8cd;260000;49;2;1;Bordeaux (33000);5306;18/07/2024;Dernier étage;Cuisine équipée;Honoraires à la charge du vendeur. Barème d’honoraires : https://files.netty.immo/file/citycergy/316/5R8Tq/city_bordeaux_honoraires_agence_2024.pdf;"City Bordeaux Immobilier est ravie de vous présenter. cet appartement T2 de 49 m2 dans un immeuble en pierre, à 2 pas du Palais de Justice.
De par sa proximité aux Transports (TRAM Ligne A et B, Bus), Commerces et Ecoles, il dispose d'un emplacement privilégié.
Entièrement rénové, niché au 3ème et dernier étage d'une petite copropriété, il bénéficie d'une belle luminosité grâce à sa double exposition.
Il se compose d'une spacieuse Pièce de vie, d'une Cuisine indépendante, d'une Chambre d'un beau volume, d'une Salle d'eau, d'un WC et d'un Cellier.
A visiter sans tarder...!
Honoraires à la charge du vendeur. Dans une copropriété de 7 lots. Aucune procédure n'est en cours. Classe énergie E, Classe climat B Montant moyen estimé des dépenses annuelles d'énergie pour un usage standard, établi à partir des prix de l'énergie de l'année 2021 : entre 890.00 et 1250.00 €. Ce bien vous est proposé par un agent commercial. Nos honoraires : Les informations sur les risques auxquels ce bien est exposé sont disponibles sur le site Géorisques : georisques.gouv.fr
Afficher plus";"['49 m² - 2 pièces - 1 chambre', 'Dernier étage (3ème)', 'Cuisine équipée', ""1 salle d'eau"", 'Wc séparé - 1 wc', 'Copropriété de 7 lots', None, None, None, None, None, None, None, None, None, None, None, None, None, None]";['https://photo.superimmo.com/uauk8af3bvx9bz639swpb1o1xec3', 'https://photo.superimmo.com/w6yzjvbtw27wr5cts7x0ouctdn3f', 'https://photo.superimmo.com/40xqriy8e33ck9jwkomyyxbcpuh9', 'https://photo.superimmo.com/f99oe4hllsp6v8fca2l6v1wltlot', None, None, None, None, None, None]
164;https://www.superimmo.com/annonces/achat-maison-115m-bordeaux-33000-xwc8cc;936600;115;4;3;Bordeaux (33000);8144;18/07/2024;Cuisine séparée, équipée;Chauffage au gaz;Honoraires à la charge de l'acquéreur : 5% TTC - 44 600 € TTC inclus dans le prix de vente. Barème d’honoraires : https://files.netty.immo/file/company34269xbl/148/r2Opd/bareme_des_honoraires_peiro_immobilier.pdf;"Très belle échoppe rénovée avec piscine à Bordeaux
Découvrez cette magnifique échoppe entièrement rénovée, située dans le quartier prisé des Chartrons (à proximité des axes Camille Godard et Émile Counord). Cette maison ancienne offre un cadre de vie paisible, sans vis-à-vis, avec des prestations de belle facture.
En entrant, vous serez charmé par l'ambiance générale de cette maison qui développe 115 m² de surface habitable (hors annexe et combles aménagés), répartis sur deux niveaux. Le rez-de-chaussée abrite un séjour salon ainsi qu'une cuisine aménagée et équipée, tournés vers la terrasse. Vous trouverez également trois chambres, deux salles d'eau et trois WC, dont un indépendant, assurant tout le confort nécessaire pour une famille.
L'extérieur de la maison est un véritable havre de paix, avec un magnifique exterieur de 120 m² exposé au sud. Aménagé dans un esprit Bassin, il comprend une terrasse en bois et une piscine au sel, idéale pour profiter des beaux jours, en toute tranquillité.
Une dépendance aménagée de 30 m² et une pièce sous combles d'environ 15 m² viennent compléter ce bien, offrant des possibilités d'aménagement supplémentaires selon vos besoins.
Le chauffage et l'eau chaude sont assurés par une installation au gaz.
Cette échoppe se trouve dans un quartier dynamique et recherché, offrant un cadre de vie agréable et toutes les commodités à proximité.
Pour plus d'informations et pour organiser une visite, contactez Stéphane Lamblin au 06 09 75 45 02 ou par email à .
Honoraires inclus de 5% TTC à la charge de l'acquéreur. Prix hors honoraires 892 000 €. DPE en cours Nos honoraires :
Votre conseiller Peiro Immobilier : Responsable investissements - Stéphane Lamblin - Tél. 0609754502
Afficher plus";['115 m² - 4 pièces - 3 chambres', 'Piscine', 'Chauffage au gaz', 'Cuisine séparée, équipée', '2 salles de bain', 'Wc séparé - 3 wc', None, None, None, None, None, None, None, None, None, None, None, None, None, None];['https://photo.superimmo.com/kjyhw0x2d32oqhc1nvr92oqx5c7x', 'https://photo.superimmo.com/2zik0qlsqvf1gnl4zqaeoth8nfz6', 'https://photo.superimmo.com/s6qeq0g0a5qqyrlievsv0fiqtzh5', 'https://photo.superimmo.com/uqd4tjeo6gdsvsjzg78vumq85yuu', 'https://photo.superimmo.com/cks6yxu0oskqyu1p0vkh6dp0m1cm', None, None, None, None, None]
