;url;price;surface;nb_pieces;nb_chambres;lieu;prix_m2;date_publication;tag_1;tag_2;tag_3;description;tags;images_url
98;https://www.superimmo.com/annonces/achat-maison-196m-hostens-33125-xwcc7d;443000;8;7;4;Hostens (33125);2259;18/07/2024;Piscine;;Honoraires à la charge du vendeur - Prix hors honoraires : 420 000 €. Barème d’honoraires : https://media.immo-facile.com/segments/immo/catalog/images/manufacturers_bareme/18259.pdf;"Située sur la commune d'Hostens, dans un secteur calme entouré de nature, magnifique maison ancienne édifiée sur une parcelle clôturée et arborée de 8500m². D'une superficie de 196m², elle se compose au rez-de-chaussée : d'une entrée, une cuisine indépendante, un chaleureux double salon/séjour avec insert, un wc indépendant, une belle véranda chauffée parfaitement exposée offrant 48m² supplémentaires ainsi qu'une partie nuit à rénover comprenant une chambre et une salle d'eau.
A l'étage: une salle de bain, un wc indépendant, trois belles chambres, deux bureaux ainsi qu'une chaufferie.
L'extérieur, magnifiquement entretenu, dispose d'une piscine 10mx5m avec liner neuf, son local technique avec wc ainsi qu'une superbe dépendance de 48m² environ.
Des travaux sont tout de même à prévoir pour profiter pleinement de cette perle mais le coup de coeur vous est assuré.
Une visite? Rendez-vous dans votre agence Era Immobilier Le Barp
L'Etat des Risques et Pollution peut être consulté sur https://www.georisques.gouv.fr
Afficher plus";['196,08 m² - 7 pièces - 4 chambres - ter. 8 500 m²', 'Piscine', None, None, None, None, None, None, None, None, None, None, None, None, None, None, None, None, None, None];['https://photo.superimmo.com/4bypadr4j0xpy3mnqpxe5mjb9eac', 'https://photo.superimmo.com/upmi1ra7553yr57uyfnzqx9jkec4', 'https://photo.superimmo.com/53qw77y70wd7pac8s4sv96crygfk', 'https://photo.superimmo.com/5tqzgzfm7z7vb15ze2xe1g4xb7we', 'https://photo.superimmo.com/pyse493xj1dvb3g3dvvttm1e5zq4', None, None, None, None, None]
99;https://www.superimmo.com/annonces/achat-appartement-40m-bordeaux-33000-xwcc6r;199500;40;2;1;Bordeaux (33000);4988;18/07/2024;;;12 176 € TTC inclus dans le prix de vente - Prix hors honoraires : 187 324 €. Barème d’honoraires : https://media.immo-facile.com/segments/immo/catalog/images/manufacturers_bareme/7691.pdf;"33000 BORDEAUX TONDU / RUE MOUNEYRA. Appartement T2 de 40 m² au sol (37 en carrez) composé d'une pièce de vie avec cuisine US, une chambre en mezzanine et une salle d'eau avec WC. Proximité tram A, Pey Berland, Palais de justice. Cave
L'Etat des Risques et Pollution peut être consulté sur https://www.georisques.gouv.fr";['40 m² - 2 pièces - 1 chambre', 'Copropriété de 15 lots', None, None, None, None, None, None, None, None, None, None, None, None, None, None, None, None, None, None];['https://photo.superimmo.com/23x0jxs9jhpx0cz3oe05abaquq06', 'https://photo.superimmo.com/b0s5kck392b5qsuw598s1fg0rfpb', 'https://photo.superimmo.com/f4evf1pybb9u95qr1jgkxref23ms', 'https://photo.superimmo.com/gowx7rsxsi2vo8340o53nh66s866', 'https://photo.superimmo.com/rwwqgkwwcf371wdwakivnct0z3ls', None, None, None, None, None]
100;https://www.superimmo.com/annonces/achat-maison-141m-eysines-33320-xwcc5t;659900;141;6;4;Eysines (33320);4680;18/07/2024;1 terrasse;6 Parkings;Honoraires à la charge de l'acquéreur : 3,02% TTC - 19 900 € TTC inclus dans le prix de vente. Barème d’honoraires : https://www.123webimmo.com/agences/baremes/agence-de-bordeaux-nord-medoc;"Votre agence 123webimmo l'immobilier au meilleur prix vous présente : Dans la commune d'EYSINES se trouve une belle propriété construite en 2024 de 141 m² aux normes RE2020 avec sa piscine et son garage indépendant de 20 m² sur une parcelle entièrement clôturée de 1455 m². La maison comprend une grande pièce de vie très lumineuse de 61 m² avec sa cuisine américaine aménagée et équipée ainsi qu'un cellier attenant. L'espace jour avec ses baies vitrées offre une vue imprenable sur le jardin et la piscine. C'est l'endroit idéal pour manger en famille ou se détendre. Elle possède 4 chambres avec placard dont 1 suite parentale avec son dressing et sa salle d'eau privative. Vous trouverez également une seconde salle d'eau ainsi que 2 wc séparés. Coup de coeur assuré pour cette merveilleuse villa qui offre de belles prestations tant intérieur qu'extérieur. Contact : Denise IRIBARNE 06 98 89 68 28. Les informations sur les risques auxquels ce bien est exposé sont disponibles sur le site du gouvernement : https://www.georisques.gouv.fr
Afficher plus";"['141 m² - 6 pièces - 4 chambres - ter. 1 455 m²', 'Piscine', 'Orientation : Ouest, Sud', '6 Parkings', '1 terrasse', 'Année de construction : 2024', 'Chauffage individuel électrique', 'Cuisine ouverte, équipée', ""1 salle d'eau"", 'Wc séparé - 2 wc', None, None, None, None, None, None, None, None, None, None]";['https://photo.superimmo.com/0x2oktyzjsgo5yympptei49ozl5m', 'https://photo.superimmo.com/qwz8nze9ltitmogquae8938u1vsl', 'https://photo.superimmo.com/v94c9epljp9pbrjoi0uxiydt8k5n', 'https://photo.superimmo.com/s5v1y4nuzq334p8lf5fuzmhxbg8v', 'https://photo.superimmo.com/j0ed3a3goby59yh08bzojlm9hqua', None, None, None, None, None]
101;https://www.superimmo.com/annonces/achat-appartement-33m-saint-medard-en-jalles-33160-xwcc46;128000;33;1;;Saint-Médard-en-Jalles (33160);3879;18/07/2024;Avec ascenseur;1 balcon;Honoraires à la charge du vendeur. Barème d’honoraires : https://www.ledoc.immo/medias/baremes/261.pdf;"**Bel appartement rénové au cœur de Saint Médard en Jalles**
Découvrez ce charmant appartement orienté EST, situé dans l'hypercentre de Saint Médard en Jalles, niché dans une petite résidence cosy et calme, à proximité immédiate des commerces du bourg.
Ce bien rénové se compose de :
- Une entrée accueillante
- Un grand séjour lumineux ouvrant sur un balcon sans vis-à-vis
- Une cuisine équipée et aménagée
- Une salle de douche moderne avec WC
En plus de ses prestations de qualité, l'appartement offre un garage fermé et une cave pratique situés au rez-de-chaussée.
Idéal pour les investisseurs, cet appartement est déjà loué avec un locataire en place.
Ne manquez pas cette opportunité rare en plein centre de Saint Médard en Jalles ! Ce bien vous est présenté par Marie-noëlle Pihatarioe, votre conseiller indépendant Dr House Immo.
Afficher plus";['33 m² - 1 pièce', 'Rez-de-chaussée', 'Avec ascenseur', 'Orientation : Est', 'Cave', '1 balcon', None, None, None, None, None, None, None, None, None, None, None, None, None, None];[None, None, None, None, None, None, None, None, None, None]
102;https://www.superimmo.com/annonces/achat-maison-187m-saint-medard-en-jalles-33160-xwcc16;329000;187;4;3;Saint-Médard-en-Jalles (33160);1759;18/07/2024;;;Barème d’honoraires : https://archive.3gimmo.com/bareme_agent2022_avril.php;"Nouveauté ! Située dans un quartier calme et résidentiel, à deux pas du centre-ville de Saint-Médard-en-Jalles, cette maison des années 1970 offre un énorme potentiel pour les amateurs de rénovation. Surface habitable : 187 m² Parcelle : 428 m² Répartition sur 2 niveaux : Étage (partie vie) : Entrée Séjour avec accès à un balcon Cuisine indépendante 2 chambres spacieuses Salle d'eau WC séparés Rez-de-chaussée : Espace garage Atelier Chaufferie Chambre supplémentaire donnant sur le jardin Cette maison nécessite des travaux de rénovation mais offre une opportunité unique de créer la maison de vos rêves dans un cadre paisible tout en étant proche de toutes les commodités du centre-ville. Prix : 329 000 € FAI Ne manquez pas cette occasion de réaliser un investissement judicieux dans une propriété à fort potentiel. Pour plus d'informations ou pour organiser une visite, contactez-moi par mail ou téléphone Nombre de lots de la Copropriété : 1 Votre agent commercial 3G IMMO sur place EI - Ana?s SAQUET Inscrite au RSAC de BORDEAUX 900 181 298, Tel : 06 02 46 70 18, Site 3gimmo : Selon l'article L.561.5 du Code Monétaire et Financier, pour l'organisation de la visite, la présentation d'une pièce d'identité vous sera demandée. - Référence 3G Immo : 192204AS-1462409525

Les informations sur les risques auxquels ce bien est exposé sont disponibles sur le site Géorisques : www.georisques.gouv.fr
Afficher plus";['187 m² - 4 pièces - 3 chambres - ter. 428 m²', None, None, None, None, None, None, None, None, None, None, None, None, None, None, None, None, None, None, None];['https://photo.superimmo.com/wnysr2o6a676gvtcxublywxfn7gh', 'https://photo.superimmo.com/1z97bl94vj83hip3fmn3arc2sf7l', 'https://photo.superimmo.com/q7cguyfv2subllrnw610997hsvaz', 'https://photo.superimmo.com/mleflh1mkfvmjg12xdfh5bs70863', 'https://photo.superimmo.com/ews0aa8w7haiye6uhnzph8rlun41', None, None, None, None, None]
103;https://www.superimmo.com/annonces/achat-maison-187m-saint-medard-en-jalles-33160-xwcc16;329000;187;4;3;Saint-Médard-en-Jalles (33160);1759;18/07/2024;;;Barème d’honoraires : https://archive.3gimmo.com/bareme_agent2022_avril.php;"Nouveauté ! Située dans un quartier calme et résidentiel, à deux pas du centre-ville de Saint-Médard-en-Jalles, cette maison des années 1970 offre un énorme potentiel pour les amateurs de rénovation. Surface habitable : 187 m² Parcelle : 428 m² Répartition sur 2 niveaux : Étage (partie vie) : Entrée Séjour avec accès à un balcon Cuisine indépendante 2 chambres spacieuses Salle d'eau WC séparés Rez-de-chaussée : Espace garage Atelier Chaufferie Chambre supplémentaire donnant sur le jardin Cette maison nécessite des travaux de rénovation mais offre une opportunité unique de créer la maison de vos rêves dans un cadre paisible tout en étant proche de toutes les commodités du centre-ville. Prix : 329 000 € FAI Ne manquez pas cette occasion de réaliser un investissement judicieux dans une propriété à fort potentiel. Pour plus d'informations ou pour organiser une visite, contactez-moi par mail ou téléphone Nombre de lots de la Copropriété : 1 Votre agent commercial 3G IMMO sur place EI - Ana?s SAQUET Inscrite au RSAC de BORDEAUX 900 181 298, Tel : 06 02 46 70 18, Site 3gimmo : Selon l'article L.561.5 du Code Monétaire et Financier, pour l'organisation de la visite, la présentation d'une pièce d'identité vous sera demandée. - Référence 3G Immo : 192204AS-1462409525

Les informations sur les risques auxquels ce bien est exposé sont disponibles sur le site Géorisques : www.georisques.gouv.fr
Afficher plus";['187 m² - 4 pièces - 3 chambres - ter. 428 m²', None, None, None, None, None, None, None, None, None, None, None, None, None, None, None, None, None, None, None];['https://photo.superimmo.com/wnysr2o6a676gvtcxublywxfn7gh', 'https://photo.superimmo.com/1z97bl94vj83hip3fmn3arc2sf7l', 'https://photo.superimmo.com/q7cguyfv2subllrnw610997hsvaz', 'https://photo.superimmo.com/mleflh1mkfvmjg12xdfh5bs70863', 'https://photo.superimmo.com/ews0aa8w7haiye6uhnzph8rlun41', None, None, None, None, None]
104;https://www.superimmo.com/annonces/achat-maison-295m-pessac-sur-dordogne-33890-xwcb3i;349000;35;7;4;Pessac-sur-Dordogne (33890);1182;18/07/2024;1 terrasse;1 Garage;Honoraires à la charge du vendeur. Barème d’honoraires : https://www.groupementimmo.fr/i/redac/honoraires?honofor=1;"Située sur une petite voie communale qui vous amène à la rivière, cette grande maison girondine, mitoyenne d'un coté, à été completement rénovée; Une toiture toute neuve, electricité, isolation , et double vitrage tout neuf sont tous au rendzvous. Les pièces sont lumineuses et acceuillantes.
La maison vous propose:
RDC:
Entrée traversante 20m2 -
Cuisine neuve toute équipée 25m2 -
Salle à Manger/salle de jeu 37m2 -
Salon avec Poele à bois 29m2 -
Bureau 10m2 -
WC separé -
Arrière Cuisine et Chaufferie 14,5m2 -
Cellier -
A l'étage:
Chambre 38m2 -
Chambre 26m2 -
Couloir 14,5m2 -
Chambre avec dressing 30m2 -
Salle d'eau avec WC 5m2 -
Salle d'eau avec WC 6m2 -
Chambre 25m2 -
Vous trouverez deux petites dépendances attenantes à la maison, et en face vous trouverez un grand parking avec un hangar et une ancienne grange.
Cette maison est pret à vous accueillir et ici vous pouvez profiter d'un environment calme, mais à moins d'un kilometre d'un village dynamique avec ses petites commerces et restaurants.

Cette annonce vous est proposée par Anderson jamie - EI - NoRSAC: 491 521 852, Enregistré au Greffe du tribunal de commerce de LibourneLes informations sur les risques auxquels ce bien est exposé sont disponibles sur le site Géorisques : www.georisques.gouv.fr - Annonce rédigée et publiée par un Agent Mandataire -
Afficher plus";"['Disponible immédiatement', '295,35 m² - 7 pièces - 4 chambres - ter. 1 980 m²', 'Orientation : Est / Ouest', '1 Garage', '1 terrasse', 'Année de construction : 1880', 'Chauffage au fuel (radiateurs)', 'Cuisine séparée, équipée', 'Séjour de 37 m²', ""2 salles d'eau"", '3 wc', '', None, None, None, None, None, None, None, None]";['https://photo.superimmo.com/xyvn2jl3yfm8cmmifys12qsnfla2', 'https://photo.superimmo.com/2jrkofzuxxf81xhzbaomqvj57e0x', 'https://photo.superimmo.com/xrbitqwjrmnh6u0cijt06ndz5iuj', 'https://photo.superimmo.com/pz5oy1zf4o40uiby3llizwgmsj7s', 'https://photo.superimmo.com/dcsavx0l5mykzxlqmbst1u0k7oth', None, None, None, None, None]
105;https://www.superimmo.com/annonces/achat-appartement-36m-merignac-33700-xwcaye;134600;47;2;1;Mérignac (33700);3691;18/07/2024;Avec ascenseur;1 terrasse;Barème d’honoraires : https://www.reseau-expertimo.fr/i/redac/honoraires?honofor=2811;L'agence SYNERGIMO vous propose ce T2 de près de 37 m2 situé à Mérignac sur le secteur de Beutre, proche de l'aéroport. Le bus 20 au pied de la résidence assure une connexion directe avec le centre de Mérignac. Commerces et écoles à proximité. Le bien, vendu loué (fin de bail le 02/10/2025), offre une perspective intéressante pour les investisseurs ou ceux planifiant leur futur logement. La résidence, construite en 2017, est sécurisée par un portail automatique. L'appartement, exposé Est, se compose d'un salon-séjour avec coin cuisine et terrasse attenante, d'une salle d'eau avec WC, d'un cellier, et d'une chambre spacieuse. Une place de parking privative en sous-sol complète l'ensemble immobilier. N'attendez pas, contactez nous !;"['36,47 m² - 2 pièces - 1 chambre', 'Rez-de-chaussée', 'Avec ascenseur', 'Orientation : Est', '1 Parking', '1 terrasse', 'Année de construction : 2017', 'Chauffage individuel au gaz', 'Coin cuisine', 'Séjour de 17 m²', ""1 salle d'eau"", '1 wc', 'Interphone', 'Copropriété de 156 lots', None, None, None, None, None, None]";['https://photo.superimmo.com/ekmrr92g4zypbi5e4k6i854d62p5', 'https://photo.superimmo.com/ufhxnccw8j3w7lt4n81pl0ec8x59', 'https://photo.superimmo.com/4ab3rfc556e9z2hw9alpi5h61njm', 'https://photo.superimmo.com/aev37mfgx6p1e6e8op8a3n6fvj0a', 'https://photo.superimmo.com/h00oj609yq35x4cjiyd8omwwon1i', None, None, None, None, None]
106;https://www.superimmo.com/annonces/achat-maison-115m-saint-medard-en-jalles-33160-xwcaxo;410000;115;4;3;Saint-Médard-en-Jalles (33160);3565;18/07/2024;Terrasse;1 Garage;Honoraires à la charge du vendeur. Barème d’honoraires : https://www.reseau-expertimo.fr/i/redac/honoraires?honofor=1674;"Maison de plain-pied au calme quartier centre au Camp des Lanciers :
Entrée avec placard,
Salon séjour avec cheminée et belle hauteur sous plafond,
Cuisine fermée aménagée et équipée (neuve), (10,30 m2)
Cellier (équipé évacuation et arrivée d'eau pour machine à laver)
3 chambres avec placards dont une avec lavabo dans un placard, (entre 10 et 11 m2 environ)
Salle d'eau spacieuse (4,70 m2),
Wc séparé avec fenêtre,
2 vérandas
Garage attenant de plus de 30 m2 (équipé évacuation et arrivée d'eau pour machine à laver)
Plus :
Huisseries PVC,
Clim réversible coin nuit
Chauffage au gaz de ville (chaudière à condensation),
Barbecue extérieur.
A découvrir ...
Cette annonce vous est proposée par LUIS Maria - EI - NoRSAC: 822706586, Enregistré au Greffe du tribunal de commerce de Bordeaux - Annonce rédigée et publiée par un Agent Mandataire -
Afficher plus";"['115 m² - 4 pièces - 3 chambres - ter. 548 m²', '1 Garage', 'Terrasse', 'Année de construction : 1980', 'Chauffage individuel au gaz', 'Climatisation', 'Cuisine séparée, équipée', 'Séjour de 24 m²', ""1 salle d'eau"", '1 wc', None, None, None, None, None, None, None, None, None, None]";['https://photo.superimmo.com/za89em9pp25c8bfjc12vgvi0x9q5', 'https://photo.superimmo.com/o4yh2hpyrpc9wklvrlz6wpux1wua', 'https://photo.superimmo.com/jxvsa2pxu1r1thn7sepat408u9jd', 'https://photo.superimmo.com/8aeg4igkfzo95wcbr5afvzufpz3c', 'https://photo.superimmo.com/qelew170xwsfpuk8p352qbqrrryi', None, None, None, None, None]
107;https://www.superimmo.com/annonces/achat-maison-159m-la-reole-33190-xwcaxj;244000;159;6;4;La Réole (33190);1535;18/07/2024;2 terrasses;1 Garage;Honoraires à la charge du vendeur. Barème d’honoraires : https://www.maurigimmobilier.com/i/redac/honoraires?honofor=1;"À 30 minutes de Bordeaux et à proximité de l'échangeur de l'autoroute, proche gare, magnifique maison en pierre située à proximité immédiate du centre-ville de LA REOLE.
Cette maison aux allures cocooning vous séduira par ses grands espaces côté jour avec un beau salon séjour agrémenté par sa cheminée avec insert, un deuxième salon de 26 m2 avec coin TV, une cuisine entièrement équipée, une salle d'eau et un wc. À l'étage, quatre grandes chambres, dont une avec dressing, une salle de bains et un wc.
L'extérieur est embelli par une véranda donnant sur une belle terrasse et vous bénéficiez d'une deuxième terrasse avec un jardin pour profiter de l'extérieur tout en étant au centre-ville.
Deux grands garagesmotorisés vient compléter ce bien.
À visiter sans tarder dans nos agences MAURIG IMMOBILIER à SAINTE BAZEILLE (05.47.22.44.74) et MARMANDE ( 05.53.64.50.00)
Afficher plus";"['159 m² - 6 pièces - 4 chambres - ter. 264 m²', '1 Garage', '2 terrasses', 'Chauffage au gaz (radiateurs)', 'Cuisine séparée, équipée', 'Séjour de 60 m²', ""1 salle d'eau - 1 salle de bain"", '2 wc', 'Cheminée', '', None, None, None, None, None, None, None, None, None, None]";['https://photo.superimmo.com/39dxi0digxe6fozctznrctd5fylj', 'https://photo.superimmo.com/8fuldqzda5p9qxcqwvqh8gaxf08e', 'https://photo.superimmo.com/sz85n65t37fvzep33wb10pipstc9', 'https://photo.superimmo.com/vmgsedt8mshlpu63foi136hvlqkk', 'https://photo.superimmo.com/yz593laurcdfr8o2pcw4x7cfomu6', None, None, None, None, None]
108;https://www.superimmo.com/annonces/achat-maison-158m-le-verdon-sur-mer-33123-xwcal7;780000;158;5;4;Le Verdon-sur-Mer (33123);4937;18/07/2024;Terrasse;;;"vous propose ce bien :
À vendre : Magnifique maison face à l'estuaire,
Localisation : Le Verdon-sur-Mer (33123), Quartier Plage de la Chambrette
Emplacement : Vue directe sur l'estuaire
BANDB by Laurence Perin vous présente cette somptueuse maison neuve au design moderne sur 3 niveaux, offrant une vue imprenable sur l'estuaire à proximité immédiate de la plage et du port du verdon-sur-mer.
Découvrez cette superbe maison idéalement située dans le charmant quartier de la Plage de la Chambrette au Verdon-sur-Mer.
Parfaite pour les amoureux de la nature et les passionnés de vues imprenables, cette propriété offre un cadre de vie unique et privilégié.
Architecture : Design contemporain avec bardage en bois
Avec une surface de terrain de 660 m², cette propriété dispose d'un jardin privatif ombragé et de nombreuses terrasses ouvertes sur l'extérieur.
Le terrain est piscinable, mais vous trouverez certainement le coin idéal pour votre Jacuzzi pour apprécier l'un des nombreux espaces de détente.
250 m² de surface utile, environ 160 m² habitable et sécurisée, elle dispose de 4 chambres, dont un séjour lumineux avec un revêtement principal en parquet, apportant chaleur et élégance à l'intérieur. Elle est dotée de 3 salles de bain modernes et fonctionnelles. parkings et grand garage de 28m² ainsi qu' une buanderie.
Elle est composée comme suit:
Rez-de-chaussée, une entrée, un garage, Buanderie, chambre et salle d'eau grande terrasse ouverte sur le jardin à l'abri des regards.
A l'étage accessible par le rez-de-chaussée ou un escalier extérieur, une pièce de vie composée d'un salon, salle à manger ainsi qu’une cuisine ouverte entièrement équipée et sa terrasse de 47 m² exposée Est avec une magnifique vue dégagée sur l’estuaire.
Au troisième niveau, 2 chambres de 15 m² partageant un balcon extérieur orienté ouest, une salle de bains, un wc
Pour finir la suite parentale de 26 m² et sa terrasse privative face à l'estuaire font de cette demeure un véritable coup de coeur.
Le confort est au rendez-vous construction avec la climatisation, volets roulants électrique. La propriété est également sécurisée par une alarme.
Le Verdon-sur-Mer, et plus particulièrement le quartier Plage de la Chambrette, est réputé pour son calme et sa qualité de vie exceptionnelle. Vous y trouverez un cadre de vie paisible avec une belle vue sur la mer, tout en étant proche des commodités et des activités de loisirs.
Cette maison d'exception est idéale pour une habitation principale ou secondaire. Ne manquez pas cette opportunité unique de vivre dans un environnement privilégié. Contactez-nous pour plus d'informations et pour organiser une visite.
Contact: B&B IMMOBILIER BY LAURENCE PERIN vous accompagne dans vos projets immobiliers.
Tel: 06 09 91 68 25 Laurence PERIN
Agent immobilier- Titulaire de la carte professionnelle inscrite au RCS de BORDEAUX N° 930601422
Surface : environ 160 m² habitable
Prix du bien : 780 000 €
Prix du bien hors honoraires : 750 000 €
Honoraires TTC : 4 % soit 30 000 € Honoraires à la charge de l’acquéreur
Date de réalisation du diagnostic énergétique : 15/07/2024
Consommation énergie primaire : B 103 kWh/m²/an
Consommation énergie finale : A 3 kWh/m²/an
Montant estimé des dépenses annuelles d'énergie pour un usage standard : entre 1010 € et 1430 € par an.
Prix moyens des énergies indexés sur les années 2021, 2022, 2023 (abonnements compris)
Les informations sur les risques auxquels ce bien est exposé sont disponibles sur le site Géorisques : www.georisques.gouv.fr
Afficher plus";"['158 m² - 5 pièces - 4 chambres - ter. 660 m²', 'Vue sur mer', 'Garage', 'Terrasse', 'Année de construction : 2021', ""Assainissement : tout à l'égout"", 'Climatisation', '3 salles de bain', '3 wc', 'Espace vert - Jardin privatif', 'Parquet', 'Alarme - Vidéosurveillance', None, None, None, None, None, None, None, None]";['https://photo.superimmo.com/s14ryuch50iko6fenln8gxeho0d5', 'https://photo.superimmo.com/l5w9ulzq8m7mo16u585iwrknrpel', 'https://photo.superimmo.com/lx3118jxg46ek55zqmzgadf97nio', 'https://photo.superimmo.com/uu0p0kmf7zpu7d8cugbpm0r98dr5', 'https://photo.superimmo.com/k3rmc48mt2u4d4rqhepetd03m0u7', None, None, None, None, None]
