;url;price;surface;nb_pieces;nb_chambres;lieu;prix_m2;date_publication;tag_1;tag_2;tag_3;description;tags;images_url
55;https://www.superimmo.com/annonces/achat-maison-217m-saint-andre-de-cubzac-33240-xwcdoz;625000;217;9;7;Saint-André-de-Cubzac (33240);2880;18/07/2024;Terrasse;Chauffage: pompe à chaleur;25 000 € TTC inclus dans le prix de vente - Prix hors honoraires : 600 000 €. Barème d’honoraires : https://telemaque.orpi.coop/agence/255/bareme.pdf;"Découvrez cette très belle maison d'architecte neuve haut de gamme prête à vous recevoir sur Saint-André-de-Cubzac, idéalement située dans un quartier calme et résidentiel proche du centre-ville et de toutes les commodités (écoles, collège, lycée, transports en commun, gare, commerces, médecin, pharmacie).
Cette maison moderne de 217 m² construite en 2024, est idéale pour les familles à la recherche de confort et de tranquillité.
Vous serez séduits dès l'entrée par le caractère unique de cette maison, comprenant une vaste pièce de vie de près de 60 m² avec un espace cuisine aménagée, cellier, salon et salle à manger donnant une large terrasse exposée Sud.
Vous profiterez de plusieurs zones de nuits avec une suite parentale, 5 chambres et un appartement pour recevoir votre famille ou vos hôtes en toute tranquillité.
Au total, 6 chambres, 3 salles d'eau, 3 wc, un appartement, 1 bureau et un extérieur à terminer selon vos goûts.
La maison est équipée de nombreux atouts : pompe à chaleur, cumulus thermodynamique, centralisation des volets roulants...
Un soin particulier et des prestations de qualité ont été apporté à l'ensemble de cette maison sans égal.
Contactez-nous pour plus d'informations sur cette propriété unique et pour planifier une visite dès aujourd'hui.
Référence agence : 2606
Afficher plus";"['Disponible immédiatement', '217 m² - 9 pièces - 7 chambres - ter. 900 m²', '1 niveau', 'Parking extérieur', 'Terrasse', 'Chauffage: pompe à chaleur', 'Climatisation', ""4 salles d'eau - 1 salle de bain"", '4 wc', 'Jardin privatif', 'Fenêtres double vitrage', '', None, None, None, None, None, None, None, None]";['https://photo.superimmo.com/plg6uyy67cog4oyco4veg8d9cqd2', 'https://photo.superimmo.com/9mvofyct3tyzx63yg5s7lnczc7wg', 'https://photo.superimmo.com/6lwlo8k9kp5h5tjwpbhdsxdnod04', 'https://photo.superimmo.com/uv54du0bqbc9eonf1zljm9986xne', 'https://photo.superimmo.com/frtvmr38ns2s2wi8wyxqbdk9fppo', None, None, None, None, None]
56;https://www.superimmo.com/annonces/achat-maison-186m-cezac-33620-xwcdoy;493500;186;5;4;Cézac (33620);2653;18/07/2024;Exclusivité;Terrasse;Honoraires à la charge du vendeur. Barème d’honoraires : https://telemaque.orpi.coop/agence/255/bareme.pdf;"Cézac situé entre Cavignac et Pugnac, Girondine entièrement rénovée alliant le charme de la pierre et le confort moderne. Construite en 1900 et avec une extension moderne datant de 10 ans, cette demeure en parfaite état offre des pièces de vie spacieuses de 80 m² avec une cuisine moderne entièrement équipée. Elle dispose de 4 chambres dont une en rez-de-chaussée avec salle d'eau et wc séparé, à l'étage, une mezzanine, 3 chambres et une salle de bains avec wc. La grande terrasse donne sur un parc de 6500 m² entièrement clôturé et sans vis-à-vis avec un vaste garage de 75 m² et 3 carports pour camping-car ou bateau. Contactez-nous pour plus d'informations.
Référence agence : 2605";"['Disponible immédiatement', '186 m² - 5 pièces - 4 chambres - ter. 6 513 m²', '2 niveaux', 'Parking couvert', 'Terrasse', 'Chauffage électrique', ""1 salle d'eau - 1 salle de bain"", '2 wc', 'Jardin privatif', 'Fenêtres double vitrage', 'Cheminée', '', None, None, None, None, None, None, None, None]";['https://photo.superimmo.com/jbibenoqkb3ggb7jkrlu37i5z82i', 'https://photo.superimmo.com/pbqwhut8edj3htsvjsgqbm2c6lw7', 'https://photo.superimmo.com/i8r7vwp5qqu8jpg6163wgv7h1vro', 'https://photo.superimmo.com/xqugaml73cquu3bwx3mqh2eif3n2', 'https://photo.superimmo.com/jkh1g9ltqf6oc7tdayae3wlo2jh4', None, None, None, None, None]
57;https://www.superimmo.com/annonces/achat-maison-89m-pessac-33600-xwcdox;297500;89;4;3;Pessac (33600);3343;18/07/2024;Exclusivité;Chauffage individuel au gaz;17 500 € TTC inclus dans le prix de vente - Prix hors honoraires : 280 000 €. Barème d’honoraires : https://telemaque.orpi.coop/agence/4265/bareme.pdf;"PESSAC FRANCE ALOUETTE
Idéalement placée, à quelques pas des commerces de Pessac Alouette, du Parc Cazalet, de la future piscine, de la gare et du tram B ; venez découvrir cette maison à rénover d'environ 90m² au coeur d'un quartier calme et proche de toutes commodités.
Sur une belle parcelle sans vis à vis de près de 700m², vous profiterez du grand jardin et d'un potentiel agrandissement de la maison.
Côté intérieur, la maison dispose d'une pièce de vie traversante au rez de chaussée ainsi que d'une spacieuse cuisine, d'une véranda de 22m², d'une salle d'eau et d'un garage de 16.5m².
A l'étage un palier desservant 3 chambres avec placards et une salle de bains.
Référence agence : 7351";"['Disponible immédiatement', '89 m² - 4 pièces - 3 chambres - ter. 690 m²', '1 niveau', 'Piscine', 'Parking couvert', 'Chauffage individuel au gaz', ""1 salle d'eau - 1 salle de bain"", '1 wc', 'Jardin privatif', 'Fenêtres double vitrage', None, None, None, None, None, None, None, None, None, None]";['https://photo.superimmo.com/1i3wvry4s2gly7q9ktuvd7zf63xl', 'https://photo.superimmo.com/l0fid9l9tuewf84ivs80v9wegn1j', 'https://photo.superimmo.com/g9pqoppfxmptipmjnmka7tgrvd2d', 'https://photo.superimmo.com/d7muz3m8gddd0mhpa96p7mwaeqh9', 'https://photo.superimmo.com/jlku0hc5cqhc0yf7xmwbe3bxsm2t', None, None, None, None, None]
58;https://www.superimmo.com/annonces/achat-maison-202m-creon-33670-xwcdj0;780000;202;;4;Créon (33670);3861;18/07/2024;Exclusivité;Terrasse;Honoraires à la charge de l'acquéreur : 4% TTC - 30 000 € TTC inclus dans le prix de vente - Prix hors honoraires : 750 000 €. Barème d’honoraires : https://www.ai2g33.fr/honoraires.html;"Découvrez cette charmante maison en pierre de plus de 200 m², sur une parcelle d’environ 3400 m² entièrement rénovée avec goût, nichée près des Vignes, un cadre paisible offrant tranquillité et intimité. Ce bien unique se distingue par son magnifique jardin, un espace idéal pour les amoureux de la nature, une belle piscine avec une terrasse parfaitement bien exposée pour vos moments de détente ensoleillés.
Cette propriété vous propose un espace de vie très accueillant,
Au rez-de-chaussée : une grande entrée, donnant sur un double salon et salle-à-manger doté d'une charmante cheminée, une cuisine aménagée et équipée indépendante très spacieuse, un cellier viens la compléter pour tous vos rangements.
De l’autre côté de l’entée on découvre un deuxième vaste salon donnant sur la piscine, une chambre avec placard, une salle d’eau très fonctionnelle et un WC.
A l’étage : 3 chambres, une salle d’eau et un WC.
Pour compléter cette maison style longère, on trouve attenant :
- un grand garage d’environ 80m² équipé d’une porte électrique,
- un ancien chaix (cave à vin) d’environ 90 m² pour les amateurs de vins ou possibilité de le transformer en maisonnette complémentaire pour recevoir vos proches.
Ce bien représente une opportunité exceptionnelle pour ceux qui cherchent la tranquillité tout en restant pas très loin des commodités de la ville.
Venez profitez d'une VUE PANORAMIQUE imprenable sur les coteaux voisins, sans vis-à-vis ou aucune nuisance , dans un environnement de nature reposant. De très beaux volumes, une luminosité omniprésente via de nombreuses ouvertures, et des matériaux de qualité qui en font une maison cosy où l'on se sent bien, et un environnement rare aux portes de BORDEAUX.
Les informations sur les risques auxquels ce bien est exposé sont disponibles sur le site Géorisque :
Pour découvrir cette maison à Gujan-Mestras, son jardin, sa piscine et sa terrasse, Contactez au plus vite Gilles MESLIER Président SAS AI2G, 16 quai des Chartrons 33300 BORDEAUX. 05 40 25 04 47
.
Les informations sur les risques auxquels ce bien est exposé sont disponibles sur le site Géorisques : www. georisques. gouv. fr
Afficher plus";"['Disponible immédiatement', '202 m² - 4 chambres - ter. 3 400 m²', 'Piscine', 'Orientation : Est / Ouest - Traversant', 'Garage', '1 cave', 'Terrasse', 'Chauffage individuel: pompe à chaleur', 'Climatisation', 'Cuisine ouverte', 'Séjour de 30 m²', ""2 salles d'eau"", '2 wc', 'Jardin privatif', 'Fenêtres double vitrage', 'Cheminée', 'Alarme', '', None, None]";['https://photo.superimmo.com/bwyk45sewj3umfgaoc96ovlsheou', 'https://photo.superimmo.com/b56t4x50q41wezhemz6lk195j6sy', 'https://photo.superimmo.com/5cs1vc0bnw3c1fr1k95ud7spiaao', 'https://photo.superimmo.com/g2lrjhykx2dr3fb7fu6w1jx5orr1', 'https://photo.superimmo.com/88z96quz7ykubwo74c598fnx7u0t', None, None, None, None, None]
59;https://www.superimmo.com/annonces/achat-appartement-84m-pessac-33600-xwcdiq;330000;84;4;3;Pessac (33600);3929;18/07/2024;Exclusivité;Étage 1/4;Honoraires à la charge du vendeur. Barème d’honoraires : https://fr.foncia.com/agence-immobiliere/pessac-33600/agence-immobiliere/foncia-transaction-pessac-3614;"PESSAC Ecoquartier de l’Artigon, à proximité et à pieds de toutes les commodités du centre ville (commerces, marché, écoles, gare SNCF, tram).
Situé au 1er étage d’une copropriété récente (livraison 2017) , ce spacieux appartement T4 d’environ 85 m2 se compose d’une entrée, 3 chambres, un vaste et lumineux séjour donnant sur une loggia, une cuisine séparée pouvant être ouverte sur le séjour, une salle de bains et un WC.
2 places de stationnement ou sous sol.";['Disponible immédiatement', '84 m² - 4 pièces - 3 chambres', 'Étage 1/4', 'Parking couvert', 'Année de construction : 2017', 'Chauffage collectif au gaz', '1 salle de bain', 'Copropriété de 238 lots', None, None, None, None, None, None, None, None, None, None, None, None];['https://photo.superimmo.com/dyakgfp4dranpltjjehhu386jtbm', 'https://photo.superimmo.com/wwaiyho1qknpfvsimp6uw3etic2e', 'https://photo.superimmo.com/fdk583avi9ku538dqyhufg8gwq6h', 'https://photo.superimmo.com/szdtpadrb0fup09mr7alt4kni6by', 'https://photo.superimmo.com/24ql2rkvfib3uasih34sq95jpzz7', None, None, None, None, None]
60;https://www.superimmo.com/annonces/achat-appartement-39m-saint-denis-de-pile-33910-xwcdhx;77000;39;2;1;Saint-Denis-de-Pile (33910);1974;18/07/2024;Exclusivité;Dernier étage;Honoraires à la charge du vendeur. Barème d’honoraires : https://fr.foncia.com/agence-immobiliere/cenon-33150/agence-immobiliere/foncia-transaction-cenon-2485;"Dans une résidence verdoyante et au calme, idéalement située sur Saint Denis de Pile, dans un quartier pavillonnaire et proche des services de proximité, venez découvrir cet appartement de type 2 vendu libre.
Le bien est bien exposé au 1er étage et dernier étage du bâtiment, il est composé d'une entrée, une pièce de vie avec cuisine américaine, un dégagement distribue le wc séparé de la salle de bains et la chambre.
Deux places de stationnement complètent le bien.
Une opportunité à saisir sur le secteur à 10 minutes de Libourne et de Saint Emilien !";['Disponible immédiatement', '39 m² - 2 pièces - 1 chambre', 'Dernier étage (1er)', 'Orientation : Est', 'Parking extérieur', 'Balcon', 'Année de construction : 2006', 'Chauffage individuel électrique', 'Séjour de 21 m²', '1 salle de bain', 'Copropriété de 28 lots', '', None, None, None, None, None, None, None, None];['https://photo.superimmo.com/goi4y7c7pcuv9ix2yjexkesdil05', 'https://photo.superimmo.com/e8qtqkfh08xohzpz4a891q3qef6u', 'https://photo.superimmo.com/lbp51rgxe9oshwl42k4akrxbewed', 'https://photo.superimmo.com/ev3yinlp3cfuv8pu5hzz97g77dpm', 'https://photo.superimmo.com/1wmv048cqr9bi9hc5edu75zeum26', None, None, None, None, None]
61;https://www.superimmo.com/annonces/achat-appartement-42m-merignac-33700-xwcdgm;136000;42;2;1;Mérignac (33700);3238;18/07/2024;Exclusivité;Chauffage individuel électrique;Honoraires à la charge du vendeur. Barème d’honoraires : https://fr.foncia.com/agence-immobiliere/merignac-33700/agence-immobiliere/foncia-transaction-merignac-1085;"Exclusivité FONCIA !
Secteur Galus à 5 min de l’aéroport, proche de la sortie 10 et à 15 min à pieds du Tram A. T2 en RDC composé d’un salon/séjour donnant sur une loggia sans vis à vis, d’une chambre, d’une salle de bains et d’un WC. Peintures fraîchement refaites. Radiateur changés l’année dernière.
Une place de parking extérieure complète ce bien.
Venez visiter rapidement ce bien !";['Disponible immédiatement', '42 m² - 2 pièces - 1 chambre', 'Parking extérieur', 'Année de construction : 2007', 'Chauffage individuel électrique', '1 salle de bain', 'Copropriété de 54 lots', '', None, None, None, None, None, None, None, None, None, None, None, None];['https://photo.superimmo.com/n63ir6qzd08409b3dog7u8nf8681', 'https://photo.superimmo.com/4uk9ih1y6bx1lu2tdyk7r5bqz8ff', 'https://photo.superimmo.com/7h5nh3y7022uk1hwutb2vez6svlh', 'https://photo.superimmo.com/dqxtctmdqkwzioh2svdft99ivyg7', 'https://photo.superimmo.com/29m4smnjjaa2o2ly4hwc3fdyhgu1', 'https://photo.superimmo.com/ynag1hfbwxr7y91vai3abnh2u6qc', None, None, None, None]
62;https://www.superimmo.com/annonces/achat-appartement-119m-pessac-33600-xwcddw;411000;119;4;3;Pessac (33600);3454;18/07/2024;Cuisine ouverte;Chauffage individuel électrique;Honoraires à la charge du vendeur. Barème d’honoraires : https://www.homekare.fr/;"A VENDRE APPARTEMENT T4 ENTIÈREMENT RÉNOVÉE D'ENVIRON 120 M2 AVEC JARDIN PRIVATIF ET DEUX PLACES DE PARKING SÉCURISÉE, QUARTIER FRANCE-ALOUETTE, 33600 PESSAC.
Le bien s'ouvre sur un couloir, permettant l'accès à la grande pièce de vie accompagnée de de sa cuisine ouverte entièrement aménagée et équipée le tout faisant près de 50 m2 !
S'en suivent 3 chambres de 16, 13 et 12 m2 chacune dont une suite parentale avec salle d'eau, un cellier une seconde salle d'eau et un WC indépendant.
Côté extérieur, vous pourrez profiter d'un jardin privatif d'environ 210 m2 avec terrasse ainsi que d'une piscine communes aux 4 appartements.
Deux places de parking et un cave de 17 m2 viennent également compléter ce bien.
N'hésitez plus et venez découvrir ce bien sans plus attendre !
HK HomeKare immobilier : ACHAT - VENTE - LOCATION - GESTION - SYNDIC
Afficher plus";"['119 m² - 4 pièces - 3 chambres', 'Rez-de-chaussée', 'Piscine', 'Orientation : Est / Ouest', 'Garage', '1 cave', 'Année de construction : 1970', 'Chauffage individuel électrique', 'Cuisine ouverte', 'Séjour de 50 m²', ""2 salles d'eau"", '1 wc', 'Copropriété de 4 lots', '', None, None, None, None, None, None]";['https://photo.superimmo.com/33jviy8n60ivr5opdkbciwxpht8i', 'https://photo.superimmo.com/k3ipxz8qe5lwgxr5xe57cte8l0l7', 'https://photo.superimmo.com/xwj6zgzssg8xep8rb8tjmb0f2o0o', 'https://photo.superimmo.com/tqv1ruvsqjhpgqftzt3fv2q6b3il', 'https://photo.superimmo.com/u2bvjladamss5qqvgusc71fovvdy', None, None, None, None, None]
63;https://www.superimmo.com/annonces/achat-appartement-58m-pessac-33600-xwcddt;275000;58;3;2;Pessac (33600);4741;18/07/2024;Dernier étage;Cuisine ouverte;Honoraires à la charge du vendeur. Barème d’honoraires : https://www.homekare.fr/;"A VENDRE APPARTEMENT T3 ENTIÈREMENT RÉNOVÉE D'ENVIRON 58 M2, AVEC 1 PLACES DE PARKING SÉCURISÉE, QUARTIER FRANCE-ALOUETTE, 33600 PESSAC.
Le bien s'ouvre sur un couloir, permettant l'accès à la pièce de vie accompagnée de de sa cuisine ouverte entièrement aménagée de 20 m2 !
S'en suivent 2 chambres de 14 et 11 m2 chacune, une salle d'eau avec WC et un cellier.
Côté extérieur, vous pourrez profiter d'une piscine communes aux 4 appartements ainsi que d'une place de parking.
N'hésitez plus et venez découvrir ce bien sans plus attendre !
HK HomeKare immobilier : ACHAT - VENTE - LOCATION - GESTION - SYNDIC";"['58 m² - 3 pièces - 2 chambres', 'Piscine', 'Dernier étage (1er)', 'Garage', 'Année de construction : 1970', 'Chauffage individuel électrique', 'Cuisine ouverte', 'Séjour de 20 m²', ""1 salle d'eau"", '1 wc', 'Copropriété de 4 lots', '', None, None, None, None, None, None, None, None]";['https://photo.superimmo.com/c55n8v04vu1ds34fqkjh04x8kvr6', 'https://photo.superimmo.com/qcbtvgchj5jsy5b1l211xom6fkkz', 'https://photo.superimmo.com/heittlifm6em20oo39yc5taf6s7x', 'https://photo.superimmo.com/ojx5rxod2io32syrl10mk62hr0h6', 'https://photo.superimmo.com/f4ttweazjqq3g5urb0kpffwrz4w5', 'https://photo.superimmo.com/qrp8angm11p83ojwl6tvg8evnkme', None, None, None, None]
64;https://www.superimmo.com/annonces/achat-maison-116m-bordeaux-33200-xwcddq;499900;116;5;4;Bordeaux (33200);4309;18/07/2024;Coin cuisine;;Honoraires à la charge du vendeur. Barème d’honoraires : https://www.homekare.fr/;"A VENDRE MAISON 5 PIÈCES D'ENVIRION 113M2 - TERRAIN D'ENVIRON 257M2 - ÉTAGE - QUARTIER CAUDERAN - BORDEAUX - 33200
Elle se compose comme suit : une grande pièce à vivre, quatre chambres, une cuisine aménagée équipée, une salle de bains et deux toilettes.
Jardin avec beaucoup de potentiel.
On trouve des écoles de tous types à moins de 10 minutes à pied. Niveau transports en commun, il y a sept lignes de bus ainsi que la ligne de tramway D. On trouve des restaurants, des boulangeries, des commerces, trois supermarchés, des boucheries et deux supérettes dans les environs.
Découvrez toutes les originalités de cette maison à vendre en prenant RDV avec l'un de nos conseillers.
HK HomeKare immobilier : ACHAT - VENTE - LOCATION - GESTION - SYNDIC";['116 m² - 5 pièces - 4 chambres - ter. 257 m²', 'Garage', 'Année de construction : 1990', 'Coin cuisine', 'Séjour de 30 m²', '1 salle de bain', '2 wc', '', None, None, None, None, None, None, None, None, None, None, None, None];['https://photo.superimmo.com/m9z6k3i7msux857kyisi4jo6ptco', 'https://photo.superimmo.com/iswe2ulno8dku0bohmou77dabdfn', 'https://photo.superimmo.com/w86t02kjx0grwiy61u0iyo74xek1', 'https://photo.superimmo.com/9n0x3aau6g5oymdahv30yl0ql2eu', 'https://photo.superimmo.com/vtgppdxc95vmyc0ah7mfteg5cw1l', 'https://photo.superimmo.com/6c8nl3fsjxdgsr88e14h8k4lfjoe', None, None, None, None]
65;https://www.superimmo.com/annonces/achat-maison-135m-le-bouscat-33110-xwcddm;757000;135;5;4;Le Bouscat (33110);5607;18/07/2024;Cuisine équipée;;Honoraires à la charge du vendeur. Barème d’honoraires : https://www.homekare.fr/;"A VENDRE - MAISON 5 PIÈCES - ENVIRON 135M2 - 33110 - BOUSCAT - BARRIERE DU MEDOC - JARDIN - STANDING - GARAGE
Au rez-de-jardin, une cuisine spacieuse et fonctionnelle s'ouvre sur le jardin par une grande baie vitrée, offrant une luminosité naturelle tout au long de la journée.
Le deuxième niveau accueille un bureau, un salon chaleureux et un coin lecture, tous bénéficiant d'une abondance de lumière grâce aux nombreuses fenêtres et à la porte-fenêtre donnant sur un balcon côté jardin.
Au troisième niveau, une somptueuse suite parentale vous attend avec son vaste dressing et sa salle de bain attenante. Deux chambres supplémentaires, dont une avec un second balcon côté rue.
Pour plus d'informations sur cette opportunité unique, contactez-nous dès maintenant.
HK HomeKare immobilier : ACHAT - VENTE - LOCATION - GESTION - SYNDIC
Afficher plus";['135 m² - 5 pièces - 4 chambres', 'Année de construction : 1970', 'Cuisine équipée', '', None, None, None, None, None, None, None, None, None, None, None, None, None, None, None, None];['https://photo.superimmo.com/88jaca4xhlf0yk5s4b584npit44j', 'https://photo.superimmo.com/j6ar57cbbysdwuqugznvcc91cfw9', 'https://photo.superimmo.com/dcubeg6tsukfnv08hgzi15qb69bd', 'https://photo.superimmo.com/0n1bsilh1h98n84bokf22isaog17', 'https://photo.superimmo.com/c2ppm1jms8mp335ktiv60389hbgb', 'https://photo.superimmo.com/a9j6i4k6oabijpnq8pek36ht0epk', None, None, None, None]
66;https://www.superimmo.com/annonces/achat-appartement-96m-pessac-33600-xwcddl;377000;96;4;3;Pessac (33600);3927;18/07/2024;Dernier étage;Cuisine équipée;Honoraires à la charge du vendeur. Barème d’honoraires : https://www.homekare.fr/;"A VENDRE APPARTEMENT RENOVÉ T4 EN DUPLEX DE 96 M2 AVEC JARDIN ET 2 PLACES DE PARKING, QUARTIER FRANCE-ALOUETTE, 33600 PESSAC.
Le bien s'ouvre sur une pièce de vie accompagnée de sa cuisine ouverte entièrement aménagée le tout faisant près de 28 m2 !
S'en suivent 2 chambres de 16 et 12 m2 chacune accompagnée de sa salle d'eau, un cellier et un WC indépendant. A l'étage, vous retrouverez une grande pièce mansardée de plus de 40 m2 !
Côté extérieur, vous pourrez profiter d'un jardin privatif ainsi que d'une piscine communes aux 4 appartements.
Deux places de parking viennent également compléter ce bien.
N'hésitez plus et venez découvrir ce bien sans plus attendre !
HK HomeKare immobilier : ACHAT - VENTE - LOCATION - GESTION - SYNDIC";"['96 m² - 4 pièces - 3 chambres', 'Dernier étage (1er)', 'Garage', 'Année de construction : 1970', 'Chauffage individuel électrique', 'Cuisine équipée', 'Séjour de 28 m²', ""1 salle d'eau - 1 salle de bain"", '2 wc', 'Copropriété de 4 lots', None, None, None, None, None, None, None, None, None, None]";['https://photo.superimmo.com/wc1pma560ecwq7rmo1fwj9gbio8i', 'https://photo.superimmo.com/pc7zd3lvmxvom4vhv0xtzxirzwcn', 'https://photo.superimmo.com/lyfjyhbkqfze7lvu0etfy72r9ic0', 'https://photo.superimmo.com/i4tcemy51mc9kfhc26m03q4q9qep', 'https://photo.superimmo.com/k66zitf065nn72x6p8ediuw3jmwf', None, None, None, None, None]
67;https://www.superimmo.com/annonces/achat-maison-143m-merignac-33700-xwcddk;780000;143;6;4;Mérignac (33700);5455;18/07/2024;Terrasse;Cuisine ouverte;Honoraires à la charge du vendeur. Barème d’honoraires : https://www.homekare.fr/;"A VENDRE MAISON EN PIERRE, ÉCHOPPE D'ENVIRON 143M2 AVEC JARDIN QUARTIER SAINT AUGUSTIN 33700 MERIGNAC
Nichée au COEUR de SAINT AUGUSTIN, cette maison pleine de CHARME avec; moulures, cheminées et sa belle hauteur sous plafond fera chavirer votre coeur !
Sur deux niveaux, cette maison se compose d'une belle entrée, d'une pièce de vie spacieuse de plus de 43M2 avec sa cuisine ouverte et équipée. Un accès direct au JARDIN intimiste et au CALME ! Vous trouverez aussi une DÉPENDANCE à l'arrière du jardin. Une chambre avec salle d'eau privée et un wc séparé ainsi qu'un espace buanderie.
A l'étage vous trouverez deux belles chambres complètes de plus de 20m2 avec cheminée, salle d'eau privée avec wc et un espace dressing/bureau. Une autre chambre de 16m2 avec cheminée complète cet étage.
Soit au total 4 chambres et trois salles d'eau.
La maison a un très bon DPE et elle est chauffée par une climatisation réversible (gainage à l'étage).
Tous les commerces de proximités sont à deux pas, ainsi que les écoles (Flornoy et Sainte Monique) et le collège Emile Combes, le marché, le tramway (500m)...
Vous l'aurez compris, il ne faut pas passer à coté de cette maison, une visite s'impose !
Votre conseiller HK HomeKare 33 : Samantha GAUTHURON - Tél. 0763217198
Agent commercial (Entreprise individuelle)
HK HomeKare immobilier : ACHAT - VENTE - LOCATION - GESTION - SYNDIC
Afficher plus";"['143 m² - 6 pièces - 4 chambres - ter. 270 m²', 'Orientation : Est / Ouest', 'Terrasse', 'Année de construction : 1949', 'Cuisine ouverte', 'Séjour de 43 m²', ""3 salles d'eau"", '3 wc', None, None, None, None, None, None, None, None, None, None, None, None]";['https://photo.superimmo.com/9527rareno3dho5ulzopqd8s99k0', 'https://photo.superimmo.com/d32dd8jjj1r3vbswlni1hjlh1lue', 'https://photo.superimmo.com/etav5rxbrjzservuc7dpdw0p8gi2', 'https://photo.superimmo.com/0ctbphv7fha0cfmoxddtg3chy967', 'https://photo.superimmo.com/wk9fce2b27jib0c7pscklgny4k5a', None, None, None, None, None]
