;url;price;surface;nb_pieces;nb_chambres;lieu;prix_m2;date_publication;tag_1;tag_2;tag_3;description;tags;images_url
0;https://www.superimmo.com/annonces/achat-maison-106m-gradignan-33170-xwb9ax;337000;106;5;3;Gradignan (33170);3179;14/07/2024;1 garage - 2 parkings;Cuisine séparée;Honoraires à la charge du vendeur. Barème d’honoraires : https://www.daniloimmobilier.fr/i/redac/honoraires?honofor=1;"Secteur calme et résidentiel, maison offrant une belle superficie habitable sur les pièces de vie en rez-de-chaussée, un salon indépendant de 27 m2, une cusine-salle à manger de 43 m2, un espace buanderie, un wc ; 2 chambres et 1 bureau à l'étage avec une salle de bains. Un grand garage attenant de 23 m2. Des travaux sont à prévoir de remise au goût du jour.
Vous profiterez d'un bel espace extérieur verdoyant, et d'une allée de stationnement.
Les informations sur les risques auxquels ce bien est exposé sont disponibles sur le site Géorisques : www.georisques.gouv.fr.";"['106 m² - 5 pièces - 3 chambres - ter. 477 m²', 'Orientation : Est, Ouest, Sud, Sud-Ouest', '1 garage - 2 parkings', 'Année de construction : 1964', 'Chauffage individuel au gaz (radiateurs)', 'Cuisine séparée', 'Séjour de 27 m²', ""1 salle d'eau - 1 salle de bain"", '1 wc', '', None, None, None, None, None, None, None, None, None, None]";['https://photo.superimmo.com/xpsr5sim0cthjq46bagv9zb6r5fa', 'https://photo.superimmo.com/8q89fqpgy8e7cht11t0ptlhk5rit', 'https://photo.superimmo.com/f5oquwj8vtdngejk13vnctz2o5f5', 'https://photo.superimmo.com/hmovyb84dc55fdd9csrhspb0az5p', 'https://photo.superimmo.com/ttzsbfhnsn0mway7ybf9fm4vabxa', None, None, None, None, None]
1;https://www.superimmo.com/annonces/achat-maison-150m-saint-laurent-medoc-33112-xwb932;365000;150;6;4;Saint-Laurent-Médoc (33112);2433;14/07/2024;Coin cuisine;Chauffage électrique;Honoraires à la charge du vendeur. Barème d’honoraires : https://www.lfimmo.fr/bareme-des-honoraires.pdf;"Située dans un hameau, commune de Saint Laurent Médoc, maison individuelle non mitoyenne de 150 m²habitable.
Au rez de chaussée, cette maison est composée d'une entrée, salon séjour, cuisine ouverte aménagée de 42m2, sa cheminée avec insert, un cellier,
4 chambres 13, 12,10,10m2, un bureau, une salle de bain et une douche, double vasque, wc séparé.
A l’ étage un plateau nu de 34m2 libre à votre imagination, avec arrivée d’eau et électricité, non isolé (les matériaux sur place),
Une terrasse et son barbecue, un abri de jardin, un jardin arboré (entre autres fruitiers)sur une parcelle de 2041 m²,
Proche de toutes commodités, écoles, de nombreux commerces...
la nature si proche pour de belles ballades à pied, en vélo avec les chemins banalisés. Un transport scolaire pour l’école, collège et lycée à deux pas de la maison,
A 30 minutes des plages, 50 minutes de Bordeaux, Aéroport de Mérignac, Tram,
Chauffage électrique, cheminée insert bois, double vitrage , volets bois, assainissement tout à l’égout, taxe foncière 1600 euros
Annonce publiée par votre agent commercial en immobilier LF immo à Saint Laurent Medoc, 33112 immatriculé au RSAC de BORDEAUX sous le n°882 045 263. Consultez nos tarifs sur le site LF immo.
Les informations sur les risques auxquels ce bien est exposé sont disponibles sur le site Géorisques : www.georisques.gouv.fr.
Afficher plus";['150 m² - 6 pièces - 4 chambres - ter. 2 041 m²', 'Vue dégagée', 'Année de construction : 1992', 'Chauffage électrique', 'Coin cuisine', '1 salle de bain', '1 wc', 'Cheminée', None, None, None, None, None, None, None, None, None, None, None, None];['https://photo.superimmo.com/1kbgao99os40syld0zbz4o1cz1v7', 'https://photo.superimmo.com/lem35mlsgwmfytuo6szthxetwnnt', 'https://photo.superimmo.com/g3932mz02vp909tuaxos90t27adl', 'https://photo.superimmo.com/93rc8uxlmphgszol04u42552tp28', None, None, None, None, None, None]
2;https://www.superimmo.com/annonces/achat-appartement-66m-le-bouscat-33110-xwb92j;220000;66;4;2;Le Bouscat (33110);3333;14/07/2024;Exclusivité;Balcon;Barème d’honoraires : https://bareme.safti.fr/;"Situé au Bouscat, ce bel appartement lumineux de 66 m², situé au 6e étage d'une résidence sécurisée avec gardien, bénéficie d'un accès facile aux transports en commun (Bus et Tramway).
L'appartement se compose d'une entrée, d'un double séjour ouvert sur un balcon/loggia, d'une cuisine équipée moderne datant de 2021 avec un balcon/séchoir attenant, de deux chambres avec placards intégrés, d'une salle d'eau avec douche et de WC séparés. La modularité de l'appartement permet de créer une troisième chambre selon vos besoins.
À l'extérieur, l'appartement dispose d'un balcon offrant une vue dégagée et d'un cellier pour un espace de rangement supplémentaire.
Un local vélo est mis à disposition et une place de parking libre extérieure assure un stationnement aisé.
Cet appartement allie confort et commodités avec une vue dégagée, une exposition optimale pour une luminosité naturelle toute la journée, et une bonne performance énergétique grâce au double vitrage récent. Vous bénéficierez également de la fibre optique, d'un ascenseur, et de la présence d'un gardien assurant sécurité et tranquillité d’esprit.
Ses atouts : la vue dégagée, l'exposition, la luminosité, la bonne performance énergétique, le double vitrage récent, la fibre, l'ascenseur, le gardien.
Contactez-moi pour organiser une visite !
Anne
Le bien comprend 2 lots, et il est situé dans une copropriété de 282 lots (les charges courantes annuelles moyennes de copropriété sont de 1500 € et le syndicat des copropriétaires ne fait pas l'objet d'une procédure citée à l'article L. 721-1 du code de la construction et de l'habitation).
Les informations sur les risques auxquels ce bien est exposé sont disponibles sur le site Géorisques : www.georisques.gouv.fr
Prix de vente : 220 000 €
Honoraires charge vendeur
Contactez votre conseiller SAFTI : Anne RIFLADE, Tél. : 07 67 27 04 29, E-mail : - EI - Agent commercial immatriculé au RSAC de BORDEAUX sous le numéro 842 891 483 - SAFTI – RIFLADE Anne, Conseiller indépendant
Afficher plus";['66 m² - 4 pièces - 2 chambres', 'Balcon', 'Année de construction : 1973', 'Gardien', 'Séjour de 26 m²', '1 wc', None, None, None, None, None, None, None, None, None, None, None, None, None, None];['https://photo.superimmo.com/be38lbnk78oiufbgkdvg22d93l33', 'https://photo.superimmo.com/fk2vkww8tg9k1yt2sp3jgpjylfgl', 'https://photo.superimmo.com/gd0t321ovudya0ezwhlqnrufonol', 'https://photo.superimmo.com/q5zgz7daz7t9wpanu4n4yioz3wcl', 'https://photo.superimmo.com/051dln3huss1f89flnoe3iqyq470', None, None, None, None, None]
3;https://www.superimmo.com/annonces/achat-appartement-22m-arcachon-33120-xwb91p;199000;22;2;1;Arcachon (33120);9045;14/07/2024;Balcon;Terrasse;Barème d’honoraires : https://bareme.safti.fr/;"Coup de cœur assuré pour ce superbe appartement récent (2005) et entièrement rénové à neuf dont la résidence sécurisée, avec ascenseur, donne directement sur la plage. A 2 pas des commerces.
Entièrement rénové, vous serez séduit par sa pièce de vie lumineuse avec sa cuisine équipée, son grand dressing, sa chambre et sa salle d'eau neuve avec WC. Vous pourrez profiter également d'une belle terrasse sans vis à vis exposée SUD.
Une place de parking et un local vélo complète le tout.
Les +: récent, lumineux, au calme, accès direct à la plage, entièrement rénové, fibre, le mobilier peut rester en place. Nombreux travaux récents réalisés dans la copro: ascenseur, ravalement de façade, parties communes, portail, chauffe eau et radiateur neufs. Place de parking. Proche commerces. Faible charge de copro.
A découvrir sans plus tarder.
Vous pouvez me joindre 7 jours sur 7, de 9h à 20h.
Ne pas se fier à la localisation du bien sur certains sites.
Le bien comprend 1 lot, et il est situé dans une copropriété de 20 lots (les charges courantes annuelles moyennes de copropriété sont de 724 € et le syndicat des copropriétaires ne fait pas l'objet d'une procédure citée à l'article L. 721-1 du code de la construction et de l'habitation).
Les informations sur les risques auxquels ce bien est exposé sont disponibles sur le site Géorisques : www.georisques.gouv.fr
Prix de vente : 199 000 €
Honoraires charge vendeur
Contactez votre conseiller SAFTI : Christophe JOIE, Tél. : 06 65 70 55 53, E-mail : - EI - Agent commercial immatriculé au RSAC de BORDEAUX sous le numéro 881 549 489 - SAFTI – JOIE Christophe, Conseiller indépendant
Afficher plus";['22 m² - 2 pièces - 1 chambre', '1 Parking', 'Balcon', 'Terrasse', 'Année de construction : 2005', '1 wc', 'Digicode', '', None, None, None, None, None, None, None, None, None, None, None, None];['https://photo.superimmo.com/57tas5lo6ji9o8mp13sezmv1oevc', 'https://photo.superimmo.com/5emdh3uz0peg7quhsvtdrmh0ymb9', 'https://photo.superimmo.com/5m4e8svlkwsw1a4e8r6zdubzk328', 'https://photo.superimmo.com/7htwjut4pftaj9jrsbmrdbt14fb4', 'https://photo.superimmo.com/us509jzcjn2naf930zvxgxhvdqgg', None, None, None, None, None]
4;https://www.superimmo.com/annonces/achat-maison-127m-montussan-33450-xwb914;324990;127;5;4;Montussan (33450);2559;14/07/2024;2 Parkings;;Barème d’honoraires : https://bareme.safti.fr/;"Bienvenue à Montussan,
Montussan est située à environ 15 kilomètres à l'est de Bordeaux, la préfecture de la Gironde. Elle fait partie de l'aire d'attraction de Bordeaux, ce qui lui confère un cadre de vie agréable, combinant la tranquillité de la campagne et la proximité d'une grande ville.
Beaucoup d'avantages à vivre sur Montussan
Nouveau collège en 2025
Aire de covoiturage avec parking
Comité des fêtes dynamique
Accès facilité grâce aux transports et la proximité de la RN89.
Je vous présente aujourd'hui cette maison de plain pied
D'une surface de 127 m², vous serez séduit par l'environnement, le calme et la qualité de la construction.
4 chambres
Un grand Garage double et surtout, un studio aménagé permettant d'accueillir vos aînés.
Quelques travaux sont à prévoir.
Les informations sur les risques auxquels ce bien est exposé sont disponibles sur le site Géorisques : www.georisques.gouv.fr
Prix de vente : 324 990 €
Honoraires charge vendeur
Contactez votre conseiller SAFTI : Jérôme BONNEFON, Tél. : 0695071208, E-mail : - EI - Agent commercial immatriculé au RSAC de Bordeaux sous le numéro 753 234 640 - SAFTI – BONNEFON Jérôme, Conseiller indépendant
Afficher plus";['127 m² - 5 pièces - 4 chambres - ter. 958 m²', '2 Parkings', 'Année de construction : 1980', '1 wc', None, None, None, None, None, None, None, None, None, None, None, None, None, None, None, None];[None, None, None, None, None, None, None, None, None, None]
5;https://www.superimmo.com/annonces/achat-maison-154m-carcans-33121-xwb8zm;570000;154;7;4;Carcans (33121);3701;14/07/2024;3 Parkings;;Barème d’honoraires : https://bareme.safti.fr/;"A 10 mn du Lac de Maubuisson, apprécié pour ses activités nautiques et ses sentiers de randonnée, à 15 mn du village de Carcans plage et de sa nature préservée et à proximité des commerces, venez découvrir cette maison familiale aux volumes généreux et au fort potentiel locatif.
Cette villa, construite en 2015 et implantée sur une parcelle de 1200 m², vous séduira par ses prestations de qualité (chauffage au sol, clim. réversible, panneaux solaires,...) et son très bon état d'entretien.
Dés l'entrée franchie, vous retrouvez un vaste séjour (43m²) donnant sur 2 terrasses dont une couverte ainsi qu'une cuisine semi-ouverte entièrement équipée.
La partie nuit se compose d'un espace bureau (chambre d'amis), de 3 chambres dont une parentale avec sa salle d'eau, d'une salle d'eau et d'un espace buanderie.
Pour l'extérieur, vous pourrez profiter d'une piscine sécurisée et chauffée en toute tranquillité grâce aux aménagements paysagés qui vous isolent d'un studio de 18m². Celui-ci, entièrement équipé, se loue très facilement d'avril à octobre ou vous permettra de recevoir vos amis en toute intimité. Un garage, 3 abris et un carport pour camping car complètent le bien.
Les informations sur les risques auxquels ce bien est exposé sont disponibles sur le site Géorisques : www.georisques.gouv.fr
Prix de vente : 570 000 €
Honoraires charge vendeur
Contactez votre conseiller SAFTI : Cyril MASSIAS, Tél. : 0650409223, E-mail : - EI - Agent commercial immatriculé au RSAC de Bordeaux sous le numéro 393 956 164 - SAFTI – MASSIAS Cyril, Conseiller indépendant
Afficher plus";['154 m² - 7 pièces - 4 chambres - ter. 1 200 m²', '3 Parkings', 'Année de construction : 2015', '2 wc', None, None, None, None, None, None, None, None, None, None, None, None, None, None, None, None];['https://photo.superimmo.com/alzgbqj6l9xhcu3hu5x5vkdvmhnt', 'https://photo.superimmo.com/igmw0tiix0lh3751pehrcag5xdag', 'https://photo.superimmo.com/5bkv227uy8al639blerderz9kga7', 'https://photo.superimmo.com/lwa1864jhmkyc8bjqk897dixm8e8', 'https://photo.superimmo.com/gkhd6sx3h3c39yojz781zm4s19ds', None, None, None, None, None]
6;https://www.superimmo.com/annonces/achat-maison-132m-pessac-33600-xwb8zl;598000;132;6;4;Pessac (33600);4530;14/07/2024;Terrasse;Piscine;Barème d’honoraires : https://bareme.safti.fr/;"Située dans la charmante ville de Pessac, cette maison bénéficie d'un emplacement idéal, à proximité de toutes les commodités. Quartier résidentiel calme, à quelques pas des écoles, commerces et transports en commun. Un lieu parfait pour une vie paisible et pratique.
Le bien se trouve sur un terrain spacieux de 1081 m²,avec un garage de 19m² offrant de nombreuses possibilités d'aménagement extérieur. Profitez d'un jardin privatif,avec piscine pour des moments de détente en famille, ainsi que d'une terrasse pour recevoir vos invités en plein air. Un espace de parking est également disponible pour plus de commodité.
À l'intérieur, cette maison de 132 m² offre un espace de vie confortable avec 6 pièces ,un séjour de 35m² et une cuisine équipée ,cellier , 4 chambres, 1espace bureau parfait pour accueillir toute la famille. Deux salles de bain sont également disponibles, offrant praticité et intimité. Cette habitation récente, construite en 2020, offre un intérieur moderne et lumineux, avec de nombreuses possibilités d'aménagement personnalisé pour répondre à vos besoins et préférences.
Les informations sur les risques auxquels ce bien est exposé sont disponibles sur le site Géorisques : www.georisques.gouv.fr
Prix de vente : 598 000 €
Honoraires charge vendeur
Contactez votre conseiller SAFTI : Mélanie BECRET, Tél. : 0664963641, E-mail : - EI - Agent commercial immatriculé au RSAC de Bordeaux sous le numéro 917 392 557 - SAFTI – BECRET Mélanie, Conseiller indépendant
Afficher plus";['132 m² - 6 pièces - 4 chambres - ter. 1 081 m²', 'Piscine', 'Terrasse', 'Année de construction : 2020', 'Séjour de 36 m²', '1 wc', None, None, None, None, None, None, None, None, None, None, None, None, None, None];['https://photo.superimmo.com/77lccg02bm1fr0gam5piox7073r4', 'https://photo.superimmo.com/1uvkdlppmdyf52r3clouii2xeg4v', 'https://photo.superimmo.com/mo9g35mddvozg22emmcevevwua9a', 'https://photo.superimmo.com/7rhadouxf55hvdd4pdnrdmw7w0oy', 'https://photo.superimmo.com/gq5h8zwclr0oeqwuhq09dybcfgii', None, None, None, None, None]
7;https://www.superimmo.com/annonces/achat-maison-108m-listrac-medoc-33480-xwb8yn;250000;108;4;3;Listrac-Médoc (33480);2315;14/07/2024;Exclusivité;Terrasse;Barème d’honoraires : https://bareme.safti.fr/;"À Listrac-Médoc, proche du bourg et de ses commodités, découvrez cette maison ancienne entièrement rénovée, située dans une impasse très calme. D'une surface habitable de 108 m², elle est mitoyenne d'un côté et se situe sur une parcelle d'environ 530 m². La maison se compose d'un hall d'entrée, d'un confortable séjour de 50 m² avec son poêle à bois et une cuisine ouverte.
Une mezzanine de plus de 8 m², idéale pour un bureau ou une chambre d'appoint, surplombe le salon. Elle dispose également d'une salle de bain avec baignoir et douche à l'italienne, d'un WC indépendant et de trois chambres dont une avec sa propre salle d'eau.
Tout est en parfait état, avec un système de chauffage au gaz récent et bien entretenu. Cette demeure bénéficie d'un spacieux extérieur avec sa terrasse, un petit garage en ossature bois ainsi qu'un large espace de stationnement, offrant de nombreuses possibilités d'aménagement supplémentaires.
Les informations sur les risques auxquels ce bien est exposé sont disponibles sur le site Géorisques : www.georisques.gouv.fr
Prix de vente : 250 000 €
Honoraires charge vendeur
Contactez votre conseiller SAFTI : Damien ROY, Tél. : 0766149963, E-mail : - EI - Agent commercial immatriculé au RSAC de Bordeaux sous le numéro 883 383 853 - SAFTI – ROY Damien, Conseiller indépendant
Afficher plus";['108 m² - 4 pièces - 3 chambres - ter. 533 m²', '3 Parkings', 'Terrasse', 'Année de construction : 1950', 'Séjour de 43 m²', '1 wc', None, None, None, None, None, None, None, None, None, None, None, None, None, None];['https://photo.superimmo.com/tdd5ll1o7bobc187qn1qj454u8kg', 'https://photo.superimmo.com/y1vgnlp4ncbq4cn1blebcpickot7', 'https://photo.superimmo.com/hty3v0l9vepyrqe35yb1bkj4qtvm', 'https://photo.superimmo.com/65sp35rdoljb5g1e7tepszgrog3b', 'https://photo.superimmo.com/wmqre56hph0m1zjda69w5nb8ql3h', None, None, None, None, None]
8;https://www.superimmo.com/annonces/achat-maison-108m-villenave-d-ornon-33140-xwb8y3;365000;108;5;4;Villenave-d'Ornon (33140);3380;14/07/2024;Exclusivité;;Barème d’honoraires : https://bareme.safti.fr/;"Située dans un secteur de Villenave d'Ornon, jolie maison familiale de 110m2 environ, entièrement rénovée.
Le rez-de-chaussée se compose d'une vaste pièce de vie avec cuisine ouverte, une suite avec salle d'eau, un toilette séparé, une véranda.
A l'étage, 3 grandes chambres, une salle de bain (baignoire et douche à l'italienne), un toilette.
Un garage de 50m2 pouvant être aménagé à votre guise (appartement, atelier,....) ainsi qu'une cave complète ce bien.
Les +:
Absence de travaux,
Le calme,
La suite en rez-de-chaussée,
Parcelle de plus de 450m2,
Le grand garage.
A visiter sans tarder.
Les informations sur les risques auxquels ce bien est exposé sont disponibles sur le site Géorisques : www.georisques.gouv.fr
Prix de vente : 365 000 €
Honoraires charge vendeur
Contactez votre conseiller SAFTI : Fabienne THIERCELIN, Tél. : 06 81 60 02 92, E-mail : - EI - Agent commercial immatriculé au RSAC de BORDEAUX sous le numéro 844 315 861 - SAFTI – THIERCELIN Fabienne, Conseiller indépendant
Afficher plus";['108 m² - 5 pièces - 4 chambres - ter. 432 m²', 'Année de construction : 1972', '2 wc', '', None, None, None, None, None, None, None, None, None, None, None, None, None, None, None, None];['https://photo.superimmo.com/xxn9umst92uzf302fgnrmpfr0ty4', 'https://photo.superimmo.com/n5u92ovvbr1qf5gd51nlpl3dfsj0', 'https://photo.superimmo.com/at70tb3lk6vghqvgq3rxpplkt57u', 'https://photo.superimmo.com/cmon8u76q4y933u6usqrknv7qkyk', 'https://photo.superimmo.com/rrvht90xcv91r54hbsuqabuhrn7v', None, None, None, None, None]
9;https://www.superimmo.com/annonces/achat-appartement-56m-andernos-les-bains-33510-xwb8xv;258000;56;3;2;Andernos-les-Bains (33510);4607;14/07/2024;Exclusivité;1 Parking;Barème d’honoraires : https://bareme.safti.fr/;"Venez découvrir cet appartement très lumineux type T3 de 56 m2, situé en plein centre-ville d'Andernos.
Il est composé d'une entrée avec placard, d'un séjour lumineux, d'une cuisine semi-ouverte, de 2 belles chambres, d'une salle d'eau, et d'un wc indépendant.
Dans une résidence sécurisée, l'appartement se situe au deuxième étage avec ascenseur, et dispose d'une place de parking privative et d'une cave.
Accès direct sur la piste cyclable pour rejoindre les commerces de proximité.
Le bien comprend 3 lots, et il est situé dans une copropriété de 40 lots (les charges courantes annuelles moyennes de copropriété sont de 1400 € et le syndicat des copropriétaires ne fait pas l'objet d'une procédure citée à l'article L. 721-1 du code de la construction et de l'habitation).
Les informations sur les risques auxquels ce bien est exposé sont disponibles sur le site Géorisques : www.georisques.gouv.fr
Prix de vente : 258 000 €
Honoraires charge vendeur
Contactez votre conseiller SAFTI : Stéphanie CARTEAU, Tél. : 06 13 67 55 78, E-mail : - EI - Agent commercial immatriculé au RSAC de BORDEAUX sous le numéro 790 792 964 - SAFTI – CARTEAU Stéphanie, Conseiller indépendant
Afficher plus";['56 m² - 3 pièces - 2 chambres', '1 Parking', 'Année de construction : 2005', '1 wc', None, None, None, None, None, None, None, None, None, None, None, None, None, None, None, None];[None, None, None, None, None, None, None, None, None, None]
10;https://www.superimmo.com/annonces/achat-maison-170m-libourne-33500-xwb8xi;565500;170;7;4;Libourne (33500);3326;14/07/2024;Exclusivité;4 Parkings;Barème d’honoraires : https://bareme.safti.fr/;"Située dans la ville de Libourne, cette grande maison familiale en pierre,. Proche de toutes les commodités, elle se trouve à proximité des commerces, des écoles et des transports en commun dans un quartier recherché.
Cette maison en pierre de taille est érigée sur un terrain de 570 m². À l'extérieur, on retrouve un jardin spacieux, piscinable avec un puits, deux terrasses en bois,
la possibilité d'aménager des espaces de détente ou de loisirs selon les envies de chacun.
À l'intérieur, ce bien d'une surface habitable de 170 m² dispose d'un agencement optimal pour la vie quotidienne. Le rez-de-chaussée comprend une entrée avec un grand placard, un bureau, un salon salle à manger avec un poêle à granulés, une cuisine, une cave, un wc, un cellier et un garage. Au premier étage, on trouve 4 chambres, dont une suite parentale avec salle d'eau et une salle de bains. Les pièces sont lumineuses et spacieuses avec un belle hauteur sous plafond, offrant un cadre de vie agréable et fonctionnel pour toute la famille.
Les informations sur les risques auxquels ce bien est exposé sont disponibles sur le site Géorisques : www.georisques.gouv.fr
Prix de vente : 565 500 €
Honoraires charge vendeur
Contactez votre conseiller SAFTI : Francis CARMAGNAC, Tél. : 06 15 36 34 59, E-mail : - EI - Agent commercial immatriculé au RSAC de LIBOURNE sous le numéro 394 573 570 - SAFTI – CARMAGNAC Francis, Conseiller indépendant
Afficher plus";['170 m² - 7 pièces - 4 chambres - ter. 570 m²', '4 Parkings', 'Année de construction : 1920', '2 wc', None, None, None, None, None, None, None, None, None, None, None, None, None, None, None, None];['https://photo.superimmo.com/0azwybfo8c2t1f2c7iil6e6dydgp', 'https://photo.superimmo.com/rug0cehst1mgccxoldkykhy3hden', 'https://photo.superimmo.com/1hpzvhd1plyeearj1tp8wd2qd8jh', 'https://photo.superimmo.com/bx3z4h8gidyn4ysruzykue7p1u14', 'https://photo.superimmo.com/zz6orvvazpb8jwj4ki5kkjeautuk', None, None, None, None, None]
11;https://www.superimmo.com/annonces/achat-maison-321m-castillon-la-bataille-33350-xwb8x1;580000;321;9;6;Castillon-la-Bataille (33350);1807;14/07/2024;;;Barème d’honoraires : https://bareme.safti.fr/;"Située à 10' de Saint Emilion, cette propriété en pierre dispose de 6 chambres dont 2 au RDC, chacune équipées de leurs salle de bain/eau/WC, une cuisine équipée, un vaste salon séjour de 80m2, une cave, un grenier aménageable, un garage et une cour pavée.
L'ensemble a été rénové avec des matériaux de qualité dans un souci de préserver le charme de ancien ( parquet massif, cheminées en marbre, moulures...) Le parc de 2000 m2 orienté sud possède des arbres remarquables.
Chaudière neuve de sept 2023.
Situé en ville, à 5 minutes à pied de tous les commerces, cette propriété conviendrait parfaitement à une grande famille ou à une activité de tourisme.
Les informations sur les risques auxquels ce bien est exposé sont disponibles sur le site Géorisques : www.georisques.gouv.fr
Prix de vente : 580 000 €
Honoraires charge vendeur
Contactez votre conseiller SAFTI : Juliette MEGALI, Tél. : 06 03 01 35 67, E-mail : - EI - Agent commercial immatriculé au RSAC de LIBOURNE sous le numéro 880 866 918 - SAFTI – MEGALI Juliette, Conseiller indépendant
Afficher plus";['321 m² - 9 pièces - 6 chambres - ter. 2 000 m²', 'Année de construction : 1800', '6 wc', '', None, None, None, None, None, None, None, None, None, None, None, None, None, None, None, None];['https://photo.superimmo.com/gjlgvb0yhxffhf0an2m9zvaj3nia', 'https://photo.superimmo.com/u2hluyvncggddbx0vzd2n3ms7r1o', 'https://photo.superimmo.com/w37rc8jst2xe9867smaktm9p5ftd', 'https://photo.superimmo.com/7g172xweo9e9zszx7rsceeze2g3i', 'https://photo.superimmo.com/nfup4ujg6k0870wjm6sqsbzi97sn', None, None, None, None, None]
