;url;price;surface;nb_pieces;nb_chambres;lieu;prix_m2;date_publication;tag_1;tag_2;tag_3;description;tags;images_url
163;https://www.superimmo.com/annonces/achat-appartement-19m-bordeaux-33300-xwb28q;96500;19;1;;Bordeaux (33300);5079;13/07/2024;Exclusivité;Meublé;Honoraires à la charge de l'acquéreur : 7,22% TTC - 6 500 € TTC inclus dans le prix de vente.;"Bordeaux centre, entre Victoire et Nansouty, idéal investissement locatif, étudiant, Studio fonctionnel et aménagé, dans un petite immeuble pierre aux charges modérées. Bon état, mais prévoir quelques travaux. Il comprend couloir d'entrée, pièce de vie avec coin cuisine, salle d'eau avec toilettes. Meubles récents laissés.
Honoraires inclus de 7.22% TTC à la charge de l'acquéreur. Prix hors honoraires 90 000 €. Dans une copropriété de 5 lots. Quote-part moyenne du budget prévisionnel 522 €/an. Aucune procédure n'est en cours. Classe énergie C, Classe climat A Montant moyen estimé des dépenses annuelles d'énergie pour un usage standard, établi à partir des prix de l'énergie de l'année 2021 : entre 300.00 et 440.00 €. Les informations sur les risques auxquels ce bien est exposé sont disponibles sur le site Géorisques : georisques.gouv.fr
Afficher plus";"['19 m² - 1 pièce', 'Dernier étage (1er)', 'Orientation : Est / Ouest', 'Année de construction : 1900', 'Chauffage individuel électrique', 'Cuisine ouverte, équipée', ""1 salle d'eau"", 'Copropriété de 5 lots', None, None, None, None, None, None, None, None, None, None, None, None]";['https://photo.superimmo.com/5qlxks61hzawkstr296in0xepxuk', 'https://photo.superimmo.com/ms42hcns953miqhn7xg6j6orez7h', 'https://photo.superimmo.com/8dt8bnfzqs3wceeo0q0p5ui186ms', None, None, None, None, None, None, None]
164;https://www.superimmo.com/annonces/achat-maison-130m-mios-33380-xwb27l;589000;130;5;4;Mios (33380);4531;13/07/2024;5 garages - 3 parkings;Cuisine équipée;Honoraires à la charge du vendeur.;"JE VOUS PROPOSE UN COIN PAISIBLE SANS VIS-A-VIS PROCHE COMMODITÉS, PROPRIÉTÉ T5 SUR TERRAIN D'ENVIRON 2500M² A 35MIN DE BORDEAUX, 25MIN D'ARCACHON ET 5MIN DE l'A63 OU DE LA GARE TER MARCHEPRIME DIRECTION GARE TGV BORDEAUX ST JEAN. MIOS 33380 (bourg de Lacanau de Mios).
Construite en 2010, la maison offre une entrée avec dressing, une pièce de vie lumineuse traversante avec cuisine pour un total d'environ 54m², le tout baigné de lumière grâce à ses baies vitrées s'ouvrant sur une grande terrasse avec piscine vu sur la nature et sans vis-à-vis. Le premier coin, une suite parentale est composée d'une chambre avec dressing, une salle d'eau, un toilette. Le second coin nuit offre trois chambres, une salle de bain, un toilette séparé.
Une piscine au sel chauffée 11mx3,5m avec local technique, une allée goudronnée sur laquelle vous pouvez garer 4 à 5 voitures, un garage d'environ 34m², un grand cabanon, sont autant d'atouts que représente un ensemble parfaitement intégré à son environnement naturel.
5min à pied : Bourg Lacanau de Mios (écoles, boulangerie, restaurant, maraîcher, place du marché)
Honoraires à la charge du vendeur. Classe énergie A, Classe climat A Montant moyen estimé des dépenses annuelles d'énergie pour un usage standard, établi à partir des prix de l'énergie de l'année 2021 : entre 520.00 et 740.00 €. Ce bien vous est proposé par un agent commercial. Les informations sur les risques auxquels ce bien est exposé sont disponibles sur le site Géorisques : georisques.gouv.fr
Votre conseiller HK HomeKare 33 : Julie CARTA - Tél. 0699656952
Agent commercial (Entreprise individuelle)
HK HomeKare immobilier : ACHAT - VENTE - LOCATION - GESTION - SYNDIC
Afficher plus";"['130 m² - 5 pièces - 4 chambres - ter. 2 500 m²', 'Piscine', '5 garages - 3 parkings', 'Année de construction : 2010', 'Chauffage: au sol', 'Cuisine équipée', ""1 salle d'eau - 1 salle de bain"", 'Wc séparé - 2 wc', None, None, None, None, None, None, None, None, None, None, None, None]";['https://photo.superimmo.com/i2bcqtvqnt8hcfwojegh5gn9bqwm', 'https://photo.superimmo.com/twoha0qwm1kg2tvc7moz4238nohj', 'https://photo.superimmo.com/yvggh9ybiy79rtaadhas853op8w9', 'https://photo.superimmo.com/8r9to15jzy4093oixbw7i06ogwwn', 'https://photo.superimmo.com/enmlx3icq46tzs741yk9q8r867m9', None, None, None, None, None]
165;https://www.superimmo.com/annonces/achat-maison-94m-mios-33380-xwb23y;262000;94;3;2;Mios (33380);2787;13/07/2024;1 garage - 1 parking;Cuisine équipée;Honoraires à la charge du vendeur. Barème d’honoraires : https://files.netty.immo/file/vilact/568/hLhjl/bareme_vilact_mars_2023_1.pdf;"MAISON 3 PIÈCES SUR PARCELLE de 811m2 - PROCHE DE L'OCEAN
Au calme proche du centre bourg nous sommes ravis de vous proposer cette maison de 3 pièces de 81 m² à Mios (33380).
Maison de plain-pied composée d'un séjour avec insert, d'une cuisine, d'une buanderie, d'une salle de bains, Wc, de deux chambres, une cuisine aménagée. Cette maison bénéficie d'un chauffage fonctionnant au gaz. L'intérieur va demander à être rénové. La maison dispose d'une surface au sol de 94m2.
Un jardin autour, un garage indépendant d'environ 20m2.
L'École Secondaire Privée Montessori Bordeaux Mios, l'École Primaire Privée Montessori Mios Campus, le Collège Montessori Bordeaux Mios, l'École Maternelle la Fauvette Pitchou et l'École Élementaire les Ecureuils sont implantés à moins de 10 minutes à pied. Côté transports, il y a deux gares (Biganos Facture et Le Teich) à moins de 10 minutes en voiture. Les autoroutes A660 et A63 sont accessibles à moins de 8 km. Vous trouverez un tennis à quelques minutes à peine. On trouve aussi des restaurants, des commerces, deux boulangeries, un bureau de poste et une boucherie-charcuterie.
Les informations sur les risques auxquels ce bien est exposé sont disponibles sur le site Géorisques : www.georisques.gouv.fr.
N'hésitez pas à prendre contact avec notre équipe pour une première visite de cette maison en vente.
Honoraires à la charge du vendeur. Classe énergie F, Classe climat F Logement à consommation énergétique excessive. La loi impose que le niveau de performance énergétique (DPE) du bien immobilier, actuellement de classe F, soit compris, à compter du 1er janvier 2028, entre la classe A et la classe E. Montant moyen estimé des dépenses annuelles d'énergie pour un usage standard, établi à partir des prix de l'énergie de l'année 2021 : entre 2008.00 et 2030.00 €. Nos honoraires : Les informations sur les risques auxquels ce bien est exposé sont disponibles sur le site Géorisques : georisques.gouv.fr
Votre conseiller VIL'ACT : Cofondatrice Gérante - Anne-Charlotte du TEIL - Tél. 0681529153
Carte T CPI330120221000000189
Votre conseiller.ère immobilier agissant pour le compte de la SARL VIL'ACT détenteur de la carte de transaction n°CPI CPI330120221000000189 immatriculée à bordeaux.
Afficher plus";['94 m² - 3 pièces - 2 chambres - ter. 811 m²', 'Travaux à prevoir', 'Orientation : Nord / Sud', '1 garage - 1 parking', 'Année de construction : 1960', 'Chauffage au gaz', 'Cuisine équipée', 'Séjour de 28 m²', '1 salle de bain', 'Wc séparé - 1 wc', None, None, None, None, None, None, None, None, None, None];['https://photo.superimmo.com/ojfabvgqv4ni2t3aiagfeq2oenu5', 'https://photo.superimmo.com/27xao1w8kd3vg8d267i7s3mtnb71', 'https://photo.superimmo.com/lq2981ba1hd3z0x6w50sjp4pc6qz', 'https://photo.superimmo.com/vjt883jj41r3lpsmh110bo0ib7if', 'https://photo.superimmo.com/vfd8vayaihzvc0jv636kaglfe4or', None, None, None, None, None]
166;https://www.superimmo.com/annonces/achat-maison-73m-villenave-d-ornon-33140-xwb1or;299900;85;4;3;Villenave-d'Ornon (33140);4061;13/07/2024;Cuisine aménagée;Chauffage au bois;Honoraires à la charge de l'acquéreur : 3,41% TTC - 9 900 € TTC inclus dans le prix de vente - Prix hors honoraires : 290 000 €.;Votre agence indépendante, l'immobiliére des vignes, vous proposeà VIllenave d'ornon, cette maison de 4 pièces edifiée sur une parcelle de 320m², comprenant un séjour de 30m², cuisine ouverte, trois chambres, une salle d'eau, wc, en annexe un cabanon de 20m². à 13 mn à pieds du tramway et des commerces.;"['73,85 m² - 4 pièces - 3 chambres - ter. 320 m²', 'Plain-pied', 'Orientation : Est / Ouest', 'Année de construction : 1988', 'Chauffage au bois', 'Cuisine aménagée', ""1 salle d'eau"", '1 wc', '1 chambre au rez-de-chaussée', '', None, None, None, None, None, None, None, None, None, None]";['https://photo.superimmo.com/5svo2d6xgent8f8pwvh5ww80u6w8', 'https://photo.superimmo.com/71e2aze5uvpc45ak2l1nmfs19opk', 'https://photo.superimmo.com/f61l17s131ef7tnput8och21hjoc', 'https://photo.superimmo.com/5l0h1ozs1ys08ehvvyhcafk7s2wv', 'https://photo.superimmo.com/ic1k5ft7yg70r5fhwc8lwgy3p7sh', None, None, None, None, None]
167;https://www.superimmo.com/annonces/achat-maison-494m-guitres-33230-xwb1mz;340000;494;1;;Guîtres (33230);688;13/07/2024;;;Barème d’honoraires : https://www.century21-gb-coutras.com/imagesBien/202/646/v5/bareme_honoraires.pdf;"Opportunité sur Guîtres :Cet immeuble unique de 494 m² situé en plein centre-ville. Profitez d'un emplacement stratégique avec un bureau de tabac bar, deux locaux commerciaux et un studio. Un projet de rénovation pour trois nouveaux logements est également inclus, offrant un potentiel de développement exceptionnel.À seulement 300 mètres de l'arrêt de bus Foyer Communal (ligne 8), vous bénéficierez d'une excellente accessibilité. La gare de Coutras est à 5 minutes en voiture, facilitant vos déplacements.Les commodités ne manquent pas avec un Lidl et deux Intermarchés à proximité. Pour les familles, le Collège Jean Aviotte est à seulement 3 minutes à pied. Vous trouverez également de nombreux restaurants, boulangeries, boucheries et bureaux de poste dans les environs. Contactez-nous pour découvrir cette opportunité rare au cœur de Guîtres.
Afficher plus";['494 m² - 1 pièce', None, None, None, None, None, None, None, None, None, None, None, None, None, None, None, None, None, None, None];[None, None, None, None, None, None, None, None, None, None]
168;https://www.superimmo.com/annonces/achat-appartement-41m-ares-33740-xwb1mu;199000;7;2;;Arès (33740);4772;13/07/2024;;;Barème d’honoraires : http://www.century21immobellevue.com;Century 21 Immobelllevue à le plaisir de vous présenter en exclusivité ce charmant appartement T2, idéalement situé à Arès Bourg.Cet appartement au dernier étage avec ascenseur, se trouve à proximité de toutes les commodités et du bassin d'Arcachon.Il se compose d'une entrée, d'un séjour agrémenté d'une cuisine ouverte, d'une chambre, d'une salle d'eau et d'un balcon pour vos moments de détente. De plus, une place de parking est incluse. L'appartement est exposé au calme côté cour.Contactez-nous dès maintenant pour organiser une visite !(Les 3 dernières photos sont des propositions de projets d'aménagement).;['41,7 m² - 2 pièces', 'Année de construction : 2014', 'Copropriété de 23 lots', '', None, None, None, None, None, None, None, None, None, None, None, None, None, None, None, None];['https://photo.superimmo.com/3pim1wr6zt8xv5xiefjliziuv46e', 'https://photo.superimmo.com/1fm41xv1hxr5l0ryjdc3r4ewg4h6', 'https://photo.superimmo.com/glbw3ueh7xzgoqofx7iky75swyzz', 'https://photo.superimmo.com/3d8y25ysonvwiipbv8m1yecjxb1p', 'https://photo.superimmo.com/wg8qaf6gfar8n7rvu8ukr1dzrqx2', None, None, None, None, None]
169;https://www.superimmo.com/annonces/achat-maison-141m-saint-medard-de-guizieres-33230-xwb1mo;375000;1;6;;Saint-Médard-de-Guizières (33230);2658;13/07/2024;;;Barème d’honoraires : https://www.century21-gb-coutras.com/imagesBien/202/646/v5/bareme_honoraires.pdf;"SAINT MEDARD DE GUIZIERESMaison de 141m² habitable sans travaux, la maison seras terminée pour la vente. Elle se compose de 3 chambres spacieuses. La suite parentale offre un espace généreux de 23.48m². Les deux autres chambres mesurent respectivement 12.38m² et 12.48m². Profitez de deux salles d'eau modernes et d'un chauffage en pompe à chaleur gainable. La maison est bien isolée avec des murs et un double vitrage, assurant un confort thermique optimal. Un garage est à votre disposition pour votre véhicule. Située à proximité des commodités et des transports en commun, cette maison est idéale pour une famille. La gare de Coutras, desservie par plusieurs lignes de bus, facilite vos déplacements quotidiens.Venez posez vos valises dans cette maison lumineuse et sans travaux à proximité immédiate de l'autoroute menant à BORDEAUX.EXCLUSIVITE CENTURY 21
Afficher plus";['141,1 m² - 6 pièces - ter. 390 m²', None, None, None, None, None, None, None, None, None, None, None, None, None, None, None, None, None, None, None];[None, None, None, None, None, None, None, None, None, None]
170;https://www.superimmo.com/annonces/achat-maison-153m-monsegur-33580-xwb14b;166000;153;8;5;Monségur (33580);1085;13/07/2024;1 terrasse;Cuisine séparée;Honoraires à la charge de l'acquéreur : 5,06% TTC - 8 000 € TTC inclus dans le prix de vente. Barème d’honoraires : https://immobilierdesbastides.la-boite-immo.com/i/redac/honoraires?honofor=1;"Située au coeur du village de Monségur, laissez vous séduire par cette maison en pierre de 153 m2, proche de toutes les commodités :
Le rez-de-chaussée se compose d'un couloir de 11 m2 desservant un salon de 19 m2, une cuisine de 14 m2 avec placard, une salle à manger de 10 m2.
Le premier étage vous propose un palier, une salle de bain ainsi que deux chambres de 17 m2 et 25 m2.
Et enfin au deuxième étage vous y trouverez un palier et trois chambres allant de 10 m2 à 17 m2.
Ce bien est complété par une cave de 26 m2, une cour et une dépendance non attenante sur deux niveaux avec WC.
De nombreux aménagements peuvent être faits pour optimiser les espaces !
Chauffage gaz de ville, production d'eau chaude chaudière, assainissement tout à l'égout, menuiseries PVC double vitrage, taxe foncière 561EUR.
Afficher plus";['Disponible immédiatement', '153 m² - 8 pièces - 5 chambres - ter. 105 m²', '1 terrasse', 'Année de construction : 1948', 'Chauffage individuel au gaz (radiateurs)', 'Cuisine séparée', 'Séjour de 19 m²', '1 salle de bain', '2 wc', 'Cheminée', None, None, None, None, None, None, None, None, None, None];['https://photo.superimmo.com/5geegztbt9pszho87o2whhljzgfw', 'https://photo.superimmo.com/1vkr11hmyevdc7wnxpv2u1k5ucrk', 'https://photo.superimmo.com/0gwot2hthi6ac75sut0mll3ef7oj', 'https://photo.superimmo.com/jr0xjqpfdziiyx26el6um4w3tatd', 'https://photo.superimmo.com/ksefb2h6ap1yt9jymr4d06j0fz9r', None, None, None, None, None]
171;https://www.superimmo.com/annonces/achat-maison-131m-le-puy-33580-xwb148;279000;131;7;5;Le Puy (33580);2130;13/07/2024;1 terrasse;1 Garage;Honoraires à la charge de l'acquéreur : 3,72% TTC - 10 000 € TTC inclus dans le prix de vente. Barème d’honoraires : https://immobilierdesbastides.la-boite-immo.com/i/redac/honoraires?honofor=1;"Située à 5 minutes de Monségur, sur la commune de Le Puy, venez découvrir cette maison traditionnelle de 131 m2, de plain pied avec parc arboré de 2806 m2 et piscine 8x4 au sel.
Une terrasse couverte de 40 m2, une cuisine d'été et un local piscine viennent compléter ce bien.
Grande pièce de vie de 48m2 avec poêle à bois, cuisine aménagée et équipée de 11m2, cellier, 5 chambres allant de 9 m2 à 13 m2 et salle de bain avec baignoire et douche.
Garage non attenant, divers abris de jardin.
Chauffage électrique + poêle à bois, production eau chaude : cumulus, menuiseries double vitrage, assainissement fosse septique.";['Disponible immédiatement', '131 m² - 7 pièces - 5 chambres - ter. 2 806 m²', 'Piscine', '1 Garage', '1 terrasse', 'Chauffage individuel électrique (radiateurs)', '1 salle de bain', '1 wc', None, None, None, None, None, None, None, None, None, None, None, None];['https://photo.superimmo.com/8z2fvwrfw83ovn8i2pq5s4tp7vos', 'https://photo.superimmo.com/879cw9ayga5v80ki8ztph07laxvx', 'https://photo.superimmo.com/xurj6yvjo7o9d4ob2732hkvbptso', 'https://photo.superimmo.com/jhnm3h9mxbivfo03d55sa3er0lye', 'https://photo.superimmo.com/wilssua1wtppztvugff4qa6wt4o0', None, None, None, None, None]
172;https://www.superimmo.com/annonces/achat-maison-155m-cazaugitat-33790-xwb142;179000;155;9;4;Cazaugitat (33790);1155;13/07/2024;Exclusivité;1 Garage;Honoraires à la charge de l'acquéreur : 5,92% TTC - 10 000 € TTC inclus dans le prix de vente. Barème d’honoraires : https://immobilierdesbastides.la-boite-immo.com/i/redac/honoraires?honofor=1;"EXCLUSIVITÉ ! Maison des années 50, de 155 m2 habitables avec garage attenant, terrasse couverte et jardin, sur un terrain de 923 m2 :
Entrée 11m2, pièce de vie 21m2 avec poêle à bois, cuisine équipée 16m2, arrière-cuisine 20m2, cellier, chaufferie / buanderie 19m2, dégagement / couloir 8m2 avec placards, chambre 16m2, salle d'eau, WC. Étage : Palier avec placards, trois chambres de 12m2 à 16m2 dont une avec balcon, bureau 11m2, couloir, salle de bains de 11m2 avec WC. Terrasse couverte côté sud, garage 60m2, grenier 40m2. Chauffage poêle à bois + gaz bonbonne (citerne enterrée), menuiseries PVC double vitrage, assainissement individuel conforme, production eau chaude chaudière, raccordé fibre, bien desservi en eau par le puits, taxe foncière : 718EUR.";"['Disponible immédiatement', '155 m² - 9 pièces - 4 chambres - ter. 923 m²', '1 Garage', 'Chauffage individuel', ""1 salle d'eau - 1 salle de bain"", '2 wc', None, None, None, None, None, None, None, None, None, None, None, None, None, None]";['https://photo.superimmo.com/liwi4fki1dbq54nd7ytuwngfr04v', 'https://photo.superimmo.com/t1x268xawvhvcukdmaruutjlt1uq', 'https://photo.superimmo.com/11awv97lfioe8gv139q5e4407x4z', 'https://photo.superimmo.com/ni10o4wafgudu5e5j898jop8iboy', 'https://photo.superimmo.com/75zh6zwgoipnpoa4ofvz85iv0xnq', None, None, None, None, None]
173;https://www.superimmo.com/annonces/achat-maison-400m-bordeaux-33000-xwb140;420000;400;8;5;Bordeaux (33000);1050;13/07/2024;;;Honoraires à la charge du vendeur. Barème d’honoraires : http://www.infika.com/i/redac/honoraires?honofor=1;"Je vous propose aujourd'hui une maison de maître d'environ 300m2 à rénovée située sur la commune de Saint Louis de montferrand.
Elle est située sur une parcelle de 24 000m2 et contient également plusieurs batiment de stockage ainsi qu'une habitation de 90m2 plus récente et avec moins de travaux.
La demeure principale pourrait redevenir quelque chose de magnifique, la hauteur sous plafond est exeptionnelle et l'ensemble est vraiment agréable.
C'est une demeure qui date du XVIII ème siècle.

Si vous souhaitez échanger sur ce bien d'exception ou pour le visiter je vous invite à me contacter.";['400 m² - 8 pièces - 5 chambres - ter. 24 424 m²', None, None, None, None, None, None, None, None, None, None, None, None, None, None, None, None, None, None, None];['https://photo.superimmo.com/xv0nfgd46n62eii0zk6fiycv8rsv', 'https://photo.superimmo.com/dzj1u3z9kj4ig9w4rdy2mfvgbdi9', 'https://photo.superimmo.com/n1m8lfo9k9r8gklk7fprkpli4b22', 'https://photo.superimmo.com/ggu9kckoxkzxxgsa8ugicijk79ex', 'https://photo.superimmo.com/lo0kke70kckncap2w03emiv1hw9o', None, None, None, None, None]
174;https://www.superimmo.com/annonces/achat-maison-239m-latresne-33360-xwb11j;894000;239;8;5;Latresne (33360);3741;13/07/2024;5 Parkings;Cuisine ouverte, équipée;Barème d’honoraires : http://www.immobilier-riva.fr/i/redac/honoraires?honofor=1;"SECTEUR LATRESNE - IMMOBILIER RIVA vous propose cette MAISON CONTEMPORAINE de 230 m2 construite en 2006 dans un environnement calme et sécurisé. En plus de l'APPARTEMENT INDEPENDANT au rez-de-jardin de 70m2 comportant 2 chambres, salon, cuisine, salle de bain, salle d'eau et wc, vous bénéficierez d'un salon avec une cuisine ouverte de 55 m donnant sur une terrasse dominant le paysage, 3 autres chambres dont une chambre parentale avec sa salle d'eau, salle de bain, 2 wc, cellier. Bureau de 43m2 avec wc. Cave à vin. Garage et atelier non attenant de 32m2 + carport. Piscine 8 x 4m au sel à débordement avec volet roulant immergé (circuit d'eau refait à neuf). Poêle à bois. Isolation refaite. Fibre connectée. Climatisation dans les 3 chambres et le salon. Le tout sur un terrain clos et arboré sans vis-à-vis de 1300m2.
Afficher plus";"['239 m² - 8 pièces - 5 chambres - ter. 1 306 m²', 'Piscine', '5 Parkings', 'Année de construction : 2006', 'Chauffage individuel', 'Climatisation', 'Cuisine ouverte, équipée', 'Séjour de 55 m²', ""3 salles d'eau - 1 salle de bain"", '4 wc', None, None, None, None, None, None, None, None, None, None]";['https://photo.superimmo.com/nhc72khrqlmhdcd08ni4650d9znh', 'https://photo.superimmo.com/4ncl89tlio7wlt1ogw2ureys7vw1', 'https://photo.superimmo.com/l36veojnhqrwvbvejhw819oe8lj0', 'https://photo.superimmo.com/3vt4prvm1wlorwckecq8yl41qnp9', 'https://photo.superimmo.com/fpol1hrtm33x9l64qfen4v4y0vxn', None, None, None, None, None]
175;https://www.superimmo.com/annonces/achat-maison-58m-bazas-33430-xwb10u;97000;58;3;2;Bazas (33430);1672;13/07/2024;1 terrasse;Cuisine ouverte;Barème d’honoraires : https://www.euroimmobilier33.com/i/redac/honoraires?honofor=1;"A 10 MINUTES DE BAZAS - REF BLUE - 4601 - Contactez NATHALIE au 06 12 22 35 22 ou XAVIER au 06 30 30 11 11
LES AGENCES EURO IMMOBILIER DE BAZAS ET SORE PRESENTENT :
Jolie maison de village en très bon état vendue louée, idéalement placée en centre village proche de Bazas.
Elle comprend une entrée par un très grand auvent, un bel espace de vie avec cuisine semi équipée, 2 chambres, SDE et WC. Une charmante cour pernets un espace extérieur.
Parking à proximité.
Chauffage électrique - DPE D";"['58 m² - 3 pièces - 2 chambres - ter. 14 m²', 'Orientation : Nord, Nord-Est, Est', '1 terrasse', 'Année de construction : 1900', 'Chauffage individuel électrique (radiateurs)', 'Cuisine ouverte', 'Séjour de 25 m²', ""1 salle d'eau"", '1 wc', '', None, None, None, None, None, None, None, None, None, None]";['https://photo.superimmo.com/r958nrzk05aabsj54pb1wdqw92s8', 'https://photo.superimmo.com/6ikjokpfuzexezl2gnxworlatvls', 'https://photo.superimmo.com/s28kuao4ry4i475r2ub9i3rpzi5j', 'https://photo.superimmo.com/64w04tno17s66cg1hlukr1u9mjk4', 'https://photo.superimmo.com/r9b659pnsqprvca334r9zmsnzlr0', None, None, None, None, None]
176;https://www.superimmo.com/annonces/achat-maison-157m-salles-33770-xwb10t;358000;157;8;4;Salles (33770);2280;13/07/2024;1 terrasse;1 Garage;Honoraires à la charge de l'acquéreur : 3,77% TTC - 13 000 € TTC inclus dans le prix de vente. Barème d’honoraires : https://www.euroimmobilier33.com/i/redac/honoraires?honofor=1;"SALLES CENTRE - REF 4566 - LAURIER
L'AGENCE EURO IMMOBILIER DE BAZAS & SORE VOUS PRÉSENTE
Proche de toutes commodités, maison d'habitation de 157m2 avec beaucoup de cachet. Elle est composée au rez de chaussée d'une entrée, séjour, salle à manger, salon télé avec cheminée/insert, cuisine, chambre, salle d'eau, WC, cellier. Carreaux de ciments.
A l'étage: palier, 3 chambres, salle d'eau avec WC. Parquet.
Chauffage central gaz, tout à l'égout. Quelques travaux à prévoir (huisseries d'origine..)
Garage de 40m2 avec partie atelier.
Sur un terrain clos de 480m2.
Pour tout renseignement, merci d'appeler Maura au 06 77 22 12 27.";"['157 m² - 8 pièces - 4 chambres - ter. 480 m²', 'Orientation : Nord, Nord-Est, Est', '1 Garage', '1 terrasse', 'Année de construction : 1930', 'Chauffage au gaz', 'Cuisine séparée', 'Séjour de 35 m²', ""1 salle d'eau - 1 salle de bain"", '2 wc', 'Cheminée', '', None, None, None, None, None, None, None, None]";[None, None, None, None, None, None, None, None, None, None]
177;https://www.superimmo.com/annonces/achat-maison-70m-grignols-33690-xwb10p;189000;70;3;2;Grignols (33690);2700;13/07/2024;Exclusivité;1 terrasse;Honoraires à la charge de l'acquéreur : 5% TTC - 9 000 € TTC inclus dans le prix de vente. Barème d’honoraires : https://www.euroimmobilier33.com/i/redac/honoraires?honofor=1;"15 MNS DE BAZAS - GRIGNOLS - REF 4599 - BALNEO - CONTACTER NATHALIE AU 06 12 22 35 22 OU XAVIER AU 06 30 30 11 11
LES AGENCES EURO IMMOBILIER DE BAZAS ET SORE VOUS PRESENTENT EN EXCLUSIVITE :
À mi-chemin entre Bazas et Casteljaloux, 1h de Bordeaux sur la petite commune de GRIGNOLS, charmant pavillon de 2017 très économique en RT 2012, surface habitable de 70 m2 avec un bel espace de vie très lumineux, vue sur la campagne, une cuisine équipée neuve, deux chambres, salle d'eau WC et cellier.
Le tout sur un terrain de 1300 m2 avec 4 places de parking. Tous commerces à pieds.
Chauffage par pompe à chaleur air/air, convecteur d'appoint dans les chambres et chauffe-eau thermodynamique et sèche serviette. DPE A - GES A.
Possibilité d'agrandissement.";"['70 m² - 3 pièces - 2 chambres - ter. 1 272 m²', 'Orientation : Est, Sud, Sud-Est', '4 Parkings', '1 terrasse', 'Année de construction : 2017', 'Chauffage individuel', 'Climatisation', 'Cuisine ouverte, équipée', 'Séjour de 35 m²', ""1 salle d'eau"", '1 wc', '', None, None, None, None, None, None, None, None]";['https://photo.superimmo.com/ug0xd7g5srhzhl1cn8ojz2ed74af', 'https://photo.superimmo.com/bx9hkm86yni22h6ji9dhwpr9eybi', 'https://photo.superimmo.com/o9p13v4dbngzvfe915muodyqh591', 'https://photo.superimmo.com/ie65g4fz2enhmlo9fk55cf2f9ptc', 'https://photo.superimmo.com/uhybz6iuet1cn1665dujhutmeyh2', None, None, None, None, None]
