;url;price;surface;nb_pieces;nb_chambres;lieu;prix_m2;date_publication;tag_1;tag_2;tag_3;description;tags;images_url
92;https://www.superimmo.com/annonces/achat-maison-186m-andernos-les-bains-33510-xwb4n7;1010000;186;8;6;Andernos-les-Bains (33510);5430;13/07/2024;1 balcon;Terrasse;Honoraires à la charge de l'acquéreur : 3,06% TTC - 30 000 € TTC inclus dans le prix de vente. Barème d’honoraires : https://www.lfimmo.fr/bareme-des-honoraires.pdf;"À vendre à Andernos Les Bains, cette magnifique maison de 8 pièces offre un cadre de vie exceptionnel.
Avec une surface habitable de 186 m² et un terrain de 710 m², cette propriété spacieuse est parfaite pour une famille ou pour ceux qui recherchent le confort et l'intimité.
La maison est équipée d'une cuisine aménagée moderne, idéale pour préparer de délicieux repas en famille ou entre amis. Le chauffage au gaz assure une chaleur agréable en toutes saisons.
Les 8 pièces ,dont 6 chambres, offrent des possibilités d'aménagement, que ce soit pour créer des espaces de vie conviviaux ou pour aménager des espaces de travail dans les cas d'une profession libérale ou alors chambres d'hôtes.
Cette maison est un véritable havre de paix, située dans un quartier résidentiel, tout en étant proche des commodités et des attractions de la ville. Ne manquez pas cette opportunité unique d'acquérir un bien d'exception à Andernos Les Bains.
Contactez-moi dès maintenant pour organiser une visite et découvrir tous les atouts de cette propriété exceptionnelle.
Prix hors honoraires d'agence 980 000 €.
Prix honoraires inclus 1 010 000 €.
Annonce publiée par Michel Boyer (EI) votre agent commercial en immobilier LF immo à Andernos, 33510 immatriculé au RSAC de BORDEAUX sous le n°834 615 635. Consultez nos tarifs sur le site LF immo.
Les informations sur les risques auxquels ce bien est exposé sont disponibles sur le site Géorisques : www.georisques.gouv.fr.
Afficher plus";"['186 m² - 8 pièces - 6 chambres - ter. 710 m²', '3 Parkings', '1 balcon', 'Terrasse', 'Chauffage au gaz', 'Coin cuisine équipé', ""4 salles d'eau - 1 salle de bain"", '5 wc', None, None, None, None, None, None, None, None, None, None, None, None]";['https://photo.superimmo.com/0giev3ljzquuyrq97yfmmtfd74dd', 'https://photo.superimmo.com/jej7vradw8qsfky76aeajsnl3bdi', 'https://photo.superimmo.com/vxenvyy22qtgg0b69qdkle6ege9l', 'https://photo.superimmo.com/8jn3w6nvs9vwtgdwizxuaxlojzb1', 'https://photo.superimmo.com/cl0rsmht7t5tx4gatswpqomuzoe9', None, None, None, None, None]
93;https://www.superimmo.com/annonces/achat-maison-82m-pauillac-33250-xwb4n4;126000;82;4;2;Pauillac (33250);1537;13/07/2024;Coin cuisine;Chauffage électrique;Honoraires à la charge du vendeur. Barème d’honoraires : https://www.lfimmo.fr/bareme-des-honoraires.pdf;"Proche de Pauillac Maison 4 pièces
Située dans un hameau de Pauillac, je vous présente une maison mitoyenne d’un coté, d'une surface habitable d'environ 82 m² au calme,
Elle se compose au rez de chaussée, d’une entrée, cuisine, un salon, séjour ou une chambre, salle d’eau avec wc,
A l’étage, un palier qui dessert 2 chambres de 12 et 11 m², et d'une salle d’eau et wc,
Un jardin de 70 m² avec la possibilité de rentrer une voiture,
Prévoir quelques travaux afin d’y mettre votre touche personnelle,
A 5 minutes de toutes commodités, cinéma, pharmacie, grande surface, médecins et spécialistes, écoles, collèges, Lycée...
A 35 minutes des plages d’Hourtin, 1 heure de Bordeaux, Aéroport de Mérignac, du Verdon en prenant le bac pour Royan.
Chauffage électrique, assainissement tout à l’égout, double vitrage, taxe foncière 520 euros
Annonce publiée par votre agent commercial en immobilier LF immo à Saint Laurent Medoc, 33112 immatriculé au RSAC de BORDEAUX sous le n°882 045 263. Consultez nos tarifs sur le site LF immo.
Les informations sur les risques auxquels ce bien est exposé sont disponibles sur le site Géorisques : www.georisques.gouv.fr.
Afficher plus";"['82 m² - 4 pièces - 2 chambres - ter. 80 m²', 'Chauffage électrique', 'Coin cuisine', ""2 salles d'eau"", '2 wc', '', None, None, None, None, None, None, None, None, None, None, None, None, None, None]";['https://photo.superimmo.com/rg9oui8qave34pztx1g3nymrx5w6', 'https://photo.superimmo.com/g7ht83e9hx7zuy51lkgcpjyiiwlv', 'https://photo.superimmo.com/u2r6tcm0nacu86m3k94onngqpe7f', 'https://photo.superimmo.com/cn134tm61llsbjv2qk81z6f6rims', 'https://photo.superimmo.com/tlx3prmkzfm2v1sjvmrlyodj9e4i', None, None, None, None, None]
94;https://www.superimmo.com/annonces/achat-maison-180m-merignac-33700-xwb4ln;548000;180;8;6;Mérignac (33700);3044;13/07/2024;;;Barème d’honoraires : https://bareme.safti.fr/;"À proximité de Pessac, dans le quartier recherché de Mérignac Arlac, cette maison familiale de 180 m² est nichée sur une parcelle arborée de 684 m². Offrant un cadre de vie calme et verdoyant, elle est à seulement cinq minutes à pied des lignes de bus 74 et 78, cinq minutes en voiture ou à vélo des tramways A (Arlac) et B (Pessac centre). Les commerces de proximité sont accessibles en moins de dix minutes à pied.
La maison se compose au rez-de-chaussée d'une entrée accueillante, d'une cuisine équipée indépendante avec cellier, et d'un séjour lumineux avec cheminée à foyer ouvert et plafond cathédrale.
Le coin nuit dispose de cinq chambres, d'une salle d'eau, d'une salle de bain et d'un WC séparé.
À l’étage, une mezzanine mène à une spacieuse suite parentale de plus de 40 m² avec salle d'eau et WC.
Un garage de 19 m² et des combles complètent ce bien, offrant des espaces de rangement supplémentaires. Cette maison est idéale pour une famille en quête de tranquillité, tout en étant à proximité des commodités.
Travaux à prévoir.
Les informations sur les risques auxquels ce bien est exposé sont disponibles sur le site Géorisques : www.georisques.gouv.fr
Prix de vente : 548 000 €
Honoraires charge vendeur
Contactez votre conseiller SAFTI : Nathalie NOGUES, Tél. : 0745081267, E-mail : - EI - Agent commercial immatriculé au RSAC de Bordeaux sous le numéro 539 820 688 - SAFTI – NOGUES Nathalie, Conseiller indépendant
Afficher plus";['180 m² - 8 pièces - 6 chambres - ter. 684 m²', 'Année de construction : 1972', '2 wc', '', None, None, None, None, None, None, None, None, None, None, None, None, None, None, None, None];['https://photo.superimmo.com/j9h5wehxuu3flwhrnaymoi1nukrz', 'https://photo.superimmo.com/855173xku17uzlggvmlop0tlcv08', 'https://photo.superimmo.com/gllaz2cr2cr4h6iznqkcvjyya88s', 'https://photo.superimmo.com/fufh9f7opienoyp5et1v5u83tn78', 'https://photo.superimmo.com/1h35oguj97d2hxr9sjv8b7viyppd', None, None, None, None, None]
95;https://www.superimmo.com/annonces/achat-maison-98m-saint-andre-de-cubzac-33240-xwb4ll;216195;98;3;2;Saint-André-de-Cubzac (33240);2206;13/07/2024;Terrasse;;Barème d’honoraires : https://bareme.safti.fr/;"Située dans la charmante commune de Saint-André-de-Cubzac (33240), cette maison offre un cadre de vie paisible à ses habitants. Proche des commerces locaux et des écoles, elle bénéficie d'une localisation idéale pour une vie quotidienne facile et agréable.
À l'intérieur, cette maison de 98 m² offre un agencement idéal pour une vie confortable. Au rez-de-chaussée, on y trouve une cuisine équipée, un séjour avec cheminée, un dressing, une salle d'eau et des toilettes. À l'étage, deux chambres lumineuses complètent l'espace de vie, offrant des espaces de repos chaleureux. Offrant un équilibre parfait entre fonctionnalité et charme, cette propriété est idéale pour une famille ou un couple à la recherche d'un lieu de vie accueillant.
À l'extérieur, cette propriété dispose d'une terrasse offrant un espace extérieur convivial pour profiter des journées ensoleillées.
Les informations sur les risques auxquels ce bien est exposé sont disponibles sur le site Géorisques : www.georisques.gouv.fr
Prix de vente : 216 195 €
Honoraires charge vendeur
Contactez votre conseiller SAFTI : Tom CLARET, Tél. : 06 73 95 46 81, E-mail : - EI - Agent commercial immatriculé au RSAC de BORDEAUX sous le numéro 901 256 008 - SAFTI – CLARET Tom, Conseiller indépendant
Afficher plus";['98 m² - 3 pièces - 2 chambres - ter. 138 m²', 'Terrasse', 'Année de construction : 1930', '', None, None, None, None, None, None, None, None, None, None, None, None, None, None, None, None];['https://photo.superimmo.com/ewhmsck93q7tkyyh4bx5nx27cecx', 'https://photo.superimmo.com/z1t34cv1b9q7usjouyy8n4p8e162', 'https://photo.superimmo.com/5hpdxqcqgtlw2cqqumuxos9vg3qr', 'https://photo.superimmo.com/i5kh5fg1f9jeeg33gizkgrzddb9w', 'https://photo.superimmo.com/nb8e1r8msit9zs9jp2o4m3x9g2ym', 'https://photo.superimmo.com/uolj8v2k0t8k88egcko1s2pk83aw', None, None, None, None]
96;https://www.superimmo.com/annonces/achat-maison-217m-bordeaux-33200-xwb4lh;899000;217;6;5;Bordeaux (33200);4143;13/07/2024;Exclusivité;;Barème d’honoraires : https://bareme.safti.fr/;"CAUDERAN HYPER CENTRE : Cette belle maison d’une superficie exceptionnelle de 217 m² dispose pour vous recevoir d’un jardin d’accueil.
L’entrée majestueuse dessert une cuisine avec arrière-cuisine, ainsi qu’un grand salon de 37 m² orienté plein sud, ouvrant sur une jolie terrasse avec piscine récente. La demeure, rénovée et en excellent état, dispose de 5 grandes chambres dont une suite parentale de 26 m², avec salle d’eau et dressing. Deux salles de bains supplémentaires et une buanderie complètent les prestations fonctionnelles.
Le jardin sur l’arrière de la maison dispose d’une entrée privative où l’on peut garer des véhicules.
La toiture est équipée de panneaux solaires.
La maison est située à 2 mn de l’Église de Caudéran, et à proximité immédiate des commerces, du marché bio du samedi et des écoles privées de renom. Les transports en commun proches, dont le futur Bus Express, permettent de se rendre rapidement à la gare ou dans le centre de Bordeaux.
C'est une maison agréable, fonctionnelle à l'emplacement privilégié. On ne se trompe pas !
Des informations ? Une visite ?
Sandrine Tournadre au 06 81 02 35 54
(Ne pas se fier à la localisation indiquée sur les sites)
Les informations sur les risques auxquels ce bien est exposé sont disponibles sur le site Géorisques : www.georisques.gouv.fr
Prix de vente : 899 000 €
Honoraires charge vendeur
Contactez votre conseiller SAFTI : Sandrine TOURNADRE, Tél. : 0681023554, E-mail : - EI - Agent commercial immatriculé au RSAC de BORDEAUX sous le numéro 823 672 654 - SAFTI – TOURNADRE Sandrine, Conseiller indépendant
Afficher plus";['217 m² - 6 pièces - 5 chambres - ter. 234 m²', 'Année de construction : 1986', '3 wc', '', None, None, None, None, None, None, None, None, None, None, None, None, None, None, None, None];['https://photo.superimmo.com/7acwld33wcgpse5qkctol2xhq6oc', 'https://photo.superimmo.com/z8gb0i9clsxdawpc743a4pausqu5', None, None, None, None, None, None, None, None]
97;https://www.superimmo.com/annonces/achat-appartement-85m-bordeaux-33300-xwb4jz;260000;85;4;3;Bordeaux (33300);3059;13/07/2024;1 Parking;;Barème d’honoraires : https://bareme.safti.fr/;"Situé à proximité du Lac de Bordeaux, cet appartement de type 4 se niche dans une résidence sécurisée et tranquille. Au rez-de-chaussée d’un immeuble de trois étages, cet espace de vie propose un cadre à la fois pratique et agréable.
Cet appartement fonctionnel se compose d'une entrée avec placard intégré, desservant la pièce de vie et la cuisine semi-ouverte équipée, avec accès sur un espace extérieur de 82m² (terrasse et jardin privatif), trois chambres avec placards et accès sur le jardin, une salle de bain et des toilettes séparées complètent les commodités.
L’appartement comprend également des espaces de rangement complémentaires : un cellier/cave dans l’immeuble à proximité de l'appartement, ainsi qu'un second cellier/local à vélo fermé, avec accès privatif directement depuis le logement.
L'appartement est également vendu avec une place de stationnement couverte au sein du parking de la résidence sécurisée.
La proximité des commerces, des écoles et des espaces verts rend le quotidien agréable et pratique. Les déplacements sont facilités grâce à l’accès rapide aux transports en commun, notamment le Tram C. Les charges de copropriété incluent l’eau froide, le chauffage et l’eau chaude.
Pour plus d’informations ou pour organiser une visite, contactez-moi dès maintenant.
Le bien comprend 3 lots, et il est situé dans une copropriété de 188 lots (les charges courantes annuelles moyennes de copropriété sont de 2700 € et le syndicat des copropriétaires ne fait pas l'objet d'une procédure citée à l'article L. 721-1 du code de la construction et de l'habitation).
Les informations sur les risques auxquels ce bien est exposé sont disponibles sur le site Géorisques : www.georisques.gouv.fr
Prix de vente : 260 000 €
Honoraires charge vendeur
Contactez votre conseiller SAFTI : Nathalie NOGUES, Tél. : 0745081267, E-mail : - EI - Agent commercial immatriculé au RSAC de Bordeaux sous le numéro 539 820 688 - SAFTI – NOGUES Nathalie, Conseiller indépendant
Afficher plus";['85 m² - 4 pièces - 3 chambres', '1 Parking', 'Année de construction : 2017', '1 wc', None, None, None, None, None, None, None, None, None, None, None, None, None, None, None, None];['https://photo.superimmo.com/jge6fddk6y5hhf2x0z68ibr5ijz5', 'https://photo.superimmo.com/dbug53z9wroy76w5e1nr6otxldri', 'https://photo.superimmo.com/fub3ho54n5xxsxadjyunakfs0hhi', 'https://photo.superimmo.com/1qz6i0dyj6m6p9m7dehhnvhb5n6a', 'https://photo.superimmo.com/guqkvx5lmv8t1dw5l7zqyhima8f6', None, None, None, None, None]
98;https://www.superimmo.com/annonces/achat-maison-80m-parempuyre-33290-xwb4jk;295000;80;5;3;Parempuyre (33290);3688;13/07/2024;Terrasse;2 Parkings;Barème d’honoraires : https://bareme.safti.fr/;"Située sur la commune de Parempuyre (33290), je vous propose ce pavillon idéalement placée, proche du centre ville, à proximité du collège et école , offrant ainsi un cadre de vie pratique et paisible pour les familles.
À l'extérieur, cette propriété dispose d'un terrain généreux de 680 m² comprenant une terrasse refaite à neuf ainsi qu'un cabanon en bois.
Elle propose également un garage de 20 m² attenant à la maison avec une porte électrique et deux places de parking extérieures.
À l'intérieur, cette maison de 80 m2 dispose d' une cuisine indépendante, possibilité de l'ouvrir sur le double salon avec baie vitrée donnant sur la terrasse, le coin nuit est composé de trois chambres.
La salle d'eau a été rénovée entièrement.
Cette propriété présente un bel équilibre entre confort et fonctionnalité.
Les informations sur les risques auxquels ce bien est exposé sont disponibles sur le site Géorisques : www.georisques.gouv.fr
Prix de vente : 295 000 €
Honoraires charge vendeur
Contactez votre conseiller SAFTI : Cécile LARTIGUE, Tél. : 0630668683, E-mail : - EI - Agent commercial immatriculé au RSAC de BORDEAUX sous le numéro 910 921 063 - SAFTI – LARTIGUE Cécile, Conseiller indépendant
Afficher plus";['80 m² - 5 pièces - 3 chambres - ter. 680 m²', '2 Parkings', 'Terrasse', 'Année de construction : 1980', '1 wc', '', None, None, None, None, None, None, None, None, None, None, None, None, None, None];['https://photo.superimmo.com/plnl3k5p0mpa8ijg1jzjgbapua3u', 'https://photo.superimmo.com/kdkhincyeh0owwyg2ex35t5ivo09', 'https://photo.superimmo.com/e2n1xnikmqrdqqlpiaa2en82602t', 'https://photo.superimmo.com/b28n05wqn9zsmbiqcm61mnp19yz8', 'https://photo.superimmo.com/344v16hsrxpr45gaylsgbxrhn7j4', None, None, None, None, None]
99;https://www.superimmo.com/annonces/achat-maison-145m-saint-medard-en-jalles-33160-xwb4iz;599000;145;5;4;Saint-Médard-en-Jalles (33160);4131;13/07/2024;;;Barème d’honoraires : https://bareme.safti.fr/;"Cette maison spacieuse de 145 m² est située à Saint-Médard-en-Jalles (33160), offrant un cadre de vie paisible et familial. Proche des commerces, écoles, et espaces verts, cette localité dynamique saura séduire ceux en quête de tranquillité alliée à la praticité au quotidien.
Construite en 1992 sur un terrain généreux de 1000 m², cette maison de type 5 propose un agencement fonctionnel avec un séjour lumineux, une cuisine semi-ouverte avec cellier, 1 salle d'eau, 1 salle de bains, 1 WC séparé, un garage et une cave. Idéale pour une famille à la recherche d'espace et de confort, cette propriété offre un cadre de vie agréable pour créer des souvenirs inoubliables.
Les informations sur les risques auxquels ce bien est exposé sont disponibles sur le site Géorisques : www.georisques.gouv.fr
Prix de vente : 599 000 €
Honoraires charge vendeur
Contactez votre conseiller SAFTI : Lynda GOBARDHAM, Tél. : 0769500056, E-mail : - EI - Agent commercial immatriculé au RSAC de sous le numéro - SAFTI – GOBARDHAM Lynda, Conseiller indépendant
Afficher plus";['145 m² - 5 pièces - 4 chambres - ter. 1 000 m²', 'Année de construction : 1992', None, None, None, None, None, None, None, None, None, None, None, None, None, None, None, None, None, None];['https://photo.superimmo.com/qyfn7q94t9ycprrv0215t9pmeyu2', 'https://photo.superimmo.com/ovfnvv8bmpsd9fsfzqn0anuuoxq0', 'https://photo.superimmo.com/9n86yjj2edcidjftrr4rnysldbt2', 'https://photo.superimmo.com/fpedb0escuum6b86iiru5shl7vrd', 'https://photo.superimmo.com/yg24p486h6jw1bbt5pyr214pjljj', None, None, None, None, None]
100;https://www.superimmo.com/annonces/achat-appartement-91m-merignac-33700-xwb4ik;374000;91;4;3;Mérignac (33700);4110;13/07/2024;1 Parking;;Barème d’honoraires : https://bareme.safti.fr/;"Vous recherchez un appartement familial avec un bel extérieur sans vis-à-vis, au sein du quartier prisé de Montdésir à Mérignac ? Cet appartement est fait pour vous !
Profitez de deux espaces extérieurs exceptionnels : une vaste terrasse de 22m², sans vis à vis, donnant sur le séjour et la cuisine indépendante (clairement une pièce en plus !) ainsi qu'un balcon de 5m² accessible depuis deux des trois chambres.
À l'intérieur, l'appartement est baigné de lumière naturelle et offre de belles prestations. Bénéficiez d'un séjour spacieux et d'une cuisine indépendante, aménagée et équipée, de trois belles chambres, d'une salle de bain et d'un WC indépendant.
Pour compléter ce bien, une place de parking privative est incluse, vous bénéficierez également d'un local poussettes ainsi que d'un local à vélos.
Ne manquez pas cette opportunité unique, contactez-moi pour organiser une visite !
Le bien comprend 2 lots, et il est situé dans une copropriété de 37 lots (les charges courantes annuelles moyennes de copropriété sont de 1100 € et le syndicat des copropriétaires fait l'objet d'une procédure citée à l'article L. 721-1 du code de la construction et de l'habitation).
Les informations sur les risques auxquels ce bien est exposé sont disponibles sur le site Géorisques : www.georisques.gouv.fr
Prix de vente : 374 000 €
Honoraires charge vendeur
Contactez votre conseiller SAFTI : Nathalie NOGUES, Tél. : 0745081267, E-mail : - EI - Agent commercial immatriculé au RSAC de Bordeaux sous le numéro 539 820 688 - SAFTI – NOGUES Nathalie, Conseiller indépendant
Afficher plus";['91 m² - 4 pièces - 3 chambres', '1 Parking', 'Année de construction : 2012', '1 wc', None, None, None, None, None, None, None, None, None, None, None, None, None, None, None, None];['https://photo.superimmo.com/19mkmkpr611nxkm2dd94iapf1lk5', 'https://photo.superimmo.com/7mxeng4l8zac0nls19ij4b0xyt14', 'https://photo.superimmo.com/ilpzgmx4jmk2qkbhht29asazy3tk', 'https://photo.superimmo.com/hlry25lj61j2y8rgnja0eqgo8lg5', 'https://photo.superimmo.com/ex6j4pj992co8yv3s81ij02ovv98', None, None, None, None, None]
101;https://www.superimmo.com/annonces/achat-maison-167m-saint-andre-de-cubzac-33240-xwb4id;230560;167;7;4;Saint-André-de-Cubzac (33240);1381;13/07/2024;;;Barème d’honoraires : https://bareme.safti.fr/;"Située dans la charmante commune de Peujard (33240), à 5 minutes de Saint André de Cubzac, cette maison bénéficie d'un cadre paisible, proche des commodités, des écoles et des commerces, cette localité offre un cadre de vie agréable et familial.
Sa grande dépendance en pierres et son terrain constructible permettent d'imaginer de nombreuses possibilités d'aménagement et/ou transformations.
Cette maison de 167 m² sur un terrain de 2223 m² se compose d'une cuisine, d'une salle à manger, d'un séjour, de 4 chambres dont 3 au rez-de-chaussée, d'une salle de bains, et de toilettes. À l'étage, un palier, une chambre et une grande pièce à aménager offrent des possibilités d'agencement supplémentaires. Avec ses 7 pièces au total, cette propriété saura séduire une famille à la recherche d'espace et de tranquillité dans un cadre bucolique.
Les informations sur les risques auxquels ce bien est exposé sont disponibles sur le site Géorisques : www.georisques.gouv.fr
Prix de vente : 230 560 €
Honoraires charge vendeur
Contactez votre conseiller SAFTI : Pierre VERDIER, Tél. : 0660412066, E-mail : - EI - Agent commercial immatriculé au RSAC de Libourne sous le numéro 809887789 - SAFTI – VERDIER Pierre, Conseiller indépendant
Afficher plus";['167 m² - 7 pièces - 4 chambres - ter. 2 223 m²', 'Année de construction : 1900', '1 wc', '', None, None, None, None, None, None, None, None, None, None, None, None, None, None, None, None];['https://photo.superimmo.com/8kgmghcku15conyc7z5mkcobd0yr', 'https://photo.superimmo.com/gwkee5qcage6ept68riyoaxpxzl4', 'https://photo.superimmo.com/ggdeqsxxuvijulg04zwu680f0ilx', 'https://photo.superimmo.com/n8kdmz705i7e5clmrht933clqb8r', 'https://photo.superimmo.com/s3e5z1acxqh2s0llzjcdktfxincj', None, None, None, None, None]
102;https://www.superimmo.com/annonces/achat-maison-114m-audenge-33980-xwb4ia;640000;114;6;4;Audenge (33980);5614;13/07/2024;;;Barème d’honoraires : https://bareme.safti.fr/;"Située dans la charmante ville d'Audenge (33980), cette propriété jouit d'un cadre paisible et familial. Réputée pour sa qualité de vie, cette localité offre à ses habitants un environnement préservé entre terre et mer. À proximité, on trouve des commerces de proximité, des écoles et des services qui rendent la vie quotidienne agréable. De plus, la nature omniprésente permet de profiter d'activités en plein air, notamment grâce à la proximité du bassin d'Arcachon.
Cette maison de 114 m² construite en 2022 sur un terrain de 685 m² offre un cadre de vie idéal. Dotée de 4 chambres, elle dispose d'une pièce de vie lumineuse propice aux moments de convivialité. Sa terrasse couverte invite à la détente, tandis que le cabanon offre un espace de rangement supplémentaire. Sans oublier la piscine 3x8, parfaite pour se rafraîchir lors des journées ensoleillées. Une opportunité unique pour allier confort et tranquillité dans un environnement privilégié.
Les informations sur les risques auxquels ce bien est exposé sont disponibles sur le site Géorisques : www.georisques.gouv.fr
Prix de vente : 640 000 €
Honoraires charge vendeur
Contactez votre conseiller SAFTI : Claudia SIMOES, Tél. : 06 25 89 74 93, E-mail : - EI - Agent commercial immatriculé au RSAC de BORDEAUX sous le numéro 888 148 137 - SAFTI – SIMOES Claudia, Conseiller indépendant
Afficher plus";['114 m² - 6 pièces - 4 chambres - ter. 685 m²', 'Année de construction : 2022', '2 wc', '', None, None, None, None, None, None, None, None, None, None, None, None, None, None, None, None];[None, None, None, None, None, None, None, None, None, None]
