;url;price;surface;nb_pieces;nb_chambres;lieu;prix_m2;date_publication;tag_1;tag_2;tag_3;description;tags;images_url
104;https://www.superimmo.com/annonces/achat-appartement-78m-aubagne-13400-xwdvw4;199900;78;3;2;Aubagne (13400);2563;24/07/2024;Exclusivité;Dernier étage;Honoraires à la charge du vendeur. Barème d’honoraires : https://homki-immobilier.com/notre-offre;"Homki vous présente en exclusivité un appartement Type 3, lumineux, avec de jolis volumes.
Situé dans une résidence recherchée, fermée et sécurisée, à proximité des commerces et des transports en commun, nous vous présentons cet appartement de 78m² habitables en 3ème et dernier étage sans ascenseur.
La pièce à vivre offre un joli volume de 29m², avec petit balcon, au calme et avec une vue très agréable sur les collines.
Elle dispose de volets roulants électriques.
Une pièce aménagée en dressing donne sur l’entrée.
Une cuisine équipée et fonctionnelle communique avec la pièce à vivre.
La chaudière à gaz est dans un état neuf.
Coté nuit, vous retrouverez 2 chambres, dont une avec placard dressing intégré. Une belle salle d’eau avec douche à l’italienne et des WC séparés se trouvent dans cet espace. Tout l’appartement est équipé de double vitrage, et il est possible d'installer une climatisation.
Une cave complète ce bien.
Un parking en placement collectif se trouve dans la copropriété, et vous aurez aussi la possibilité de louer des places au parking POTIERS, au pied de l’immeuble.
La résidence propose également une piscine commune.
Vous trouverez à proximité des écoles primaires et collèges, de nombreux commerces ainsi qu'une ligne de bus gratuite.
Informations financières :
La taxe foncière est de 1565€
Les charges sont de 130€
Qui est le Homker proche de chez vous ?
Je suis Yohan Nataf, agent commercial immatriculé au RSAC de Marseille sous le numéro 800 916 595, et je serais ravi de vous le faire découvrir !
Qui est Homki ?
Homki offre aux acquéreurs et vendeurs un service complet et transparent afin que chaque projet immobilier soit une expérience innovante vécue sereinement.
Nos frais d'agence sont de 4 900 € fixes à la charge du vendeur.
Afficher plus";"['78 m² - 3 pièces - 2 chambres', 'Dernier étage (3ème)', 'Orientation : Sud', 'Parking extérieur', '1 cave', 'Balcon', ""1 salle d'eau"", '1 wc', None, None, None, None, None, None, None, None, None, None, None, None]";['https://photo.superimmo.com/e5tcr4e172il1yd4p7oafui6lxac', 'https://photo.superimmo.com/lhi3ra7ajo6lizi7cncjxiax6wvg', 'https://photo.superimmo.com/f9m4fgascv1oa9cmlx5h6d14mmbj', 'https://photo.superimmo.com/tiyi5hah7j81a1ixosn684rjkyho', 'https://photo.superimmo.com/09cdcx90zta6kuef3yx2z3vbmiwm', None, None, None, None, None]
105;https://www.superimmo.com/annonces/achat-maison-136m-marseille-13eme-13013-xwdvvx;639000;136;5;4;Marseille 13ème (13013);4699;24/07/2024;Exclusivité;Terrasse;Honoraires à la charge du vendeur. Barème d’honoraires : https://homki-immobilier.com/notre-offre;"Coup de coeur assuré pour cette belle maison des années 40 entièrement rénovée située dans un beau quartier résidentiel au calme dit ""les Médecins"".
Edifié sur deux niveaux, sur 136m² au total, le bien se compose au rez-de chaussée d'une belle pièce de vie de 40 m², lumineuse aux tonalités chaudes : parquet, pierres, tout est là pour vous plaire. Traversante, la pièce se prolonge d'une cuisine aux tons turquoises et son espace dinatoire complétée d'un espace buanderie.
Trois chambres avec rangement, une salle de bains et des WC complètent ce niveau.
A l'étage, vous pourrez alors découvrir une vaste suite parentale sous velux avec son coin salon et sa salle d'eau privative avec WC.
Le charme opère tout autant sur les extérieurs avec sa terrasse ombragée sous tonnelle laisse entrevoir un jardin verdoyant et sa piscine.
Pour votre confort, la maison est entièrement climatisée et équipée de volets roulants électriques et double vitrage.
Informations financières :
La taxe foncière est de 2698€
Qui est le Homker proche de chez vous ?
Je suis Pierre Chabert, agent commercial immatriculé au RSAC de Aix-en-Provence sous le numéro 880 335 401, et je serais ravi de vous le faire découvrir !
Qui est Homki ?
Homki offre aux acquéreurs et vendeurs un service complet et transparent afin que chaque projet immobilier soit une expérience innovante vécue sereinement.
Nos frais d'agence sont de 4 900 € fixes à la charge du vendeur.
Afficher plus";"['136 m² - 5 pièces - 4 chambres - ter. 1 000 m²', '2 niveaux', 'Piscine', 'Orientation : Est, Ouest, Sud, Sud-Ouest', 'Terrasse', 'Année de construction : 1948', 'Chauffage au gaz', 'Séjour de 40 m²', ""1 salle d'eau - 1 salle de bain"", '2 wc', 'Jardin privatif', '', None, None, None, None, None, None, None, None]";['https://photo.superimmo.com/g2f7d17ba75sw1wzgc8m5kvwlpcz', 'https://photo.superimmo.com/laoah0mhspqrt0rfamehrofs29rc', 'https://photo.superimmo.com/ihe6jqg3wz1hx750bpu026i3vacw', 'https://photo.superimmo.com/fzbhanoa55tf26euatemvzi1pztv', 'https://photo.superimmo.com/03gbqip29u9gn0bf8i6szw0o6l1n', None, None, None, None, None]
106;https://www.superimmo.com/annonces/achat-maison-84m-arles-13200-xwdvvu;254900;84;4;3;Arles (13200);3035;24/07/2024;Exclusivité;Chauffage au bois;Honoraires à la charge du vendeur. Barème d’honoraires : https://homki-immobilier.com/notre-offre;"Exclusivité à ne pas rater à Arles !
Découvrez le charme intemporel de cette villa de plain-pied, nichée dans le quartier prisé de Trinquetaille à Arles. Construite en 1978 sur une parcelle de 341m², cette propriété offre un cadre de vie confortable et pratique.
À l'intérieur, un séjour lumineux de 25,3m² avec une cheminée invite à la détente, tandis qu'une cuisine séparée semi-équipée offre un espace fonctionnel pour concocter de délicieux repas.
Les trois chambres, mesurant respectivement 9,4m², 10,2m² et 12,8m², assurent un repos paisible, avec la chambre principale bénéficiant d'un placard intégré pour un rangement optimal. Une salle d'eau avec douche italienne et des toilettes séparées ajoutent au confort de cette villa.
À l'extérieur, un garage de 15m² offre un espace de stationnement sécurisé ou un rangement supplémentaire, selon vos besoins.
Profitez de la tranquillité du quartier résidentiel de Trinquetaille tout en étant à proximité des commodités et des attractions d'Arles.
Confort et chauffage :
Fenêtres en PVC double vitrage avec volets roulants électriques,
Cheminée,
Climatisation réversible.
Homki adore : quartier paisible, plain pied, idéal pour la famille
Informations financières :
La taxe foncière est de 1 555 €
DPE : C
ERP : Les informations sur les risques auxquels ce bien est exposé sont disponibles sur le site Géorisques : www.georisques.gouv.fr
Qui est le Homker proche de chez vous ?
Je suis Michael, agent commercial immatriculé au RSAC de Tarascon sous le numéro 502 396 286, et je serais ravi de vous le faire découvrir ! Je suis à votre écoute tous les jours de 9H à 20H.
Qui est Homki ?
Homki offre aux acquéreurs et vendeurs un service complet et transparent pour que chaque projet immobilier soit une expérience innovante vécue sereinement.
Nos frais d'agence sont de 4 900 € fixes à la charge du vendeur.
Afficher plus";"['84 m² - 4 pièces - 3 chambres - ter. 341 m²', 'Orientation : Est, Ouest, Sud, Sud-Ouest', 'Vue sur rue', 'Garage', 'Année de construction : 1978', ""Assainissement : tout à l'égout"", 'Chauffage au bois', 'Séjour de 25 m²', ""1 salle d'eau"", '1 wc', 'Jardin privatif', '', None, None, None, None, None, None, None, None]";['https://photo.superimmo.com/jcvgvnvs4gpryq481klwbboyvh3j', 'https://photo.superimmo.com/ky8513jwto0xdtkxxdn1f1vr8ihg', 'https://photo.superimmo.com/yhc03py6baq293fgt7w5zdllko12', 'https://photo.superimmo.com/cio9kwy4vdvu1ys3izzg1ygb6uor', 'https://photo.superimmo.com/7rh6fuw7t3fa8nos0oiils7s8jib', None, None, None, None, None]
107;https://www.superimmo.com/annonces/achat-maison-88m-marseille-6eme-13006-xwdvvq;360000;88;4;3;Marseille 6ème (13006);4091;24/07/2024;Exclusivité;Terrasse;Honoraires à la charge du vendeur. Barème d’honoraires : https://homki-immobilier.com/notre-offre;"Rue Saint Jacques 13006 Marseille : Idéalement situé en plein cœur du quartier des Antiquaires à deux pas de toutes les commodités et de l'hypercentre de Marseille Homki vous invite à découvrir en exclusivité cette maison de ville de 88m² en R+1 avec possibilité d'exploiter un toit terrasse de 40m².
Vous serez séduit par son fort potentiel après travaux, son agencement, ses beaux volumes, ses nombreuses possibilités de réorganisation de l'espace et son emplacement géographique. Au rez-de-chaussée le bien se compose d'une entrée de 4m², d'un séjour double de 30m², d'une cuisine indépendante équipée de 8m² et d'une salle d'eau.
À l'étage vous disposerez d'une grande pièce de 23m² et d'une seconde pièce de 8m² ouvrant sur un balcon (possibilité de création d'un accès au toit terrasse).
À découvrir sans tarder
Informations financières :
La taxe foncière est de 1545€
Qui est le Homker proche de chez vous ?
Je suis Robin Ricaut, agent commercial immatriculé au RSAC de Aix-en-Provence sous le numéro 537 770 216, et je serais ravi de vous le faire découvrir !
Qui est Homki ?
Homki offre aux acquéreurs et vendeurs un service complet et transparent afin que chaque projet immobilier soit une expérience innovante vécue sereinement.
Nos frais d'agence sont de 4 900 € fixes à la charge du vendeur.
Afficher plus";"['88 m² - 4 pièces - 3 chambres', '2 niveaux', 'Terrasse', 'Chauffage électrique', ""1 salle d'eau"", '1 wc', None, None, None, None, None, None, None, None, None, None, None, None, None, None]";['https://photo.superimmo.com/xzn56azv77ith98qolk5wb4rxiku', 'https://photo.superimmo.com/qrt6dafjebcy5y1qpwkd1ebnbkfw', 'https://photo.superimmo.com/h7tfxaoeqye0f67pemy0vhm1wi9w', 'https://photo.superimmo.com/6ooluq7ux8uanqj497g9s783dtef', 'https://photo.superimmo.com/imr6kygruljt0086ixvqe1csmwcd', None, None, None, None, None]
108;https://www.superimmo.com/annonces/achat-maison-155m-marseille-7eme-13007-xwdvvp;1285000;155;5;4;Marseille 7ème (13007);8290;24/07/2024;Exclusivité;Terrasse;Honoraires à la charge du vendeur. Barème d’honoraires : https://homki-immobilier.com/notre-offre;"Dans le quartier d'Endoume, à proximité immédiate de la Corniche, Homki vous invite à découvrir en exclusivité cette maison idéalement située, à deux pas du bord de mer, dans un secteur calme, et proche de toutes les commodités.
Magnifique maison de type 5 de 155 m² sur une parcelle de 421 m².
Vous serez immédiatement séduit par son emplacement géographique, son agréable jardin arboré, son calme, ses beaux volumes, son excellent état et ses nombreux rangements.
Cette maison de construction traditionnelle totalement au calme s'ouvre sur un jardin arboré de 300 m². Vous pourrez profiter de moments de détente dans les divers espaces disponibles, tels que la terrasse, le coin salon extérieur, en ayant également la possibilité d'installer une piscine.
Une fois à l'intérieur, au rez-de-chaussée, vous disposerez d'une agréable pièce de vie de 42 m², d'une cuisine équipée de 23 m² ouvrant sur l'extérieur, d'une grande buanderie de 6 m², d'un cellier et de Wc séparés.
À l'étage, l'espace nuit se compose de trois chambres de 9m², 12m² et 14m² et d'une salle de bains avec Wc séparés.
Vous découvrirez également une 4ème chambre de 20 m² - dite chambre parentale, avec son dressing, sa salle d'eau privative et sa terrasse.
À découvrir sans tarder !
Qui est le Homker proche de chez vous ?
Je suis Robin Ricaut, agent commercial immatriculé au RSAC de Aix-en-Provence sous le numéro 537 770 216, et je serais ravi de vous le faire découvrir !
Qui est Homki ?
Homki offre aux acquéreurs et vendeurs un service complet et transparent afin que chaque projet immobilier soit une expérience innovante vécue sereinement.
Nos frais d'agence sont de 4 900 € fixes à la charge du vendeur.
Afficher plus";['155 m² - 5 pièces - 4 chambres - ter. 421 m²', '2 niveaux', 'Orientation : Est, Ouest, Sud, Sud-Ouest', 'Parking extérieur', 'Terrasse', 'Année de construction : 1970', 'Chauffage au gaz', 'Séjour de 42 m²', '2 salles de bain', '2 wc', 'Espace vert - Jardin privatif', '', None, None, None, None, None, None, None, None];['https://photo.superimmo.com/274l2ylrbjznvhxav54ip086o7ms', 'https://photo.superimmo.com/pm2g4gs5x7jkyqfxrqxsvz5es2n5', 'https://photo.superimmo.com/yo41f9jx349tewx46wigl6adol0r', 'https://photo.superimmo.com/vk6aik6l10pf0b7wvg16bjklyiki', 'https://photo.superimmo.com/36i6b3lnrp1k0idwo6c0qee5xvcc', None, None, None, None, None]
109;https://www.superimmo.com/annonces/achat-maison-260m-peyrolles-en-provence-13860-xwdvvf;890000;260;7;5;Peyrolles-en-Provence (13860);3423;24/07/2024;Exclusivité;Terrasse;Honoraires à la charge du vendeur. Barème d’honoraires : https://homki-immobilier.com/notre-offre;"Pure place par Homki a le privilège de vous présenter en exclusivité une villa familiale d'exception. Plongée au cœur de la nature, dans le village authentique de Peyrolles-en-Provence, situé à seulement 25 min au nord d'Aix-en-Provence, cette maison de 260 m² ne manque pas d'atouts.
Construite en 2016, elle dévoile pleinement le charme typique de la Provence, avec une ambiance traditionnelle marquée par sa cheminée avec insert 3 faces, ses sols en terre cuite et sa construction de haute qualité utilisant des matériaux nobles.
De plain-pied, cette maison offre une charmante entrée avec rangement, une vaste pièce de vie de près de 80 m² s'articulant autour d'une cheminée à bois, l'un des éléments centraux de la maison. Exposé Sud-Ouest, cet espace, baigné de lumière, laisse entrevoir par sa verrière une belle cuisine authentique sur mesure équipée d'électroménager haut de gamme. Un espace buanderie complète les lieux.
Comme un lien entre l'intérieur et l'extérieur, une magnifique terrasse de 210 m², véritable jardin suspendu, orientée plein Sud, offre différents espaces propices à la détente.
L'espace nuit se distingue alors en deux parties de part et d'autre de la bâtisse. D'abord, une suite parentale incluant une salle de bains spacieuse avec douche et baignoire et un dressing, accompagnée de deux autres chambres ainsi que d'une salle d'eau avec WC.
De l'autre côté, on y découvre deux nouvelles chambres, accompagnées de deux salles d'eau avec toilettes.
Dans la continuité de cette partie, une pièce de vie supplémentaire de 42 m² pouvant être aménagée aussi bien en salle de jeux qu'en logement indépendant pour les amis ou la famille.
Érigée sur un terrain arboré d'1 hectare, piscinable, la maison bénéficie d'un cadre de vie privilégié où seul le chant des oiseaux pourrait sans doute bouleverser cette quiétude.
Pour finir, un double garage de 52 m² pouvant être aménagé en appartement ou pour stationner plusieurs voitures vient parfaire le tableau.
Les volets et les menuiseries en aluminium, le portail électrique, le forage, l'arrosage automatique et l'accès PMR viennent clore les prestations de cette maison.
Votre contact Pure place :
Je suis Manon Affergan, Salarié pour le compte de Homki Immobilier / SAS Homki. Je serais ravie de vous accompagner dans la découverte de ce bien.
Chez Pure place par Homki, nous nous engageons à transformer chaque projet immobilier en une expérience unique, grâce à une offre adaptée à un marché exigeant et avant-gardiste. Découvrez avec nous le luxe de l'espace et la sérénité d'un chez-soi pensé pour vous.
Des honoraires au plus juste pour un service sur mesure :
Pure Place par Homki offre aux acquéreurs et vendeurs un service complet et transparent. Nos frais d'agence sont fixés à 8 900 €, à la charge du vendeur.
Afficher plus";"['260 m² - 7 pièces - 5 chambres - ter. 10 000 m²', 'Orientation : Sud', 'Parking extérieur', '1 cave', 'Terrasse', 'Année de construction : 2016', 'Chauffage électrique', 'Séjour de 80 m²', ""3 salles d'eau - 1 salle de bain"", '4 wc', 'Jardin privatif', '', None, None, None, None, None, None, None, None]";['https://photo.superimmo.com/6qfc0z9uxdcb1yqygc95y2tbxemw', 'https://photo.superimmo.com/zq3g0xxsbu4g0hyvx64m03wsnurd', 'https://photo.superimmo.com/p6usatekk2be4xvb4zwxkwsa4wik', 'https://photo.superimmo.com/vhb5yjqw5jrgx3fcv77idbahkdmy', 'https://photo.superimmo.com/a49lf5346o3zar1kzi7kmholm5xh', None, None, None, None, None]
110;https://www.superimmo.com/annonces/achat-maison-157m-arles-13200-xwdvve;329900;157;6;4;Arles (13200);2101;24/07/2024;Exclusivité;Balcon;Honoraires à la charge du vendeur. Barème d’honoraires : https://homki-immobilier.com/notre-offre;"Exclusivité à ne pas rater à Arles !
Ne manquez pas cette opportunité d'acquérir cette Villa de type 6 d'une surface de 157m² édifiée sur une parcelle généreuse de 622m² nichée dans un quartier résidentiel d'Arles. Construite en 1965 et entièrement rénovée en 2000, cette propriété offre un cadre de vie paisible et confortable pour toute la famille.
Dès l'entrée, vous serez accueilli par un hall d'entrée élégant, offrant un accès fluide à l'ensemble de la maison. La cuisine équipée, fonctionnelle, est le lieu idéal pour préparer de délicieux repas en famille ou entre amis.
Une chambre spacieuse de 18,2m², une salle d'eau avec des WC et une réserve de 24,6m², offrant de nombreuses possibilités d'aménagement, complètent l'aménagement de ce niveau.
À l'étage, un séjour de 25,3m² avec un balcon offre un espace de vie convivial, baigné de lumière naturelle et offrant une vue panoramique sur le jardin verdoyant.
Trois chambres lumineuses, dont deux avec placards intégrés, offrent des espaces intimes pour toute la famille. Les superficies des chambres sont de 10,6m², 10,9m² et 18,1m², offrant une flexibilité d'utilisation.
Une salle de bains et des toilettes séparées complètent l'aménagement de cet étage.
À l'extérieur, un joli jardin arboré avec sa terrasse et son barbecue est l'endroit idéal pour profiter des journées ensoleillées en famille ou entre amis. Un garage de 34m² offre un espace de stationnement sécurisé pour votre véhicule, ainsi qu'un espace de rangement supplémentaire.
Ne manquez pas cette opportunité unique de devenir propriétaire de cette villa dans un quartier résidentiel d'Arles.
Confort et chauffage :
- Les portes et fenêtres sont en bois exotique, du double vitrage avec volets battants en bois et volets roulants électriques.
- Chauffage central au gaz.
- Climatisation réversible.
- Ballon électrique.
- Alarme.
Homki adore : Quartier paisible, superbe jardin, idéal pour la famille.
DPE : D
ERP : Les informations sur les risques auxquels ce bien est exposé sont disponibles sur le site Géorisques : www.georisques.gouv.fr
Informations financières :
La taxe foncière est de 2626 €
Qui est le Homker proche de chez vous ?
Je suis Michael, agent commercial immatriculé au RSAC de Tarascon sous le numéro 502 396 286, et je serais ravi de vous le faire découvrir ! Je suis à votre écoute tous les jours de 9H à 20H.
Qui est Homki ?
Homki offre aux acquéreurs et vendeurs un service complet et transparent pour que chaque projet immobilier soit une expérience innovante vécue sereinement.
Nos frais d'agence sont de 4 900 € fixes à la charge du vendeur.
Afficher plus";"['157 m² - 6 pièces - 4 chambres - ter. 622 m²', '2 niveaux', 'Orientation : Sud', 'Vue sur rue', 'Garage', 'Balcon', 'Terrasse', 'Année de construction : 1965', ""Assainissement : tout à l'égout"", 'Chauffage au gaz', 'Séjour de 25 m²', ""1 salle d'eau - 1 salle de bain"", '2 wc', 'Espace vert - Jardin privatif', None, None, None, None, None, None]";['https://photo.superimmo.com/1nqkweyvktm0e4xzlyj0u693uv92', 'https://photo.superimmo.com/k2jpbsypn99b99otbhkcskysyc4j', 'https://photo.superimmo.com/691bd7kjnae1ca9bbby3rxshax6o', 'https://photo.superimmo.com/ihliqadhp6b5nl3o2a6zx8yqdb6l', 'https://photo.superimmo.com/hatvgcpp08xoylcykwv84u7tr3sq', None, None, None, None, None]
111;https://www.superimmo.com/annonces/achat-appartement-125m-marseille-6eme-13006-xwdvva;310000;125;5;4;Marseille 6ème (13006);2480;24/07/2024;Terrasse;;Honoraires à la charge du vendeur. Barème d’honoraires : https://homki-immobilier.com/notre-offre;"Cours Julien 13006 Marseille : Idéalement situé en plein cœur du Cours Julien dans une impasse fleurie au CALME et à proximité immédiate de toutes les commodités du centre-ville (métro, bus, tramway, commerces, école, gare...).
Homki vous invite à découvrir en exclusivité dans un bel immeuble ancien très bien entretenu ce magnifique appartement unique en rez-de-chaussée et souplex de 125m² de type 5 avec grand GARAGE et COUR INTERIEURE.
Vous serez immédiatement séduit par ses beaux volumes, son excellent état, son calme, son cachet unique, ses nombreux rangements, son extérieur et son emplacement géographique.
L'appartement se compose au rez-de-chaussée d'une agréable pièce de vie de 40m² avec son espace cuisine équipée, le tout ouvrant sur une cour intérieure de 7m².
L'espace nuit bien distinct des pièces de vie se compose d'un hall desservant un accès au GARAGE, de 2 chambres de 12m² et 9m².
Pour finir, au rez-de-chaussée, vous disposerez d'une grande salle de bains de 7m² ainsi que des WC séparés.
La partie souplex se compose de 2 chambres de 13m² et 8m², d'une grande buanderie de 13m², d'une pièce rangement de 6m² et d'une salle d'eau avec des WC.
À découvrir sans tarder !
Informations financières :
La taxe foncière est de 1500€
Les charges sont de 100€
Qui est le Homker proche de chez vous ?
Je suis Robin Ricaut, agent commercial immatriculé au RSAC de Aix-en-Provence sous le numéro 537 770 216, et je serais ravi de vous le faire découvrir !
Qui est Homki ?
Homki offre aux acquéreurs et vendeurs un service complet et transparent afin que chaque projet immobilier soit une expérience innovante vécue sereinement.
Nos frais d'agence sont de 3 900 € fixes à la charge du vendeur.
Afficher plus";"['125 m² - 5 pièces - 4 chambres', 'Garage', 'Terrasse', 'Climatisation', 'Séjour de 40 m²', ""1 salle d'eau - 1 salle de bain"", '2 wc', 'Jardin privatif', None, None, None, None, None, None, None, None, None, None, None, None]";['https://photo.superimmo.com/pqmhsb7tfifry3xaz58a32dp4p1t', 'https://photo.superimmo.com/07wq4dn4b5xfffqcx82rh5n0sksf', 'https://photo.superimmo.com/edo3ag4smklk3ok4lpam4vrdnxfl', 'https://photo.superimmo.com/t0vl4dn5je48n1xdqxjjzbg5msy4', 'https://photo.superimmo.com/jtt2y2d5slw5n0su82jd7ed9y86l', None, None, None, None, None]
112;https://www.superimmo.com/annonces/achat-appartement-141m-marseille-10eme-13010-xwdvux;339000;141;4;3;Marseille 10ème (13010);2404;24/07/2024;Exclusivité;Dernier étage;Honoraires à la charge du vendeur. Barème d’honoraires : https://homki-immobilier.com/notre-offre;"ENTRE LA VILLA ET APPARTEMENT, je vous propose de découvrir ce duplex de 141 m² LOI CARREZ et 170 m² de surface au sol, situé au 1er et 2 ème étage d'une maison divisée en deux appartements.
Vous trouverez au 1er étage une entrée avec de nombreux rangements, une cuisine équipée, un vaste séjour de 40 m² bénéficiant de plusieurs fenêtres apportant une grande luminosité, une chambre avec salle d'eau, WC indépendants.
A l'étage : deux grandes chambres mansardées et une salle de bains. Vous avez également la jouissance exclusive d'un jardinet pour profiter des belles journées ensoleillées.
Qui est le Homker proche de chez vous ?
Je suis Eric Fallet, agent commercial immatriculé au RSAC de Marseille sous le numéro 342 483 609, et je serais ravi de vous le faire découvrir !
Informations financières :
La taxe foncière est de 2075€
Les charges sont de 25€
Qui est Homki ?
Homki offre aux acquéreurs et vendeurs un service complet et transparent afin que chaque projet immobilier soit une expérience innovante vécue sereinement.
Nos frais d'agence sont de 4 900 € fixes à la charge du vendeur.
Afficher plus";"['141 m² - 4 pièces - 3 chambres', 'Dernier étage (1er)', 'Orientation : Est, Ouest, Sud, Sud-Ouest', 'Garage', 'Terrasse', ""Assainissement : tout à l'égout"", 'Chauffage au gaz', 'Séjour de 40 m²', ""1 salle d'eau - 1 salle de bain"", '2 wc', None, None, None, None, None, None, None, None, None, None]";['https://photo.superimmo.com/b0sxeiaftojqvv9ywvlpok5u9p5f', 'https://photo.superimmo.com/jrrtbg6tw01dk4xr6htkq7w2iduf', 'https://photo.superimmo.com/my3guh37o9nsgyaov3eqaaxx7u3j', 'https://photo.superimmo.com/7isnx37dm79ig3eob3qs9byxh2dv', 'https://photo.superimmo.com/h8upjz4ibt2h6iepmiog3qwkbwv5', None, None, None, None, None]
