;url;price;surface;nb_pieces;nb_chambres;lieu;prix_m2;date_publication;tag_1;tag_2;tag_3;description;tags;images_url
210;https://www.superimmo.com/annonces/achat-maison-45m-saintes-maries-de-la-mer-13460-xwdvae;279000;45;1;2;Saintes-Maries-de-la-Mer (13460);6200;24/07/2024;Terrasse;Coin cuisine;Honoraires à la charge du vendeur. Barème d’honoraires : https://bareme.iadfrance.fr;"iad France - Celine Bernard (06 11 05 14 26) vous propose : Proche des Saintes Maries de la Mer, à seulement 9mn de la plage, venez découvrir cette charmante petite maison de 45m² environ, située au cOEur du Parc Naturel Régional de la Camargue. Idéalement située dans une résidence fermée et sécurisée, cette maison est idéale pour ceux qui recherchent un cadre de vie serein.
La maison comprend deux espaces nuits, une mezzanine, une salle d'eau et deux WC. Le coin cuisine et le salon forment à eux deux un espace de vie agréable.
La terrasse fermée dispose d'un barbecue en briques, parfait pour des moments conviviaux en famille ou entre amis. Un abri de jardin et un dégagement complètent ce bien, offrant des espaces de rangement supplémentaires.
Ne manquez pas cette opportunité unique de vivre au cOEur de la nature tout en étant à proximité de la mer.
Venez visiter et laissez-vous charmer par cette maison au cOEur de la Camargue !
La présente annonce immobilière vise 1 lot principal situé dans une copropriété formant 150 lots au total ne faisant l'objet d'aucune procédure en cours et d'un montant de charges d’environ 81.27 € par mois (soit 975.24 € annuel) déclaré par le vendeur.Honoraires d’agence à la charge du vendeur.Information d'affichage énergétique sur ce bien : classe ENERGIE E indice 293 et classe CLIMAT B indice 9. Les informations sur les risques auxquels ce bien est exposé sont disponibles sur le site Géorisques : www.georisques.gouv.fr. La présente annonce immobilière a été rédigée sous la responsabilité éditoriale de Mlle Celine Bernard EI (ID 47633), mandataire indépendant en immobilier (sans détention de fonds), agent commercial de la SAS I@D France immatriculé au RSAC de TARASCON sous le numéro 392225629, titulaire de la carte de démarchage immobilier pour le compte de la société I@D France SAS.
Retrouvez tous nos biens sur notre site internet.
Afficher plus";['45 m² - 1 pièce - 2 chambres - ter. 100 m²', 'Terrasse', 'Année de construction : 1975', 'Chauffage électrique (radiateurs)', 'Coin cuisine', 'Copropriété de 150 lots', None, None, None, None, None, None, None, None, None, None, None, None, None, None];['https://photo.superimmo.com/omt59880i09issvy7se6g8ev446a', 'https://photo.superimmo.com/zy1siz39uu9edoy675j6mgo0rvqz', 'https://photo.superimmo.com/mjs2qf5s6g6e09f761xyey7ccd5g', 'https://photo.superimmo.com/s1gedl451huim1f555ctg6o1q2l1', 'https://photo.superimmo.com/smj5r2jmpb9mxkwmagcrg74bgtf1', None, None, None, None, None]
211;https://www.superimmo.com/annonces/achat-maison-165m-la-ciotat-13600-xwdv97;1490000;165;5;3;La Ciotat (13600);9030;24/07/2024;Exclusivité;Piscine;Honoraires à la charge du vendeur. Barème d’honoraires : https://bareme.iadfrance.fr;"iad France - Dylan Vernier (07 86 23 28 57) vous propose : Villa d’Exception à La Ciotat
Découvrez cette somptueuse villa située à La Ciotat, offrant une vue imprenable sur la mer Méditerranée. Nichée au cOEur d'un terrain paysagé de 4 989 m², cette propriété de 125 m² est un véritable havre de paix.
Caractéristiques de la Villa : Superficie : 125 m² - Pièces : 4 pièces - Salon lumineux avec de grandes baies vitrées ouvrant sur une terrasse ensoleillée. - Cuisine équipée moderne et fonctionnelle. - Trois chambres spacieuses - Deux salles de bains supplémentaires, avec des équipements haut de gamme :Magnifique piscine privée entourée d’un espace détente et d’un jardin méditerranéen. - Grande terrasse avec vue panoramique sur la mer, idéale pour les soirées d’été.
Dépendance : Superficie : 40 m² - Composition : Pièce à vivre, kitchenette, salle de bain, idéale pour recevoir des invités ou pour une location saisonnière.
Extérieur : Terrain : 4 989 m² de terrain paysagé, arboré d'essences méditerranéennes, offrant un cadre exceptionnel et une grande intimité. Parking : Plusieurs places de stationnement
Localisation : Située dans un secteur prisé de La Ciotat, cette villa bénéficie de la tranquillité tout en étant proche des commodités et des plages. Un véritable bijou pour les amoureux de la mer et de la nature.
Nous consulter pour plus de détails. Pour plus d’informations ou pour organiser une visite, n’hésitez pas à nous contacter. Cette villa d’exception n’attend plus que vous ! Ne laissez pas passer cette opportunité unique de vivre dans un cadre idyllique à La Ciotat .
La présente annonce immobilière vise 2 lots principaux situés dans une copropriété formant 3 lots au total ne faisant l'objet d'aucune procédure en cours déclarée par le vendeur.Honoraires d’agence à la charge du vendeur.Information d'affichage énergétique sur ce bien : classe ENERGIE C indice 149 et classe CLIMAT A indice 4. Les informations sur les risques auxquels ce bien est exposé sont disponibles sur le site Géorisques : www.georisques.gouv.fr. La présente annonce immobilière a été rédigée sous la responsabilité éditoriale de M. Dylan Vernier EI (ID 82721), mandataire indépendant en immobilier (sans détention de fonds), agent commercial de la SAS I@D France immatriculé au RSAC de Marseille sous le numéro 882269608, titulaire de la carte de démarchage immobilier pour le compte de la société I@D France SAS.
Retrouvez tous nos biens sur notre site internet.
Afficher plus";['165 m² - 5 pièces - 3 chambres - ter. 4 989 m²', 'Piscine', 'Année de construction : 2002', 'Alarme - Digicode - Interphone', 'Télévision par cable', 'Copropriété de 4 lots', None, None, None, None, None, None, None, None, None, None, None, None, None, None];['https://photo.superimmo.com/pttiiz0yblaix1qcca88a3h3z2ce', 'https://photo.superimmo.com/t8pv1zkx2d9yo7k6rgs4lviw0h06', 'https://photo.superimmo.com/fm8y0sbc9vo91l3pxdg1ukiy715o', 'https://photo.superimmo.com/mpum2ykvq50c4u7jqukvpt0oibt8', 'https://photo.superimmo.com/g441mv69xtfik4u77pww095he9ax', None, None, None, None, None]
212;https://www.superimmo.com/annonces/achat-appartement-58m-marseille-9eme-13009-xwdv94;179000;58;3;2;Marseille 9ème (13009);3086;24/07/2024;Étage 8/21 avec ascenseur;;Honoraires à la charge du vendeur. Barème d’honoraires : https://bareme.iadfrance.fr;"iad France - Sophie Ducarne (07 64 39 31 30) vous propose :
Ce bel appartement traversant et lumineux de 58m² Carrez est composé d’un salon spacieux avec une vue panoramique exceptionnelle, d’une cuisine séparée aménagée avec sa buanderie attenante, de deux belles chambres dont une vue mer, d’une salle d'eau, d’un WC séparé et d'un joli balcon.
Situé au 8ème étage, traversant et orienté Est-Ouest l’appartement est baigné de lumière tout au long de la journée. Aucun travaux à prévoir.
Implanté au cOEur de la Rouvière, vous vivrez dans un cadre idyllique où tout est à portée de main, médecins, pharmacies, crèches, école, nombreux commerces… l’emplacement est idéal pour une vie pratique et confortable. Ne manquez pas cette opportunité !
Une cave est également comprise dans le lot, offrant ainsi un espace de rangement supplémentaire.
La présente annonce immobilière vise 1 lot principal situé dans une copropriété formant 2096 lots au total ne faisant l'objet d'aucune procédure en cours et d'un montant de charges d’environ 225 € par mois (soit 2700 € annuel) déclaré par le vendeur.Honoraires d’agence à la charge du vendeur.Information d'affichage énergétique sur ce bien : classe ENERGIE D indice 177 et classe CLIMAT D indice 38. Les informations sur les risques auxquels ce bien est exposé sont disponibles sur le site Géorisques : www.georisques.gouv.fr. La présente annonce immobilière a été rédigée sous la responsabilité éditoriale de Mme Sophie Ducarne EI (ID 81869), mandataire indépendant en immobilier (sans détention de fonds), agent commercial de la SAS I@D France immatriculé au RSAC de Marseille sous le numéro 987547155, titulaire de la carte de démarchage immobilier pour le compte de la société I@D France SAS.
Retrouvez tous nos biens sur notre site internet.
Afficher plus";['58 m² - 3 pièces - 2 chambres', 'Étage 8/21 avec ascenseur', 'Gardien', 'Interphone', 'Copropriété de 4192 lots', '', None, None, None, None, None, None, None, None, None, None, None, None, None, None];['https://photo.superimmo.com/4qm00wt8kyjxvy10p6ikcdyqohez', 'https://photo.superimmo.com/7ox57o9jyejetneeogjfv0elbl2m', 'https://photo.superimmo.com/q68idgv2sv09a04fur1w3dqmt0ea', 'https://photo.superimmo.com/1ro5si4lio06qlupdt13yk5wqys5', 'https://photo.superimmo.com/ubpfpzsfdlrsnd76zxqojry7zrd3', None, None, None, None, None]
213;https://www.superimmo.com/annonces/achat-maison-280m-velaux-13880-xwdv89;880000;280;9;6;Velaux (13880);3143;24/07/2024;Chauffage au fuel (radiateurs);Piscine;Honoraires à la charge du vendeur. Barème d’honoraires : https://bareme.iadfrance.fr;"iad France - John-Steven Greenaway (06 22 97 38 69) vous propose : Nichée dans la paisible commune de Velaux, cette propriété exceptionnelle s'étend sur un terrain de 4000 m² et abrite deux habitations distinctes pour une superficie totale de 280 m². Chaque maison, baignée de lumière grâce à son exposition plein sud, offre des espaces de vie généreux avec leurs salons, salles à manger et cuisines entièrement équipées. Chacune dispose de trois chambres, avec suite parentale , un grand garage d'environ 30m², une cave
Les prestations de cette propriété : climatisation, fenêtres à double vitrage, volets roulants et stores bannes électriques etc
L'approvisionnement en eau pour l'extérieur est assuré par un forage tout en bénéficiant de l'eau de ville, garantissant ainsi une gestion optimale des ressources.
Chauffage par climatisation et chaudière fuel
Les grandes terrasses ombragées donnent sur les jardins, magnifiquements arborés, offre un cadre de vie idyllique avec une piscine accueillante et des dépendances de rangement pratiques.
Cet ensemble immobilier, est idéal pour un achat en famille, entre amis, ou pour des investisseurs à la recherche d'une opportunité locative attractive. Vous pouvez choisir d'habiter une maison et de louer l'autre, maximisant ainsi votre investissement.
Venez découvrir ce havre de paix où le calme et la sérénité règnent en maître, une perle rare sur le marché immobilier de Velaux.
La ville de Velaux offre de nombreux avantages, qui en font une destination prisée pour les acheteurs immobiliers et les familles en quête de tranquillité et de qualité de vie.
Cadre de vie agréable : Velaux est réputée pour son environnement calme et verdoyant, offrant une qualité de vie exceptionnelle. La commune est entourée de paysages naturels magnifiques, propices aux promenades et aux activités de plein air.
Proximité des grandes villes : Située à seulement une trentaine de kilomètres de Marseille et à proximité d'Aix-en-Provence, Velaux permet de bénéficier des avantages de la vie rurale tout en étant proche des grandes agglomérations et de leurs infrastructures.
Infrastructures de qualité : Velaux dispose d'écoles, de crèches, d'un collège, de commerces de proximité, de centres sportifs et culturels, offrant ainsi tous les services nécessaires à une vie quotidienne confortable et agréable.
Vie associative et culturelle : Velaux est dynamique sur le plan associatif, culturel et sportif avec de nombreuses activités et événements organisés tout au long de l'année, favorisant le lien social et la convivialité entre les habitants.
Accessibilité : Velaux est bien desservie par les réseaux routiers et les transports en commun, facilitant les déplacements vers les villes voisines et les principales zones d'activité de la région.
En résumé, Velaux combine le charme d'une petite ville provençale avec les avantages d'une localisation stratégique, offrant un cadre de vie idyllique pour tous ceux qui recherchent la tranquillité sans renoncer à la proximité des grandes agglomérations.
Honoraires d’agence à la charge du vendeur.Information d'affichage énergétique sur ce bien : classe ENERGIE D indice 112 et classe CLIMAT D indice 32. Les informations sur les risques auxquels ce bien est exposé sont disponibles sur le site Géorisques : www.georisques.gouv.fr. La présente annonce immobilière a été rédigée sous la responsabilité éditoriale de M. John-Steven Greenaway EI (ID 71838), mandataire indépendant en immobilier (sans détention de fonds), agent commercial de la SAS I@D France immatriculé au RSAC de SALON DE PROVENCE sous le numéro 520661083, titulaire de la carte de démarchage immobilier pour le compte de la société I@D France SAS.
Retrouvez tous nos biens sur notre site internet.
Afficher plus";['280 m² - 9 pièces - 6 chambres - ter. 4 061 m²', 'Piscine', 'Année de construction : 2003', 'Chauffage au fuel (radiateurs)', 'Climatisation', 'Télévision par cable', None, None, None, None, None, None, None, None, None, None, None, None, None, None];['https://photo.superimmo.com/666j1vseg51waoj0p75x8k16tflh', 'https://photo.superimmo.com/74agxof96nglgxu75k6lxossrc1f', 'https://photo.superimmo.com/9u8o98vbia07z7p4gmfiqpkryeah', 'https://photo.superimmo.com/9lvjomj4blutz7v86s8r4jd43vo3', 'https://photo.superimmo.com/hhzs5zz91hylimcnx32wrvsb51hd', None, None, None, None, None]
214;https://www.superimmo.com/annonces/achat-maison-147m-eyguieres-13430-xwdv5s;498000;147;5;3;Eyguières (13430);3388;24/07/2024;Chauffage au fuel;Piscine;Honoraires à la charge du vendeur. Barème d’honoraires : https://bareme.iadfrance.fr;"iad France - Angélique Lambert (06 73 69 62 91) vous propose : A la recherche d'une charmante maison traditionnelle de plain-pied à Eyguières? Venez découvrir cette petite pépite.
En bon état général et avec beaucoup de possibilités d'aménagement, cette maison comprend actuellement un grand séjour lumineux, une cuisine indépendante, deux espaces bureau et 3 suites parentales.
Située à proximité du collège et du stade, elle vous séduira par ses volumes, son exposition et son charme.
Les +: Jolie piscine, climatisation, forage, deux doubles garages, chalet et d'autres surprises
Honoraires d’agence à la charge du vendeur.Information d'affichage énergétique sur ce bien : classe ENERGIE C indice 131 et classe CLIMAT C indice 16. Les informations sur les risques auxquels ce bien est exposé sont disponibles sur le site Géorisques : www.georisques.gouv.fr. La présente annonce immobilière a été rédigée sous la responsabilité éditoriale de Mme Angélique Lambert EI (ID 58178), mandataire indépendant en immobilier (sans détention de fonds), agent commercial de la SAS I@D France immatriculé au RSAC de TARASCON sous le numéro 898885223, titulaire de la carte de démarchage immobilier pour le compte de la société I@D France SAS.
Retrouvez tous nos biens sur notre site internet.
Afficher plus";['147 m² - 5 pièces - 3 chambres - ter. 1 780 m²', 'Piscine', 'Année de construction : 1962', 'Chauffage au fuel', 'Climatisation', 'Alarme', None, None, None, None, None, None, None, None, None, None, None, None, None, None];['https://photo.superimmo.com/3aovjgb1ry8eynx71f9vcztpm5x0', 'https://photo.superimmo.com/ledgknp5q2q6p2uc7v2gq7evqrs3', 'https://photo.superimmo.com/v6nlm7b6wldhxsmzqh1087jn8lv9', 'https://photo.superimmo.com/cgz6vbgwcfyo42mv26b84v0g66zi', 'https://photo.superimmo.com/q6hw92lwhiw8bjedpmpbegrhk9ss', None, None, None, None, None]
215;https://www.superimmo.com/annonces/achat-appartement-34m-marseille-3eme-13003-xwdv5n;59000;34;2;1;Marseille 3ème (13003);1735;24/07/2024;Étage 2/3;Chauffage individuel électrique (radiateurs);Honoraires à la charge du vendeur. Barème d’honoraires : https://bareme.iadfrance.fr;"iad France - Gary Delgado-Coronel (06 50 28 34 13) vous propose : Opportunité à saisir ! Charmant appartement 2 pièces à rénover, idéalement situé au cOEur de Marseille. Ce bien de 34m², comprenant une chambre, une salle d'eau, une cuisine et un séjour, offre un potentiel incroyable pour un premier achat ou un investissement locatif. Situé au 2ème étage d'un immeuble de 3 étage sans ascenseur, cet appartement bénéficie d'une exposition ouest, apportant une belle luminosité naturelle. Les équipements incluent la fibre optique, des convecteurs électriques et une cuisine non équipée. Des travaux de rénovation sont à prévoir pour personnaliser cet espace selon vos goûts. Ne tardez pas à visiter cet appartement à rénover dans un quartier vivant de Marseille, proche de toutes les commodités. Une occasion à ne pas manquer !
La présente annonce immobilière vise 1 lot principal situé dans une copropriété formant 8 lots au total ne faisant l'objet d'aucune procédure en cours et d'un montant de charges d’environ 100 € par mois (soit 1200 € annuel) déclaré par le vendeur.Honoraires d’agence à la charge du vendeur.Information d'affichage énergétique sur ce bien : classe ENERGIE C indice 155 et classe CLIMAT A indice 4. Les informations sur les risques auxquels ce bien est exposé sont disponibles sur le site Géorisques : www.georisques.gouv.fr. La présente annonce immobilière a été rédigée sous la responsabilité éditoriale de M. Gary Delgado-Coronel EI (ID 38355), mandataire indépendant en immobilier (sans détention de fonds), agent commercial de la SAS I@D France immatriculé au RSAC de MARSEILLE sous le numéro 853281574, titulaire de la carte de démarchage immobilier pour le compte de la société I@D France SAS.
Retrouvez tous nos biens sur notre site internet.
Afficher plus";['34 m² - 2 pièces - 1 chambre', 'Étage 2/3', 'Année de construction : 1965', 'Chauffage individuel électrique (radiateurs)', 'Télévision par cable', 'Copropriété de 8 lots', None, None, None, None, None, None, None, None, None, None, None, None, None, None];['https://photo.superimmo.com/gnpc7jrngxwfahiqjskg5eyh3sxq', 'https://photo.superimmo.com/vqg2fu8e5fy1ivq004ng2jdcx6jc', None, None, None, None, None, None, None, None]
216;https://www.superimmo.com/annonces/achat-appartement-34m-marseille-3eme-13003-xwdv5n;59000;34;2;1;Marseille 3ème (13003);1735;24/07/2024;Étage 2/3;Chauffage individuel électrique (radiateurs);Honoraires à la charge du vendeur. Barème d’honoraires : https://bareme.iadfrance.fr;"iad France - Gary Delgado-Coronel (06 50 28 34 13) vous propose : Opportunité à saisir ! Charmant appartement 2 pièces à rénover, idéalement situé au cOEur de Marseille. Ce bien de 34m², comprenant une chambre, une salle d'eau, une cuisine et un séjour, offre un potentiel incroyable pour un premier achat ou un investissement locatif. Situé au 2ème étage d'un immeuble de 3 étage sans ascenseur, cet appartement bénéficie d'une exposition ouest, apportant une belle luminosité naturelle. Les équipements incluent la fibre optique, des convecteurs électriques et une cuisine non équipée. Des travaux de rénovation sont à prévoir pour personnaliser cet espace selon vos goûts. Ne tardez pas à visiter cet appartement à rénover dans un quartier vivant de Marseille, proche de toutes les commodités. Une occasion à ne pas manquer !
La présente annonce immobilière vise 1 lot principal situé dans une copropriété formant 8 lots au total ne faisant l'objet d'aucune procédure en cours et d'un montant de charges d’environ 100 € par mois (soit 1200 € annuel) déclaré par le vendeur.Honoraires d’agence à la charge du vendeur.Information d'affichage énergétique sur ce bien : classe ENERGIE C indice 155 et classe CLIMAT A indice 4. Les informations sur les risques auxquels ce bien est exposé sont disponibles sur le site Géorisques : www.georisques.gouv.fr. La présente annonce immobilière a été rédigée sous la responsabilité éditoriale de M. Gary Delgado-Coronel EI (ID 38355), mandataire indépendant en immobilier (sans détention de fonds), agent commercial de la SAS I@D France immatriculé au RSAC de MARSEILLE sous le numéro 853281574, titulaire de la carte de démarchage immobilier pour le compte de la société I@D France SAS.
Retrouvez tous nos biens sur notre site internet.
Afficher plus";['34 m² - 2 pièces - 1 chambre', 'Étage 2/3', 'Année de construction : 1965', 'Chauffage individuel électrique (radiateurs)', 'Télévision par cable', 'Copropriété de 8 lots', None, None, None, None, None, None, None, None, None, None, None, None, None, None];['https://photo.superimmo.com/gnpc7jrngxwfahiqjskg5eyh3sxq', 'https://photo.superimmo.com/vqg2fu8e5fy1ivq004ng2jdcx6jc', None, None, None, None, None, None, None, None]
217;https://www.superimmo.com/annonces/achat-maison-87m-marseille-13eme-13013-xwdv4m;499000;87;3;2;Marseille 13ème (13013);5736;24/07/2024;Chauffage électrique (radiateurs);Piscine;Honoraires à la charge du vendeur. Barème d’honoraires : https://bareme.iadfrance.fr;"iad France - Marine Gautier (06 35 40 69 58) vous propose : MARSEILLE - 13013 (Chateau Gombert). Découvrez cette magnifique maison de 1936, de type 4 d'environ 87 m², parfaitement entretenue et prête à vous accueillir sans aucun travaux à prévoir. Située dans le quartier paisible et recherché de Château-Gombert, cette propriété offre un cadre de vie idéal pour une famille. De plain pied, profitez d'une pièce de vie spacieuse et lumineuse d'environ 38m², idéale pour recevoir vos proches et profiter de moments conviviaux, de deux chambres confortables ainsi que d'une salle de bains avec son espace toilettes. A l'étage, une mezzanine pouvant être aménagée en troisième chambre ou en bureau, en fonction de vos besoins.
A l'extérieur, profitez d'une parcelle de 504 m², sans vis-à-vis, comprenant une piscine, parfait pour se détendre en toute tranquillité durant les chaudes journées d'été, d'une cuisine extérieure, pour profiter, en toute intimité, des repas en plein air et de plusieurs dépendances.
Idéalement située dans un quartier prisé de Marseille, cette demeure est proche de toutes les commodités (commerces, écoles, transports en commun).
Honoraires d’agence à la charge du vendeur.Information d'affichage énergétique sur ce bien : classe ENERGIE C indice 96 et classe CLIMAT C indice 19. Les informations sur les risques auxquels ce bien est exposé sont disponibles sur le site Géorisques : www.georisques.gouv.fr. La présente annonce immobilière a été rédigée sous la responsabilité éditoriale de Mlle Marine Gautier EI (ID 82869), mandataire indépendant en immobilier (sans détention de fonds), agent commercial de la SAS I@D France immatriculé au RSAC de Marseille sous le numéro 883914533, titulaire de la carte de démarchage immobilier pour le compte de la société I@D France SAS.
Retrouvez tous nos biens sur notre site internet.
Afficher plus";['87 m² - 3 pièces - 2 chambres - ter. 504 m²', 'Piscine', 'Année de construction : 1936', 'Chauffage électrique (radiateurs)', 'Alarme', '', None, None, None, None, None, None, None, None, None, None, None, None, None, None];[None, None, None, None, None, None, None, None, None, None]
