;url;price;surface;nb_pieces;nb_chambres;lieu;prix_m2;date_publication;tag_1;tag_2;tag_3;description;tags;images_url
29;https://www.superimmo.com/annonces/achat-maison-126m-martigues-13500-xwd1aj;375950;126;4;3;Martigues (13500);2984;20/07/2024;;;Honoraires à la charge du vendeur. Barème d’honoraires : https://www.myproimmobilier.com/accueil-my-pro-immobilier-agence-immobiliere-istres;"Pour les amoureux de l'ancien-En pleine garrigue à 500m des plages
C'est en pleine garrigue, au calme absolu, que nous vous invitons à venir découvrir cette belle bâtisse ayant traversé les époques.
De type 4, d'une surface de 120m²env. elle vous séduira par son charme et ses beaux volumes!
Lors de votre visite,vous découvrirez de plain pied:
-une cuisine traversante donnant sur une jolie cour extérieure,
-un spacieux séjour avec cheminée et poutres apparentes,
-un cellier,
-un WC séparé,
et un atelier de 15m²env/espace de rangement
A l'étage/un grand hall desservant :
-trois belles chambres de 12,50 13,50 et 20,00 m²/toutes équipées de nombreux placards
-un WC séparé
-une salle d'eau disposant d'une cabine de douche et d'un meuble vasque
-un accès sur une seconde cour extérieure
-36m²env. de combles aménageables
Côté jardin, comme précédemment indiqué, le bien dispose de deux cours extérieures mais ce n'est pas tout!
Un beau jardin de 120m²env. entièrement cloturé et disposant d'une terrasse ombragée par une pergola,d'un barbecue,ainsi que deux places de stationnement.
A visiter sans plus tarder!
Prix 375 950 euros TTC frais d'agence inclus
My pro immobilier agence immobilière sur Istres
Afficher plus";"['126 m² - 4 pièces - 3 chambres - ter. 256 m²', 'Parking extérieur', ""1 salle d'eau - 1 salle de bain"", '2 wc', None, None, None, None, None, None, None, None, None, None, None, None, None, None, None, None]";['https://photo.superimmo.com/9u9rfqc6evz0etv7urmji63msp4p', 'https://photo.superimmo.com/lnxz4j1zh7yi877p8jwh94vrewgw', 'https://photo.superimmo.com/u7tko0vhhpb14w91odh2263rye16', 'https://photo.superimmo.com/idmfzwmvbmkoi5rofi9al2upyr7o', 'https://photo.superimmo.com/mhdfuophyqlcsrcua8yxslr6n6w0', None, None, None, None, None]
30;https://www.superimmo.com/annonces/achat-maison-108m-bouc-bel-air-13320-xwd1ai;580000;108;4;3;Bouc-Bel-Air (13320);5370;20/07/2024;Chauffage: pompe à chaleur;;Honoraires à la charge du vendeur. Barème d’honoraires : https://fr.foncia.com/agence-immobiliere/aix-en-provence-13/agence-immobiliere/foncia-transaction-aix-en-provence-espariat-2493;"Située dans un quartier calme et recherché, proche du village , et des écoles, sur parcelle dominante d'environ 500 m2, Charmante maison d'environ 105 m2 composée d'un vaste séjour salle à manger traversant d’environ 55 m² et une cuisine indépendante.
Côté nuit, vous découvrirez trois belles chambres, dont une avec double dressing, et enfin une salle de bain.
Vous serez séduits par la qualité des matériaux utilisés pour sa construction, les prestations haut de gamme qui la rendent aussi très économique au quotidien : la climatisation réversible dans chaque pièce, un poêle à bois pour les soirées d'hiver, un système de sécurité pour votre tranquillité d'esprit, un arrosage automatique intégré.
Côté extérieur , vous serez charmés par les différents espaces entourant la maison : une grande terrasse avec tonnelle, salon avec terrasse en bois, belle cuisine d’été,
Côté piscine, un espace de détente pour transats ou canapés vous permettra de vous relaxer en toute quiétude et sans vis-à-vis et un coin piscine avec douche et WC
Enfin, vous bénéficiiez d'un espace de stationnement privatif à l'intérieur de la parcelle, 2 caves et un abri.
Contact SYLVIE : 0785808565
Afficher plus";['Disponible immédiatement', '108 m² - 4 pièces - 3 chambres', 'Traversant', 'Année de construction : 2001', 'Chauffage: pompe à chaleur', '1 salle de bain', None, None, None, None, None, None, None, None, None, None, None, None, None, None];['https://photo.superimmo.com/l713gtkmesqp429nfl2cxj3bvmu5', 'https://photo.superimmo.com/b5ssk4xqsufzto08kl5roa6ryqjx', 'https://photo.superimmo.com/ll1oq4eno95b2qh8lem4j8ccqbwd', 'https://photo.superimmo.com/i1dh873vp6iaug489nfb4vj4e6iw', 'https://photo.superimmo.com/midogyxu5vct5g3mzbkhuk699t4d', None, None, None, None, None]
31;https://www.superimmo.com/annonces/achat-maison-170m-maussane-les-alpilles-13520-xwd1ah;1160000;170;7;5;Maussane-les-Alpilles (13520);6824;20/07/2024;;;Honoraires à la charge du vendeur.;"Alpilles Sud: Rare:
Idéalement située en position dominante et à pied du centre village de Maussane les Alpilles, venez découvrir cette magnifique Bastide aux allures contemporaines d'environ 170 m2 comprenant un bel espace de vie d'environ 45 m2, Salon-Cheminée insert, très lumineux avec de grandes baies à galandages donnant au Sud, salle à manger, cuisine entièrement équipée, puis une belle suite paretanle en rez de chaussée avec douche italienne, dressing et wc.
A l'étage: Grand escalier desservant 3 grandes chambres avec une salle d'eau/ Douche italienne.
Puis indépenadante et attenante à la maison, une autre suite avec douche, wc et dressing.
Grand garage de 30 m2 avec porte automatique.
Le jardin est clos et paysager. Une piscine originale carrée de 5,5 m x 5,5 m vient compléter la propriété. Grande terrasse en bois, et une terrasse semi couverte pour les douces soirées d'été. Le bien est situé dans un quartier résidentiel très calme. Maison de famille idéale ou pour faire de la location saisonnière si besoin. A voir absolument.... --
Afficher plus";"['170 m² - 7 pièces - 5 chambres - ter. 869 m²', ""1 salle d'eau"", None, None, None, None, None, None, None, None, None, None, None, None, None, None, None, None, None, None]";['https://photo.superimmo.com/zq4lm8xvw9atbc0241bn81quo521', 'https://photo.superimmo.com/apor3wg3gvjjrvik8tmiiw3uye7d', 'https://photo.superimmo.com/28f7wyj8auo55zv1668c895cgod0', 'https://photo.superimmo.com/8aztszvf9iqv4h1l0uc10hshxkjw', 'https://photo.superimmo.com/zbhvev6nejib2svw1r6q5eu9lpdw', None, None, None, None, None]
32;https://www.superimmo.com/annonces/achat-appartement-68m-aix-en-provence-13290-xwd1ae;315000;68;3;2;Aix-en-Provence (13290);4632;20/07/2024;Exclusivité;;Honoraires à la charge de l'acquéreur : 5% TTC - 15 000 € TTC inclus dans le prix de vente - Prix hors honoraires : 300 000 €.;"M-OI Aix-en-Provence vous propose à la vente cet appartement rénové avec garage et parking au cœur du village des Milles.
Situation et contexte :
Appartement situé au cœur du paisible village des Milles, à proximité immédiate des commerces, transports et écoles. Cadre calme et recherché.
Description intérieure :
Cet appartement rénové de [surface en m²] offre un salon avec séjour et une cuisine ouverte.
Coin nuit :
La partie nuit comprend deux chambres, un dressing et une salle de bains avec toilettes. Aménagement optimisé pour garantir confort et praticité.
Prestations complémentaires :
Ce bien est complété par un garage et une place de stationnement privative, offrant des solutions de stationnement idéales.
Conclusion :
Une belle opportunité d'acquérir un appartement rénové au cœur du village des Milles.
L'adresse du bien, la vidéo de visite virtuelle et toutes les informations financières sont disponibles en ligne sur le site de Mon Office Immobilier avec la référence 4534-MBA (Lien direct sur les photos)
--
--
À votre service : Mathilde BAILLE - +33684746245
Agent commercial immatriculé au RSAC de Draguignan - N°981778426
Référence annonce : 4534-MBA
Le prix indiqué comprend les honoraires à la charge de l'acheteur.
Les informations sur les risques auxquels ce bien est exposé sont disponibles sur le site Géorisques : www.georisques.gouv.fr
Afficher plus";['68 m² - 3 pièces - 2 chambres', '1 salle de bain', None, None, None, None, None, None, None, None, None, None, None, None, None, None, None, None, None, None];['https://photo.superimmo.com/ippfjq1bc0ce55tkbfnfsdrokq67', 'https://photo.superimmo.com/zfeieshrbxvgxiou8d1sl3rabmig', 'https://photo.superimmo.com/djehx48nzn0s15yw4lplsoyvpytw', 'https://photo.superimmo.com/8ec8dunb4grikp3ps46309zcve2s', 'https://photo.superimmo.com/kh1hoa13eyevigqmi36jt81tqjjp', 'https://photo.superimmo.com/26ychan6ssorxrtmzofc71kdbsbp', None, None, None, None]
33;https://www.superimmo.com/annonces/achat-appartement-65m-marseille-13eme-13013-xwd1ad;259000;65;3;2;Marseille 13ème (13013);3985;20/07/2024;;;Honoraires à la charge du vendeur. Barème d’honoraires : https://www.maxihome.net/clients/maxihome/images/filemanager/bareme_2023.pdf;"!! Château Gombert !!
Appartement T3 lumineux de plus de 65 m² en rez de jardin avec plus de 50 m² d'extérieur exposé sud est.
Il se compose d'une belle pièce a vivre de 23m² avec cuisine séparée (pouvant être ouverte) de presque 9m², pour la partie nuit, un couloir dessert deux chambres, une salle d'eau et wc séparé. Nombreux rangements.
Un box en sous sol vient compléter ce bien.
Situé dans une résidence sécurisée, au calme et proche de toutes commodités (par athéna, crèche, école, collège, bus, commerce), n'attendez plus pour venir visiter votre futur coup de coeur !!! (MB)
A visiter rapidement, contactez-nous pour organiser une visite Marie BRACCI : CLAIRIMMO Chateau Gombert - 13 rue Centrale 13013 CHATEAU GOMBERT -Tél : 04 91 502 502 email : l RCS 851 986 620";"['65 m² - 3 pièces - 2 chambres', 'Orientation : Est / Ouest', 'Garage', 'Climatisation', ""1 salle d'eau"", '1 wc', 'Copropriété de 60 lots', '', None, None, None, None, None, None, None, None, None, None, None, None]";['https://photo.superimmo.com/njpg861trcf5rziaocun5gcojr73', 'https://photo.superimmo.com/j079fvm8h3ajh5qg29mzns39j2hn', 'https://photo.superimmo.com/zfg5rya8bbctkv2x4crcbqt6dl7o', 'https://photo.superimmo.com/5u3h0z0chm9bq25y0ou2grjl2w6q', 'https://photo.superimmo.com/p50ib5lvq6p8jngp9j2d9mn5u5x8', None, None, None, None, None]
34;https://www.superimmo.com/annonces/achat-appartement-90m-marseille-6eme-13006-xwd11o;325000;90;3;2;Marseille 6ème (13006);3611;20/07/2024;;;Honoraires à la charge du vendeur. Barème d’honoraires : https://bareme.iadfrance.fr;"iad France - Jean-François KIEHL (06 62 56 36 22) vous propose : Ce superbe appartement de type 3, idéalement situé dans un quartier recherché à proximité de la Place Castellane. Il Offre des espaces généreux et bien agencés, il est parfait pour une famille ou un couple à la recherche de confort et de commodités.
Prévoir un budget pour des travaux de rafraichissement.
Aménagements Intérieurs :
-Grand séjour : un espace de vie ouvert et accueillant, parfait pour se détendre et recevoir vos invités. Le séjour dispose d’un balcon.
-Deux Chambres confortables : chaque chambre dispose d’un balcon, est spacieuse et lumineuse, idéale pour des nuits paisibles
-une cuisine fonctionnelle pour préparer vos repas avec plaisir.
- une salle de bain et un espace de rangement , équipée d'une baignoire. Possibilité d'aménager une douche à l'italienne supplémentaire pour un confort quotidien optimal.
Espaces Extérieurs :
-Deux Balcons : Profitez de l'extérieur grâce à deux balcons, parfaits pour vos moments de détente.
Localisation :
- Quartier Recherché : situé dans une zone agréable, à proximité des commodités.
Points Forts :
•Espaces lumineux et bien agencés.
•Deux balcons pour profiter de l'extérieur.
•Emplacement idéal, proche des commodités et des transports.
Garage Privé en sus: un espace de stationnement sécurisé pour votre véhicule, ajoutant un confort supplémentaire.
La présente annonce immobilière vise 1 lot principal situé dans une copropriété formant 271 lots au total ne faisant l'objet d'aucune procédure en cours et d'un montant de charges d’environ 276 € par mois (soit 3312 € annuel) déclaré par le vendeur.Honoraires d’agence à la charge du vendeur.Information d'affichage énergétique sur ce bien : classe ENERGIE C indice 114 et classe CLIMAT C indice 24. Les informations sur les risques auxquels ce bien est exposé sont disponibles sur le site Géorisques : www.georisques.gouv.fr. La présente annonce immobilière a été rédigée sous la responsabilité éditoriale de M. Jean-François KIEHL EI (ID 37232), mandataire indépendant en immobilier (sans détention de fonds), agent commercial de la SAS I@D France immatriculé au RSAC de marseille sous le numéro 419993621, titulaire de la carte de démarchage immobilier pour le compte de la société I@D France SAS.Le présent bien est commercialisé dans le cadre d'une délégation de mandat.
Retrouvez tous nos biens sur notre site internet.
Afficher plus";['90 m² - 3 pièces - 2 chambres', 'Rez-de-chaussée', 'Séjour de 29 m²', 'Copropriété de 576 lots', None, None, None, None, None, None, None, None, None, None, None, None, None, None, None, None];['https://photo.superimmo.com/q12vb1gb5a9kiqymxocrdu20qtyn', 'https://photo.superimmo.com/r95jt9jar0ji6f5wf7kb9bcz8zo0', 'https://photo.superimmo.com/081vkhgs2w3ueft069h9s0s59f5h', 'https://photo.superimmo.com/qystqfkot3zp40l5mtciihkg5sy9', 'https://photo.superimmo.com/hghatk1v22k859vkdwbr07w1n2t4', None, None, None, None, None]
35;https://www.superimmo.com/annonces/achat-appartement-40m-aubagne-13400-xwd0wk;179000;40;2;1;Aubagne (13400);4475;20/07/2024;Exclusivité;Étage 1/3 avec ascenseur;Honoraires à la charge du vendeur. Barème d’honoraires : https://bareme.iadfrance.fr;"iad France - Helene Feri (06 13 29 19 96) vous propose : Exclusivité iad T2 de 40m2 avec box fermé en sous sol et cave idéal pour investissement ou premier achat. Situé au 1er étage d'un immeuble de 3 niveaux, ce charmant appartement de 40m² offre un espace de vie lumineux et fonctionnel.
Il se compose d'une chambre, d'un salon cosy climatisé avec cuisine équipée, d'une salle d'eau et wc.
L'exposition sud garantit une belle luminosité toute la journée.
Construit en 2015, l'appartement nécessite aucun travaux à prévoir.
Proche des commodités et des transports en commun, cet appartement bénéficie d'un emplacement pratique. Une opportunité à saisir rapidement !
Pour plus d'informations ou pour organiser une visite, contactez-moi dés à présent.
La présente annonce immobilière vise 1 lot principal situé dans une copropriété formant 3 lots au total ne faisant l'objet d'aucune procédure en cours et d'un montant de charges d’environ 143 € par mois (soit 1716 € annuel) déclaré par le vendeur.Honoraires d’agence à la charge du vendeur.Information d'affichage énergétique sur ce bien : classe ENERGIE C indice 125 et classe CLIMAT C indice 23. Les informations sur les risques auxquels ce bien est exposé sont disponibles sur le site Géorisques : www.georisques.gouv.fr. La présente annonce immobilière a été rédigée sous la responsabilité éditoriale de Mlle Helene Feri EI (ID 81257), mandataire indépendant en immobilier (sans détention de fonds), agent commercial de la SAS I@D France immatriculé au RSAC de marseille sous le numéro 810435891, titulaire de la carte de démarchage immobilier pour le compte de la société I@D France SAS.
Retrouvez tous nos biens sur notre site internet.
Afficher plus";['40 m² - 2 pièces - 1 chambre', 'Étage 1/3 avec ascenseur', '1 Parking', 'Année de construction : 2015', 'Chauffage collectif au gaz (radiateurs)', 'Climatisation', 'Digicode - Interphone', 'Télévision par cable', 'Copropriété de 3 lots', '', None, None, None, None, None, None, None, None, None, None];[None, None, None, None, None, None, None, None, None, None]
36;https://www.superimmo.com/annonces/achat-appartement-78m-aubagne-13400-xwd0wc;299000;78;4;3;Aubagne (13400);3833;20/07/2024;Exclusivité;Étage 3/4;Honoraires à la charge du vendeur. Barème d’honoraires : https://bareme.iadfrance.fr;"iad France - Helene Feri (06 13 29 19 96) vous propose : EXCLUSIVITE iad à Aubagne, cet appartement spacieux de 78m² de type 4 avec balcon filant de 10m2 et vue dégagée idéal pour une famille, ou un jeune couple.
Au 3ème étage d'un immeuble de 4 niveaux SANS ascenseur cet appartement bénéficie d'une exposition sud est entièrement rénové.
Il se compose d'un grand séjour avec cuisine ouverte entièrement équipée, 3 chambres, salle d'eau, wc indépendant ainsi qu'une buanderie.
Stationnement aisé dans la résidence plusieurs parking.
Un gardien dans la résidence, vous bénéficiez d'un cadre sécurisé.
Ne manquez pas cette opportunité à Aubagne, proche des commodités, axes autoroutiers,
écoles maternelle, primaire, collègues et lycée.
Contactez moi au plus vite pour une visite disponible 7/7
La présente annonce immobilière vise 1 lot principal situé dans une copropriété formant 80 lots au total ne faisant l'objet d'aucune procédure en cours et d'un montant de charges d’environ 190 € par mois (soit 2280 € annuel) déclaré par le vendeur.Honoraires d’agence à la charge du vendeur.Information d'affichage énergétique sur ce bien : classe ENERGIE C indice 159 et classe CLIMAT C indice 27. Les informations sur les risques auxquels ce bien est exposé sont disponibles sur le site Géorisques : www.georisques.gouv.fr. La présente annonce immobilière a été rédigée sous la responsabilité éditoriale de Mlle Helene Feri EI (ID 81257), mandataire indépendant en immobilier (sans détention de fonds), agent commercial de la SAS I@D France immatriculé au RSAC de marseille sous le numéro 810435891, titulaire de la carte de démarchage immobilier pour le compte de la société I@D France SAS.
Retrouvez tous nos biens sur notre site internet.
Afficher plus";['78 m² - 4 pièces - 3 chambres', 'Étage 3/4', '1 Parking', 'Année de construction : 1970', 'Gardien', 'Chauffage collectif au gaz (radiateurs)', 'Climatisation', 'Interphone', 'Télévision par cable', 'Copropriété de 120 lots', None, None, None, None, None, None, None, None, None, None];['https://photo.superimmo.com/s2g9ekfn2xmhrvilyjpk89gekneu', 'https://photo.superimmo.com/bjkrrn9f7x3om5sp2kd4wpp6w76z', 'https://photo.superimmo.com/fa4v54gnnewzema7jtm7s55n2p81', 'https://photo.superimmo.com/mxgz5m9na2wd4kr9ytycmljy68zy', 'https://photo.superimmo.com/mhkh89j80vok8dhlc6uzkqjtj709', None, None, None, None, None]
37;https://www.superimmo.com/annonces/achat-maison-85m-marseille-11eme-13011-xwd0w7;420000;85;5;4;Marseille 11ème (13011);4941;20/07/2024;Exclusivité;Terrasse;Honoraires à la charge du vendeur. Barème d’honoraires : https://bareme.iadfrance.fr;"iad France - Anaïs Lamberti (06 12 49 62 33) vous propose : Vous êtes à la recherche d'un véritable havre de paix niché sur les hauteurs de La Millière, offrant un charme atypique et une vue imprenable sur les collines marseillaises ? Cette maison est faite pour vous ! Idéalement située sur un terrain traversant sur 3 niveaux, cette propriété vous offre un cadre de vie exceptionnel, où tranquillité et confort se marient à la perfection.
Cette maison bénéficie d'un emplacement privilégié offrant une vue panoramique à 180° sur les collines environnantes. Vous pourrez profiter de la sérénité de la campagne tout en restant à proximité des commodités urbaines. Dès le premier regard, cette maison séduit par son charme atypique. Son architecture unique et ses détails authentiques en font une propriété hors du commun, où chaque recoin raconte une histoire.
La maison est agencée de manière fonctionnelle, offrant deux niveaux distincts pour un espace de vie confortable et bien pensé.
Au rez-de-chaussée, un appartement de type 2 de 27 m² environ, avec sa propre terrasse de 55 m² environ. La piscine orientée nord vous permet de vous rafraîchir tout en admirant la vue panoramique sur les collines.
À l'étage, un deuxième appartement de type 2 de 66 m² environ, vous accueille avec ses espaces lumineux et bien aménagés. La véranda chauffée de 18 m² environ offre un espace supplémentaire idéal pour se détendre tout en profitant de la vue sur le magnifique jardin arboré.
Le jardin qui entoure la propriété est un véritable havre de verdure, où vous pourrez vous ressourcer en toute intimité. À l'abri des regards, ce jardin offre un cadre paisible où il fait bon se détendre et se ressourcer.
Trois dépendances ( 9 m² environ, 7 m² environ, 5 m² environ), dont deux sont aménagées en chambre, offrent un espace supplémentaire idéal pour accueillir des invités, créé un espace de travail ou simplement pour répondre à vos besoins de rangement.
Un garage et deux places de parking complètent ce bien, offrant ainsi une solution pratique pour stationner vos véhicules en toute sécurité.
Cette maison au charme atypique est une véritable pépite sur le marché immobilier. Ne manquez pas l'opportunité de vivre dans un cadre enchanteur, où confort, tranquillité et vue panoramique se conjuguent harmonieusement. Contactez-nous dès aujourd'hui pour organiser une visite et découvrir tous les atouts de cette propriété exceptionnelle !
Honoraires d’agence à la charge du vendeur.Information d'affichage énergétique sur ce bien : classe ENERGIE E indice 263 et classe CLIMAT D indice 36. Les informations sur les risques auxquels ce bien est exposé sont disponibles sur le site Géorisques : www.georisques.gouv.fr. La présente annonce immobilière a été rédigée sous la responsabilité éditoriale de Mlle Anaïs Lamberti EI (ID 36487), mandataire indépendant en immobilier (sans détention de fonds), agent commercial de la SAS I@D France immatriculé au RSAC de MARSEILLE sous le numéro 899631592, titulaire de la carte de démarchage immobilier pour le compte de la société I@D France SAS.
Retrouvez tous nos biens sur notre site internet.
Afficher plus";['85 m² - 5 pièces - 4 chambres - ter. 472 m²', 'Piscine', '1 Garage', 'Terrasse', 'Année de construction : 1920', 'Chauffage au gaz', 'Cuisine séparée, équipée', 'Cheminée', 'Télévision par cable', '', None, None, None, None, None, None, None, None, None, None];['https://photo.superimmo.com/6s8l68kgb5iyicxyc66ypo0kiwub', 'https://photo.superimmo.com/n36zam3l4pvzo7z635cy5lh7aer3', 'https://photo.superimmo.com/8czlbie2gp57xkfn1ytxq2tmh4a3', 'https://photo.superimmo.com/5oquboba5sowgctlr19dxbjxwa7c', 'https://photo.superimmo.com/pbn3iahw3a0vsb3jaftzu05z5cyb', None, None, None, None, None]
