;url;price;surface;nb_pieces;nb_chambres;lieu;prix_m2;date_publication;tag_1;tag_2;tag_3;description;tags;images_url
0;https://www.superimmo.com/annonces/achat-appartement-76m-marseille-2eme-13002-xwd4i3;187000;76;3;2;Marseille 2ème (13002);2461;21/07/2024;Balcon;;Barème d’honoraires : https://bareme.safti.fr/;"Situé dans le cœur du 2e arrondissement de Marseille (13002), cet appartement de 76 m² situé au 2ème étage sur 7, profite d'un emplacement privilégié offrant une atmosphère dynamique et une vie cosmopolite. Bordé par le Vieux-Port, ce quartier typiquement marseillais regorge de restaurants, bars et boutiques, offrant une ambiance animée à ses résidents. De plus, sa proximité avec les transports en commun facilite les déplacements dans la ville, idéal pour les actifs ou les amateurs de vie urbaine.
Description de l'Appartement :
*Séjour spacieux avec cuisine américaine entièrement équipée et de nombreux placards, créant un espace convivial et pratique.
*Deux chambres lumineuses, chacune dotée d'un balcon, offrant une vue agréable et une abondance de lumière naturelle.
*Salle de douche à l'italienne moderne avec deux lavabos,nécessitant le remplacement du ballon d'eau chaude.
*Appartement vendu meublé*, vous permettant de vous installer immédiatement sans aucun souci d'ameublement.
Atouts Supplémentaires :
*Cave offrant un espace de stockage supplémentaire, idéal pour maintenir votre appartement bien organisé.
*Emplacement privilégié dans la dynamique ville de Marseille, à proximité de toutes les commodités, commerces et transports en commun.
Cet appartement de 3 pièces est parfait pour ceux qui recherchent un logement confortable, moderne et bien situé. Ne manquez pas cette occasion exceptionnelle de vivre dans l'une des villes les plus vivantes et attractives de France.
Pour plus d'informations ou pour planifier une visite, n'hésitez pas à nous contacter.
Le bien comprend 2 lots, et il est situé dans une copropriété de 14 lots (les charges courantes annuelles moyennes de copropriété sont de 1924 € et le syndicat des copropriétaires ne fait pas l'objet d'une procédure citée à l'article L. 721-1 du code de la construction et de l'habitation).
Les informations sur les risques auxquels ce bien est exposé sont disponibles sur le site Géorisques : www.georisques.gouv.fr
Prix de vente : 187 000 €
Honoraires charge vendeur
Contactez votre conseiller SAFTI : Monique DOS SANTOS RUFI, Tél. : 0665323774, E-mail : - EI - Agent commercial immatriculé au RSAC de Marseille sous le numéro 853398147 - SAFTI – DOS SANTOS RUFI Monique, Conseiller indépendant
Afficher plus";['76 m² - 3 pièces - 2 chambres', 'Balcon', 'Année de construction : 1974', 'Climatisation', '1 wc', 'Digicode', None, None, None, None, None, None, None, None, None, None, None, None, None, None];['https://photo.superimmo.com/3n0dh5abzmwwr10mp720inmvc4hm', 'https://photo.superimmo.com/9k9i4l1zo0v3eet1bvlcsembbljn', 'https://photo.superimmo.com/ono8iw2fdwal7nmu9ly4g20bserw', 'https://photo.superimmo.com/mk1122mr7y26ceo77dtpp90sp0e6', 'https://photo.superimmo.com/o3j5ib2dy153nhx0h9eiiu6zclvh', None, None, None, None, None]
1;https://www.superimmo.com/annonces/achat-appartement-25m-marseille-13eme-13013-xwd2te;82000;25;2;1;Marseille 13ème (13013);3280;20/07/2024;Dernier étage;Balcon;Honoraires à la charge du vendeur. Barème d’honoraires : http://diszln7ft1ccx.cloudfront.net/pdf/BAREME_NATIONAL.pdf;"13013 MARSEILLE - SAINT JERÔME – APPARTEMENT T2 EN DUPLEX – 25,35M2 - effiCity l’Agence qui estime votre bien en ligne vous propose cet appartement en deuxième et dernier étage composé d’un salon, d’une kitchenette, d’une chambre, d’une salle d’eau et d’un balcon.
Le système de chauffage est individuel et électrique.
Une place de parking privative complète ce bien.
L’appartement est situé dans une résidence semi récente, calme et sécurisée à proximité des écoles, d’un centre médical et de nombreux commerces tels que des supermarchés, épiceries, boulangeries,..
Emplacement idéal, proche de l’A507/L2 et arrêts de bus au pied de la résidence.
Faibles charges de copropriété, environ 200€ par trimestre.
Taxe foncière 2023 : 802€
INVESTISSEURS, cet appartement bénéficie d’un fort potentiel de rendement locatif, d’environ 7%. Forte attractivité locative de par sa proximité avec les facultés de St Jérôme.
Contactez Angélique Donati au 06.26.26.24.52 ou par mail dès maintenant pour organiser une visite.
Les informations sur les risques auxquels ce bien est exposé sont disponibles sur le site Georisque : georisques. gouv. fr
Angélique Donati - EI - est Agent Commercial mandataire en immobilier, immatriculé au Registre Spécial des Agents Commerciaux du Tribunal de Commerce de Salon-de-Provence sous le n°948897533.
Siège social du mandant : effiCity, 48 avenue de Villiers - 75017 PARIS - Société par Actions Simplifiée, société au capital de 132 373,05 euros, immatriculée au RCS Paris 497 617 746 et titulaire de la Carte professionnelle CPI 7501 2015 000 002 025 délivrée par la CCI Paris IDF - Caisse de Garantie : GALIAN Assurances 89 rue de la Boétie 75008 Paris
Afficher plus";"['25 m² - 2 pièces - 1 chambre', 'Dernier étage (2ème)', 'Garage', 'Balcon', 'Chauffage individuel électrique (radiateurs)', ""1 salle d'eau"", '1 wc', '', None, None, None, None, None, None, None, None, None, None, None, None]";['https://photo.superimmo.com/8qg6198bx9ki87244l9gd9oe4psf', 'https://photo.superimmo.com/i0p27ixyhr2ucwaqtvms3b3xujf1', 'https://photo.superimmo.com/ojwcsuppj6prtaxa8lcov1yjlrzt', None, None, None, None, None, None, None]
2;https://www.superimmo.com/annonces/achat-appartement-38m-marseille-15eme-13015-xwd2sp;135000;38;2;1;Marseille 15ème (13015);3553;20/07/2024;Avec ascenseur;Terrasse;Honoraires à la charge du vendeur. Barème d’honoraires : http://diszln7ft1ccx.cloudfront.net/pdf/BAREME_NATIONAL.pdf;"13015 MARSEILLE - LA VISTE - APPARTEMENT T2 - 38M2 - VUE EXCEPTIONNELLE - RARE A LA VENTE
effiCity, l'Agence qui estime votre bien en ligne vous propose cet appartement composé d'un salon/séjour comprenant une cuisine équipée, d'une chambre, d'une salle d'eau et d'une terrasse avec une vue imprenable sur la mer et sur les îles du Frioul grâce à son exposition plein Sud.
Une place de parking privative dans un garage au sous sol complète ce bien. Elle peut éventuellement être transformée en box fermé.
L'appartement est situé dans une résidence récente de 2015, calme et sécurisée.
L'emplacement de la copropriété est idéal, par sa proximité avec de nombreux commerces, écoles et des principaux axes autoroutiers.
Il n'y a aucun travaux à prévoir. Venez découvrir ce véritable havre de paix lumineux et sans vis à vis au coeur du quinzième arrondissement de Marseille.
Contactez Angélique Donati au 06 26 26 24 52 ou par mail à l'adresse dès maintenant pour organiser une visite.
Diagnostics en cours
Les informations sur les risques auxquels ce bien est exposé sont disponibles sur le site Georisque : georisques. gouv. fr
Angélique Donati - EI - est Agent Commercial mandataire en immobilier, immatriculé au Registre Spécial des Agents Commerciaux du Tribunal de Commerce de Salon-de-Provence sous le n°948897533.
Siège social du mandant : effiCity, 48 avenue de Villiers - 75017 PARIS - Société par Actions Simplifiée, société au capital de 132 373,05 euros, immatriculée au RCS Paris 497 617 746 et titulaire de la Carte professionnelle CPI 7501 2015 000 002 025 délivrée par la CCI Paris IDF - Caisse de Garantie : GALIAN Assurances 89 rue de la Boétie 75008 Paris
Afficher plus";"['38 m² - 2 pièces - 1 chambre', 'Rez-de-chaussée', 'Avec ascenseur', 'Orientation : Sud', 'Garage', 'Terrasse', 'Chauffage collectif électrique (radiateurs)', ""1 salle d'eau"", '1 wc', 'Copropriété de 2 lots', None, None, None, None, None, None, None, None, None, None]";['https://photo.superimmo.com/dh1nyglta8lfpcg9rqgdhl03j05s', 'https://photo.superimmo.com/4agaucb40s70jw4r7ma9l4xbrxw3', 'https://photo.superimmo.com/ikarzaq96sqrw46y456gs3lr9ib9', 'https://photo.superimmo.com/kj46x9lo0vvcsc9qlzvxgn0zrlb2', 'https://photo.superimmo.com/xzgzttzmqrvwedbx53mp1myid7l7', None, None, None, None, None]
3;https://www.superimmo.com/annonces/achat-appartement-87m-istres-13800-xwd270;179000;87;5;3;Istres (13800);2057;20/07/2024;Étage 2/4;Chauffage collectif;Honoraires à la charge du vendeur. Barème d’honoraires : https://media.immo-facile.com/segments/immo/catalog/images/manufacturers_bareme/358462.pdf;"Istres, très bel appartement entièrement rénové de type 5 situé au 2ème étage sans ascenseur, qui se compose d'un hall d'entrée, d'un double séjour très lumineux, une cuisine semi ouverte équipée, donnant sur une agréable terrasse sans vis à vis, un cellier, 3 chambres (possibilité d'une 4ème), un wc, une salle de bains. Les menuiseries sont en pvc double vitrage, volets roulants électrique, une cave collective. Nombreux rangements
« Informations sur le bien à vendre )
+ DPE Energie : D GES : D
Prix : 179 000 euros
Pour visiter et vous accompagner dans votre projet, contactez Jean-pierre LE POLLOZEC, au 0650194619 ou par courriel à
Selon l'article L.561.5 du Code Monétaire et Financier, pour l'organisation de la visite, la présentation d'une pièce d'identité vous sera demandée.
Cette vente est garantie 12 mois.
Cette présente annonce a été rédigée sous la responsabilité éditoriale de Jean-pierre LE POLLOZEC agissant sous le statut d'agent commercial immatriculé au RSAC salon de provence 819 285 560 auprès de la SAS PROPRIETES PRIVEES, au capital de 40 000 euros, ZAC LE CHÊNE FERRÉ - 44 ALLÉE DES CINQ CONTINENTS 44120 VERTOU; SIRET 487 624 777 00040, RCS Nantes. Carte professionnelle Transactions sur immeubles et fonds de commerce (T) et Gestion immobilière (G) n° CPI 4401 2016 000 010 388 délivrée par la CCI Nantes - Saint Nazaire. Compte séquestre n°30932508467 BPA SAINT-SEBASTIEN-SUR-LOIRE (44230) ; Garantie GALIAN - 89 rue de la Boétie, 75008 Paris - n°28137 J pour 2 000 000 euros pour T et 120 000 euros pour G. Assurance responsabilité civile professionnelle par MMA Entreprise n° de police 120.137.405
Mandat réf : 366554 - Le professionnel garantit et sécurise votre projet immobilier.
Copropriété de 100 lots ().
Charges annuelles : 2465 euros.
Jean-pierre LE POLLOZEC (EI) Agent Commercial - Numéro RSAC : salon de provence 819 285 560 - .
Les informations sur les risques auxquels ce bien est exposé sont disponibles sur le site Géorisques : www. georisques. gouv. fr
Afficher plus";['87 m² - 5 pièces - 3 chambres', 'Étage 2/4', 'Année de construction : 1974', 'Chauffage collectif', '1 salle de bain', 'Copropriété de 100 lots', None, None, None, None, None, None, None, None, None, None, None, None, None, None];['https://photo.superimmo.com/xsw9ugaparbtikceckzl9n7s9mcx', 'https://photo.superimmo.com/yonk7xfqybmaahb6uloq8vs7auco', 'https://photo.superimmo.com/f8aufat4mfoxsy0ucslbi6bfmz3c', 'https://photo.superimmo.com/tfecv1xytp7r084u4393rfqzalaf', 'https://photo.superimmo.com/94pw0eg67qrgf4i9ce9rdkq1xj1x', None, None, None, None, None]
4;https://www.superimmo.com/annonces/achat-maison-130m-roquevaire-13360-xwd25a;850000;130;4;3;Roquevaire (13360);6538;20/07/2024;Terrasse;Cuisine aménagée;Honoraires à la charge du vendeur. Barème d’honoraires : https://media.immo-facile.com/segments/immo/catalog/images/manufacturers_bareme/350928.pdf;"Lascours rare à la vente ! Villa neuve.
Située sur les hauteurs de Roquevaire dans un écrin de verdure cette villa neuve vous offre une très belle vue dégagée sur les collines.
Au calme sans être isolée pour autant cette belle villa s'agrémente d'un terrain de 860 m2 et d'une piscine.
Le rez de chaussée est composé d'une grande pièce à vivre très lumineuse, type cathédrale avec belle hauteur sous plafond et cheminée. Cette pièce est exposée Sud et s'ouvre sur la terrasse et la piscine. La cuisine est séparée et attenante à un patio. Suite parentale également de plain pied avec salle de bains balnéo et dressing.
A l'étage deux chambres dont une avec sa salle de douche privative.
Sous sol de 120 m2 isolé et carrelé prêt à être aménagé à votre goût et selon vos besoins.
Côté technique, norme TR 2012, menuiseries aluminium double vitrage, volets roulants télécommandés, pompe à chaleur, vidéophone, portail électrique...
L'aménagement extérieur en cours de finalisation sera effectué pour la vente ou sera pris en compte dans le cadre d'une négociation.
Ce bien vous est proposé au prix de 850 000 euros honoraires charge vendeur.
DPE C GES A
Montant moyen estimé des dépenses annuelles d'énergie pour un usage standard établi à partir des prix de l'énergie de l'année 2021 : entre 1060 et 1510 Euros
ESTIMATION GRATUITE DE VOTRE BIEN SOUS 48H.
Pour visiter et vous accompagner dans votre projet, contactez Jean-Charles Wendling, au 07 63 03 55 33 ou par courriel à
Selon l'article L.561.5 du Code Monétaire et Financier, pour l'organisation de la visite, la présentation d'une pièce d'identité vous sera demandée.
Cette présente annonce a été rédigée sous la responsabilité éditoriale de Jean-Charles Wendling agissant sous le statut d'agent commercial immatriculé au RSAC Marseille 849214101 auprès de la SAS PROPRIETES PRIVEES au capital de 40 000 euros, ZAC LE CHÊNE FERRÉ - 44 ALLÉE DES CINQ CONTINENTS 44120 VERTOU ; SIRET 487 624 777 00040, RNE Nantes. Carte professionnelle Transactions sur immeubles et fonds de commerce (T) et Gestion immobilière (G) n° CPI 4401 2016 000 010 388 délivrée par la CCI Nantes - Saint Nazaire. Compte séquestre n°30932508467 BPA SAINT-SEBASTIEN-SUR-LOIRE (44230) ; Garantie GALIAN - 89 rue de la Boétie, 75008 Paris - n°28137 J pour 2 000 000euros pour T et 120 000euros pour G. Assurance responsabilité civile professionnelle par MMA Entreprise n° de police 120.137.405
Mandat réf : 350168 - Le professionnel garantit et sécurise votre projet immobilier.
Les informations sur les risques auxquels ce bien est exposé sont disponibles sur le site Géorisques : www.georisques.gouv.fr
Référence annonce 350168JCW
Jean Charles WENDLING (EI) Agent Commercial - Numéro RSAC : MARSEILLE 849214101 - .
Afficher plus";"['130 m² - 4 pièces - 3 chambres - ter. 860 m²', '2 niveaux', 'Piscine', 'Orientation : Sud', 'Parking extérieur', 'Terrasse', 'Année de construction : 2019', 'Chauffage individuel: clim. réversible', 'Cuisine aménagée', ""1 salle d'eau - 1 salle de bain"", '2 wc', 'Sous-sol', 'Jardin privatif', '', None, None, None, None, None, None]";['https://photo.superimmo.com/jdu694utjc7azv6k0rh05meswe0x', 'https://photo.superimmo.com/qybpx8tw28g8szwzmt7v8drjduan', 'https://photo.superimmo.com/ztgg9f8mqet85m0a2df4tzeggd4p', 'https://photo.superimmo.com/0qm61s603vja4tr75r5i6a3zqjh4', 'https://photo.superimmo.com/bc25l8ds7pi1ggh1hinszgwsmgsq', None, None, None, None, None]
5;https://www.superimmo.com/annonces/achat-maison-165m-istres-13800-xwd24p;569000;165;6;4;Istres (13800);3448;20/07/2024;Cuisine aménagée;Chauffage individuel;Honoraires à la charge du vendeur. Barème d’honoraires : https://media.immo-facile.com/segments/immo/catalog/images/manufacturers_bareme/358462.pdf;"Maison Traditionnelle de Charme et Confort
Bienvenue dans cette charmante maison nichée dans un écrin de verdure, située dans une impasse paisible et très recherchée.
794 m² de terrain arboré, avec un joli bassin à poissons et une piscine parfaite pour vos moments de détente en famille.
Description :
Rez-de-chaussée :
Un grand hall d'entrée accueillant.
Une grande cuisine équipée, chaleureuse et fonctionnelle, avec une arrière-cuisine pratique.
Un séjour spacieux et lumineux, idéal pour des soirées cocooning.
Une chambre confortable
Une salle d'eau
Un WC indépendant.
Un garage, une buanderie et un dressing pour un rangement optimal.
A l'étage :
Une charmante mezzanine offrant un espace cosy pour se détendre ou travailler.
Trois chambres douillettes, dont deux avec accès à une terrasse couverte ensoleillée, parfaite pour savourer vos matins.
Un dressing aménagé pouvant servir de chambre d'appoint pour votre confort.
Un WC indépendant et une salle de bains .
Équipements :
Climatisation réversible pour un confort tout au long de l'année.
Volets roulants solaires, modernes et économes en énergie.
Possibilité de stationner une voiture à l'intérieur de la propriété. Forage .
Points forts :
Un cadre de vie exceptionnel, calme et sécurisé, parfait pour une vie familiale sereine.
Un terrain généreux et verdoyant, idéal pour les jeux d'enfants ou les moments de détente.
Une maison parfaitement entretenue, alliant charme et fonctionnalité.
Laissez-vous séduire par cette maison cosy et confortable, où chaque détail a été pensé pour votre bien-être. Ne laissez pas passer cette opportunité unique de vivre dans un cadre idyllique. Contactez-moi dès maintenant pour plus d'informations ou pour organiser une visite.
Prix de vente : 569 000 euros
DPE en cours
« Informations sur le bien à vendre + DPE + mentions sur la copropriété le cas échéant » Pour visiter et vous accompagner dans votre projet, contactez Jean-pierre LE POLLOZEC, au 0650194619 ou par courriel à Selon l'article L.561.5 du Code Monétaire et Financier, pour l'organisation de la visite, la présentation d'une pièce d'identité vous sera demandée. Cette vente est garantie 12 mois. Cette annonce a été rédigée sous la responsabilité éditoriale de Jean-pierre LE POLLOZEC agissant sous le statut d'agent commercial immatriculé au RSAC salon de provence 819 285 560 auprès de la SAS PROPRIETES PRIVEES, au capital de 40 000 euros, ZAC LE CHÊNE FERRÉ - 44 ALLÉE DES CINQ CONTINENTS 44120 VERTOU; SIRET 487 624 777 00040, RCS Nantes , Carte professionnelle Transactions sur immeubles et fonds de commerce (T) et Gestion immobilière (G) n° CPI 4401 2016 000 010 388 délivrée par la CCI Nantes - Saint Nazaire. Compte séquestre n°30932508467 BPA SAINT-SEBASTIEN-SUR-LOIRE (44230) ; Garantie GALIAN - 89 rue de la Boétie, 75008 Paris - n°28137 J pour 2 000 000 euros pour T et 120 000 euros pour G. Assurance responsabilité civile professionnelle par MMA Entreprise n° de police 120.137.405 Mandat réf 374128. - Le professionnel garantit et sécurise votre projet immobilier.
Jean-pierre LE POLLOZEC (EI) Agent Commercial - Numéro RSAC : salon de provence 819 285 560 - .
Afficher plus";"['165 m² - 6 pièces - 4 chambres - ter. 794 m²', '1 niveau', 'Année de construction : 1978', 'Chauffage individuel', 'Cuisine aménagée', ""1 salle d'eau - 1 salle de bain"", '2 wc', 'Jardin privatif', 'Cheminée', '', None, None, None, None, None, None, None, None, None, None]";['https://photo.superimmo.com/3ypnlurnn50y5ch6ver24f56a6s6', 'https://photo.superimmo.com/eptq066pl2jwbphu0g06k8gczbd1', 'https://photo.superimmo.com/1bcpe9sxgvee9czh58gvx91h4oj3', 'https://photo.superimmo.com/z8wi6lq0f6dlp3q7fb5s9845umew', 'https://photo.superimmo.com/betb9ct5lm3ce8i6rfl7wqfag2ct', None, None, None, None, None]
6;https://www.superimmo.com/annonces/achat-maison-206m-arles-13200-xwd23x;395100;206;10;6;Arles (13200);1918;20/07/2024;Terrasse;Piscine;Honoraires à la charge du vendeur. Barème d’honoraires : https://media.immo-facile.com/segments/immo/catalog/images/manufacturers_bareme/366348.pdf;"DU POTENTIEL POUR CETTE DEMEURE! A VISITER. BELLE RENTABILITE EN INVESTISSEMENT
GAELLE LEMESLE vous présente, Maison de 206 m2 sur parcelle de 665m2 environ.
En rez de chaussée vous trouverez un T4 de 103m2 environ composé d'un bel espace de vie et une cuisine équipée.
De belles ouvertures pour des pièces lumineuse.
3 Chambres. Une salle d'eau et wc indépendant.
Une grande terrasse qui donne accès a la piscine et a une cuisine d'été!
Au 1er étage, un grand T4 composé de 3 grandes chambres, un séjour lumineux avec cheminée. Une cuisine équipée . Une salle d'eau spacieuse. Un grand balcon pour profiter des beaux jours! CLIMATISATION REVERSIBLE.
A VISITER! Possible de réunir les 2 logements..
COUP DE COEUR FAMILLE ET INVESTISSEUR!
PRIX 395100 EUROS Honoraires charge vendeur
DPE: D GES: A
Montant moyen estimé des dépenses annuelles d'énergie pour un usage standard établi à partir des prix de l'énergie de l'année 2021 : entre 1140 euros et 1600 euros
Pour visiter et vous accompagner dans votre projet, contactez Gaelle LEMESLE, au 0625134187 ou par courriel à
Selon l'article L.561.5 du Code Monétaire et Financier, pour l'organisation de la visite, la présentation d'une pièce d'identité vous sera demandée.
Cette vente est garantie 12 mois.
Cette présente annonce a été rédigée sous la responsabilité éditoriale de Gaelle LEMESLE agissant sous le statut d'agent commercial immatriculé au RSAC salon de Provence 529 702 334 auprès de la SAS PROPRIETES PRIVEES, au capital de 40 000 euros, ZAC LE CHÊNE FERRÉ - 44 ALLÉE DES CINQ CONTINENTS 44120 VERTOU; SIRET 487 624 777 00040, RCS Nantes. Carte professionnelle Transactions sur immeubles et fonds de commerce (T) et Gestion immobilière (G) n° CPI 4401 2016 000 010 388 délivrée par la CCI Nantes - Saint Nazaire. Compte séquestre n°30932508467 BPA SAINT-SEBASTIEN-SUR-LOIRE (44230) ; Garantie GALIAN - 89 rue de la Boétie, 75008 Paris - n°28137 J pour 2 000 000 euros pour T et 120 000 euros pour G. Assurance responsabilité civile professionnelle par MMA Entreprise n° de police 120.137.405
Mandat ref: 361963 - Le professionnel garantit et sécurise votre projet immobilier.
Gaelle LEMESLE (EI) Agent Commercial - Numéro RSAC : salon de Provence 529 702 334 - .
Les informations sur les risques auxquels ce bien est exposé sont disponibles sur le site Géorisques : www. georisques. gouv. fr
Afficher plus";['206 m² - 10 pièces - 6 chambres - ter. 660 m²', '1 niveau', 'Piscine', 'Garage', 'Terrasse', '2 salles de bain', '2 wc', 'Jardin privatif', None, None, None, None, None, None, None, None, None, None, None, None];['https://photo.superimmo.com/1fhby0bqnhawlsyud6wpakulwva1', 'https://photo.superimmo.com/qjrzl057fmhon2j0l8vaj2zpmzjk', 'https://photo.superimmo.com/e519gmi8ghihj3vw2dablnzbe9hi', 'https://photo.superimmo.com/lw3x7a2zcoyrvyez2cp085lkd4qt', 'https://photo.superimmo.com/d63kp90bsp0kbjf30qjdwvj0zic9', None, None, None, None, None]
