;url;price;surface;nb_pieces;nb_chambres;lieu;prix_m2;date_publication;tag_1;tag_2;tag_3;description;tags;images_url
58;https://www.superimmo.com/annonces/achat-maison-147m-la-fare-les-oliviers-13580-xwczw0;574500;147;5;4;La Fare-les-Oliviers (13580);3908;20/07/2024;1 terrasse;1 garage - 3 parkings;Barème d’honoraires : https://www.reseau-expertimo.fr/i/redac/honoraires?honofor=1533;"LA FARE LES OLIVIERS - SAINT EXUPÉRY

L'agence Provence Immo à le plaisir de vous présenter une charmante maison de 147m2 habitables de plain pied avec garage et piscine.

Construite en 2002, cette villa se compose d'un hall d'entrée, un salon/salle à manger lumineux doté d'une cheminée ce qui apporte un côté chaleureux à la pièce, une grande cuisine séparée avec cellier, 4 chambres (de 15 à 12m2) dont l'une possède sa propre salle d'eau et son WC, un bureau, une salle de bains, un second WC. Exposée plein sud sur une parcelle arborée de 765m2, vous serez séduits par son jardin verdoyant, sa cuisine d'été et sa piscine.

Un garage de 28m2 avec partie buanderie, climatisation réversible, double vitrage et arrosage automatique viennent compléter ce bien.

A proximité des commerces et écoles, cette maison sera le lieu idéal pour une famille avec des enfants et pour les amoureux du plain-pied! Pour plus d'informations et pour organiser une visite, n'hésitez pas à me contacter dès aujourd'hui.
Cette annonce vous est proposée par Petruschi Pascal - - NoRSAC: 500 300 058, Enregistré au Greffe du tribunal de commerce de Salon de Provence
Afficher plus";"['147 m² - 5 pièces - 4 chambres - ter. 765 m²', 'Piscine', 'Orientation : Sud', '1 garage - 3 parkings', '1 terrasse', 'Année de construction : 2002', 'Chauffage individuel au gaz', 'Climatisation', 'Cuisine séparée, équipée', 'Séjour de 40 m²', ""1 salle d'eau - 1 salle de bain"", '2 wc', 'Cheminée', '', None, None, None, None, None, None]";['https://photo.superimmo.com/cf02mn97322lvmlxebgpqfju7xvm', 'https://photo.superimmo.com/g7w950hub5u3jyslfcctkamt5mdp', 'https://photo.superimmo.com/drw7ht06zn3gohx7wywi90fht184', 'https://photo.superimmo.com/9622fpnt24dnakz6ydi5nz1vreuv', 'https://photo.superimmo.com/wvkv5265ipkzkp7y7l3zumg3sk3q', None, None, None, None, None]
59;https://www.superimmo.com/annonces/achat-appartement-42m-salon-de-provence-13300-xwczvm;179000;48;2;1;Salon-de-Provence (13300);4214;20/07/2024;1 Parking;;Honoraires à la charge du vendeur. Barème d’honoraires : https://www.reseau-expertimo.fr/i/redac/honoraires?honofor=1533;"FABIENNE HERNANDEZ à le plaisir de vous présenter, dans une Résidence CALME et SÉCURISÉE, cet appartement CLIMATISÉ et LUMINEUX de 42,48m2, situé au COEUR du CENTRE VILLE de Salon de Provence, à quelques pas de la PLACE MORGAN.
Idéal pour le TOUT A PIEDS. Appartement à Usage MIXTE, Habitation ou Profession Libérale.
Ce BEAU T2 se situe au PREMIER étage d'un immeuble de 4 étages, construit en 1999.
Entrée donnant sur la LUMINEUSE Pièce de vie de 21,54m2 et sa Cuisine Ouverte, équipée d'une plaque à induction, d'une hotte,d'un frigo top et de rangements. Vous accéderez à la Belle Terrasse Couverte de 7,4m2 orientée SUD, faisant un espace de vie TRÈS AGRÉABLE A VIVRE. Vis à vis sur la terrasse qui peut facilement disparaître grâce à un jeu de plantes ou de brise vue.
COIN BUREAU.
Belle CHAMBRE DE 10,6m2 orienté NORD, avec PLACARD INTÉGRÉ. Salle de douche à l'Italienne, avec Porte coulissante. BUANDERIE. WC INDÉPENDANT.
PLACE DE PARKING Privative en sous-sol. Accès par l'ascenseur. Caméra de surveillance. Fenêtres sont en Double Vitrage PVC. Volet roulant électrique et manuel. VENDU LIBRE. FIBRE
( Projetez-vous grâce à l'AI du Home Staging ) Ce beau T3 se loue habituellement 740EUR + 60EUR de charges. Parking ville à 10EUR/mois avec le Pass Résident. Taxe Foncière: 966EUR Charges de Copropriété: 94EUR/mois. Aucune procédure en cours.
Les informations sur les risques auxquels ce bien est exposé sont disponibles sur le site Géorisques : www.georisques.gouv.fr N'ATTENDEZ PLUS, CONTACTEZ-MOI POUR TOUTES INFORMATIONS COMPLEMENTAIRES. JE SUIS DISPONIBLE 7J/7 POUR VOS PROJETS IMMOBILIERS. Votre conseillère PROVENCE-IMMO: Fabienne Hernandez: 06 35 30 25 28 EI Agent Commercial Salariée
Honoraires à la charge du vendeur.
Afficher plus";"['42,48 m² - 2 pièces - 1 chambre', 'Rez-de-chaussée', '1 Parking', ""1 salle d'eau"", '1 wc', '', None, None, None, None, None, None, None, None, None, None, None, None, None, None]";['https://photo.superimmo.com/5igk2hyaw8nswm0pia3k7d81ljyi', 'https://photo.superimmo.com/y4nfq77gs91ep3ryycmnutewmao0', 'https://photo.superimmo.com/stby0l64msjhqlb3r0uqttyknjju', 'https://photo.superimmo.com/082fpl3ac38k8994zp8199dqf7hz', 'https://photo.superimmo.com/eoxuw7nbog90kzpxzbjy3mqktxq1', None, None, None, None, None]
60;https://www.superimmo.com/annonces/achat-maison-154m-puyricard-13540-xwczvb;956800;154;6;4;;6213;20/07/2024;1 Garage;Cuisine séparée;Honoraires à la charge du vendeur. Barème d’honoraires : https://www.reseau-expertimo.fr/i/redac/honoraires?honofor=1433;"Maison individuelle 154 m2 sur vue dégagée + terrain arboré avec une très grande piscine et une très belle véranda 40,91 m2, terrain de boules, ce bien est composé d'un grand séjour de 40,58 m2 , d'une cuisine séparée de 8,10 m2, 2 chambres en de rez-de-chaussée, un bureau , une buanderie, un dressing, un WC. À l'étage ( 41,84 m2) un palier de 16,98 m2 qui peut s'aménager pour un grand bureau ou une bibliothèque, 2 chambres, 1 salle d'eau. Le chauffage est électrique, il y a un poil à bois qui chauffe une très grande partie de la maison, dans le jardin se trouve un très grand hangar avec trois portes, un abri de garage, le portail est électrique. Les commerces et bus sont à proximités. Quartier tranquille. N'hésitez à me contacter pour une visite.
Cette annonce vous est proposée par MALTÈSE Martine - - NoRSAC: 888053113, Enregistré au Greffe du tribunal de commerce de AIX EN PROVENCE - Annonce rédigée et publiée par un Agent Mandataire -
Afficher plus";"['154 m² - 6 pièces - 4 chambres - ter. 1 550 m²', 'Piscine', 'Orientation : Sud', '1 Garage', 'Année de construction : 1995', 'Chauffage individuel électrique (radiateurs)', 'Cuisine séparée', 'Séjour de 40 m²', ""2 salles d'eau - 2 salles de bain"", '1 wc', None, None, None, None, None, None, None, None, None, None]";['https://photo.superimmo.com/4d8fks8oatmgx1ufw9n10xog8onl', 'https://photo.superimmo.com/ici858ifcdel6vdjmtvvsd5k0yd8', 'https://photo.superimmo.com/u9uzu5a2urvvnzhz8y7pnk5fpjyw', 'https://photo.superimmo.com/eoriz1habeoezql3u7fmr1v0jwbs', 'https://photo.superimmo.com/an23esq0ppkbjwiurdl8n0bnpqy6', None, None, None, None, None]
61;https://www.superimmo.com/annonces/achat-maison-73m-marignane-13700-xwczv9;315000;32;4;3;Marignane (13700);4296;20/07/2024;2 terrasses;1 Garage;Honoraires à la charge du vendeur. Barème d’honoraires : www.muretransaction.com;"L'agence immobilière Mûre Transaction vous propose à la vente une charmante maison de 73 m2 de type quatre, idéalement située à Marignanne sur une parcelle de 137 m2.
Au rez-de-chaussée : hall d'entrée, salon/séjour de 20 m2 , cuisine indépendante équipée avec placards et un cellier pour un rangement optimal. A l'étage : trois chambres, dont deux avec placards intégrés, une salle d'eau. Equipements : double vitrage et climatisation.
Extérieur : Profitez de moments de détente en extérieur grâce à une terrasse à l'avant et une seconde terrasse à l'arrière exposée sud, équipée d'un barbecue pour des repas conviviaux. Un garage pour votre véhicule.
Localisation : Située dans un quartier résidentiel recherché, proche des commodités, des écoles et des transports en commun.
Contactez-nous pour plus de détails ou pour organiser une visite. Un vrai coup de coeur vous attend ! Votre partenaire immobilier de confiance, Brandon SLIMANI EI RSAC 949 617 005. Contact : 06 67 15 22 77
Photos retouchées par logiciel IA (non contractuelles).Surface : 73 m2 Prix du bien : 315 000 EUR Honoraires à la charge du vendeur. Date de réalisation du diagnostic énergétique : 04/12/2023 Consommation énergie primaire : 313 kWh/m2/an Consommation énergie finale : Non communiqué.
Afficher plus";"['73,32 m² - 4 pièces - 3 chambres - ter. 137 m²', '1 Garage', '2 terrasses', 'Année de construction : 1974', 'Cuisine séparée', 'Séjour de 20 m²', ""1 salle d'eau"", '1 wc', None, None, None, None, None, None, None, None, None, None, None, None]";['https://photo.superimmo.com/3m7vo2l83quu1hh41c8ky4nduy7v', 'https://photo.superimmo.com/twpz4lof0mbygqqwtenwtksls872', 'https://photo.superimmo.com/f3kogjtw7nyyl4ltyqglx41z7y0o', 'https://photo.superimmo.com/l5tu0gepsbyaj3scntend8w04ub0', 'https://photo.superimmo.com/1uj6rw6fnmwnr5yd3xl7bi8qmpiw', None, None, None, None, None]
62;https://www.superimmo.com/annonces/achat-maison-210m-grans-13450-xwczt6;949000;210;6;4;Grans (13450);4519;20/07/2024;Exclusivité;Terrasse;Honoraires à la charge du vendeur. Barème d’honoraires : https://mon-projetimmo.fr/i/redac/honoraires?honofor=1;"A VENDRE - GRANS - BIEN D'EXCEPTION - EN CENTRE VILLE - Propriété en fond d'impasse, au calme, bénéficiant d'une proximité immédiate avec le centre village. Ce bien composé de deux maisons sur une parcelle paysagée de 2 243m2 avec piscine est extrêmement rare de par sa localisation avec une vue exceptionnelle. La première maison, datant du 19e siècle, se compose en rez-de-chaussée d'un séjour de plus de 30m2 avec sa cheminée en pierre, d'une cuisine indépendante voutée avec arrière cuisine, ainsi que d'une chaufferie et d'un wc indépendant. Au 1er étage: une chambre spacieuse ainsi qu'une salle d'eau en travertin avec wc. Au 2nd étage: un bureau et une chambre lumineuse offrant une vue dégagée sur les toits du village et son clocher. La 2e maison, entièrement de plain pied, se compose d'un séjour ouvert sur le jardin, d'une cuisine entièrement équipée avec arrière cuisine, de deux chambres avec placard, d'une salle d'eau, d'une buanderie et d'un wc indépendant. Chaque maison bénéficie de sa propre chaudière au gaz de ville et de la climatisation. Côté extérieur la propriété bénéficie d'une piscine 11*5 entièrement automatisée avec traitement au sel ainsi que sa plage carrelée avec vue dominante. L'ensemble du jardin est paysagé et profite d'un arrosage automatique. Ce bien possède de nombreuses prestations et dépendances: terrain de pétanque, cave voûtée, local technique de 40m2, forage, puit... Cette propriété saura vous séduire par sa localisation idéale et ses prestations généreuses. Ce bien vous est présenté par Florian RUCART, agence MON PROJET IMMO, ref 083.
Afficher plus";"['210 m² - 6 pièces - 4 chambres - ter. 2 243 m²', 'Piscine', 'Orientation : Est', '5 Parkings', 'Terrasse', 'Année de construction : 1820', 'Chauffage individuel au gaz', 'Climatisation', 'Cuisine séparée, équipée', ""2 salles d'eau"", '3 wc', '', None, None, None, None, None, None, None, None]";['https://photo.superimmo.com/cjw63trdhgj2fln302ama10y7ly6', 'https://photo.superimmo.com/wxwfy74n39wdntwugm30q8pxqc77', 'https://photo.superimmo.com/ksxo4cofdrswm4wj9wxx7flxnxcp', 'https://photo.superimmo.com/ipjihhbohd24udtxligidyqh840s', 'https://photo.superimmo.com/hd1psv2ff024blb0eg6qks7k9mgd', None, None, None, None, None]
63;https://www.superimmo.com/annonces/achat-maison-110m-senas-13560-xwczsb;454000;110;5;4;Sénas (13560);4127;20/07/2024;1 terrasse;1 garage - 7 parkings;Barème d’honoraires : https://mon-projetimmo.fr/i/redac/honoraires?honofor=1;"À Vendre - Maison de 108 m2 avec Piscine à Sénas
Caractéristiques Principales :
Surface Habitable : 108 m2
Nombre de Pièces : 5
Année de Construction : 2003
Garage : 60 m2
Cuisine d'Été : 20 m2
Piscine : Oui
Terrain : 718 m2
Description :
Située dans une impasse calme et proche du centre-ville de Sénas, cette maison de 108 m2 construite en 2003 vous charmera par ses espaces généreux et ses prestations de qualité.
Intérieur :
Pièce à Vivre : Grande pièce de 52 m2 avec cuisine aménagée et équipée avec matériaux de qualité
Espace Nuit : Quatre chambres dont trois avec placard, une salle d'eau et des WC indépendants.
Garage : Environ 60 m2, avec buanderie, bureau, cave et espace pour garer une voiture.
Extérieur :
Terrain : Plus de 718 m2, entièrement clôturé et arboré.
Cuisine d'Été : Plus de 20 m2 pour profiter pleinement des journées ensoleillées.
Piscine : Idéale pour se rafraîchir et se détendre.
Les Plus :
Climatisation réversible dans la pièce à vivre.
Eau du canal.
Nombreux stationnements disponibles sur la parcelle.
Localisation :
Adresse : Sénas, dans une impasse au calme.
Proximité : À quelques pas du centre-ville et de toutes les commodités.
Informations Supplémentaires : Les informations sur les risques auxquels ce bien est exposé sont disponibles sur le site Géorisques : www.georisques.gouv.fr
Ce bien vous est présenté par Richard ROMAIRE agence MON PROJET IMMO. REF
Afficher plus";"['110 m² - 5 pièces - 4 chambres', 'Piscine', 'Orientation : Est, Ouest, Sud, Sud-Ouest', '1 garage - 7 parkings', '1 terrasse', 'Année de construction : 2000', 'Chauffage individuel', 'Climatisation', 'Cuisine ouverte, équipée', 'Séjour de 55 m²', ""1 salle d'eau"", '1 wc', 'Alarme', '', None, None, None, None, None, None]";['https://photo.superimmo.com/b0214wpb6aoj3sdgc1u9xqhrjd6a', 'https://photo.superimmo.com/yn7v0ci22lr89hbtl11828fi0kfw', 'https://photo.superimmo.com/5turckn2tv2wfc11fgjjoi9k9nk4', 'https://photo.superimmo.com/zijraeyxpoeu7zfbj5cznw9yv7ay', 'https://photo.superimmo.com/cqzh3vq0zklvwr3sbe2kmo60ottz', 'https://photo.superimmo.com/hjlolg74690g8gw5y2vbcw8d4i3j', None, None, None, None]
64;https://www.superimmo.com/annonces/achat-appartement-59m-marseille-3eme-13003-xwczrb;125000;59;3;2;Marseille 3ème (13003);2119;20/07/2024;Étage 6/7 avec ascenseur;Cuisine séparée;Barème d’honoraires : superhome.fr;"Superhome vous propose un grand T3 à quelques minutes de la gare à pieds.
Situé dans une impasse au calme absolu, il est composé d'une entrée, une grande piece de vie donnant sur un balcon ensoleillé, une cuisine séparée avec sa grande loggia qui permet d'optimiser l'espace, deux chambres, une salle d'eau et un WC
Une cave complète le bien.
Proche de tous les commerces, université, transports, ecoles....
Prenez contact avec johanna o611585568 pour visiter !";"['59 m² - 3 pièces - 2 chambres', 'Étage 6/7 avec ascenseur', 'Cave', 'Année de construction : 1960', 'Cuisine séparée', ""1 salle d'eau"", '1 wc', '', None, None, None, None, None, None, None, None, None, None, None, None]";['https://photo.superimmo.com/dvefk4sw71wawkt1p8h0geuqm5p6', 'https://photo.superimmo.com/lmo3r4ss98si2majimtal4wjogcm', 'https://photo.superimmo.com/ugfxg9siwqn6ry7suc8u26twf13y', 'https://photo.superimmo.com/wrjv8p2crv0phxo6dcakkn9nd6xq', 'https://photo.superimmo.com/66k5mqngq2z7q2swlu67giysbsc6', None, None, None, None, None]
65;https://www.superimmo.com/annonces/achat-appartement-88m-marseille-8eme-13008-xwczra;415000;88;4;3;Marseille 8ème (13008);4716;20/07/2024;Exclusivité;Étage 1/3 avec ascenseur;Honoraires à la charge du vendeur. Barème d’honoraires : http://agences-reunies.la-boite-immo.com/i/redac/honoraires?honofor=1506;"Photos en cours de réalisation.
Jonathan SEBAG vous propose EN EXCLUSIVITE,, au calme, au sein d'une très jolie résidence des années 90, fermée et sécurisée, à proximité immédiate des plages de la Pointe rouge et de la Veillie Chapelle, Bd Mireille Jourdan Barry Marseille 8ème, appartement lumineux et traversant de type 4 de 88 m2 avec une large terrasse sans vis-à-vis de 16 m2, au 1er étage avec ascenseur.
Une entrée donnant sur un séjour de 40 m2 ouvert sur terrasse exposée Ouest, une cuisine équipée et séparée en partie (possibilité de supprimer la cloison séparative).
Partie nuit, un couloir menant à deux chambres avec placards encastrés de 9,52 m2 et 10,22 m 2, une troisième chambre parentale avec sa salle de bains et son dressing de 16,34 m2.
Une seconde salle d'eau et wc séparé.
Double vitrage, nombreux placards et rangements, électricité aux normes.
Possibilité d'acquérir en sus du prix un garage en sous-sol de 14,60 m2 et une place de parking de plain-pied.
Eau et chauffage individuels.
Charges mensuelles 180EUR.
Taxe foncière 1790EUR.
Contacter Jonathan SEBAG au 0629700816
Afficher plus";"['88 m² - 4 pièces - 3 chambres', 'Étage 1/3 avec ascenseur', '1 garage - 1 parking', '1 terrasse', 'Année de construction : 1990', 'Chauffage individuel', ""1 salle d'eau - 1 salle de bain"", '1 wc', 'Copropriété de 25 lots', '', None, None, None, None, None, None, None, None, None, None]";[None, None, None, None, None, None, None, None, None, None]
66;https://www.superimmo.com/annonces/achat-appartement-65m-marseille-4eme-13004-xwczql;190000;22;3;2;Marseille 4ème (13004);2913;20/07/2024;Étage 2/3;1 balcon (3 m²);Honoraires à la charge du vendeur. Barème d’honoraires : https://immodltransactions.fr/i/redac/honoraires?honofor=1;"Charmant appartement de 2 chambres dans le 4e arrondissement de Marseille. Cet appartement de 65,22 m2 comprend une cuisine, deux chambres, une salle d'eau et un salon de 16,86 m2. La disposition actuelle permet d'ouvrir la cuisine, le salon et le séjour pour créer un grand espace de vie convivial. Le bien dispose d'une cave en sous-sol.
Vous pourrez également profiter d'un agréable balcon de 3,22 m2 avec vue sur le jardin, portant la surface totale à 68,44 m2. Le prix de vente est de 190 000 EUR.
Montant estimé des dépenses annuelles d'énergie pour un usage standard : entre 1 420 EUR et 1 960 EUR par an. Prix moyens des énergies indexés sur l'année non communiqué (abonnements compris).
Honoraire charge vendeur
Bien soumis au régime de la copropriété : Aucune procédure en cours.
Les informations sur les risques auxquels ce bien est exposé sont disponibles sur le site Géorisques : www.georisques.gouv.fr
N'hésitez pas à nous contacter au 06.72.22.30.48 pour en savoir plus ou pour organiser une visite.
Afficher plus";"['65,22 m² - 3 pièces - 2 chambres', 'Étage 2/3', 'Orientation : Nord', 'Cave (13,6 m²)', '1 balcon (3 m²)', 'Année de construction : 1970', 'Cuisine séparée', 'Séjour de 16 m²', ""1 salle d'eau"", '1 wc', None, None, None, None, None, None, None, None, None, None]";['https://photo.superimmo.com/61dhopdp00j1ilkyyap901dar4bn', 'https://photo.superimmo.com/rimmaouh1z0y0jxfaaamju7fizqc', 'https://photo.superimmo.com/9iyxvg9mz5bapws5f58anah0e339', 'https://photo.superimmo.com/p6miz758043nuceg60d9aguk4sy8', 'https://photo.superimmo.com/284hqbyz3bjut6gn1v7urpuuoxi5', None, None, None, None, None]
67;https://www.superimmo.com/annonces/achat-maison-90m-auriol-13390-xwczqf;295000;90;4;3;Auriol (13390);3278;20/07/2024;1 terrasse;1 Garage;Honoraires à la charge du vendeur. Barème d’honoraires : https://www.chaiximmobilier.com/;13390 AURIOL - Au calme, proches de toutes les commodités à pied, au coeur du village, Charmante maison de Ville atypique entièrement rénovée Type 4 de 87,08m2 répartie sur 3 niveaux. La maison est traversante et se compose en rez-de-chaussée d'un garage de 28m2. Au 1er étage un séjour, cuisine équipée, salle à manger donnant sur un balcon de 2m2. Au 2ème étage un dégagement pouvant servir de bureau, une chambre avec placards, salle d'eau et wc. Au 3ème étage deux chambres et une salle d'eau avec wc. Une Cave de 27m2 avec un accès extérieur complète ce bien. Un vrai cocon sans aucun travaux. Pas de copropriété, pas de charges. 'Les informations sur les risques auxquels ce bien est exposé sont disponibles sur le site Géorisques http://www.georisques.gouv.fr'.;"['90 m² - 4 pièces - 3 chambres', 'Orientation : Est / Ouest', '1 Garage', '1 terrasse', 'Chauffage individuel', 'Séjour de 27 m²', ""2 salles d'eau"", '2 wc', None, None, None, None, None, None, None, None, None, None, None, None]";['https://photo.superimmo.com/hiyfc2y2o53viwdu8x8jmgqlwxdb', 'https://photo.superimmo.com/72ztsmjgx67c2i70in6pzp1naayl', 'https://photo.superimmo.com/5b3llk1ha3x3pe5rr4xi0e8t1m4s', 'https://photo.superimmo.com/wcp6qhpl03mxxyl0xnjlsbdb170k', 'https://photo.superimmo.com/8l1mv1wa8kmcy6kx9hhef10c1u7y', None, None, None, None, None]
68;https://www.superimmo.com/annonces/achat-maison-65m-marseille-12eme-13012-xwczll;239000;65;3;2;Marseille 12ème (13012);3677;20/07/2024;Exclusivité;;Barème d’honoraires : https://bareme.safti.fr/;"Découvrez cette charmante maison de ville sur 3 niveaux, rénovée avec goût et offrant un cadre de vie calme et fonctionnel à proximité de toutes les commodités.
Au rez-de-chaussée, une cuisine équipée ouverte sur un agréable séjour / salle à manger vous accueille pour des moments de convivialité en famille ou entre amis.
À l'étage, vous retrouverez une chambre spacieuse, une salle d'eau moderne et les toilettes principaux de la maison.
Parfaitement ensoleillée, la terrasse vous invite à profiter des beaux jours et du calme en plein cœur de la ville.
Sous les toits, une chambre mansardée aménagée avec charme offre un espace supplémentaire pour une chambre, un bureau ou un coin lecture.
Les informations sur les risques auxquels ce bien est exposé sont disponibles sur le site Géorisques : www.georisques.gouv.fr
Prix de vente : 239 000 €
Honoraires charge vendeur
Contactez votre conseiller SAFTI : Thibault BONETTO, Tél. : 0760939130, E-mail : - EI - Agent commercial immatriculé au RSAC de Marseille sous le numéro 915 357 420 - SAFTI – BONETTO Thibault, Conseiller indépendant
Afficher plus";['65 m² - 3 pièces - 2 chambres', 'Année de construction : 1930', '1 wc', '', None, None, None, None, None, None, None, None, None, None, None, None, None, None, None, None];['https://photo.superimmo.com/lbw57z8fd1khrkjz2cprsrgkv0ie', 'https://photo.superimmo.com/m4f6jfypj6y5siumb4afbcaerjzi', 'https://photo.superimmo.com/2urkfltd76dntsli6jg5tceijsid', 'https://photo.superimmo.com/k4jy922hn81ss3memmz2baubsij2', 'https://photo.superimmo.com/bx55uwc6rk2sxdrwe9sz7wv5hpyt', None, None, None, None, None]
69;https://www.superimmo.com/annonces/achat-maison-110m-marseille-14eme-13014-xwczic;250000;110;4;3;Marseille 14ème (13014);2273;20/07/2024;Meublée;1 Garage;Honoraires à la charge du vendeur. Barème d’honoraires : https://agpr.archive.immo/agpr/agence/bareme/1200.pdf;"Maison individuelle T4 en R+1 de 110m² Secteur Bd Henri Maulini
L IMMOBILIERE DE LA BONNE MERE vous propose une grande maison individuelle en R+1 d'environ 110m² avec son grand jardin de 100m² et une cave de 16m².
Le bien est composé :
Au rez-de-chaussée vous trouverez un hall d entrée, une grande cuisine de 24m² sur mesure et équipée entièrement vitrée, un séjour de 16m² avec insert fonctionnel, une grande chambre de 18m², une salle de bain de 4,5m², un wc séparé, un bureau de 6m² ainsi qu'un espace de stockage de 4m².
Le premier étage premier étage est composée de deux espaces de 21m² chacun mansardés pouvant accueillir deux chambres et une salle d'eau.
La superficie totale de l'extérieur est de 100 m² qui comprend un abri de jardin de 8m², un jardin de 70m², une terrasse de 25m² ainsi qu'une grande cave sous la maison de 16m².
La maison a été intégralement rénové, vous profiterez d'une toiture neuve. Aucun frais important à prévoir.
Si vous recherchez de beaux volumes, une maison individuelle, de nombreuses possibilités d emménagement, un beau jardin et le calme absolu, ce bien est fait pour vous.
A proximité immédiate des commerces et grands axes routiers ou L2.
Taxe foncière : 1041euros
Vidéo disponible sur demande.
Prix : 250 000euros (Les honoraires d'agence sont intégralement à la charge du vendeur)
ESTIMATION GRATUITE SOUS 48H : RAPHAEL AUDIBERT EXPERT DU 14éme ET 13eme ARRONDISSEMENT
Mandat n° 30
Estimation des coûts annuels : entre 700 euros et 1000euros par an, prix moyens des énergies indexés au 1er janvier 2021
Les informations sur les risques auxquels ce bien est exposé sont disponibles sur le site Géorisques : www.georisques.gouv.fr
L IMMOBILIERE DE LE BONNE MERE
Gestion / Transaction / Syndic
178 Cours Lieutaud 13006 Marseille
57 Bd Kraemer 13014 Marseille
Afficher plus";['110 m² - 4 pièces - 3 chambres - ter. 100 m²', 'Vue dégagée', '1 Garage', 'Cave (16 m²)', 'Chauffage individuel au gaz', 'Climatisation', 'Cuisine séparée', 'Séjour de 16 m²', '1 salle de bain', 'Wc séparé - 1 wc', 'Cheminée', 'Alarme', None, None, None, None, None, None, None, None];['https://photo.superimmo.com/tsqkefivupbf54t1cmxg68sljtk7', 'https://photo.superimmo.com/yygco78qmewlyxkzg6h8dcbro2op', 'https://photo.superimmo.com/c6cakz3k6h4u3gaa7v9yir9o7gqe', 'https://photo.superimmo.com/qzaows71vrv0kdd89fy0ave0rn9o', 'https://photo.superimmo.com/85uqan1u1impl7p95irqi6lfugy9', None, None, None, None, None]
