;url;price;surface;nb_pieces;nb_chambres;lieu;prix_m2;date_publication;tag_1;tag_2;tag_3;description;tags;images_url
68;https://www.superimmo.com/annonces/achat-appartement-126m-limonest-69760-xwc15s;731500;32;4;3;Limonest (69760);5791;17/07/2024;Exclusivité;Étage 2/1;Honoraires à la charge du vendeur.;"DUPLEX- 4 PIÈCES- 126.32 m²-TERRASSE - JARDIN
César et Brutus by KW vous présente en exclusivité ce superbe duplex de 126.32 m², dans une ancienne bâtisse réhabilitée alliant le charme de l'ancien et le confort moderne. Proche du centre du village, à quelques pas de l'arrêt de bus et de tous les commerces.
Il bénéficie d'un grand salon/salle à manger donnant sur l'extérieur, d'une cuisine séparée, entièrement aménagée et équipée avec de nombreux rangements deux chambres confortables et une salle de bain spacieuse avec baignoire et douche.
A l'étage :
Une belle suite parentale climatisée, et un bureau pouvant être fermé pour créer un espace indépendant, idéal pour une profession libérale ou un studio.
A l'extérieur un jardin , deux terrasses :
Une terrasse ensoleillée idéale pour profiter des beaux jours.
Une terrasse ombragée, parfaite pour se détendre lors des fortes chaleurs.
Une cabane de rangement et de stockage pratique pour vos affaires et un Jacuzzi pour des moments de détente.
Une cave et deux places de parking complètent le bien.
Ce duplex est un véritable coup de cœur, offrant un cadre de vie exceptionnel à proximité de toutes les commodités. N'attendez plus pour venir le visiter !
DPE : D GES: D
TF : 1261 euros
Date de réalisation du diagnostic: 12/07/2024
Bien soumis à la copropriété.
Pas de procédure en cours.
Nombre de lots d'habitations : 11 Lots (4 bâtiments)
Charges de copropriété mensuelles : 245 euros
Envie d'en savoir plus sur cet appartement en vente ? Prenez contact avec Sophie Heinen - - 07 69 27 36 43.
RSAC 918089491
Référence annonce: 58 68
Les informations sur les risques auxquels ce bien est exposé sont disponibles sur le site Géorisques :
www.georisques.gouv.fr
Les informations sur les risques auxquels ce bien est exposé sont disponibles sur le site Géorisques du gouvernement.
Afficher plus";['126,32 m² - 4 pièces - 3 chambres', 'Étage 2/1', '2 Parkings', 'Balcon', 'Copropriété de 31 lots', '', None, None, None, None, None, None, None, None, None, None, None, None, None, None];['https://photo.superimmo.com/9gwvnf9rk02cu832r9cb9xebozxc', 'https://photo.superimmo.com/z2iln99m4t993evttcpny78rfn7u', 'https://photo.superimmo.com/hhpa0m4qcaj1j24r8mopq8aledgy', 'https://photo.superimmo.com/a3hm9a7xe5rm0a5cc3pouobhw9xl', 'https://photo.superimmo.com/vnys897j9jx51bkgr9fy7hb5r9tn', None, None, None, None, None]
69;https://www.superimmo.com/annonces/achat-appartement-68m-lyon-5eme-69005-xwc15r;245000;8;3;2;Lyon 5ème (69005);3599;17/07/2024;Exclusivité;Étage 5/10;Honoraires à la charge du vendeur.;"Lyon 5 - À proximité des transports et des commerces, dans une résidence calme et sécurisée, venez découvrir ce joli T3 en étage élevé, calme et lumineux.
Il est exposé à l'ouest. Il se situe au 5e étage d'un immeuble avec ascenseur. La sécurité de l'appartement est assurée par un interphone.
Il se compose : D'une entrée, d'une cuisine aménagée et équipée, d'un séjour donnant accès au balcon exposé Ouest, de deux chambres, d'une salle de bains et d'un WC séparé.
Une cave est associée à l'appartement.
Possibilité d'un stationnement en sus.
Des établissements scolaires de tous types (de la maternelle au lycée) sont implantés à proximité. On trouve un arrêt de bus à trois minutes du bien ainsi que le tram à 10 minutes. Pour vos loisirs, vous pourrez compter sur un théâtre à moins de 10 minutes. Il y a également de nombreux restaurants et un bureau de poste. Enfin, un marché a lieu toutes les semaines le mercredi matin.
Samuel BLANCHET
06/44/78/42/60
Référence : 5859
Les informations sur les risques auxquels ce bien est exposé sont disponibles sur le site Géorisques du gouvernement.
Afficher plus";['68,08 m² - 3 pièces - 2 chambres', 'Étage 5/10', 'Balcon', 'Année de construction : 1970', '1 wc', 'Copropriété de 1243 lots', None, None, None, None, None, None, None, None, None, None, None, None, None, None];['https://photo.superimmo.com/63jl7qgiwtiqcw77jmlz4ng1gasq', 'https://photo.superimmo.com/4sqc1v0se5msr6yd7r6wjvontmsf', 'https://photo.superimmo.com/2vtcrjbgokcgmsh942j9qh08w4vf', 'https://photo.superimmo.com/0mgfgnqu3mnkcjcx9g2l2ghh9ac5', 'https://photo.superimmo.com/7eaq29mgc136tiqabq2bnz54fk4c', None, None, None, None, None]
70;https://www.superimmo.com/annonces/achat-appartement-45m-lyon-2eme-69002-xwc15q;160000;45;1;;Lyon 2ème (69002);3556;17/07/2024;Exclusivité;;Honoraires à la charge du vendeur.;"PLATEAU VIABILISÉ
Julie Conte Invest by KW, a le plaisir de vous présenter cette belle opportunité :
Au sein du prestigieux 2ème arrondissement Lyonnais et plus particulièrement dans le quartier en fort développement de CONFLUENCE. A proximité des transports, commerces, et écoles et gare SNCF de Perrache.
Studio à rénover d'environ 45m2, situé au rez-de-chaussée dans un ancien entrepôt semi-indépendant construit en 1939, en parfait état au sein d’une copropriété de 39 lots principaux bien entretenue et suivie par ses habitants.
Les évacuations d'eau et cloisonnages sont réalisés par le propriétaire actuel.
Vous bénéficierez d’un local vélo et d’un local poubelle.
Ce bien se compose d'une pièce principale avec les évacuations et les arrivées d'eau.
Un bien idéal pour un investissement locatif ou un premier achat.
Découvrons ce bel appartement ensemble, contactez-moi !
Agent Julie Conte
07 83 86 46 84 -
Agent commercial
RSAC : 835221169 / EI
Référence : 5879
Les informations sur les risques auxquels ce bien est exposé sont disponibles sur le site Géorisques du gouvernement.
Afficher plus";"['45 m² - 1 pièce', 'Rez-de-chaussée', 'Année de construction : 1939', ""1 salle d'eau"", '1 wc', 'Copropriété de 39 lots', None, None, None, None, None, None, None, None, None, None, None, None, None, None]";[None, None, None, None, None, None, None, None, None, None]
71;https://www.superimmo.com/annonces/achat-maison-145m-dardilly-69570-xwc101;750000;145;6;4;Dardilly (69570);5172;17/07/2024;Exclusivité;Piscine;Honoraires à la charge du vendeur.;"A Vendre Villa 4 Chambres Dardilly
-- Guillerme Immobilier --
Excluvisité
Votre Agence Guillerme Immobilier Dardilly vous propose à la vente en exclusivité cette magnifique villa de 145m2 habitables (230m2 utiles) avec son terrain de 2000m2 et sa piscine avec pool house.
Elle se compose:
Au Rez-de-jardin:
- Une vaste pièce de vie de 60m2 avec cuisine ouverte donnant sur une terrasse avec vue sur le clocher de Dardilly
- Une chambre parentale avec salle d'eau et dressing
- Une seconde chambre
Au 1er étage:
- Deux chambres
- Un coin bureau
- Une salle de bains
Sous-sol complet de 95m2
- Garage double
- Buanderie
- Coin chaufferie
Equipements:
- Fibre optique
- Pompe à chaleur Air/Eau (avec production d'eau chaude)
- BSO
On aime:
- Le terrain profitable avec superbe vue
- Les 4 chambres dont deux de plain-pied
- Le sous-sol complet
Pas de travaux à prévoir
Contact: Christophe
Agence Guillerme Immobilier
4 Bis Ruelle des Soeurs
69570 DARDILLY
Afficher plus";['145 m² - 6 pièces - 4 chambres - ter. 2 000 m²', 'Piscine', 'Orientation : Est', 'Vue dégagée', 'Année de construction : 1972', 'Fenêtres double vitrage', 'Vidéosurveillance', '', None, None, None, None, None, None, None, None, None, None, None, None];['https://photo.superimmo.com/614nha564e8o049ntqwwh4z8q12p', 'https://photo.superimmo.com/gg2l21qovkjgalw2iws3g7inyby9', 'https://photo.superimmo.com/2iix5uoww62iy1cxxhhyrod25hsn', 'https://photo.superimmo.com/7t4sjlaj9nbevcxuf8dvjfx78hun', 'https://photo.superimmo.com/j8h3dad8pzjvrcn93u8koahr9n1t', None, None, None, None, None]
72;https://www.superimmo.com/annonces/achat-appartement-124m-lyon-8eme-69008-xwc0qz;400000;124;5;4;Lyon 8ème (69008);3226;17/07/2024;;;Barème d’honoraires : https://bareme.safti.fr/;"Investisseurs et familles, saisissez cette opportunité unique ! En collaboration avec Efficity, SAFTI vous présente ce superbe T5 de 124 m², idéalement situé au 2ème étage d’un immeuble au charme de l’ancien, offrant un potentiel exceptionnel et une localisation privilégiée.
Situé dans une rue résidentielle calme, cet appartement bénéficie d’un emplacement stratégique avec un accès facile aux transports en commun et aux principales commodités :
Tram T2 et T4 à proximité immédiate.
Nombreuses lignes de bus accessibles.
Métro Grange Blanche à seulement 10 minutes.
Accès direct au périphérique et à l'autoroute A43.
Profitez d’un quartier dynamique et résidentiel, proche des écoles, des commerces et des universités, tout en bénéficiant de la tranquillité d’une rue à sens unique.
Cet appartement lumineux et traversant séduit par son charme authentique :
Volumes généreux et hauteurs sous plafond, parfaits pour les amateurs d’espaces.
Cheminées en marbre, boiseries murales et parquets en chêne massif, témoins du charme de l’ancien.
Agencement optimal : 124 m² bien répartis autour d’un spacieux dégagement, comprenant une cuisine séparée de plus de 11 m², un séjour de 27 m², 4 belles chambres, un dressing, deux WC et une salle de bain.
Un atout majeur pour les investisseurs : cet appartement, issu de la réunion de deux logements, offre la possibilité d’être divisé en deux T3 grâce à ses deux entrées séparées déjà existantes.
Rénové en 2000, il dispose de :
Double vitrage en PVC pour une isolation optimale.
Chauffage individuel au gaz avec chaudière à condensation.
DPE D.
Le tout est complété par deux caves spacieuses de 8,39 m² et 4,31 m², parfaites pour le stockage.
Pour plus d’informations et pour organiser une visite, n’hésitez pas à me contacter dès maintenant. Ne laissez pas passer cette opportunité rare et pleine de potentiel !
Le bien comprend 3 lots, et il est situé dans une copropriété de 11 lots (les charges courantes annuelles moyennes de copropriété sont de 1550 € et le syndicat des copropriétaires ne fait pas l'objet d'une procédure citée à l'article L. 721-1 du code de la construction et de l'habitation).
Les informations sur les risques auxquels ce bien est exposé sont disponibles sur le site Géorisques : www.georisques.gouv.fr
Prix de vente honoraires d'agence inclus : 400 000 €
Prix de vente hors honoraires d'agence : 390 000 €
Honoraires : 2,56 % TTC de la valeur du bien hors honoraires
Honoraires charge acquéreur
Contactez votre conseiller SAFTI : Carine CHAINTREUIL, Tél. : 06 17 37 59 55, E-mail : - EI - Agent commercial immatriculé au RSAC de LYON sous le numéro 832 286 785 - SAFTI – CHAINTREUIL Carine, Conseiller indépendant
Afficher plus";['124 m² - 5 pièces - 4 chambres', 'Année de construction : 1880', '2 wc', '', None, None, None, None, None, None, None, None, None, None, None, None, None, None, None, None];['https://photo.superimmo.com/3kutnbphgs4mf23wphw0m9idk6qo', 'https://photo.superimmo.com/e39pl6h61xyrdwras6b4w36q3gjk', 'https://photo.superimmo.com/mg5f4lun5408t3cptv871gyk2dca', 'https://photo.superimmo.com/e25vvf4ysvw29w0fzbv3bg4ddizg', 'https://photo.superimmo.com/gi0tolr5tfdkl55nc8bw6bhrxna2', None, None, None, None, None]
73;https://www.superimmo.com/annonces/achat-appartement-59m-venissieux-69200-xwbzz7;185000;16;3;2;Vénissieux (69200);3127;17/07/2024;Exclusivité;Étage 3/4 avec ascenseur;Honoraires à la charge du vendeur. Barème d’honoraires : https://www.bussat-immobilier.com/i/redac/honoraires?honofor=1;"Appartement Lumineux à 10 minutes du Centre
Votre futur nid douillet vous attend !
Découvrez cet appartement idéalement situé à moins de 10 minutes du centre-ville, parfaitement desservi par les transports en commun : bus C12, métro ligne B (station gare de Vénissieux) et tramway T4.
Une localisation idéale qui allie tranquillité et praticité !
Vivez des moments uniques : Que vous préfériez savourer un café en terrasse au petit matin ou organiser des soirées apéros entre amis, cet appartement est fait pour vous !
Caractéristiques du bien :
Grande entrée avec rangements intégrés pour une organisation optimale.
Vaste pièce de vie : salon-séjour lumineux avec cuisine équipée, ouvrant sur un balcon exposé plein Sud pour profiter du soleil toute la journée.
Deux chambres dont une avce ouverture sur la terrasse.
Salle de bain moderne et fonctionnelle.
Toilette séparée pour plus de confort.
Cerise sur le gâteau : Possibilité d'acquérir un garage en supplément.
Quelques chiffres clés :
DPE / GES : C - 106 kWh/m2/an, C - 21 kg CO2/m2/an
Charges prévisionnelles : 317,20 EUR par trimestre (incluant 15,56 EUR de fonds de travaux)
Taxe foncière : 1 002 EUR
Informations supplémentaires : Appartement soumis au régime de la copropriété comprenant 57 lots d'habitation répartis sur 3 bâtiments. Pas de procédure en cours.
Les honoraires sont à la charge du vendeur.
Envie d'en savoir plus ? Exclusivité BUSSAT Immobilier
Contactez sans attendre Virginie Dumont-Hénoux - Agent Commercial - EI - RSAC 883 837 098 (Lyon) pour organiser une visite. Référence de l'annonce : 7839.
Les informations sur les risques liés à ce bien sont disponibles sur le site Géorisques www.georisques.gouv.fr
Cette annonce vous est proposée par DUMONT-HENOUX Virginie - - NoRSAC: 883837098, Enregistré au Greffe du tribunal de commerce de LYON
Afficher plus";['59,16 m² - 3 pièces - 2 chambres', 'Étage 3/4 avec ascenseur', 'Orientation : Nord, Nord-Ouest, Est, Ouest', '1 Garage', '1 balcon (5 m²)', 'Année de construction : 2013', 'Chauffage individuel au gaz', 'Cuisine ouverte', 'Séjour de 23 m²', '1 salle de bain', '1 wc', 'Interphone', 'Copropriété de 57 lots', '', None, None, None, None, None, None];['https://photo.superimmo.com/6v2ratpgjdvtfr8sylveztfj7kir', 'https://photo.superimmo.com/xqiqqag5zromb1wojh6bohsi5qgs', 'https://photo.superimmo.com/1g3lihrlg1o0t31si9fkhzsa7qxn', 'https://photo.superimmo.com/886atcq7n6h3f27dn8g6wuasp3u4', 'https://photo.superimmo.com/knp8q016q798c42xds6fzxoka7i6', None, None, None, None, None]
74;https://www.superimmo.com/annonces/achat-appartement-52m-lyon-7eme-69007-xwbzz6;200000;7;2;1;Lyon 7ème (69007);3841;17/07/2024;Exclusivité;Étage 4/5;Honoraires à la charge du vendeur. Barème d’honoraires : https://www.bussat-immobilier.com/i/redac/honoraires?honofor=1;"Lyon 7ème/Garibaldi Berthelot à côté du tramway - Venez decouvrir ce beau T2 de 52 m2 situé en étage élevé d'une petite copropriété !
Il est composé d'un séjour avec cuisine ouverte, d'une grande chambre avec alcove et d'une salle de bains.
Fenêtres récentes avec double vitrage et volets roulants électriques. Cave et grenier.
DPE : G 471 kWh ep/m2.an. Energie finale kWh/m2/an 200 (Chaudière électrique)
Estimation des émissions : C 15 kg eqCO2/m2.an (Classe C)
Estimation des coûts annuels : entre 1 460 EUR et 2 010 EUR par an, prix moyens des énergies indexés au 1er janvier 2021.
Les informations sur les risques auxquels ce bien est exposé sont disponibles sur le site Géorisques : https://www.georisques.gouv.fr
Un bien proposé en exclusivité par Bussat immobilier
Honoraires à la charge du vendeur.
Afficher plus";['52,07 m² - 2 pièces - 1 chambre', 'Étage 4/5', 'Orientation : Sud', 'Cave (2 m²)', 'Année de construction : 1920', 'Chauffage individuel électrique', 'Cuisine séparée', 'Séjour de 13 m²', '1 salle de bain', '1 wc', 'Cheminée', 'Interphone', 'Copropriété de 18 lots', '', None, None, None, None, None, None];['https://photo.superimmo.com/ehnzwy205e803dlwldndng3nakdf', 'https://photo.superimmo.com/0g2nlxqj17i241nwppjqpkz3joi3', 'https://photo.superimmo.com/puzv8ixxgr4yk3yjvrqu90c9a2gy', None, None, None, None, None, None, None]
75;https://www.superimmo.com/annonces/achat-maison-110m-saint-genis-les-ollieres-69290-xwbzup;470000;110;5;4;Saint-Genis-les-Ollières (69290);4273;17/07/2024;2 Garages;;Honoraires à la charge du vendeur. Barème d’honoraires : https://ouestimmo.la-boite-immo.com/i/redac/honoraires?honofor=1;"RESEAU OUEST IMMO vous propose au coeur de Saint Genis Les Ollieres, au fond d'une petite impasse à l'abris des regards tout en restant à deux pas du centre avec commerces, écoles et bus TCL (direction Tassin et Lyon) à pied, belle maison familiale de plus de 110m2 habitables sur une parcelle de terrain clos et paysager de 750m2.
Elle se compose d'un espace de vie avec séjour et salon, cuisine séparée qu'il est possible d'ouvrir sur le séjour, 3 chambres, salle de douche, wc séparé. Placards de rangements.
Une chambre complémentaire au rez de chaussée avec sa salle de douche a été crée pour compléter ce bien. Sous-sol complet avec garagen espace atelier et buanderie.
Vous serez séduit par le jardin intimiste de cette charmante maison entièrement clos, arboré et piscinable. Elle dispose de plusieurs espaces terrasses avec vue dégagée dont une couverte.
Pour plus de renseignements et visite contactez Solene ESCARABAJAL o6x82x39x61x16 Bernard MONTILLET o6x67x11x22x11 avec la référence 5846a.
Afficher plus";"['110 m² - 5 pièces - 4 chambres - ter. 745 m²', 'Orientation : Est / Ouest', '2 Garages', ""1 salle d'eau - 1 salle de bain"", None, None, None, None, None, None, None, None, None, None, None, None, None, None, None, None]";['https://photo.superimmo.com/si05x4hghq95h3khrpqvcn8nxadx', 'https://photo.superimmo.com/8443wx5qgfpx79gt2cisbbiphu1i', 'https://photo.superimmo.com/wxj41qhbz2inej18l4iv9lu9be6b', 'https://photo.superimmo.com/1a20somfc9wbpv9igr43ct4e5ks5', None, None, None, None, None, None]
76;https://www.superimmo.com/annonces/achat-appartement-58m-venissieux-69200-xwbzuk;125000;66;3;2;Vénissieux (69200);2131;17/07/2024;Exclusivité;Étage 3/4;Honoraires à la charge du vendeur. Barème d’honoraires : https://www.sandraviricel-immobilier.com/i/redac/honoraires?honofor=1;"Rue Joseph Deschamps, à proximité du parc de Parilly et de l'accès périphérique, Sandra Viricel Immobilier a le plaisir de vous présenter dans une copropriété sécurisée (résidence avec grande cour et jardin arboré) ce T3 de 58,7 m2.
Situé au 3ème étage sur entresol (sans ascenseur), vous serez séduits par sa luminosité (appartement traversant), ses 2 chambres, salle de bains et WC.
En annexes, une loggia, une cave et un parking privatif extérieur.
Idéal premier achat ou investisseur.
Des travaux de raffraichissement sont à prévoir.
Agent commercial : Jérémie BOITON (06.85.15.05.30)";['58,66 m² - 3 pièces - 2 chambres', 'Étage 3/4', '1 Parking', 'Cave (4 m²)', '1 balcon (2 m²)', 'Année de construction : 1965', 'Chauffage collectif au gaz (au sol)', 'Cuisine séparée', '1 salle de bain', '1 wc', None, None, None, None, None, None, None, None, None, None];['https://photo.superimmo.com/tddwd1r7ocmu6mmyb4yzzr0i868h', 'https://photo.superimmo.com/fqi8ynnkeb1uvx2d6xjrgr7hutfo', 'https://photo.superimmo.com/kdzd1vfdd3zhn6uotmemcv7kjkw0', 'https://photo.superimmo.com/aca50vt3p4tb1vi2mn44udkogj8z', 'https://photo.superimmo.com/g4wjob2wsnmtr3x3bl713l07rxg3', None, None, None, None, None]
77;https://www.superimmo.com/annonces/achat-appartement-55m-lyon-2eme-69002-xwbzu7;297000;55;2;1;Lyon 2ème (69002);5400;17/07/2024;Étage 1/5;;Barème d’honoraires : https://www.sandraviricel-immobilier.com/i/redac/honoraires?honofor=1;"Lyon 2, Ainay, rue Auguste Comte, Sandra Viricel Immobilier a le plaisir de vous présenter dans un bel immeuble cet appartement de 55 m2 livré en plateau.
Situé au 1er étage, l'appartement bénéficie d'un bel espace de vie de 34 m2 ainsi qu'une grande chambre séparée avec accès à sa salle d'eau et dressing.
En plein centre d'Ainay, ce plateau permet d'être au pied des commerces et des transports pour bénéficier d'un cadre de vie exceptionnel.
Des propositions d'aménagement avec devis ont été réalisées permettant de confier intégralement la rénovation complète de plateau à des artisans qualifiés.
Agent commercial : Jérémie BOITON : 06.85.15.05.30
A visiter rapidement.";"['55 m² - 2 pièces - 1 chambre', 'Étage 1/5', 'Séjour de 25 m²', ""1 salle d'eau"", '1 wc', '', None, None, None, None, None, None, None, None, None, None, None, None, None, None]";['https://photo.superimmo.com/8ojzu4fa3ong0drtzbfzpyv1oj8n', 'https://photo.superimmo.com/kvx9a9nnphxadao6mn16269f538x', 'https://photo.superimmo.com/zbata4rbqxjprgvurxmce2skseyd', 'https://photo.superimmo.com/cs0stfd1umw3ejvvzopquaa21x2s', 'https://photo.superimmo.com/ytpetgo1x6mzane8m2adfdt1xjbg', 'https://photo.superimmo.com/11jnwaykk7yriv86qy9op9vpfe3a', None, None, None, None]
78;https://www.superimmo.com/annonces/achat-appartement-43m-caluire-et-cuire-69300-xwbzll;273000;4;3;2;Caluire-et-Cuire (69300);6290;17/07/2024;Chauffage électrique;;Honoraires à la charge du vendeur. Barème d’honoraires : https://assets.adaptimmo.com/bareme/69004/bareme.pdf;"Caluire - À moins de 100m d'un arrêt de bus (ligne S5).  À 3 min en voiture du boulevard Laurent Bonnevay.  À 5 min en voiture de la Cité Internationale et du Parc de la Tête d'Or. Dans une résidence fermée et sécurisée, totalement réhabilitée en R+2 ! Venez visiter ce charmant appartement T3 de 43.40 m² en rez-de-jardin privatif !! Exposé Est. Refait totalement à neuf avec des matériaux de qualité : faïence, WC suspendu, radiateur à détecteur de présence. Menuiserie double-vitrage. Parquet stratifié. Fibre optique installée :) Très moderne avec tout le cachet de l'ancien ! Au rez-de-chaussée : pièce de vie de 17.40 m² ouverte sur un jardin privatif de 60 m² + 2 chambres à l'étage d'environ 11 m². Jardin de 60 m² engazonné et plantations. Clôture séparative en bois. Dans la copropriété, emplacement à vélo ! Rénovation complète du bâtiment, avec utilisation de matériaux de qualité et une attention particulière sur la rénovation thermique : livré avec une étiquette DPE logement B ou C ! Idéal pour habiter ou pour investir : LMNP possible !! Prix de vente : 273 000 €. Parking extérieur en sus possible : 15 000 €. Meubles de cuisine et électroménager non compris. Présentation 7/7 semaine + SAMEDI ET DIMANCHE compris ! Kamel BOUTIAB - Tél : 06 99 38 81 63 - agent immobilier pour le réseau Casarèse. Mandat N° 4815. D'autres biens sur www casarese com ! Les informations sur les risques auxquels ce bien est exposé sont disponibles sur le site Géorisques : www.georisques.gouv.fr Honoraires TTC charge vendeur. Prix moyens des énergies indexés au 01/01/2021 (abonnement compris). Montant estimé des dépenses annuelles d'énergie pour un usage standard : entre 776 € et 1 050 € par an. Bien soumis au statut juridique de la Copropriété. Nb de lots : 16. Charges annuelles de copropriété (Montant moyen annuel quote-part du budget prévisionnel vendeur) : 960 €. Pas de procédure en cours. Surface CARREZ : 68.8 m²
Afficher plus";"['43,4 m² - 3 pièces - 2 chambres - ter. 60 m²', 'Dernier étage', 'Plain-pied', 'Chauffage électrique', ""1 salle d'eau"", '1 wc', 'Copropriété de 16 lots', '', None, None, None, None, None, None, None, None, None, None, None, None]";['https://photo.superimmo.com/jtv4rolbk3tylbkfskflbz4i0gbs', 'https://photo.superimmo.com/5wic04br1585k11bi7n4hkschsat', 'https://photo.superimmo.com/imgvfthentaksorcqydt2sx0z02v', 'https://photo.superimmo.com/uz6e7ibjbzzh2sf7zn7srwe6kgo0', 'https://photo.superimmo.com/hyvixnt80vtokdqz30o2dq8bm14v', 'https://photo.superimmo.com/kxhcko34g2p331gpths32jgcm7ci', None, None, None, None]
79;https://www.superimmo.com/annonces/achat-appartement-95m-lyon-1er-69001-xwbzgn;570000;14;3;2;Lyon 1er (69001);5991;17/07/2024;Étage 2/3 avec ascenseur;;Honoraires à la charge du vendeur. Barème d’honoraires : https://media.immo-facile.com/segments/immo/catalog/images/manufacturers_bareme/381718.pdf;"Le dialogue réussi entre charme de l'ancien et modernité : tel est sans doute ce qui singularise ce T3 à la très belle atmosphère. Au 2ème étage avec ascenseur d'un immeuble de 1640, profitant du calme d'une rue peu passante à proximité du quai Saint-Vincent et des bords de Saône, l'appartement de 95.14m² Carrez distribue ses volumes généreux comme suit : cuisine aménagée ouverte sur séjour de 45.62m², salle d'eau autour de laquelle s'articulent 2 chambres de 13.63 et 22.57 m² buanderie et sanitaires. Ayant bénéficié de rénovations privilégiant le charme (grandes hauteurs sous plafonds à la française, cheminée, travertin, éléments de décor industriels, etc.) sans faire l'économie de la fonctionnalité (rangements, buanderie, accès directs à la salle d'eau depuis chaque chambre), le bien saura séduire une clientèle exigeante attentive au style et au confort de son intérieur. Une cave complète le lot. Copropriété de 20 lots (Pas de procédure en cours). Charges annuelles : 1953 euros.
Afficher plus";"['95,14 m² - 3 pièces - 2 chambres', 'Étage 2/3 avec ascenseur', '1 cave', 'Séjour de 45 m²', ""1 salle d'eau"", '1 wc', 'Copropriété de 20 lots', '', None, None, None, None, None, None, None, None, None, None, None, None]";['https://photo.superimmo.com/eod5dsgaxo83wdrm0znhi5sbfbq0', 'https://photo.superimmo.com/vvbvkwi62fp9v91lqydw0ijlvdaz', 'https://photo.superimmo.com/okmup7tcr2u07u90yu3ob9z52syw', 'https://photo.superimmo.com/q4sw86mfjh1q8mzhv4na7mntkzpb', 'https://photo.superimmo.com/o3q5cjt4ui61sr172cq65o7inxmq', None, None, None, None, None]
