;url;price;surface;nb_pieces;nb_chambres;lieu;prix_m2;date_publication;tag_1;tag_2;tag_3;description;tags;images_url
173;https://www.superimmo.com/annonces/achat-appartement-154m-meyzieu-69330-xwbkdh;345000;154;6;4;Meyzieu (69330);2240;16/07/2024;Exclusivité;Dernier étage;Honoraires à la charge du vendeur. Barème d’honoraires : https://homki-immobilier.com/notre-offre;"Bien rare à la vente, HOMKI vous propose de découvrir ce magnifique appartement de 154,07m² (177,49m² utiles) en duplex de 6 pièces au 1er étage d'une maison de ville au cœur de Meyzieu.
Ce bien d'exception offre de grands espaces idéaux pour une grande famille ou un espace de vie avec bureau à domicile.
Au 1er niveau vous retrouverez :
- Une grande pièce à vivre de 53,26m² avec sa belle cuisine équipée.
- Une première chambre de 17,57m² carrez (21,21m² au sol).
- Un salon / salle de jeu / cinéma de 15,79 m² avec un grand espace sous rampant de 10,03m² au sol.
- Une salle d'eau avec des WC.
Un escalier permet d’accéder au second niveau :
- Une deuxième chambre de 17,80m² avec espace dressing.
- Une troisième chambre de 12,36m².
- Une quatrième chambre de 9,93m².
- Une salle de bains.
- Des WC indépendants.
Pour encore plus de confort, une cave de 8,40m² complète ce bien.
Cet appartement est idéalement situé en plein centre de Meyzieu, sur la Rue de la République, proche de toutes commodités et desservi par les transports.
La gare de Meyzieu et son Tram T3 est seulement à 10 minutes à pied de l’appartement, vous reliant à la Part Dieu et à l’aéroport Saint Exupéry.
Pour vos voitures, il est possible de louer une place de parking ou de se garer facilement aux alentours du bien.
L’appartement climatisé ne nécessite aucun travaux !
Informations financières :
La taxe foncière est de 949€
Les charges sont de 63€
Pour plus de détails ou organiser une visite, n'hésitez pas à nous contacter.
Qui est le Homker proche de chez vous ?
Je suis Andry Ravoniharoson, agent commercial immatriculé au RSAC de Bourg-en-Bresse sous le numéro 910 352 160, et je serais ravi de vous le faire découvrir !
Qui est Homki ?
Homki offre aux acquéreurs et vendeurs un service complet et transparent afin que chaque projet immobilier soit une expérience innovante vécue sereinement.
Nos frais d'agence sont de 4 900 € fixes à la charge du vendeur.
Afficher plus";"['154 m² - 6 pièces - 4 chambres', 'Dernier étage (1er)', 'Orientation : Sud', '1 cave', ""Assainissement : tout à l'égout"", 'Chauffage électrique', 'Séjour de 53 m²', ""1 salle d'eau - 1 salle de bain"", '2 wc', '', None, None, None, None, None, None, None, None, None, None]";['https://photo.superimmo.com/dz3t25dh0ys9nk3y24g1v2asbc06', 'https://photo.superimmo.com/b0ph87ywnfacnxxldwbmu2hdet7x', 'https://photo.superimmo.com/bdt7k66eb20h4mnb5pigilzw2p15', 'https://photo.superimmo.com/ndvtjcrm5t93usx4g9ftwj4lwooa', 'https://photo.superimmo.com/73rfuikj7nudisw7fcmxa6kop832', None, None, None, None, None]
174;https://www.superimmo.com/annonces/achat-appartement-62m-lyon-5eme-69005-xwbkcj;355000;62;3;2;Lyon 5ème (69005);5726;16/07/2024;Exclusivité;Étage 4/5;Honoraires à la charge du vendeur. Barème d’honoraires : https://homki-immobilier.com/notre-offre;"Opportunité rare !
Au coeur du Lyon historique dans la mythique rue Saint-Jean, au quatrième étage sans ascenseur d'un très bel immeuble bien entretenu dont la toiture vient d'être refaite, venez découvrir ce superbe appartement traversant de 61m².
Dès l'entrée vous serez séduits par la luminosité dont dispose ce logement en très bon état, rénové dans un esprit moderne avec des matériaux de qualité.
L'entrée disposant d'un placard distribue les deux chambres coté cours, une salle d'eau, et des WC indépendants. Le couloir vous amène dans la pièce de vie de plus de 28m² baignée de lumière avec une cuisine équipée aux lignes contemporaines.
Situation exceptionnelle pour ce très beau logement, vous offrant une vue dégagée sur la place du Gouvernement avec le charme de la vie de quartier du Lyon historique.
À découvrir sans tarder !
Informations financières :
La taxe foncière est de 405€
Les charges sont de 100€
arge du vendeur.
Qui est le Homker proche de chez vous ?
Je suis Séverine Bertrand, agent commercial immatriculé au RSAC de Lyon sous le numéro 948 441 068, et je serais ravie de vous le faire découvrir !
Qui est Homki ?
Homki offre aux acquéreurs et vendeurs un service complet et transparent afin que chaque projet immobilier soit une expérience innovante vécue sereinement.
Nos frais d'agence sont de 4 900 € fixes à la charge du vendeur.
Afficher plus";"['62 m² - 3 pièces - 2 chambres', 'Étage 4/5', ""Assainissement : tout à l'égout"", 'Chauffage électrique', ""1 salle d'eau"", '1 wc', None, None, None, None, None, None, None, None, None, None, None, None, None, None]";['https://photo.superimmo.com/7zfdljuc90n1pyk3cpuqnskgyujs', 'https://photo.superimmo.com/ezqnfkp094bnb7lnnr1hcgyxoe4d', 'https://photo.superimmo.com/yfh49jsal2y6xisv271t83urb2ci', 'https://photo.superimmo.com/9gte75c7h3gwexim9savqbv7j4qd', 'https://photo.superimmo.com/xpzohr8mz8i3ureumsu9jc0ex6pd', None, None, None, None, None]
175;https://www.superimmo.com/annonces/achat-maison-224m-colombier-saugnieu-69124-xwbkbc;449000;224;7;4;Colombier-Saugnieu (69124);2004;16/07/2024;Exclusivité;Chauffage au fuel;Honoraires à la charge du vendeur. Barème d’honoraires : https://homki-immobilier.com/notre-offre;"A vendre, en exclusivité chez Homki cette magnifique maison de style Dauphinoise située dans le village calme et dynamique de Colombier-Saugnieu.
Avec ses 224 m² de surface et ses hauts plafonds à 3m15, elle séduira les amateurs de construction traditionnelle et offrira un habitat idéal aux familles nombreuses sur son terrain de 550 m².
La maison étant aménagée sur trois niveaux, vous découvrirez au rez-de-chaussée, une vaste pièce de vie de 35m², avec cuisine ouverte en chêne. Un salon lumineux
et une bibliothèque. Cet étage est complété par une buanderie de 15m², des toilettes et un cellier avec point d’eau.
Au premier étage, l’espace nuit vous offre quatre belles chambres entre 11 et 15m², une
spacieuse salle de bain de 7m² et des toilettes.
Enfin, sous un superbe plafond cathédrale avec poutres apparentes, 70m² de loft vous attendent, avec salle de bain et petite mezzanine. Selon vos besoins, il
fera un magnifique espace parental, une vaste salle de jeu ou vous donnera la possibilité de bénéficier jusqu’à cinq chambres supplémentaires.
Rénovée depuis 2017, la maison vous offre une belle luminosité avec ses hautes fenêtres. Un grand confort thermique est assuré en toute saison. L’été, la maison reste fraiche grâce à l’inertie des solides murs en pisés et l’ombre de deux platanes centenaires. L’hiver, le chauffage central, régulé par robinets électroniques programmable vous offre un vrai confort économique. Le système de régulation thermique est complété par une pompe à chaleur réversible pour le deuxième étage et un petit poêle à bois au salon.
Colombier-Saugnieu se trouve à 15 minutes des centres d’activité de Meyzieu et de Saint Quentin Fallavier et à 25 km de Lyon.
Différents commerces situé dans le village, écoles maternelles et primaires à proximité.
Qui est le Homker proche de chez vous ?
Je suis Raphaël Bonat, agent commercial immatriculé au RSAC de 793 695 297 RSAC Lyon, et je serais ravi de vous le faire découvrir !
Qui est Homki ?
Homki offre aux acquéreurs et vendeurs un service complet et transparent afin que chaque projet immobilier soit une expérience innovante vécue sereinement.
Nos frais d'agence sont de 4 900 € fixes à la charge du vendeur.
Informations financières :
La taxe foncière est de 1329€
Les charges sont de 0€
Afficher plus";"['224 m² - 7 pièces - 4 chambres - ter. 550 m²', '3 niveaux', 'Orientation : Sud', 'Année de construction : 1833', ""Assainissement : tout à l'égout"", 'Chauffage au fuel', ""1 salle d'eau - 2 salles de bain"", '2 wc', 'Jardin privatif', '', None, None, None, None, None, None, None, None, None, None]";['https://photo.superimmo.com/rhzno755eej105kp6qsibznullz2', 'https://photo.superimmo.com/k78gkdq7647gr89l6l9lgw66i03x', 'https://photo.superimmo.com/eak326i177yib5a01xppps6cr7ll', 'https://photo.superimmo.com/1r2ek4fnvn27a1nbf4j7vgpcu7e0', 'https://photo.superimmo.com/vpca2ieityr73vfibib93up4f9jp', None, None, None, None, None]
176;https://www.superimmo.com/annonces/achat-maison-120m-meyzieu-69330-xwbkb2;530000;120;5;3;Meyzieu (69330);4417;16/07/2024;Exclusivité;Terrasse;Honoraires à la charge du vendeur. Barème d’honoraires : https://homki-immobilier.com/notre-offre;"Bienvenue dans cette oasis de tranquillité au cœur du Grand Large à Meyzieu !
Nous vous invitons à découvrir cette charmante maison familiale de 120m².
Dès l'entrée, laissez-vous charmer par la chaleureuse pièce de vie de 44,67m², sublimée par un poêle à bois et une cuisine équipée.
La véranda de 22,63m² vous offre un espace de détente privilégié, reliant parfaitement l'intérieur à un jardin intimiste et verdoyant sur une parcelle de 426m².
Le rez-de-chaussée vous réserve également une buanderie, un garage et des WC indépendants pour votre plus grand confort.
À l'étage, un dégagement accueillant actuellement une bibliothèque mène vers 3 chambres : 10,60 m², 11,78m² et 19,42 m² avec un dressing.
Une salle de bains et des WC complètent ce niveau pour une vie quotidienne pratique et agréable.
Cette maison pleine de charme vous séduira par son ambiance cosy et son environnement paisible, offrant un véritable havre de paix pour toute la famille.
Profitez d'un accès privilégié au canal et à toutes les commodités du Grand Large.
Ne laissez pas passer cette opportunité et venez découvrir votre futur chez-vous sans plus tarder !
Informations financières :
La taxe foncière est de 1621€
Les charges sont de 58€
Qui est le Homker proche de chez vous ?
Je suis Andry Ravoniharoson, agent commercial immatriculé au RSAC de Bourg-en-Bresse sous le numéro 910 352 160, et je serais ravi de vous le faire découvrir !
Qui est Homki ?
Homki offre aux acquéreurs et vendeurs un service complet et transparent afin que chaque projet immobilier soit une expérience innovante vécue sereinement.
Nos frais d'agence sont de 4 900 € fixes à la charge du vendeur.
Afficher plus";"['120 m² - 5 pièces - 3 chambres - ter. 426 m²', '2 niveaux', 'Orientation : Nord / Sud', 'Parking extérieur', 'Terrasse', 'Année de construction : 1970', ""Assainissement : tout à l'égout"", 'Chauffage au gaz', 'Séjour de 45 m²', '1 salle de bain', '2 wc', 'Jardin privatif', None, None, None, None, None, None, None, None]";['https://photo.superimmo.com/thajftorw6x56zkj99ig3wdr14y5', 'https://photo.superimmo.com/yyosrv8ss2vup5zfpnixmul5ooea', 'https://photo.superimmo.com/11p32b3syubmyri5h351hqq6qcoi', 'https://photo.superimmo.com/hc4fa9msdi0pte9wy4m7lvr5rw6r', 'https://photo.superimmo.com/hvfc8nqon97nv5uai5cnz1cpqxm9', None, None, None, None, None]
177;https://www.superimmo.com/annonces/achat-appartement-81m-lyon-8eme-69008-xwbkau;449000;81;4;3;Lyon 8ème (69008);5543;16/07/2024;Exclusivité;Étage 4/7;Honoraires à la charge du vendeur. Barème d’honoraires : https://homki-immobilier.com/notre-offre;"À vendre en exclusivité chez Homki, ce magnifique appartement, de février 2024, de type 4 de 81m² avec une grande terrasse de 29m² orienté plein Sud.
Situé boulevard Ambroise Paré dans le 8ème arrondissement à proximité des axes routiers de l'Est Lyonnais et des transports en commun (tram et bus) et niché au quatrième étage sur 7, vous serez séduit par le standing et les prestations de qualités de l'immeuble et du bien.
Ainsi venez découvrir ce bel appartement composé d'une jolie cuisine jamais servie (meublée et équipée) ouverte sur la pièce de vie carrelée, qui donne sur la grande terrasse pour profiter des beaux jours qui arrivent entre amis et famille.
Côté nuit vous aurez accès à 3 belles chambres avec parquet dont deux avec accès terrasse et placards intégrés.
Une salle de bains avec baignoire et des WC séparés avec point d'eau.
Vous avez également un garage box fermé et sécurisé PMR de 21m², compris dans le prix de ce bien.
Vous trouverez également :
- Radiateur gaz.
- Des stores électriques Somfy.
- Fibre optique.
- Local à vélo.
Informations financières :
La taxe foncière est à venir.
Les charges sont de 109€ par mois.
Qui est le Homker proche de chez vous ?
Je suis Raphaël Bonat, agent commercial immatriculé au RSAC de 793 695 297 RSAC Lyon, et je serais ravi de vous le faire découvrir !
Qui est Homki ?
Homki offre aux acquéreurs et vendeurs un service complet et transparent afin que chaque projet immobilier soit une expérience innovante vécue sereinement.
Nos frais d'agence sont de 4 900 € fixes à la charge du vendeur.
Afficher plus";"['81 m² - 4 pièces - 3 chambres', 'Étage 4/7', 'Orientation : Est, Ouest, Sud, Sud-Ouest', 'Garage', 'Terrasse', 'Année de construction : 2024', ""Assainissement : tout à l'égout"", 'Chauffage au gaz', '1 salle de bain', '1 wc', None, None, None, None, None, None, None, None, None, None]";['https://photo.superimmo.com/g20con92ae99plxzpymwno7ac4wz', 'https://photo.superimmo.com/z7ngl4utr4zock3qz0j2593y7ptx', 'https://photo.superimmo.com/9tmasaipsacwej336nvmdq24wybw', 'https://photo.superimmo.com/f9ryjyl5r9vkykpwu2a18upmd7h8', 'https://photo.superimmo.com/ayt1za4m555ulzn25zuv75cu1an5', None, None, None, None, None]
178;https://www.superimmo.com/annonces/achat-appartement-227m-lyon-9eme-69009-xwbka1;725000;227;7;4;Lyon 9ème (69009);3194;16/07/2024;Exclusivité;Terrasse;Honoraires à la charge du vendeur. Barème d’honoraires : https://homki-immobilier.com/notre-offre;"Venez découvrir en plein cœur de l’ancien village de Saint-Rambert, une maison de ville de 227m² au sol entièrement rénovée avec goût et un cachet exceptionnel.
Elle se compose comme suit :
Au rez-de-chaussée : Une grande entrée lumineuse avec placard de rangement, desservant un bureau ainsi qu’un espace buanderie bien aménagé, on ressent l’âme authentique et cosy du lieu, un atelier de 39m² et une cave.
Au premier étage : une cuisine dînatoire aménagée avec son bel îlot central donne sur une terrasse 15m², un vrai havre de paix.
L’espace salon communique lui aussi avec l’extérieur par une grande baie vitrée. Il propose une belle cheminée ainsi qu'un coin bibliothèque en enfilade qui lui confère du charme et une double exposition.
Sur ce même niveau on trouve une suite parentale avec sa jolie et spacieuse salle d’eau .
La charmante terrasse intime avec son barbecue mural, comblera les envies d’extérieurs et la possibilité de manger dehors .
La rénovation contemporaine et cosy de la maison finira de vous convaincre.
Au dernier niveau, vous trouverez 3 chambres très lumineuses, l’une avec coin dressing, toutes d’une belle taille, qui confère à cet étage un niveau parfait pour accueillir les enfants ou les amis de passage.
La seconde salle d’eau tout aussi charmante avec sa double vasque et les troisièmes WC se retrouvent ici.
Cette maison de ville réserve également de beaux atouts pour les artistes, les bricoleurs et les amateurs de vins avec un grand atelier de 39m², ainsi qu’une cave enterrée de 13m².
Elle n’attend plus que vos valises.
À proximité des commerces, des transports et des crèches/école, toutes les commodités peuvent s’envisager à pied . Double piste cyclable aménagée à 500m.
Possibilité de céder la location d’une ou deux places de parking à 50m de la maison ou parking aisé et gratuit dans la rue.
Informations financières :
La taxe foncière est de 1607€
Qui est le Homker proche de chez vous ?
Je suis Séverine Bertrand, agent commercial immatriculé au RSAC de Lyon sous le numéro 948 441 068, et je serais ravie de vous le faire découvrir !
Qui est Homki ?
Homki offre aux acquéreurs et vendeurs un service complet et transparent afin que chaque projet immobilier soit une expérience innovante vécue sereinement.
Nos frais d'agence sont de 4 900 € fixes à la charge du vendeur.
Afficher plus";"['227 m² - 7 pièces - 4 chambres', '1 cave', 'Terrasse', ""Assainissement : tout à l'égout"", 'Chauffage électrique', 'Séjour de 29 m²', ""2 salles d'eau"", '3 wc', None, None, None, None, None, None, None, None, None, None, None, None]";['https://photo.superimmo.com/iz7bqwigcxnkhcftt2xptslzttd7', 'https://photo.superimmo.com/h2b42jypmt3ma8woloou566tb3ed', 'https://photo.superimmo.com/7up34qqhvrl0x7u7adcergofaq7y', 'https://photo.superimmo.com/75jvw6jkibnqufy8zrielhieb93n', 'https://photo.superimmo.com/yl4du7s5sw44wozed3l3mdolq458', None, None, None, None, None]
179;https://www.superimmo.com/annonces/achat-appartement-112m-villeurbanne-69100-xwbk8c;299900;112;4;3;Villeurbanne (69100);2678;16/07/2024;Exclusivité;Dernier étage avec ascenseur;Honoraires à la charge du vendeur. Barème d’honoraires : https://homki-immobilier.com/notre-offre;"Villeurbanne.
Duplex 4 pièces en dernier étage : 112m² utiles.
Traversant : EST - OUEST.
Balcon.
Climatisé.
DPE C.
Ravalement de façade voté !
Sur la commune de Villeurbanne, HOMKI a le plaisir de vous présenter cet appartement de 4 pièces en duplex de 112m2 (93m² carrez) avec balcon, cave et un garage (en option).
Situé au dernier étage (4ème et 5ème) d'une résidence de 1995, traversant Est - Ouest, cet appartement climatisé (2017) se compose d'une entrée avec placard desservant une grande pièce de vie de 30m² s'ouvrant sur un balcon, d'une belle cuisine équipée de 14,25m² et de toilettes indépendantes.
Un escalier permet d'accéder à l'espace nuit : 3 chambres avec Velux, une salle de bains et des WC.
Pour plus de confort vous disposerez d'une cave en sous-sol et la possibilité de garer vos vélos dans un espace dédié.
Il est possible d'acquérir un garage (box fermé) en sus du prix.
La résidence sécurisée bénéficie également d'un beau jardin commun. L'immeuble fera peau neuve car le ravalement de façade a été voté et payé par les vendeurs.
Idéalement situé, vous êtes à 400 mètres du métro Flachet ""ligne A (direction Perrache et Carré de soie).
Ne laissez pas passer cette opportunité et venez découvrir votre futur chez-vous sans plus tarder!
Informations financières :
La taxe foncière est de 1168€
Les charges sont de 188€
Qui est le Homker proche de chez vous ?
Je suis Andry Ravoniharoson, agent commercial immatriculé au RSAC de Bourg-en-Bresse sous le numéro 910 352 160, et je serais ravi de vous le faire découvrir !
Qui est Homki ?
Homki offre aux acquéreurs et vendeurs un service complet et transparent afin que chaque projet immobilier soit une expérience innovante vécue sereinement.
Nos frais d'agence sont de 4 900 € fixes à la charge du vendeur.
Afficher plus";"['112 m² - 4 pièces - 3 chambres', 'Dernier étage (5ème) avec ascenseur', 'Orientation : Est / Ouest', '1 cave', 'Balcon', 'Année de construction : 1995', ""Assainissement : tout à l'égout"", 'Chauffage électrique', 'Séjour de 30 m²', '1 salle de bain', '2 wc', '', None, None, None, None, None, None, None, None]";['https://photo.superimmo.com/lq0iz1ujx8jcanhzl2dsie153xpa', 'https://photo.superimmo.com/iz7tptjht54yr8v7au97w3rgcgbc', 'https://photo.superimmo.com/vav2lyj8kqx6ptcjsie9bw0035qc', 'https://photo.superimmo.com/lonwaw4s5ko91mgciktghbbqpu2d', 'https://photo.superimmo.com/emdd1e8ckxk1nke6x0w7mf67a91p', None, None, None, None, None]
180;https://www.superimmo.com/annonces/achat-maison-139m-corcelles-en-beaujolais-69220-xwbk7w;275000;139;6;4;Corcelles-en-Beaujolais (69220);1978;16/07/2024;Exclusivité;Terrasse;Honoraires à la charge du vendeur. Barème d’honoraires : https://homki-immobilier.com/notre-offre;"A mi-chemin entre Corcelles-en-Beaujolais et Belleville, venez visiter cette maison rénovée en 2020 qui vous offrira un confort de vie agréable par ses beaux volumes et ses commodités accessibles en quelques minutes en voiture.
Vous trouverez de plain pied une vaste cuisine équipée et son séjour, des WC, une salle de bains et une chambre.
A l'étage, une suite parentale avec dressing et salle de bains, 2 chambres supplémentaires et une salle d'eau.
Les extérieurs sont bien exposés et bénéficient de nombreux rangements, vous apprécierez le jardin d'un côté et les dépendances de l'autre.
Cet ancien corps de ferme rénové en 2020, est prêt à vivre et ses équipements techniques en font un ensemble confortable et économique.
Informations financières:
La taxe foncière est de 379€
Qui est le Homker proche de chez vous ?
Je suis Anthony Compte, agent commercial immatriculé au RSAC de Villefranche-Tarare sous le numéro 822 691 416, et je serais ravi de vous le faire découvrir !
Qui est Homki ?
Homki offre aux acquéreurs et vendeurs un service complet et transparent afin que chaque projet immobilier soit une expérience innovante vécue sereinement.
Nos frais d'agence sont de 4 900 € fixes à la charge du vendeur.
Afficher plus";"['139 m² - 6 pièces - 4 chambres - ter. 430 m²', 'Piscine', 'Orientation : Est, Sud, Sud-Est', 'Terrasse', ""Assainissement : tout à l'égout"", 'Chauffage: pompe à chaleur', 'Séjour de 23 m²', ""1 salle d'eau - 2 salles de bain"", '2 wc', 'Jardin privatif', None, None, None, None, None, None, None, None, None, None]";['https://photo.superimmo.com/dr219orko54z72vmj4pgeemfsv9n', 'https://photo.superimmo.com/fn0wrbaqqou3t3rx8hpm9dnhtcrm', 'https://photo.superimmo.com/eymjei2q4qqodt5a7xznjqmr1hrr', 'https://photo.superimmo.com/2d9xp98h0aglwv2scyyd1kz2tzzv', 'https://photo.superimmo.com/o2ks2qh10bbuxfevdzptd0cwyna4', None, None, None, None, None]
181;https://www.superimmo.com/annonces/achat-appartement-72m-millery-69390-xwbk7c;235000;72;3;2;Millery (69390);3264;16/07/2024;Exclusivité;Étage 2/4;Honoraires à la charge du vendeur. Barème d’honoraires : https://homki-immobilier.com/notre-offre;"Venez découvrir dans une petite copropriété familiale, un T3 de 72m² avec un balcon donnant sur une vue entièrement dégagée.
L'entrée dispose de 2 grands placards, ensuite vous trouverez une belle pièce à vivre de 24m², d'une cuisine équipée indépendante de 9.27m² le tout donnant sur un balcon de 8.5 m². De 2 belles chambres dont une de plus de 12m², d'une salle d'eau et des WC.
Le bien dispose aussi d'une cave et d'une place de parking, vous pouvez acquérir en SUS du prix de vente un double garage de 35m²au prix de 20 000 €
Informations financières :
La taxe foncière est de 884€
Les charges sont de 116€ par mois
Qui est le Homker proche de chez vous ?
Je suis Séverine Bertrand, agent commercial immatriculé au RSAC de Lyon sous le numéro 948 441 068, et je serais ravie de vous le faire découvrir !
Qui est Homki ?
Homki offre aux acquéreurs et vendeurs un service complet et transparent afin que chaque projet immobilier soit une expérience innovante vécue sereinement.
Nos frais d'agence sont de 4 900 € fixes à la charge du vendeur.
Afficher plus";"['72 m² - 3 pièces - 2 chambres', 'Étage 2/4', 'Parking extérieur', '1 cave', 'Balcon', 'Année de construction : 1970', 'Chauffage électrique', 'Séjour de 24 m²', ""1 salle d'eau"", '1 wc', None, None, None, None, None, None, None, None, None, None]";['https://photo.superimmo.com/63ibdj7d25vlpfs96606sdpqw4zo', 'https://photo.superimmo.com/7g3a599mroq2x077a0qh4y8rtz62', 'https://photo.superimmo.com/va8k2ixpytsxpqadyr5fo0c1u52x', 'https://photo.superimmo.com/x1sdxt7xd7b086rq23ji88fvid7v', 'https://photo.superimmo.com/h66umxdjh34b9qg1n97d2hfy47xe', None, None, None, None, None]
