;url;price;surface;nb_pieces;nb_chambres;lieu;prix_m2;date_publication;tag_1;tag_2;tag_3;description;tags;images_url
65;https://www.superimmo.com/annonces/achat-appartement-53m-saint-didier-au-mont-d-or-69370-xwbsbp;249000;53;3;2;Saint-Didier-au-Mont-d'Or (69370);4698;16/07/2024;Terrasse;1 Parking;Honoraires à la charge du vendeur. Barème d’honoraires : https://bareme.iadfrance.fr;"iad France - Léa Turmeau (07 62 19 04 39) vous propose : Venez découvrir cette CHARMANTE PETITE MAISON EN SOUPLEX, située au cOEur du BOIS DE JOHAR, à SAINT-DIDER-AU-MONT-D'OR. Construite en 2015, cette petite maison de 53 m² est idéale pour les personnes souhaitant profiter d’un cadre de vie paisible et verdoyant.
En entrant, vous serez accueilli par un ESPACE DE VIE avec accès direct à la TERRASSE et au JARDIN DE 32M², parfait pour les beaux jours.
La CUISINE, ouverte sur le séjour, est conçue pour être à la fois fonctionnelle et conviviale. Des WC SÉPARÉS complètent ce niveau.
Descendez quelques marches pour découvrir le souplex, où se trouvent les 2 CHAMBRES, offrant une atmosphère cosy et intime. Une SALLE DE BAIN MODERNE complète ce niveau.
2 PLACES DE PARKING sont incluses, facilitant vos déplacements quotidiens.
La présente annonce immobilière vise 1 lot principal situé dans une copropriété formant 14 lots au total faisant l'objet d'une ou plusieurs procédures en cours et d'un montant de charges d’environ 73.79 € par mois (soit 885.48 € annuel) déclaré par le vendeur.Honoraires d’agence à la charge du vendeur.Information d'affichage énergétique sur ce bien : classe ENERGIE D indice 246 et classe CLIMAT B indice 7. Les informations sur les risques auxquels ce bien est exposé sont disponibles sur le site Géorisques : www.georisques.gouv.fr. La présente annonce immobilière a été rédigée sous la responsabilité éditoriale de Mlle Léa Turmeau EI (ID 76787), mandataire indépendant en immobilier (sans détention de fonds), agent commercial de la SAS I@D France immatriculé au RSAC de Lyon sous le numéro 913290623, titulaire de la carte de démarchage immobilier pour le compte de la société I@D France SAS.
Retrouvez tous nos biens sur notre site internet.
Afficher plus";['53 m² - 3 pièces - 2 chambres - ter. 32 m²', 'Rez-de-chaussée', '1 Parking', 'Terrasse', 'Année de construction : 2015', 'Chauffage individuel électrique (radiateurs)', 'Copropriété de 38 lots', 'Procédure en cours : Oui', None, None, None, None, None, None, None, None, None, None, None, None];['https://photo.superimmo.com/jsvi03jzf2llitm4f5s03d3e253s', 'https://photo.superimmo.com/lik069raxi0thwgj9lw7ypol8ake', 'https://photo.superimmo.com/l46dhck0y5d5s1mg0pb3osdlxozl', 'https://photo.superimmo.com/f4gi3a22lry1a6jhay32x19fbhy1', 'https://photo.superimmo.com/iqywivpl3hjwbo6d0iqbu6q746mj', None, None, None, None, None]
66;https://www.superimmo.com/annonces/achat-appartement-66m-lyon-6eme-69006-xwbsad;370000;66;3;2;Lyon 6ème (69006);5606;16/07/2024;1 Parking;Chauffage individuel électrique;Honoraires à la charge du vendeur. Barème d’honoraires : https://bareme.iadfrance.fr;"iad France - Chloé Jaillet (06 52 89 47 39) vous propose : Appartement T3 de 65m2, Lyon 6ème, garage, terrasse
Venez découvrir ce superbe appartement T3 situé face à la Clinique du Parc, dans le prestigieux 6ème arrondissement de Lyon. A proximité du quartier prisé des Brotteaux et à seulement quelques minutes à pied du Parc de la Tête d'Or et de la station de métro Charpennes, cet appartement bénéficie d’un emplacement de premier choix.
Situé au 3ème étage d'une résidence récente et sécurisée datant de 2011, cet appartement fonctionnel est idéal pour un couple ou une famille.
Il se compose d’une entrée avec placard desservant tout l’appartement avec d’un côté l’espace à vivre et de l’autre côté l’espace nuit afin de préserver l’intimité de chacun. Vous trouverez à l’Est une pièce à vivre lumineuse de 25m2 environ composée d’une cuisine ouverte entièrement équipée et aménagée donnant sur un séjour avec terrasse. Côté nuit, vous découvrirez une salle de bains spacieuse avec baignoire et vasque ainsi que l’emplacement nécessaire pour une machine à laver, des toilettes séparées ainsi que deux chambres avec placard de 10m2 et 12m2 environ. Petit plus, la deuxième chambre vous permettra de profiter de l’extérieur grâce à sa terrasse privative.
Energie : bon DPE (D) pour cet appartement équipé de fenêtres PVC double vitrage et volets électriques. Chauffage individuel électrique.
La résidence sécurisée garantit tranquillité et sérénité. Pour faciliter votre quotidien, un garage box en sous-sol est disponible en sus au prix de 30 000€, offrant une solution de stationnement pratique en plein cOEur de la ville.
Cet appartement, grâce à sa localisation privilégiée et ses prestations de qualité, offre un cadre de vie idéal pour ceux qui souhaitent profiter de la vie urbaine tout en ayant accès à des espaces verts et à une excellente desserte en transports en commun.
Pour plus d'informations ou pour organiser une visite, n'hésitez pas à me contacter. Ne manquez pas cette opportunité rare dans l'un des quartiers les plus recherchés de Lyon !
La présente annonce immobilière vise 1 lot principal situé dans une copropriété ne faisant l'objet d'aucune procédure en cours déclarée par le vendeur.Honoraires d’agence à la charge du vendeur.Information d'affichage énergétique sur ce bien : classe ENERGIE D indice 190 et classe CLIMAT B indice 6. Les informations sur les risques auxquels ce bien est exposé sont disponibles sur le site Géorisques : www.georisques.gouv.fr. La présente annonce immobilière a été rédigée sous la responsabilité éditoriale de Mlle Chloé Jaillet EI (ID 54231), mandataire indépendant en immobilier (sans détention de fonds), agent commercial de la SAS I@D France immatriculé au RSAC de LYON sous le numéro 892694704, titulaire de la carte de démarchage immobilier pour le compte de la société I@D France SAS.
Retrouvez tous nos biens sur notre site internet.
Afficher plus";['66 m² - 3 pièces - 2 chambres', 'Avec ascenseur', '1 Parking', 'Année de construction : 2011', 'Chauffage individuel électrique', 'Digicode - Interphone', 'Copropriété de 1 lots', '', None, None, None, None, None, None, None, None, None, None, None, None];['https://photo.superimmo.com/bqobuogw4tzyldpnwevlfq9kgbqc', 'https://photo.superimmo.com/811psaez8f4n73hl1dnc1jvy2l95', 'https://photo.superimmo.com/166adwsx4nntfk2cs8f1hpsrakbx', 'https://photo.superimmo.com/ngevewgzrjhumthwxoltifhgsx3d', 'https://photo.superimmo.com/u60jp3la8d5b1gxb5ev0duqn470y', None, None, None, None, None]
67;https://www.superimmo.com/annonces/achat-appartement-29m-lyon-9eme-69009-xwbs6k;133000;29;1;1;Lyon 9ème (69009);4586;16/07/2024;Exclusivité;Chauffage individuel électrique (radiateurs);Honoraires à la charge du vendeur. Barème d’honoraires : https://bareme.iadfrance.fr;"iad France - Marion Berweiler (06 67 78 89 69) vous propose : Studio Idéal pour Investisseurs ou Primo-Accédants : Opportunité Exceptionnelle à Vaise.
Surface totale : 36 m² avec rendement exceptionnel de 7%.
Situé rue de Saint-Cyr, dans le secteur prisé de Vaise côté quai de Saône, ce studio est un véritable bijou à ne pas manquer ! Niché dans une ancienne maison bourgeoise, ce charmant studio avec mezzanine et plafond à la française offre un cadre de vie unique et authentique.
Les Atouts de ce Studio :
Surface et Aménagement : Une superficie totale de 36 m², optimisée avec une mezzanine pour un espace de vie agréable et fonctionnel.
Cuisine Équipée : Une cuisine moderne, entièrement équipée, prête à vous accueillir ou à vos futurs locataires.
Chauffage Moderne : Des radiateurs électriques récents, dont un radiateur à inertie dans le séjour, pour un confort thermique optimal.
Localisation Idéale :Proximité Imbattable : À quelques pas de la Gare de Vaise (moins de 5 minutes à pied), avec un accès rapide aux TER et aux lignes de bus TCL (22, 23, 43, 20, 40, 2, 31, C6).
Vie de Quartier Animée : Entouré de commerces, de restaurants, et d'infrastructures essentielles pour un quotidien pratique et agréable.
Proche des Universités : Une aubaine pour les étudiants cherchant un logement proche de leurs lieux d'études.
Pourquoi Investir ?
Rendement Exceptionnel de 7% : Un investissement rentable avec un excellent rapport qualité-prix.
Secteur Prisé : Vaise est un quartier dynamique et recherché, garantissant une forte demande locative.
Charme et Authenticité : Le caractère unique de ce studio avec ses éléments d'époque séduit instantanément.
Que vous soyez investisseur à la recherche d'un bien avec un fort potentiel de rendement ou primo-accédant souhaitant s'installer dans un quartier vivant et bien desservi, ce studio est fait pour vous !
Ne manquez pas cette opportunité en or ! Contactez-moi dès maintenant pour organiser une visite.
La présente annonce immobilière vise 1 lot principal situé dans une copropriété formant 20 lots au total ne faisant l'objet d'aucune procédure en cours et d'un montant de charges d’environ 52.67 € par mois (soit 632 € annuel) déclaré par le vendeur.Honoraires d’agence à la charge du vendeur.Information d'affichage énergétique sur ce bien : classe ENERGIE E indice 342 et classe CLIMAT B indice 11. Les informations sur les risques auxquels ce bien est exposé sont disponibles sur le site Géorisques : www.georisques.gouv.fr. La présente annonce immobilière a été rédigée sous la responsabilité éditoriale de Mlle Marion Berweiler EI (ID 44002), mandataire indépendant en immobilier (sans détention de fonds), agent commercial de la SAS I@D France immatriculé au RSAC de LYON sous le numéro 880186432, titulaire de la carte de démarchage immobilier pour le compte de la société I@D France SAS.
Retrouvez tous nos biens sur notre site internet.
Afficher plus";['29 m² - 1 pièce - 1 chambre', 'Chauffage individuel électrique (radiateurs)', 'Digicode', 'Télévision par cable', 'Copropriété de 31 lots', '', None, None, None, None, None, None, None, None, None, None, None, None, None, None];['https://photo.superimmo.com/1jpgkor1s9cb5ni1zt390w98z280', 'https://photo.superimmo.com/9yj75adyc3ew9hpf8olvhxx7wihk', 'https://photo.superimmo.com/z2zdcqziorbdx30l7r0xguxdzcrq', 'https://photo.superimmo.com/k45018flw24iz34bpcwybcqblc14', 'https://photo.superimmo.com/k1gliizf5yidkewr6mcnj6aozqhh', None, None, None, None, None]
68;https://www.superimmo.com/annonces/achat-appartement-81m-villeurbanne-69100-xwbs4g;230000;81;3;2;Villeurbanne (69100);2840;16/07/2024;Exclusivité;Étage 3/12 avec ascenseur;Honoraires à la charge du vendeur. Barème d’honoraires : https://bareme.iadfrance.fr;"iad France - Gaël SERGERE (07 62 01 22 57) vous propose : Appartement T3 (possible T4) de 81 m² - Villeurbanne, Parc de la Tête d'Or !!
Situé au 14 avenue Roberto Rossellini à Villeurbanne, découvrez ce spacieux appartement T3 (possible T4) de 81 m², offrant une opportunité rare et une localisation exceptionnelle.
—> Localisation Idéale :
- Proximité immédiate du Parc de la Tête d'Or, idéal pour les promenades et les activités de plein air.
- À deux pas de la place Wilson et de son marché réputé.
—> Caractéristiques de l'Appartement :
- Situé au 3ème étage sur 12, avec ascenseurs, d'une copropriété bien entretenue des années 1975 avec ascenseur.
- Traversant Est-Ouest, bénéficiant d'une luminosité exceptionnelle et sans vis-à-vis. - Grand balcon de 9 m², parfait pour profiter des beaux jours en toute intimité.
—> Agencement et Confort :
- Entrée accueillante desservant un salon/salle à manger de plus de 30 m², avec accès direct au balcon. Possibilité de recréer facilement une 3ème chambre en ajoutant une cloison.
- Cuisine séparée et équipée de 13m2 environ.
- Deux chambres de 11m2 environ avec de nombreux rangements.
- Salle d'eau avec douche.
- Toilettes séparées.
- Cave incluse pour un espace de rangement supplémentaire.
- Possibilité d'acquérir un garage (box fermé en souterrain) pour 20 000€ en sus.
—> Ce qui m’a plu dans l’appartement :
- Superficie généreuse de 81 m² environ, offrant de nombreuses possibilités d'aménagement.
- Luminosité exceptionnelle grâce à son exposition traversante Est-Ouest.
- Balcon sans vis-à-vis, un véritable espace extérieur confortable.
- Proximité du Parc de la Tête d'Or et de la place Wilson.
Cet appartement est parfait pour ceux qui recherchent un espace de vie lumineux et spacieux, avec la possibilité de personnaliser l'agencement selon leurs besoins. Contactez-moi rapidement pour organiser une visite et découvrir ce bien rare sur le marché.
La présente annonce immobilière vise 1 lot principal situé dans une copropriété formant 110 lots au total ne faisant l'objet d'aucune procédure en cours et d'un montant de charges d’environ 300 € par mois (soit 3600 € annuel) déclaré par le vendeur.Honoraires d’agence à la charge du vendeur.Information d'affichage énergétique sur ce bien : classe ENERGIE C indice 175 et classe CLIMAT C indice 20. Les informations sur les risques auxquels ce bien est exposé sont disponibles sur le site Géorisques : www.georisques.gouv.fr. La présente annonce immobilière a été rédigée sous la responsabilité éditoriale de M. Gaël SERGERE EI (ID 54554), mandataire indépendant en immobilier (sans détention de fonds), agent commercial de la SAS I@D France immatriculé au RSAC de LYON sous le numéro 892812041, titulaire de la carte de démarchage immobilier pour le compte de la société I@D France SAS.
Retrouvez tous nos biens sur notre site internet.
Afficher plus";['81 m² - 3 pièces - 2 chambres - ter. 9 m²', 'Étage 3/12 avec ascenseur', '1 garage - 1 parking', '1 balcon', 'Année de construction : 1975', 'Gardien', 'Chauffage collectif au gaz (radiateurs)', 'Cuisine séparée, équipée', 'Séjour de 21 m²', 'Digicode - Interphone', 'Télévision par cable', 'Copropriété de 330 lots', None, None, None, None, None, None, None, None];['https://photo.superimmo.com/3nmql7uw8lk5uz6rukpjtfkm77lv', 'https://photo.superimmo.com/e2tt09z295ab99jbvfatpnjloviv', 'https://photo.superimmo.com/rvkcrabgb536po61otnbw6ulv706', 'https://photo.superimmo.com/cxph7pnr5ptnsr63ler685cwold9', 'https://photo.superimmo.com/20alt4vgyphg8rahu7dtyvodgj7o', None, None, None, None, None]
69;https://www.superimmo.com/annonces/achat-appartement-64m-decines-charpieu-69150-xwbs02;209000;64;4;3;Décines-Charpieu (69150);3266;16/07/2024;Exclusivité;1 balcon;Honoraires à la charge du vendeur. Barème d’honoraires : https://bareme.iadfrance.fr;"iad France - Bertrand Mourlevat (06 66 19 53 32) vous propose : A Décines-Charpieu, appartement lumineux de 4 pièces, situé dans une résidence bien entretenue, avec des espaces verts ainsi que des jeux pour enfants. Il se compose d'une entrée qui dessert un salon confortable donnant sur son balcon, une chambre attenante ainsi qu'une cuisine séparée et sa loggia. Côté nuit, vous trouverez 2 jolies chambres, une salle de bains et un WC séparé. L'exposition Est-Ouest offre une belle luminosité naturelle tout au long de la journée. Profitez du calme et de la tranquillité dans cet appartement au bon état général, idéal pour une famille ou un investisseur. La résidence sécurisée est équipée d'un digicode et d'un interphone pour votre confort. Vous bénéficiez également de la fibre optique. Un garage et une cave complètent l'ensemble ainsi qu'un parking collectif qui est disponible pour tous. A proximité des commodités, des transports en commun, du Grand Stade et de son pôle de loisirs. Aucuns travaux ne sont à prévoir. Cet appartement est un véritable coup de cOEur. Ne manquez pas cette opportunité !
La présente annonce immobilière vise 1 lot principal situé dans une copropriété formant 78 lots au total ne faisant l'objet d'aucune procédure en cours et d'un montant de charges d’environ 290 € par mois (soit 3480 € annuel) déclaré par le vendeur.Honoraires d’agence à la charge du vendeur.Information d'affichage énergétique sur ce bien : classe ENERGIE D indice 178 et classe CLIMAT D indice 38. Les informations sur les risques auxquels ce bien est exposé sont disponibles sur le site Géorisques : www.georisques.gouv.fr. La présente annonce immobilière a été rédigée sous la responsabilité éditoriale de M. Bertrand Mourlevat EI (ID 65768), mandataire indépendant en immobilier (sans détention de fonds), agent commercial de la SAS I@D France immatriculé au RSAC de Lyon sous le numéro 835244880, titulaire de la carte de démarchage immobilier pour le compte de la société I@D France SAS.
Retrouvez tous nos biens sur notre site internet.
Afficher plus";['64 m² - 4 pièces - 3 chambres', 'Rez-de-chaussée', '1 garage - 1 parking', 'Cave', '1 balcon', 'Année de construction : 1965', 'Chauffage collectif au gaz', 'Cuisine séparée, équipée', 'Digicode - Interphone', 'Copropriété de 150 lots', None, None, None, None, None, None, None, None, None, None];['https://photo.superimmo.com/h3xtcptirrv4lf0x199grw5g4n09', 'https://photo.superimmo.com/7k6bzj1m7zzbi1njpggh1zt8g5ew', 'https://photo.superimmo.com/47savjb1fsp49cl4u8hepd6lya60', 'https://photo.superimmo.com/ffiowrrm7f7iu3s039jlbs9l8rqo', 'https://photo.superimmo.com/fb08tq7rcleyyhwd5ihnqw6mufwj', None, None, None, None, None]
70;https://www.superimmo.com/annonces/achat-appartement-132m-lyon-4eme-69004-xwbryr;365000;132;3;2;Lyon 4ème (69004);2765;16/07/2024;Exclusivité;Chauffage individuel au gaz (radiateurs);Honoraires à la charge du vendeur. Barème d’honoraires : https://bareme.iadfrance.fr;"iad France - Stéphane Marvy (06 08 60 29 73) vous propose : Idéal investisseurs !
Stéphane Marvy vous propose ce charmant T3 de 132 m² disponibles (72 m² Carrez et 60 m² hors Carrez) à fort potentiel dans une copropriété calme et bien entretenue (parties communes en excellent état et toit rénové en 2023) de la Croix Rousse.
Véritable havre de paix, cet appartement (divisible) vous offre une tranquillité absolue, une absence totale de vis-à-vis et une vue dégagée sur les pentes et le Clos Bissardon : une rareté à la Croix Rousse !
Situé 55 rue Eugène Pons, son emplacement est également idéal : proximité des commerces (5’ à pieds), écoles, crèches, bus (N°38 à 100 m), Parc de la Tête d’Or à seulement 10’ à pieds.
Découvrons maintenant ensemble cet appartement cocon…
Vous entrez tout d’abord à un niveau intermédiaire : ce demi-palier est très pratique car il propose suffisamment d’espace pour vous permettre d’installer un bureau et une commode ou un meuble de rangement.
Puis, juste quelques marches plus haut, vous arrivez au niveau principal.
Le charme est immédiat : vous êtes de suite séduit par la clarté, les volumes de la grande pièce de vie et le sentiment d’être dans un appartement unique !
Vous y trouverez un agréable salon, une salle à manger, un espace aménageable en chambre ou salle de jeu, une cuisine américaine, deux chambres, une salle de bains avec WC, un bureau et une grande buanderie particulièrement fonctionnelle.
Vous remarquerez très vite que les 60 m² hors carrez vous offrent non seulement un espace de vie supplémentaire mais aussi de multiples possibilités de rangement et stockage. C’est véritablement le plus de l’appartement !
Enfin, il est en excellent état, habitable donc de suite et des améliorations appréciables ont été réalisées très récemment : velux changés et électricité remise à jour.
Il est traversant et orienté nord-est / sud-ouest.
Une cave est comprise dans le prix.
Les atouts majeurs de cet appartement :
- sa rentabilité pour un investisseur : 5% brut annuel
- son caractère et son charme
- sa très vaste surface utile et son fort potentiel
- sa fonctionnalité
- son emplacement
- son calme et la sérénité qu’il dégage
- son absence de vis-à-vis et sa vue
- les nombreux espaces de travail pour les couples en home office
- des levés de soleil en toutes saisons et le chant des oiseaux à la belle saison
Loyer encadré majoré en meublé : 1 527.20 euros/mois hors charges.
Chauffage au gaz individuel
Taxe foncière : 637 euros
Charges mensuelles moyennes : 114 euros comprenant l’eau froide et l’entretien de la copropriété.
Copropriété de 21 lots principaux et 12 lots annexes.
La présente annonce immobilière vise 1 lot principal situé dans une copropriété formant 21 lots au total ne faisant l'objet d'aucune procédure en cours et d'un montant de charges d’environ 114 € par mois (soit 1368 € annuel) déclaré par le vendeur.Honoraires d’agence à la charge du vendeur.Information d'affichage énergétique sur ce bien : classe ENERGIE D indice 206 et classe CLIMAT D indice 35. Les informations sur les risques auxquels ce bien est exposé sont disponibles sur le site Géorisques : www.georisques.gouv.fr. La présente annonce immobilière a été rédigée sous la responsabilité éditoriale de M. Stéphane Marvy EI (ID 79523), mandataire indépendant en immobilier (sans détention de fonds), agent commercial de la SAS I@D France immatriculé au RSAC de Lyon sous le numéro 502726227, titulaire de la carte de démarchage immobilier pour le compte de la société I@D France SAS.
Retrouvez tous nos biens sur notre site internet.
Afficher plus";['132 m² - 3 pièces - 2 chambres', 'Année de construction : 1850', 'Chauffage individuel au gaz (radiateurs)', 'Digicode', 'Télévision par cable', 'Copropriété de 33 lots', None, None, None, None, None, None, None, None, None, None, None, None, None, None];['https://photo.superimmo.com/4h6otecra9pmyjjctjtk0dwxrw1m', 'https://photo.superimmo.com/lakmbq2zsm3k9q2c8a0o30mteofh', 'https://photo.superimmo.com/febuhlwioujswvg8mlkytukzk671', 'https://photo.superimmo.com/2n0r3j2gi318j78o5cgclxlvqkjk', 'https://photo.superimmo.com/6fkj9rp5dlgwyl8ya7ioi68mj7da', None, None, None, None, None]
71;https://www.superimmo.com/annonces/achat-appartement-37m-saint-fons-69190-xwbqir;145000;37;2;1;Saint-Fons (69190);3919;16/07/2024;Étage 1/4;Balcon;Honoraires à la charge du vendeur.;"Nouveauté spécial primo-accédant / Investisseur
C'est votre premier achat ? Vous cherchez un investissement fiable ? Ce bien est fait pour vous !
Dans une belle copropriété récente datant de 2017, venez découvrir ce joli appartement 2 pièces d'environ 38m2 dans un excellent état.
Il se situe au 1er étage avec ascenseur de l'immeuble et au calme en intérieur de copropriété. Un interphone et un visiophone assurent un accès sécurisé au bâtiment.
La visite commence par une entrée desservant la cuisine ouverte sur le séjour lui-même porté sur la belle loggia côté verdure et calme.
Côté nuit, vous trouverez une chambre de 13 m² avec un placard aménagé, exposée à l'ouest et ayant accès également sur la loggia et une salle d'eau avec WC.
L'appartement possède des radiateurs alimentés au gaz, le chauffage est individuel. L'intérieur de l'appartement est en excellent état. La fibre y est installée.
Nos impressions : C'est un bien clé en main avec aucun travaux à prévoir pour vous installer ou pour y placer un locataire.
Les + : Un garage en sous-sol complète le bien
À proximité : Établissements scolaires primaires à moins de 10 minutes à pied. Côté transports, on trouve les lignes de bus C12, 93, 60 et 64, la gare Saint-Fons ainsi que la station de tramway Maurice Thorez (ligne T4) juste à côté. Différents commerces ainsi que le marché Place Durel anime les environs.
Prix de vente : 145.000€ H.A.I honoraires charges vendeur.
Charges de copropriété : 973 €/an
Aucune procédures en cours.
Les informations sur les risques auxquels ce bien est exposé sont disponibles sur le site Géorisques : www.georisques.gouv.fr.
Envie d'en savoir plus ?
Prenez contact avec Jérémy THIVAND au 06/18/78/49/47
EI / RSAC : 834 532 83
Référence : 5843
Les informations sur les risques auxquels ce bien est exposé sont disponibles sur le site Géorisques du gouvernement.
Afficher plus";"['37 m² - 2 pièces - 1 chambre', 'Étage 1/4', 'Balcon', 'Année de construction : 2017', ""1 salle d'eau"", '1 wc', 'Copropriété de 134 lots', '', None, None, None, None, None, None, None, None, None, None, None, None]";['https://photo.superimmo.com/twz84002m6t4gx5hpatx8yeere85', 'https://photo.superimmo.com/p2k1psgweutobhg3lxm8gjphy06b', 'https://photo.superimmo.com/xngqngbeze9be8bu6vp0evaso6gb', 'https://photo.superimmo.com/b6hi5621xihiejf63u7fgwblr4fi', 'https://photo.superimmo.com/pzb1vcvayosvez59531xf7lck630', None, None, None, None, None]
