;url;price;surface;nb_pieces;nb_chambres;lieu;prix_m2;date_publication;tag_1;tag_2;tag_3;description;tags;images_url
20;https://www.superimmo.com/annonces/achat-maison-120m-colombier-saugnieu-69124-xwd23e;369000;120;5;3;Colombier-Saugnieu (69124);3075;20/07/2024;Exclusivité;;Honoraires à la charge du vendeur. Barème d’honoraires : https://www.epargne-patrimoine.fr/transaction-immobiliere/tarifs-prestations/;"La société Epargne et Patrimoine a le plaisir de vous présenter cette maison individuelle de 114 m2 habitables, en pisée et rénovée en 2004.
Au RDC sur environ 70m2, une salle à manger avec cuisine sur 26m2, un salon séparé de 18m2, une chambre de 16m2, une salle de bain, WC séparés et buanderie/chaufferie.
A l'étage 2 grandes chambres de 18m2 et WC séparés. Il y a sur ce même niveau, une grande pièce d'environ 30m2 avec fenêtre utilisée actuellement pour du stockage. Cette pièce se situe au-dessus de la salle de bain du RDC, avec quelques travaux vous pourrez créer une ou deux chambres et une salle de bain.
Terrain d'environ 524m2, piscinable. Chauffage au Fioul. Garage de 28m2 (avec cuve à fioul), avec fenêtre et évier.
Ce bien est issue d'une division parcellaire, il faudra prévoir un grillage de séparation entre les deux propriétés et la pose d'un portail.
Diagnostics en cours. Visite virtuelle possible après entretien téléphonique.
""Montant estimé des dépenses annuelles d'énergie pour un usage standard : entre 1640€ et 2260.00 € par an. Prix moyens des énergies indexés sur l'année 1er janvier 2021 (abonnements compris) Taxe foncière 2022 1055 €
""Levasseur Pascal Conseiller Privé en Immobilier Agent Commercial Indépendant Mandataire Epargne et Patrimoine RSAC Vienne N°794657858 O637271145
--
Afficher plus";['120 m² - 5 pièces - 3 chambres - ter. 524 m²', None, None, None, None, None, None, None, None, None, None, None, None, None, None, None, None, None, None, None];['https://photo.superimmo.com/gd7c5txgk4n5q8j0zl36pan0l9r2', 'https://photo.superimmo.com/g8lwae7ps4t4v18te3wm0ao6pr21', 'https://photo.superimmo.com/0u9egb0okw2dlmn5at821ogaudvs', 'https://photo.superimmo.com/bnw8g0j88ytrpo9cyqhh9tdxkmol', 'https://photo.superimmo.com/s05c619lspwc7spr7fj9ckxkkn22', None, None, None, None, None]
21;https://www.superimmo.com/annonces/achat-maison-100m-jons-69330-xwd13x;429000;100;5;3;Jons (69330);4290;20/07/2024;Exclusivité;Terrasse;Honoraires à la charge du vendeur. Barème d’honoraires : https://bareme.iadfrance.fr;"iad France - Bertrand Mourlevat (06 66 19 53 32) vous propose : - JONS -
Sur une parcelle de 900 m² environ avec de beaux espaces verts, au sein d'un environnement calme et résidentiel, édifiée en 1999, traversante d'est en ouest, charmante maison traditionnelle de 100m² environ en excellent état, offrant un espace de vie cosy. Idéale pour une famille, cette maison de plain-pied comprend une entrée avec son dressing qui dessert un vaste salon/séjour très lumineux et sa cuisine ouverte aménagée et équipée.
Côté nuit, vous trouverez trois jolies chambres avec leurs rangements, une salle d'eau avec une double vasque et un wc.
Profitez de sa terrasse, de sa piscine et de son terrain de pétanque pour des moments de détente en plein air.
Les huisseries, les volets ainsi que la porte d'entrée ont été remplacé. Aucuns travaux ne sont à prévoir.
A proximité des commodités, à 10 min de Meyzieu (Les Panettes) et de la rocade est. Cette maison est un véritable havre de paix. Alors venez vite la visiter elle n'attend que vous !
Honoraires d’agence à la charge du vendeur.Information d'affichage énergétique sur ce bien : classe ENERGIE D indice 154 et classe CLIMAT D indice 36. Les informations sur les risques auxquels ce bien est exposé sont disponibles sur le site Géorisques : www.georisques.gouv.fr. La présente annonce immobilière a été rédigée sous la responsabilité éditoriale de M. Bertrand Mourlevat EI (ID 65768), mandataire indépendant en immobilier (sans détention de fonds), agent commercial de la SAS I@D France immatriculé au RSAC de Lyon sous le numéro 835244880, titulaire de la carte de démarchage immobilier pour le compte de la société I@D France SAS.
Retrouvez tous nos biens sur notre site internet.
Afficher plus";['100 m² - 5 pièces - 3 chambres - ter. 902 m²', 'Piscine', '1 Garage', 'Terrasse', 'Année de construction : 1998', 'Cuisine ouverte, équipée', None, None, None, None, None, None, None, None, None, None, None, None, None, None];['https://photo.superimmo.com/9w80ort582ddcweajde845evxhpf', 'https://photo.superimmo.com/d3o2si3kxkb0lu9o1sir8zep9y87', 'https://photo.superimmo.com/jtx96trbbtz80x2uts11nrwvla6s', 'https://photo.superimmo.com/5f1qq553wpwxkzx3zpx518n0se67', 'https://photo.superimmo.com/pya3trreg1m687ycxxjivxo0qef9', None, None, None, None, None]
22;https://www.superimmo.com/annonces/achat-appartement-41m-villeurbanne-69100-xwd11j;220000;41;2;1;Villeurbanne (69100);5366;20/07/2024;Exclusivité;Étage 2/5 avec ascenseur;Honoraires à la charge du vendeur. Barème d’honoraires : https://bareme.iadfrance.fr;"iad France - Elodie Abrami (06 65 26 20 10) vous propose : EXCLUSIVITÉ ! RARE à Gratte Ciel * Parc du Centre _ Rue Robert Desnos * Vous recherchez un T2 avec Terrasse et au calme ? Venez découvrir ce beau T2 de 41,27 m2, avec BALCON + GARAGE en SUS, au 2° étage avec ascenseur, d'une résidence édifiée en 2014 et très bien entretenue.
Exposé Sud, lumineux et ensoleillé, au calme sur rue piétonne, cet appartement, en excellent état, offre un agencement idéal. Il distribue une entrée dotée d'un placard dressing et d'un spacieux WC, une lumineuse pièce de vie de 20m2 avec une cuisine meublée et équipée ouverte sur le séjour, prolongée par une agréable loggia à vivre de plus de 6m2. Attenante une chambre de 11,39m2 en parquet massif dotée d'un placard mural et d'une salle de bain avec meuble vasque et emplacement fermé pour la machine à laver.
Porte blindée 3 points. Huisserie Double vitrage avec volets roulants. Chauffage et eau chaude individuels gaz. Local vélo dans la copropriété. Adapté PMR. Label BBC. RT 2012. DPE en C.
Un précieux GARAGE de 12m2 en sous-sol EN SUS complète ce bien (Possibilité borne de rechargement pour véhicule électrique).
Vous apprécierez sa luminosité, son agencement fonctionnel, son extérieur, son possible stationnement et son emplacement central à proximité des commerces et des transports (à 5 mn à pied du métro Gratte Ciel et 2 mn du futur tram arrêt Billon) tout en étant au calme.
Votre futur appartement ? Contactez-moi pour me partager votre projet et organiser une visite !
La présente annonce immobilière vise 1 lot principal situé dans une copropriété formant 41 lots au total ne faisant l'objet d'aucune procédure en cours et d'un montant de charges d’environ 52.92 € par mois (soit 635.04 € annuel) déclaré par le vendeur.Honoraires d’agence à la charge du vendeur.Information d'affichage énergétique sur ce bien : classe ENERGIE C indice 93 et classe CLIMAT C indice 17. Les informations sur les risques auxquels ce bien est exposé sont disponibles sur le site Géorisques : www.georisques.gouv.fr. La présente annonce immobilière a été rédigée sous la responsabilité éditoriale de Mlle Elodie Abrami EI (ID 79792), mandataire indépendant en immobilier (sans détention de fonds), agent commercial de la SAS I@D France immatriculé au RSAC de Lyon sous le numéro 850597501, titulaire de la carte de démarchage immobilier pour le compte de la société I@D France SAS.
Retrouvez tous nos biens sur notre site internet.
Afficher plus";['41 m² - 2 pièces - 1 chambre', 'Étage 2/5 avec ascenseur', '1 Parking', '1 balcon', 'Terrasse', 'Année de construction : 2014', 'Digicode - Interphone', 'Télévision par cable', 'Copropriété de 82 lots', '', None, None, None, None, None, None, None, None, None, None];['https://photo.superimmo.com/ako9asl0o472m52fphvoopyjsz6n', 'https://photo.superimmo.com/zp3fk0zczfsg4q0bz4gta30mhhtk', 'https://photo.superimmo.com/0d0g5rzqp0sha7hgmcvoqiyt6r55', 'https://photo.superimmo.com/1lnj2v5m9v0uclpw0qkb0mjtamm4', 'https://photo.superimmo.com/rc528oqm3jgoaw84829rzgcbemxu', None, None, None, None, None]
23;https://www.superimmo.com/annonces/achat-maison-202m-saint-laurent-de-chamousset-69930-xwd104;298000;202;5;3;Saint-Laurent-de-Chamousset (69930);1475;20/07/2024;;;Honoraires à la charge du vendeur. Barème d’honoraires : https://bareme.iadfrance.fr;"iad France - Carole Tulkens (06 37 49 45 24) vous propose : Authentique ferme du 19ème siècle à rénover sur deux étages, offrant un potentiel incroyable dans un cadre bucolique au porte de Brullioles. Avec une surface habitable de 202m² sur un terrain de 2900m2 env., Les expositions Est et ouest offrent une luminosité naturelle. Un véritable projet de rénovation pour les amateurs d'authenticité souhaitant créer leur havre de paix.
L’entrée se fait par une grande porte ancienne qui donne sous un superbe porche, une cour centrale repartie la vie de la ferme avec son habitation de 202 m2 environ, une étable de 140m2 environ une grange de 137m2 environ et des petites annexes.
L'habitation au rdc, 4 pièces, à l’étage même surface avec 3 pièces en enfilade, deux escaliers accède à cet étage.
Sous la ferme deux superbes caves voutées.
Un puit alimente la maison, Il y a l'eau et l'électricité. L'assainissement est à faire car inexistante.
Bâtiments en bon état structurel, les tuiles sont à changer sur tous les bâtiments suite visite d’un Architect. CU opérationnelle demandé et avis favorable pour changement de destination des annexes.
Ne manquez pas cette opportunité unique de redonner vie à ce trésor historique. Vous recherche la tranquillité l’isolement le tout dans la campagne perdu cette ferme est pour vous.
Honoraires d’agence à la charge du vendeur. Bien non soumis au DPE. Les informations sur les risques auxquels ce bien est exposé sont disponibles sur le site Géorisques : www.georisques.gouv.fr. La présente annonce immobilière a été rédigée sous la responsabilité éditoriale de Mlle Carole Tulkens EI (ID 46256), mandataire indépendant en immobilier (sans détention de fonds), agent commercial de la SAS I@D France immatriculé au RSAC de LYON sous le numéro 877802702, titulaire de la carte de démarchage immobilier pour le compte de la société I@D France SAS.
Retrouvez tous nos biens sur notre site internet.
Afficher plus";['202 m² - 5 pièces - 3 chambres - ter. 2 910 m²', 'Année de construction : 1900', None, None, None, None, None, None, None, None, None, None, None, None, None, None, None, None, None, None];['https://photo.superimmo.com/zbb6pkn4o6swl82c27faq1wd8y2f', 'https://photo.superimmo.com/ngu7msfh0asnfm5bwrorhmcyyh68', 'https://photo.superimmo.com/6wetqyc86z9ywzgeatib4c4sqp04', 'https://photo.superimmo.com/u2u8wmk1euy0ity5qgn3oifllad3', 'https://photo.superimmo.com/tcub3gmnlnyy36anscmig8c5y70y', None, None, None, None, None]
24;https://www.superimmo.com/annonces/achat-appartement-66m-lyon-6eme-69006-xwd0yf;370000;66;3;2;Lyon 6ème (69006);5606;20/07/2024;Étage 3/5 avec ascenseur;1 Parking;Honoraires à la charge du vendeur. Barème d’honoraires : https://bareme.iadfrance.fr;"iad France - Cédric Travailleur (07 68 32 90 26) vous propose : Appartement T3 de 65m2, 3ème étage avec ascenseur, local vélos, Lyon 6ème, garage, terrasse
Venez découvrir ce superbe appartement T3 situé face à la Clinique du Parc, dans le prestigieux 6ème arrondissement de Lyon. A proximité du quartier prisé des Brotteaux et à seulement quelques minutes à pied du Parc de la Tête d'Or et de la station de métro Charpennes, cet appartement bénéficie d’un emplacement de premier choix.
Situé au 3ème étage d'une résidence récente et sécurisée datant de 2011, cet appartement fonctionnel est idéal pour un couple ou une famille.
Il se compose d’une entrée avec placard desservant tout l’appartement avec d’un côté l’espace à vivre et de l’autre côté l’espace nuit afin de préserver l’intimité de chacun. Vous trouverez à l’Est une pièce à vivre lumineuse de 25m2 environ composée d’une cuisine ouverte entièrement équipée et aménagée donnant sur un séjour avec terrasse. Côté nuit, vous découvrirez une salle de bains spacieuse avec baignoire et vasque ainsi que l’emplacement nécessaire pour une machine à laver, des toilettes séparées ainsi que deux chambres avec placard de 10m2 et 12m2 environ. Petit plus, la deuxième chambre vous permettra de profiter de l’extérieur grâce à sa terrasse privative.
Energie : bon DPE (D) pour cet appartement équipé de fenêtres PVC double vitrage et volets électriques. Chauffage individuel électrique.
La résidence sécurisée garantit tranquillité et sérénité. Pour faciliter votre quotidien, un garage box en sous-sol est disponible en sus au prix de 30 000€, offrant une solution de stationnement pratique en plein cOEur de la ville.
Cet appartement, grâce à sa localisation privilégiée et ses prestations de qualité, offre un cadre de vie idéal pour ceux qui souhaitent profiter de la vie urbaine tout en ayant accès à des espaces verts et à une excellente desserte en transports en commun.
Pour plus d'informations ou pour organiser une visite, n'hésitez pas à me contacter. Ne manquez pas cette opportunité rare dans l'un des quartiers les plus recherchés de Lyon !
La présente annonce immobilière vise 1 lot principal situé dans une copropriété formant 61 lots au total ne faisant l'objet d'aucune procédure en cours et d'un montant de charges d’environ 88.33 € par mois (soit 1059.96 € annuel) déclaré par le vendeur.Honoraires d’agence à la charge du vendeur.Information d'affichage énergétique sur ce bien : classe ENERGIE D indice 190 et classe CLIMAT B indice 6. Les informations sur les risques auxquels ce bien est exposé sont disponibles sur le site Géorisques : www.georisques.gouv.fr. La présente annonce immobilière a été rédigée sous la responsabilité éditoriale de M. Cédric Travailleur EI (ID 82259), mandataire indépendant en immobilier (sans détention de fonds), agent commercial de la SAS I@D France immatriculé au RSAC de LYON sous le numéro 925403537, titulaire de la carte de démarchage immobilier pour le compte de la société I@D France SAS.
Retrouvez tous nos biens sur notre site internet.
Afficher plus";['66 m² - 3 pièces - 2 chambres', 'Étage 3/5 avec ascenseur', '1 Parking', 'Année de construction : 2011', 'Chauffage individuel électrique', 'Digicode - Interphone', 'Copropriété de 118 lots', '', None, None, None, None, None, None, None, None, None, None, None, None];['https://photo.superimmo.com/5k5u8ad1d3hzxnr5eyx1i9rckn2x', 'https://photo.superimmo.com/atu3332o5jmh5sql7y3nds5mhzaw', 'https://photo.superimmo.com/vh55r0a8h3vl82ntrayh2b9i87by', 'https://photo.superimmo.com/0c92fp3r61dg11t7ei70hox5lizl', 'https://photo.superimmo.com/vbfrpn54dxoqfbixqn60ythsh21x', None, None, None, None, None]
25;https://www.superimmo.com/annonces/achat-appartement-71m-craponne-69290-xwd0w8;250000;71;4;3;Craponne (69290);3521;20/07/2024;Exclusivité;4ème étage;Honoraires à la charge du vendeur. Barème d’honoraires : https://bareme.iadfrance.fr;"iad France - Cédric Travailleur (07 68 32 90 26) vous propose : Appartement T4 au dernier étage avec loggia et cave - Centre de Craponne
Situé au cOEur de Craponne, ce superbe appartement T4 de 71 m² environ vous séduira par ses nombreux atouts. Niché au 4ème et dernier étage d'une résidence fermée, il offre une tranquillité absolue et une vue dégagée.
Passé la porte de l'appartement, vous découvrirez une entrée desservant à l’Ouest une cuisine fonctionnelle entièrement aménagée et équipée donnant sur un cellier, idéale pour vos rangements et votre espace buanderie. A l’Est un salon spacieux et lumineux avec l'accès sur une loggia avec vue sur le parc de 5 m² environ.
Coté nuit, vous trouverez une salle d’eau avec fenêtre, des toilettes et trois belles chambres de 11 et 12 m² environ offrant des espaces confortables pour toute la famille. De plus, l’une des chambres s'ouvre sur la loggia, un véritable atout pour profiter de moments de détente en extérieur.
La résidence, sécurisée et entourée d'un parc arboré privatif, est un véritable havre de paix en plein centre-ville. Vous bénéficierez ainsi de la proximité des commerces, des écoles et des transports en commun (ligne bus C24 et 73 direction Gorge de Loup), tout en profitant du calme et de la verdure.
Energie : fenêtres PVC double vitrage et chauffage collectif gaz. Pour un meilleur confort, les travaux de façade avec isolation par l'extérieur ont déjà été votés et seront entièrement pris en charge par le vendeur, vous garantissant ainsi une meilleure performance énergétique.
Points positifs :
-Emplacement au centre de Craponne, au calme avec parc privatif
-Dernier étage avec vue dégagée
-Travaux de façade avec rénovation énergétique votés
Ne manquez pas cette opportunité rare d'acquérir un appartement au dernier étage, alliant emplacement idéal, calme et vue dégagée. Contactez-moi dès maintenant pour organiser une visite et découvrir par vous-même tout le potentiel de cet appartement.
La présente annonce immobilière vise 1 lot principal situé dans une copropriété formant 70 lots au total ne faisant l'objet d'aucune procédure en cours et d'un montant de charges d’environ 244.29 € par mois (soit 2931.48 € annuel) déclaré par le vendeur.Honoraires d’agence à la charge du vendeur.Information d'affichage énergétique sur ce bien : classe ENERGIE F indice 403 et classe CLIMAT E indice 60. Les informations sur les risques auxquels ce bien est exposé sont disponibles sur le site Géorisques : www.georisques.gouv.fr. La présente annonce immobilière a été rédigée sous la responsabilité éditoriale de M. Cédric Travailleur EI (ID 82259), mandataire indépendant en immobilier (sans détention de fonds), agent commercial de la SAS I@D France immatriculé au RSAC de LYON sous le numéro 925403537, titulaire de la carte de démarchage immobilier pour le compte de la société I@D France SAS.
Retrouvez tous nos biens sur notre site internet.
Afficher plus";['71 m² - 4 pièces - 3 chambres', '4ème étage', '1 Parking', 'Cave', '1 balcon', 'Année de construction : 1967', 'Chauffage collectif au gaz (radiateurs)', 'Cuisine séparée', 'Digicode - Interphone', 'Copropriété de 188 lots', None, None, None, None, None, None, None, None, None, None];['https://photo.superimmo.com/2k80ztf606zdoprxtnvd90o34fff', 'https://photo.superimmo.com/whyffb7mtilfj8vq2wb2ltve8m1j', 'https://photo.superimmo.com/s9k8uv384ttpfczd1ehp08txtzto', 'https://photo.superimmo.com/2s6kbbffibvtlzb0bkukv5scj7qu', 'https://photo.superimmo.com/s0sam97mh8d2pfms1co4jooir2jv', None, None, None, None, None]
26;https://www.superimmo.com/annonces/achat-maison-58m-villefranche-sur-saone-69400-xwd0v5;188000;58;3;2;Villefranche-sur-Saône (69400);3241;20/07/2024;2 Parkings;;Honoraires à la charge du vendeur. Barème d’honoraires : https://www.ledoc.immo/medias/baremes/259.pdf;"Située dans une rue calme de Villefranche sur Saône, à moins de 2km de la gare, et du centre ville, cette charmante maison de ville rénovée récemment, vous offre au rez-de-chaussée, un jolie séjour de 30 m2 avec son coin cuisine aménagée donnant sur une terrasse carrelée de 12 m2 .
A l'étage vous découvrirez deux chambres de 10 m2 et 11 m2 toutes deux donnant sur un balcon ainsi qu'une jolie salle d'eau et son wc entièrement rénovée.
La maison a été rénovée en 2023, le système de chauffage est électrique avec radiateur et bénéficie d'une climatisation réversible dans la pièce de vie.
Le bien comprend également deux places de parking privées dans la cour commune ainsi qu'un parking gratuit en face de la maison.
N'hésitez pas à contacter Karine FERRANT au: 07.49.39.49.74 afin de prévoir ne visite. Ce bien vous est présenté par Karine Ferrant, votre conseiller indépendant Dr House Immo.
Afficher plus";"['58 m² - 3 pièces - 2 chambres - ter. 65 m²', '2 Parkings', 'Climatisation', ""1 salle d'eau"", '1 wc', '', None, None, None, None, None, None, None, None, None, None, None, None, None, None]";['https://photo.superimmo.com/jm75zgsy7912pza18bn9c2kwhyi5', 'https://photo.superimmo.com/tspizsrbzm1c4xywlm5tei5q4xpf', 'https://photo.superimmo.com/5nm66edtxtseekt31ahzotz0dyca', 'https://photo.superimmo.com/cjdwm5vw528x2005rhglhxc1037v', 'https://photo.superimmo.com/gv9yvi0f7isqw3mryy5d6nbyj52r', None, None, None, None, None]
27;https://www.superimmo.com/annonces/achat-appartement-98m-lyon-9eme-69009-xwd0us;279500;6;5;4;Lyon 9ème (69009);2835;20/07/2024;Exclusivité;Dernier étage avec ascenseur;Honoraires à la charge du vendeur. Barème d’honoraires : https://www.ledoc.immo/medias/baremes/68.pdf;"Saisissez l'opportunité d'acquérir cet appartement lumineux de 98,6 m², idéalement situé au 5ème et dernier étage au cœur de l’éco quartier. Ce bien unique, sans voisin en dessus, est parfait pour une famille ou un investissement locatif destiné à la colocation.
Caractéristiques de l'appartement :
• Quatre chambres spacieuses : Offrant une vue dégagée et bénéficiant d'une exceptionnelle luminosité grâce à leur position en étage élevé.
• Cuisine équipée : Combinant modernité et praticité avec des installations de haute qualité.
• Balcon : Profitez d'un espace extérieur privilégié pour des moments de détente en plein air.
• Confort moderne : Equipé de double vitrage et d'une isolation de pointe pour une excellente efficacité énergétique.
L'appartement est niché dans le quartier de La Duchère, reconnu pour son engagement vers un avenir durable. Cet éco-quartier met l'accent sur la sobriété énergétique, la préservation de la biodiversité et la durabilité.
Points forts du quartier :
• Éco-quartier exemplaire : Un cadre de vie sain et durable pour ses habitants.
• Services et commodités : Accès facile à divers commerces, ainsi qu'à des établissements scolaires allant de la maternelle au lycée.
• Parc du Vallon : Un grand parc urbain à proximité, parfait pour les loisirs et la détente en famille ou entre amis.
• Excellente desserte par les transports : Profitez de six lignes de bus, incluant deux lignes majeures et un trolleybus, facilitant l'accès à la Gare de Vaise et au centre de Lyon en quelques minutes.
Cette propriété est une occasion rare pour ceux qui désirent investir dans un quartier avant-gardiste ou cherchent un foyer familial spacieux et lumineux.
Contactez-moi pour en savoir plus et planifier votre visite. Découvrez comment cet appartement peut devenir votre nouveau chez-vous ou un investissement locatif prometteur. Ce bien vous est présenté par Olivier Serre, votre conseiller indépendant Dr House Immo.
Afficher plus";"['98,6 m² - 5 pièces - 4 chambres', 'Dernier étage (5ème) avec ascenseur', 'Année de construction : 2010', 'Cuisine ouverte, équipée', ""1 salle d'eau - 1 salle de bain"", 'Wc séparé - 2 wc', 'Interphone', 'Copropriété de 45 lots', None, None, None, None, None, None, None, None, None, None, None, None]";['https://photo.superimmo.com/lthugyyfrhptflgpr03c38pdi2qz', 'https://photo.superimmo.com/askneykwa3z4hy8qpj63e62rrc7q', 'https://photo.superimmo.com/80vn8e739s40i65nuy8b0x6fn8ak', 'https://photo.superimmo.com/r4woo9lnpahjsemo4feouxfs3iq4', 'https://photo.superimmo.com/3sto1ycao67ujinc97mdewsubs13', None, None, None, None, None]
28;https://www.superimmo.com/annonces/achat-appartement-100m-cours-la-ville-69470-xwd0tc;56000;100;4;;;560;20/07/2024;Meublé;Chauffage électrique;Honoraires à la charge du vendeur.;"BBii vous propose aujourd'hui 2 appartements dans l'hyper centre de Cours la Ville (Le salon de coiffure n'est pas en vente).
- Un T2 de 48m2 au 1er étage composé de 2 chambres, un bureau, une cuisine, une salle de bain et un WC ;
- Un T2 de 52m2 au 2e étage composé de 2 chambres, un bureau, une cuisine, une salle de bain et un WC.
Chauffage électrique dans le l'appartement du 1er, aucun moyen de chauffage dans le 2e.
Double vitrage + volets roulants dans l'appartement du 2e.
Un terrain de 150m2 environ est attenant à l'immeuble.
L'immeuble est à 1h de Lyon. A PREVOIR : Remise aux normes électriques ; Doubles vitrages sur le 1er appartement ; Isolation générale ; Moyen de chauffage dans les deux appartements ; Rénovation des sols et des murs les deux logements. Prix : 56 000¤ (honoraires à la charge du vendeur) Vous pouvez désormais réserver votre rendez-vous de visite en ligne via ce lien : Lapierre Marine, Négociatrice 06 59 32 84 84 Siret : 95316539600011
Afficher plus";['100 m² - 4 pièces', 'Chauffage électrique', None, None, None, None, None, None, None, None, None, None, None, None, None, None, None, None, None, None];[None, None, None, None, None, None, None, None, None, None]
